ID	Database	Citation
7690968	Pubmed	"Transfected human liver cytochrome P-450 hydroxylates vitamin D analogs at different side-chain positions. Guo YD, Strugnell S, Back DW, Jones G. Proc Natl Acad Sci U S A. 1993 Sep 15;90(18):8668–72.  <a href=""http://www.ncbi.nlm.nih.gov/pubmed/7690968"" target=""_blank"" class=""external"" rel=""nofollow"">PubMed</a> <a href=""https://europepmc.org/abstract/MED/7690968"" target=""_blank"" class=""external"" rel=""nofollow"">Europe PMC</a> <a href=""https://scholia.toolforge.org/pubmed/7690968"" target=""_blank"" class=""external"" rel=""nofollow"">Scholia</a>"
11111101	Pubmed	"Biochemical and genetic aspects of 7-dehydrocholesterol reductase and Smith-Lemli-Opitz syndrome. Waterham HR, Wanders RJ. Biochim Biophys Acta. 2000 Dec 15;1529(1–3):340–56.  <a href=""http://www.ncbi.nlm.nih.gov/pubmed/11111101"" target=""_blank"" class=""external"" rel=""nofollow"">PubMed</a> <a href=""https://europepmc.org/abstract/MED/11111101"" target=""_blank"" class=""external"" rel=""nofollow"">Europe PMC</a> <a href=""https://scholia.toolforge.org/pubmed/11111101"" target=""_blank"" class=""external"" rel=""nofollow"">Scholia</a>"
15128933	Pubmed	"Genetic evidence that the human CYP2R1 enzyme is a key vitamin D 25-hydroxylase. Cheng JB, Levine MA, Bell NH, Mangelsdorf DJ, Russell DW. Proc Natl Acad Sci U S A. 2004 May 18;101(20):7711–5.  <a href=""http://www.ncbi.nlm.nih.gov/pubmed/15128933"" target=""_blank"" class=""external"" rel=""nofollow"">PubMed</a> <a href=""https://europepmc.org/abstract/MED/15128933"" target=""_blank"" class=""external"" rel=""nofollow"">Europe PMC</a> <a href=""https://scholia.toolforge.org/pubmed/15128933"" target=""_blank"" class=""external"" rel=""nofollow"">Scholia</a>"
18689389	Pubmed	"From vitamin D to hormone D: fundamentals of the vitamin D endocrine system essential for good health. Norman AW. Am J Clin Nutr. 2008 Aug;88(2):491S-499S.  <a href=""http://www.ncbi.nlm.nih.gov/pubmed/18689389"" target=""_blank"" class=""external"" rel=""nofollow"">PubMed</a> <a href=""https://europepmc.org/abstract/MED/18689389"" target=""_blank"" class=""external"" rel=""nofollow"">Europe PMC</a> <a href=""https://scholia.toolforge.org/pubmed/18689389"" target=""_blank"" class=""external"" rel=""nofollow"">Scholia</a>"
20418485	Pubmed	"Genome-wide association study of circulating vitamin D levels. Ahn J, Yu K, Stolzenberg-Solomon R, Simon KC, McCullough ML, Gallicchio L, et al. Hum Mol Genet. 2010 Jul 1;19(13):2739–45.  <a href=""http://www.ncbi.nlm.nih.gov/pubmed/20418485"" target=""_blank"" class=""external"" rel=""nofollow"">PubMed</a> <a href=""https://europepmc.org/abstract/MED/20418485"" target=""_blank"" class=""external"" rel=""nofollow"">Europe PMC</a> <a href=""https://scholia.toolforge.org/pubmed/20418485"" target=""_blank"" class=""external"" rel=""nofollow"">Scholia</a>"
20541252	Pubmed	"Common genetic determinants of vitamin D insufficiency: a genome-wide association study. Wang TJ, Zhang F, Richards JB, Kestenbaum B, van Meurs JB, Berry D, et al. Lancet. 2010 Jul 17;376(9736):180–8.  <a href=""http://www.ncbi.nlm.nih.gov/pubmed/20541252"" target=""_blank"" class=""external"" rel=""nofollow"">PubMed</a> <a href=""https://europepmc.org/abstract/MED/20541252"" target=""_blank"" class=""external"" rel=""nofollow"">Europe PMC</a> <a href=""https://scholia.toolforge.org/pubmed/20541252"" target=""_blank"" class=""external"" rel=""nofollow"">Scholia</a>"
20736230	Pubmed	"A ChIP-seq defined genome-wide map of vitamin D receptor binding: associations with disease and evolution. Ramagopalan SV, Heger A, Berlanga AJ, Maugeri NJ, Lincoln MR, Burrell A, et al. Genome Res. 2010 Oct;20(10):1352–60.  <a href=""http://www.ncbi.nlm.nih.gov/pubmed/20736230"" target=""_blank"" class=""external"" rel=""nofollow"">PubMed</a> <a href=""https://europepmc.org/abstract/MED/20736230"" target=""_blank"" class=""external"" rel=""nofollow"">Europe PMC</a> <a href=""https://scholia.toolforge.org/pubmed/20736230"" target=""_blank"" class=""external"" rel=""nofollow"">Scholia</a>"
