ID	Database	Citation
18772890	Pubmed	"Comprehensive genomic characterization defines human glioblastoma genes and core pathways. Cancer Genome Atlas Research Network. Nature. 2008 Oct 23;455(7216):1061–8.  <a href=""http://www.ncbi.nlm.nih.gov/pubmed/18772890"" target=""_blank"" class=""external"" rel=""nofollow"">PubMed</a> <a href=""https://europepmc.org/abstract/MED/18772890"" target=""_blank"" class=""external"" rel=""nofollow"">Europe PMC</a> <a href=""https://scholia.toolforge.org/pubmed/18772890"" target=""_blank"" class=""external"" rel=""nofollow"">Scholia</a>"
19419954	Pubmed	"Up-regulation of miR-21 by HER2/neu signaling promotes cell invasion. Huang TH, Wu F, Loeb GB, Hsu R, Heidersbach A, Brincat A, et al. J Biol Chem. 2009 Jul 3;284(27):18515–24.  <a href=""http://www.ncbi.nlm.nih.gov/pubmed/19419954"" target=""_blank"" class=""external"" rel=""nofollow"">PubMed</a> <a href=""https://europepmc.org/abstract/MED/19419954"" target=""_blank"" class=""external"" rel=""nofollow"">Europe PMC</a> <a href=""https://scholia.toolforge.org/pubmed/19419954"" target=""_blank"" class=""external"" rel=""nofollow"">Scholia</a>"
20048743	Pubmed	"Downregulation of miR-21 inhibits EGFR pathway and suppresses the growth of human glioblastoma cells independent of PTEN status. Zhou X, Ren Y, Moore L, Mei M, You Y, Xu P, et al. Lab Invest. 2010 Feb;90(2):144–55.  <a href=""http://www.ncbi.nlm.nih.gov/pubmed/20048743"" target=""_blank"" class=""external"" rel=""nofollow"">PubMed</a> <a href=""https://europepmc.org/abstract/MED/20048743"" target=""_blank"" class=""external"" rel=""nofollow"">Europe PMC</a> <a href=""https://scholia.toolforge.org/pubmed/20048743"" target=""_blank"" class=""external"" rel=""nofollow"">Scholia</a>"
21078976	Pubmed	"MicroRNA-21 induces resistance to 5-fluorouracil by down-regulating human DNA MutS homolog 2 (hMSH2). Valeri N, Gasparini P, Braconi C, Paone A, Lovat F, Fabbri M, et al. Proc Natl Acad Sci U S A. 2010 Dec 7;107(49):21098–103.  <a href=""http://www.ncbi.nlm.nih.gov/pubmed/21078976"" target=""_blank"" class=""external"" rel=""nofollow"">PubMed</a> <a href=""https://europepmc.org/abstract/MED/21078976"" target=""_blank"" class=""external"" rel=""nofollow"">Europe PMC</a> <a href=""https://scholia.toolforge.org/pubmed/21078976"" target=""_blank"" class=""external"" rel=""nofollow"">Scholia</a>"
21278789	Pubmed	"Downregulation of Spry2 by miR-21 triggers malignancy in human gliomas. Kwak HJ, Kim YJ, Chun KR, Woo YM, Park SJ, Jeong JA, et al. Oncogene. 2011 May 26;30(21):2433–42.  <a href=""http://www.ncbi.nlm.nih.gov/pubmed/21278789"" target=""_blank"" class=""external"" rel=""nofollow"">PubMed</a> <a href=""https://europepmc.org/abstract/MED/21278789"" target=""_blank"" class=""external"" rel=""nofollow"">Europe PMC</a> <a href=""https://scholia.toolforge.org/pubmed/21278789"" target=""_blank"" class=""external"" rel=""nofollow"">Scholia</a>"
21934092	Pubmed	"MicroRNA-499-5p promotes cellular invasion and tumor metastasis in colorectal cancer by targeting FOXO4 and PDCD4. Liu X, Zhang Z, Sun L, Chai N, Tang S, Jin J, et al. Carcinogenesis. 2011 Dec;32(12):1798–805.  <a href=""http://www.ncbi.nlm.nih.gov/pubmed/21934092"" target=""_blank"" class=""external"" rel=""nofollow"">PubMed</a> <a href=""https://europepmc.org/abstract/MED/21934092"" target=""_blank"" class=""external"" rel=""nofollow"">Europe PMC</a> <a href=""https://scholia.toolforge.org/pubmed/21934092"" target=""_blank"" class=""external"" rel=""nofollow"">Scholia</a>"
