ID	Database	Citation
4349027	Pubmed	"Tritz GJ, Chandler JL. Recognition of a gene involved in the regulation of nicotinamide adenine dinucleotide biosynthesis. J Bacteriol. 1973 Apr;114(1):128–36. <a href=""http://www.ncbi.nlm.nih.gov/pubmed/4349027"" target=""_blank"" class=""external"" rel=""nofollow"">PubMed</a> <a href=""https://europepmc.org/abstract/MED/4349027"" target=""_blank"" class=""external"" rel=""nofollow"">Europe PMC</a> <a href=""https://scholia.toolforge.org/pubmed/4349027"" target=""_blank"" class=""external"" rel=""nofollow"">Scholia</a>"
8086213	Pubmed	"Sánchez-Alcón MD, Pérez Garrigues H, Vílchez J, Casanova B, Morera C. The study of deafness in patients with facioscapulohumeral dystrophy. Acta Otorrinolaringol Esp. 1994;45(2):79–82. <a href=""http://www.ncbi.nlm.nih.gov/pubmed/8086213"" target=""_blank"" class=""external"" rel=""nofollow"">PubMed</a> <a href=""https://europepmc.org/abstract/MED/8086213"" target=""_blank"" class=""external"" rel=""nofollow"">Europe PMC</a> <a href=""https://scholia.toolforge.org/pubmed/8086213"" target=""_blank"" class=""external"" rel=""nofollow"">Scholia</a>"
10464228	Pubmed	"Raffaelli N, Lorenzi T, Mariani PL, Emanuelli M, Amici A, Ruggieri S, et al. The Escherichia coli NadR regulator is endowed with nicotinamide mononucleotide adenylyltransferase activity. J Bacteriol. 1999 Sep;181(17):5509–11. <a href=""http://www.ncbi.nlm.nih.gov/pubmed/10464228"" target=""_blank"" class=""external"" rel=""nofollow"">PubMed</a> <a href=""https://europepmc.org/abstract/MED/10464228"" target=""_blank"" class=""external"" rel=""nofollow"">Europe PMC</a> <a href=""https://scholia.toolforge.org/pubmed/10464228"" target=""_blank"" class=""external"" rel=""nofollow"">Scholia</a>"
12446641	Pubmed	"Kurnasov OV, Polanuyer BM, Ananta S, Sloutsky R, Tam A, Gerdes SY, et al. Ribosylnicotinamide kinase domain of NadR protein: identification and implications in NAD biosynthesis. J Bacteriol. 2002 Dec;184(24):6906–17. <a href=""http://www.ncbi.nlm.nih.gov/pubmed/12446641"" target=""_blank"" class=""external"" rel=""nofollow"">PubMed</a> <a href=""https://europepmc.org/abstract/MED/12446641"" target=""_blank"" class=""external"" rel=""nofollow"">Europe PMC</a> <a href=""https://scholia.toolforge.org/pubmed/12446641"" target=""_blank"" class=""external"" rel=""nofollow"">Scholia</a>"
12648681	Pubmed	"Lin S-J, Guarente L. Nicotinamide adenine dinucleotide, a metabolic regulator of transcription, longevity and disease. Curr Opin Cell Biol. 2003 Apr;15(2):241–6. <a href=""http://www.ncbi.nlm.nih.gov/pubmed/12648681"" target=""_blank"" class=""external"" rel=""nofollow"">PubMed</a> <a href=""https://europepmc.org/abstract/MED/12648681"" target=""_blank"" class=""external"" rel=""nofollow"">Europe PMC</a> <a href=""https://scholia.toolforge.org/pubmed/12648681"" target=""_blank"" class=""external"" rel=""nofollow"">Scholia</a>"
14724176	Pubmed	"Lin S-J, Ford E, Haigis M, Liszt G, Guarente L. Calorie restriction extends yeast life span by lowering the level of NADH. Genes Dev. 2004 Jan 1;18(1):12–6. <a href=""http://www.ncbi.nlm.nih.gov/pubmed/14724176"" target=""_blank"" class=""external"" rel=""nofollow"">PubMed</a> <a href=""https://europepmc.org/abstract/MED/14724176"" target=""_blank"" class=""external"" rel=""nofollow"">Europe PMC</a> <a href=""https://scholia.toolforge.org/pubmed/14724176"" target=""_blank"" class=""external"" rel=""nofollow"">Scholia</a>"
15137942	Pubmed	"Bieganowski P, Brenner C. Discoveries of nicotinamide riboside as a nutrient and conserved NRK genes establish a Preiss-Handler independent route to NAD+ in fungi and humans. Cell. 2004 May 14;117(4):495–502. <a href=""http://www.ncbi.nlm.nih.gov/pubmed/15137942"" target=""_blank"" class=""external"" rel=""nofollow"">PubMed</a> <a href=""https://europepmc.org/abstract/MED/15137942"" target=""_blank"" class=""external"" rel=""nofollow"">Europe PMC</a> <a href=""https://scholia.toolforge.org/pubmed/15137942"" target=""_blank"" class=""external"" rel=""nofollow"">Scholia</a>"
16078372	Pubmed	"Gerasimova AV, Gelfand MS. Evolution of the NadR regulon in Enterobacteriaceae. J Bioinform Comput Biol. 2005 Aug;3(4):1007–19. <a href=""http://www.ncbi.nlm.nih.gov/pubmed/16078372"" target=""_blank"" class=""external"" rel=""nofollow"">PubMed</a> <a href=""https://europepmc.org/abstract/MED/16078372"" target=""_blank"" class=""external"" rel=""nofollow"">Europe PMC</a> <a href=""https://scholia.toolforge.org/pubmed/16078372"" target=""_blank"" class=""external"" rel=""nofollow"">Scholia</a>"
18029306	Pubmed	"Ostrowski EA, Woods RJ, Lenski RE. The genetic basis of parallel and divergent phenotypic responses in evolving populations of Escherichia coli. Proc Biol Sci. 2008 Feb 7;275(1632):277–84. <a href=""http://www.ncbi.nlm.nih.gov/pubmed/18029306"" target=""_blank"" class=""external"" rel=""nofollow"">PubMed</a> <a href=""https://europepmc.org/abstract/MED/18029306"" target=""_blank"" class=""external"" rel=""nofollow"">Europe PMC</a> <a href=""https://scholia.toolforge.org/pubmed/18029306"" target=""_blank"" class=""external"" rel=""nofollow"">Scholia</a>"
