ID	Database	Citation
7565706	Pubmed	"Welch PJ, Wang JY. Abrogation of retinoblastoma protein function by c-Abl through tyrosine kinase-dependent and -independent mechanisms. Mol Cell Biol. 1995 Oct;15(10):5542–51.  <a href=""http://www.ncbi.nlm.nih.gov/pubmed/7565706"" target=""_blank"" class=""external"" rel=""nofollow"">PubMed</a> <a href=""https://europepmc.org/abstract/MED/7565706"" target=""_blank"" class=""external"" rel=""nofollow"">Europe PMC</a> <a href=""https://scholia.toolforge.org/pubmed/7565706"" target=""_blank"" class=""external"" rel=""nofollow"">Scholia</a>"
8242749	Pubmed	"Welch PJ, Wang JY. A C-terminal protein-binding domain in the retinoblastoma protein regulates nuclear c-Abl tyrosine kinase in the cell cycle. Cell. 1993 Nov 19;75(4):779–90.  <a href=""http://www.ncbi.nlm.nih.gov/pubmed/8242749"" target=""_blank"" class=""external"" rel=""nofollow"">PubMed</a> <a href=""https://europepmc.org/abstract/MED/8242749"" target=""_blank"" class=""external"" rel=""nofollow"">Europe PMC</a> <a href=""https://scholia.toolforge.org/pubmed/8242749"" target=""_blank"" class=""external"" rel=""nofollow"">Scholia</a>"
9528081	Pubmed	"Domínguez R, Famulari A, Vila J. Leukoencephalopathy: the frontier between what is reversible and what is persistent. Rev Neurol. 1997 Dec;25(148):2074.  <a href=""http://www.ncbi.nlm.nih.gov/pubmed/9528081"" target=""_blank"" class=""external"" rel=""nofollow"">PubMed</a> <a href=""https://europepmc.org/abstract/MED/9528081"" target=""_blank"" class=""external"" rel=""nofollow"">Europe PMC</a> <a href=""https://scholia.toolforge.org/pubmed/9528081"" target=""_blank"" class=""external"" rel=""nofollow"">Scholia</a>"
15469821	Pubmed	"Ji P, Jiang H, Rekhtman K, Bloom J, Ichetovkin M, Pagano M, et al. An Rb-Skp2-p27 pathway mediates acute cell cycle inhibition by Rb and is retained in a partial-penetrance Rb mutant. Mol Cell. 2004 Oct 8;16(1):47–58.  <a href=""http://www.ncbi.nlm.nih.gov/pubmed/15469821"" target=""_blank"" class=""external"" rel=""nofollow"">PubMed</a> <a href=""https://europepmc.org/abstract/MED/15469821"" target=""_blank"" class=""external"" rel=""nofollow"">Europe PMC</a> <a href=""https://scholia.toolforge.org/pubmed/15469821"" target=""_blank"" class=""external"" rel=""nofollow"">Scholia</a>"
18591254	Pubmed	"Gabriely G, Wurdinger T, Kesari S, Esau CC, Burchard J, Linsley PS, et al. MicroRNA 21 promotes glioma invasion by targeting matrix metalloproteinase regulators. Mol Cell Biol. 2008 Sep;28(17):5369–80.  <a href=""http://www.ncbi.nlm.nih.gov/pubmed/18591254"" target=""_blank"" class=""external"" rel=""nofollow"">PubMed</a> <a href=""https://europepmc.org/abstract/MED/18591254"" target=""_blank"" class=""external"" rel=""nofollow"">Europe PMC</a> <a href=""https://scholia.toolforge.org/pubmed/18591254"" target=""_blank"" class=""external"" rel=""nofollow"">Scholia</a>"
19850741	Pubmed	"Garzon R, Heaphy CEA, Havelange V, Fabbri M, Volinia S, Tsao T, et al. MicroRNA 29b functions in acute myeloid leukemia. Blood. 2009 Dec 17;114(26):5331–41.  <a href=""http://www.ncbi.nlm.nih.gov/pubmed/19850741"" target=""_blank"" class=""external"" rel=""nofollow"">PubMed</a> <a href=""https://europepmc.org/abstract/MED/19850741"" target=""_blank"" class=""external"" rel=""nofollow"">Europe PMC</a> <a href=""https://scholia.toolforge.org/pubmed/19850741"" target=""_blank"" class=""external"" rel=""nofollow"">Scholia</a>"
21078976	Pubmed	"Valeri N, Gasparini P, Braconi C, Paone A, Lovat F, Fabbri M, et al. MicroRNA-21 induces resistance to 5-fluorouracil by down-regulating human DNA MutS homolog 2 (hMSH2). Proc Natl Acad Sci U S A. 2010 Dec 7;107(49):21098–103.  <a href=""http://www.ncbi.nlm.nih.gov/pubmed/21078976"" target=""_blank"" class=""external"" rel=""nofollow"">PubMed</a> <a href=""https://europepmc.org/abstract/MED/21078976"" target=""_blank"" class=""external"" rel=""nofollow"">Europe PMC</a> <a href=""https://scholia.toolforge.org/pubmed/21078976"" target=""_blank"" class=""external"" rel=""nofollow"">Scholia</a>"
