ID	Database	Citation
3549275	Pubmed	"Biological actions of androgens. Mooradian AD, Morley JE, Korenman SG. Endocr Rev. 1987 Feb;8(1):1–28.  <a href=""http://www.ncbi.nlm.nih.gov/pubmed/3549275"" target=""_blank"" class=""external"" rel=""nofollow"">PubMed</a> <a href=""https://europepmc.org/abstract/MED/3549275"" target=""_blank"" class=""external"" rel=""nofollow"">Europe PMC</a> <a href=""https://scholia.toolforge.org/pubmed/3549275"" target=""_blank"" class=""external"" rel=""nofollow"">Scholia</a>"
6371845	Pubmed	"Progestins can mimic, inhibit and potentiate the actions of androgens. Bardin CW, Brown T, Isomaa VV, Jänne OA. Pharmacol Ther. 1983;23(3):443–59.  <a href=""http://www.ncbi.nlm.nih.gov/pubmed/6371845"" target=""_blank"" class=""external"" rel=""nofollow"">PubMed</a> <a href=""https://europepmc.org/abstract/MED/6371845"" target=""_blank"" class=""external"" rel=""nofollow"">Europe PMC</a> <a href=""https://scholia.toolforge.org/pubmed/6371845"" target=""_blank"" class=""external"" rel=""nofollow"">Scholia</a>"
9949684	Pubmed	"Regulation of androgen action. Roy AK, Lavrovsky Y, Song CS, Chen S, Jung MH, Velu NK, et al. Vitam Horm. 1999;55:309–52.  <a href=""http://www.ncbi.nlm.nih.gov/pubmed/9949684"" target=""_blank"" class=""external"" rel=""nofollow"">PubMed</a> <a href=""https://europepmc.org/abstract/MED/9949684"" target=""_blank"" class=""external"" rel=""nofollow"">Europe PMC</a> <a href=""https://scholia.toolforge.org/pubmed/9949684"" target=""_blank"" class=""external"" rel=""nofollow"">Scholia</a>"
12351684	Pubmed	"The roles of androgen receptors and androgen-binding proteins in nongenomic androgen actions. Heinlein CA, Chang C. Mol Endocrinol. 2002 Oct;16(10):2181–7.  <a href=""http://www.ncbi.nlm.nih.gov/pubmed/12351684"" target=""_blank"" class=""external"" rel=""nofollow"">PubMed</a> <a href=""https://europepmc.org/abstract/MED/12351684"" target=""_blank"" class=""external"" rel=""nofollow"">Europe PMC</a> <a href=""https://scholia.toolforge.org/pubmed/12351684"" target=""_blank"" class=""external"" rel=""nofollow"">Scholia</a>"
12589933	Pubmed	"Anabolic steroids, testosterone-precursors and virilizing androgens induce distinct activation profiles of androgen responsive promoter constructs. Holterhus PM, Piefke S, Hiort O. J Steroid Biochem Mol Biol. 2002 Nov;82(4–5):269–75.  <a href=""http://www.ncbi.nlm.nih.gov/pubmed/12589933"" target=""_blank"" class=""external"" rel=""nofollow"">PubMed</a> <a href=""https://europepmc.org/abstract/MED/12589933"" target=""_blank"" class=""external"" rel=""nofollow"">Europe PMC</a> <a href=""https://scholia.toolforge.org/pubmed/12589933"" target=""_blank"" class=""external"" rel=""nofollow"">Scholia</a>"
12600226	Pubmed	"Progestogens with antiandrogenic properties. Raudrant D, Rabe T. Drugs. 2003;63(5):463–92.  <a href=""http://www.ncbi.nlm.nih.gov/pubmed/12600226"" target=""_blank"" class=""external"" rel=""nofollow"">PubMed</a> <a href=""https://europepmc.org/abstract/MED/12600226"" target=""_blank"" class=""external"" rel=""nofollow"">Europe PMC</a> <a href=""https://scholia.toolforge.org/pubmed/12600226"" target=""_blank"" class=""external"" rel=""nofollow"">Scholia</a>"
16633980	Pubmed	"Androgen physiology. Davison SL, Bell R. Semin Reprod Med. 2006 Apr;24(2):71–7.  <a href=""http://www.ncbi.nlm.nih.gov/pubmed/16633980"" target=""_blank"" class=""external"" rel=""nofollow"">PubMed</a> <a href=""https://europepmc.org/abstract/MED/16633980"" target=""_blank"" class=""external"" rel=""nofollow"">Europe PMC</a> <a href=""https://scholia.toolforge.org/pubmed/16633980"" target=""_blank"" class=""external"" rel=""nofollow"">Scholia</a>"
