ID	Database	Citation
14998222	Pubmed	"Argo TR, Carnahan RM, Perry PJ. Aripiprazole, a novel atypical antipsychotic drug. Pharmacotherapy. 2004 Feb;24(2):212–28. <a href=""http://www.ncbi.nlm.nih.gov/pubmed/14998222"" target=""_blank"" class=""external"" rel=""nofollow"">PubMed</a> <a href=""https://europepmc.org/abstract/MED/14998222"" target=""_blank"" class=""external"" rel=""nofollow"">Europe PMC</a> <a href=""https://scholia.toolforge.org/pubmed/14998222"" target=""_blank"" class=""external"" rel=""nofollow"">Scholia</a>"
15257633	Pubmed	"Swainston Harrison T, Perry CM. Aripiprazole: a review of its use in schizophrenia and schizoaffective disorder. Drugs. 2004;64(15):1715–36. <a href=""http://www.ncbi.nlm.nih.gov/pubmed/15257633"" target=""_blank"" class=""external"" rel=""nofollow"">PubMed</a> <a href=""https://europepmc.org/abstract/MED/15257633"" target=""_blank"" class=""external"" rel=""nofollow"">Europe PMC</a> <a href=""https://scholia.toolforge.org/pubmed/15257633"" target=""_blank"" class=""external"" rel=""nofollow"">Scholia</a>"
15770075	Pubmed	"Kubo M, Koue T, Inaba A, Takeda H, Maune H, Fukuda T, et al. Influence of itraconazole co-administration and CYP2D6 genotype on the pharmacokinetics of the new antipsychotic ARIPIPRAZOLE. Drug Metab Pharmacokinet. 2005 Feb;20(1):55–64. <a href=""http://www.ncbi.nlm.nih.gov/pubmed/15770075"" target=""_blank"" class=""external"" rel=""nofollow"">PubMed</a> <a href=""https://europepmc.org/abstract/MED/15770075"" target=""_blank"" class=""external"" rel=""nofollow"">Europe PMC</a> <a href=""https://scholia.toolforge.org/pubmed/15770075"" target=""_blank"" class=""external"" rel=""nofollow"">Scholia</a>"
17164689	Pubmed	"Molden E, Lunde H, Lunder N, Refsum H. Pharmacokinetic variability of aripiprazole and the active metabolite dehydroaripiprazole in psychiatric patients. Ther Drug Monit. 2006 Dec;28(6):744–9. <a href=""http://www.ncbi.nlm.nih.gov/pubmed/17164689"" target=""_blank"" class=""external"" rel=""nofollow"">PubMed</a> <a href=""https://europepmc.org/abstract/MED/17164689"" target=""_blank"" class=""external"" rel=""nofollow"">Europe PMC</a> <a href=""https://scholia.toolforge.org/pubmed/17164689"" target=""_blank"" class=""external"" rel=""nofollow"">Scholia</a>"
17214606	Pubmed	"Spina E, de Leon J. Metabolic drug interactions with newer antipsychotics: a comparative review. Basic Clin Pharmacol Toxicol. 2007 Jan;100(1):4–22. <a href=""http://www.ncbi.nlm.nih.gov/pubmed/17214606"" target=""_blank"" class=""external"" rel=""nofollow"">PubMed</a> <a href=""https://europepmc.org/abstract/MED/17214606"" target=""_blank"" class=""external"" rel=""nofollow"">Europe PMC</a> <a href=""https://scholia.toolforge.org/pubmed/17214606"" target=""_blank"" class=""external"" rel=""nofollow"">Scholia</a>"
