ID	Database	Citation
16258936	Pubmed	"Van Hateren N, Shenton T, Borycki A-G. Expression of avian C-terminal binding proteins (Ctbp1 and Ctbp2) during embryonic development. Dev Dyn. 2006 Feb;235(2):490–5.  <a href=""http://www.ncbi.nlm.nih.gov/pubmed/16258936"" target=""_blank"" class=""external"" rel=""nofollow"">PubMed</a> <a href=""https://europepmc.org/abstract/MED/16258936"" target=""_blank"" class=""external"" rel=""nofollow"">Europe PMC</a> <a href=""https://scholia.toolforge.org/pubmed/16258936"" target=""_blank"" class=""external"" rel=""nofollow"">Scholia</a>"
16973150	Pubmed	"Alexandrova EM, Thomsen GH. Smurf1 regulates neural patterning and folding in Xenopus embryos by antagonizing the BMP/Smad1 pathway. Dev Biol. 2006 Nov 15;299(2):398–410.  <a href=""http://www.ncbi.nlm.nih.gov/pubmed/16973150"" target=""_blank"" class=""external"" rel=""nofollow"">PubMed</a> <a href=""https://europepmc.org/abstract/MED/16973150"" target=""_blank"" class=""external"" rel=""nofollow"">Europe PMC</a> <a href=""https://scholia.toolforge.org/pubmed/16973150"" target=""_blank"" class=""external"" rel=""nofollow"">Scholia</a>"
19666824	Pubmed	"Smith AN, Miller L-A, Radice G, Ashery-Padan R, Lang RA. Stage-dependent modes of Pax6-Sox2 epistasis regulate lens development and eye morphogenesis. Development. 2009 Sep;136(17):2977–85.  <a href=""http://www.ncbi.nlm.nih.gov/pubmed/19666824"" target=""_blank"" class=""external"" rel=""nofollow"">PubMed</a> <a href=""https://europepmc.org/abstract/MED/19666824"" target=""_blank"" class=""external"" rel=""nofollow"">Europe PMC</a> <a href=""https://scholia.toolforge.org/pubmed/19666824"" target=""_blank"" class=""external"" rel=""nofollow"">Scholia</a>"
19825829	Pubmed	"Meyn MA 3rd, Smithgall TE. Chemical genetics identifies c-Src as an activator of primitive ectoderm formation in murine embryonic stem cells. Sci Signal. 2009 Oct 13;2(92):ra64.  <a href=""http://www.ncbi.nlm.nih.gov/pubmed/19825829"" target=""_blank"" class=""external"" rel=""nofollow"">PubMed</a> <a href=""https://europepmc.org/abstract/MED/19825829"" target=""_blank"" class=""external"" rel=""nofollow"">Europe PMC</a> <a href=""https://scholia.toolforge.org/pubmed/19825829"" target=""_blank"" class=""external"" rel=""nofollow"">Scholia</a>"
22007134	Pubmed	"Andoniadou CL, Signore M, Young RM, Gaston-Massuet C, Wilson SW, Fuchs E, et al. HESX1- and TCF3-mediated repression of Wnt/β-catenin targets is required for normal development of the anterior forebrain. Development. 2011 Nov;138(22):4931–42.  <a href=""http://www.ncbi.nlm.nih.gov/pubmed/22007134"" target=""_blank"" class=""external"" rel=""nofollow"">PubMed</a> <a href=""https://europepmc.org/abstract/MED/22007134"" target=""_blank"" class=""external"" rel=""nofollow"">Europe PMC</a> <a href=""https://scholia.toolforge.org/pubmed/22007134"" target=""_blank"" class=""external"" rel=""nofollow"">Scholia</a>"
23022961	Pubmed	"Swope D, Li J, Radice GL. Beyond cell adhesion: the role of armadillo proteins in the heart. Cell Signal. 2013 Jan;25(1):93–100.  <a href=""http://www.ncbi.nlm.nih.gov/pubmed/23022961"" target=""_blank"" class=""external"" rel=""nofollow"">PubMed</a> <a href=""https://europepmc.org/abstract/MED/23022961"" target=""_blank"" class=""external"" rel=""nofollow"">Europe PMC</a> <a href=""https://scholia.toolforge.org/pubmed/23022961"" target=""_blank"" class=""external"" rel=""nofollow"">Scholia</a>"
23123965	Pubmed	"Mukhopadhyay A, Krishnaswami SR, Cowing-Zitron C, Hung N-J, Reilly-Rhoten H, Burns J, et al. Negative regulation of Shh levels by Kras and Fgfr2 during hair follicle development. Dev Biol. 2013 Jan 15;373(2):373–82.  <a href=""http://www.ncbi.nlm.nih.gov/pubmed/23123965"" target=""_blank"" class=""external"" rel=""nofollow"">PubMed</a> <a href=""https://europepmc.org/abstract/MED/23123965"" target=""_blank"" class=""external"" rel=""nofollow"">Europe PMC</a> <a href=""https://scholia.toolforge.org/pubmed/23123965"" target=""_blank"" class=""external"" rel=""nofollow"">Scholia</a>"
23643939	Pubmed	"Leung AW, Kent Morest D, Li JYH. Differential BMP signaling controls formation and differentiation of multipotent preplacodal ectoderm progenitors from human embryonic stem cells. Dev Biol. 2013 Jul 15;379(2):208–20.  <a href=""http://www.ncbi.nlm.nih.gov/pubmed/23643939"" target=""_blank"" class=""external"" rel=""nofollow"">PubMed</a> <a href=""https://europepmc.org/abstract/MED/23643939"" target=""_blank"" class=""external"" rel=""nofollow"">Europe PMC</a> <a href=""https://scholia.toolforge.org/pubmed/23643939"" target=""_blank"" class=""external"" rel=""nofollow"">Scholia</a>"
23677624	Pubmed	"Lee MY, Sun L, Veltmaat JM. Hedgehog and Gli signaling in embryonic mammary gland development. J Mammary Gland Biol Neoplasia. 2013 Jun;18(2):133–8.  <a href=""http://www.ncbi.nlm.nih.gov/pubmed/23677624"" target=""_blank"" class=""external"" rel=""nofollow"">PubMed</a> <a href=""https://europepmc.org/abstract/MED/23677624"" target=""_blank"" class=""external"" rel=""nofollow"">Europe PMC</a> <a href=""https://scholia.toolforge.org/pubmed/23677624"" target=""_blank"" class=""external"" rel=""nofollow"">Scholia</a>"
