ID	Database	Citation
11991950	Pubmed	"Drocourt L, Ourlin J-C, Pascussi J-M, Maurel P, Vilarem M-J. Expression of CYP3A4, CYP2B6, and CYP2C9 is regulated by the vitamin D receptor pathway in primary human hepatocytes. J Biol Chem. 2002 Jul 12;277(28):25125–32. <a href=""http://www.ncbi.nlm.nih.gov/pubmed/11991950"" target=""_blank"" class=""external"" rel=""nofollow"">PubMed</a> <a href=""https://europepmc.org/abstract/MED/11991950"" target=""_blank"" class=""external"" rel=""nofollow"">Europe PMC</a> <a href=""https://scholia.toolforge.org/pubmed/11991950"" target=""_blank"" class=""external"" rel=""nofollow"">Scholia</a>"
12573484	Pubmed	"Pascussi JM, Gerbal-Chaloin S, Drocourt L, Maurel P, Vilarem MJ. The expression of CYP2B6, CYP2C9 and CYP3A4 genes: a tangle of networks of nuclear and steroid receptors. Biochim Biophys Acta. 2003 Feb 17;1619(3):243–53. <a href=""http://www.ncbi.nlm.nih.gov/pubmed/12573484"" target=""_blank"" class=""external"" rel=""nofollow"">PubMed</a> <a href=""https://europepmc.org/abstract/MED/12573484"" target=""_blank"" class=""external"" rel=""nofollow"">Europe PMC</a> <a href=""https://scholia.toolforge.org/pubmed/12573484"" target=""_blank"" class=""external"" rel=""nofollow"">Scholia</a>"
14978251	Pubmed	"Echchgadda I, Song CS, Roy AK, Chatterjee B. Dehydroepiandrosterone sulfotransferase is a target for transcriptional induction by the vitamin D receptor. Mol Pharmacol. 2004 Mar;65(3):720–9. <a href=""http://www.ncbi.nlm.nih.gov/pubmed/14978251"" target=""_blank"" class=""external"" rel=""nofollow"">PubMed</a> <a href=""https://europepmc.org/abstract/MED/14978251"" target=""_blank"" class=""external"" rel=""nofollow"">Europe PMC</a> <a href=""https://scholia.toolforge.org/pubmed/14978251"" target=""_blank"" class=""external"" rel=""nofollow"">Scholia</a>"
15205382	Pubmed	"Yasunami Y, Hara H, Iwamura T, Kataoka T, Adachi T. C-jun N-terminal kinase modulates 1,25-dihydroxyvitamin D3-induced cytochrome P450 3A4 gene expression. Drug Metab Dispos. 2004 Jul;32(7):685–8. <a href=""http://www.ncbi.nlm.nih.gov/pubmed/15205382"" target=""_blank"" class=""external"" rel=""nofollow"">PubMed</a> <a href=""https://europepmc.org/abstract/MED/15205382"" target=""_blank"" class=""external"" rel=""nofollow"">Europe PMC</a> <a href=""https://scholia.toolforge.org/pubmed/15205382"" target=""_blank"" class=""external"" rel=""nofollow"">Scholia</a>"
15581595	Pubmed	"Handschin C, Meyer UA. Regulatory network of lipid-sensing nuclear receptors: roles for CAR, PXR, LXR, and FXR. Arch Biochem Biophys. 2005 Jan 15;433(2):387–96. <a href=""http://www.ncbi.nlm.nih.gov/pubmed/15581595"" target=""_blank"" class=""external"" rel=""nofollow"">PubMed</a> <a href=""https://europepmc.org/abstract/MED/15581595"" target=""_blank"" class=""external"" rel=""nofollow"">Europe PMC</a> <a href=""https://scholia.toolforge.org/pubmed/15581595"" target=""_blank"" class=""external"" rel=""nofollow"">Scholia</a>"
16002434	Pubmed	"Wang T-T, Tavera-Mendoza LE, Laperriere D, Libby E, MacLeod NB, Nagai Y, et al. Large-scale in silico and microarray-based identification of direct 1,25-dihydroxyvitamin D3 target genes. Mol Endocrinol. 2005 Nov;19(11):2685–95. <a href=""http://www.ncbi.nlm.nih.gov/pubmed/16002434"" target=""_blank"" class=""external"" rel=""nofollow"">PubMed</a> <a href=""https://europepmc.org/abstract/MED/16002434"" target=""_blank"" class=""external"" rel=""nofollow"">Europe PMC</a> <a href=""https://scholia.toolforge.org/pubmed/16002434"" target=""_blank"" class=""external"" rel=""nofollow"">Scholia</a>"
16186133	Pubmed	"Matilainen M, Malinen M, Saavalainen K, Carlberg C. Regulation of multiple insulin-like growth factor binding protein genes by 1alpha,25-dihydroxyvitamin D3. Nucleic Acids Res. 2005 Sep 26;33(17):5521–32. <a href=""http://www.ncbi.nlm.nih.gov/pubmed/16186133"" target=""_blank"" class=""external"" rel=""nofollow"">PubMed</a> <a href=""https://europepmc.org/abstract/MED/16186133"" target=""_blank"" class=""external"" rel=""nofollow"">Europe PMC</a> <a href=""https://scholia.toolforge.org/pubmed/16186133"" target=""_blank"" class=""external"" rel=""nofollow"">Scholia</a>"
16399349	Pubmed	"Chatterjee B, Echchgadda I, Song CS. Vitamin D receptor regulation of the steroid/bile acid sulfotransferase SULT2A1. Methods Enzymol. 2005;400:165–91. <a href=""http://www.ncbi.nlm.nih.gov/pubmed/16399349"" target=""_blank"" class=""external"" rel=""nofollow"">PubMed</a> <a href=""https://europepmc.org/abstract/MED/16399349"" target=""_blank"" class=""external"" rel=""nofollow"">Europe PMC</a> <a href=""https://scholia.toolforge.org/pubmed/16399349"" target=""_blank"" class=""external"" rel=""nofollow"">Scholia</a>"
17721433	Pubmed	"Deeb KK, Trump DL, Johnson CS. Vitamin D signalling pathways in cancer: potential for anticancer therapeutics. Nat Rev Cancer. 2007 Sep;7(9):684–700. <a href=""http://www.ncbi.nlm.nih.gov/pubmed/17721433"" target=""_blank"" class=""external"" rel=""nofollow"">PubMed</a> <a href=""https://europepmc.org/abstract/MED/17721433"" target=""_blank"" class=""external"" rel=""nofollow"">Europe PMC</a> <a href=""https://scholia.toolforge.org/pubmed/17721433"" target=""_blank"" class=""external"" rel=""nofollow"">Scholia</a>"
19106115	Pubmed	"Han S, Chiang JYL. Mechanism of vitamin D receptor inhibition of cholesterol 7alpha-hydroxylase gene transcription in human hepatocytes. Drug Metab Dispos. 2009 Mar;37(3):469–78. <a href=""http://www.ncbi.nlm.nih.gov/pubmed/19106115"" target=""_blank"" class=""external"" rel=""nofollow"">PubMed</a> <a href=""https://europepmc.org/abstract/MED/19106115"" target=""_blank"" class=""external"" rel=""nofollow"">Europe PMC</a> <a href=""https://scholia.toolforge.org/pubmed/19106115"" target=""_blank"" class=""external"" rel=""nofollow"">Scholia</a>"
19667142	Pubmed	"Carlberg C, Seuter S. A genomic perspective on vitamin D signaling. Anticancer Res. 2009 Sep;29(9):3485–93. <a href=""http://www.ncbi.nlm.nih.gov/pubmed/19667142"" target=""_blank"" class=""external"" rel=""nofollow"">PubMed</a> <a href=""https://europepmc.org/abstract/MED/19667142"" target=""_blank"" class=""external"" rel=""nofollow"">Europe PMC</a> <a href=""https://scholia.toolforge.org/pubmed/19667142"" target=""_blank"" class=""external"" rel=""nofollow"">Scholia</a>"
20736230	Pubmed	"Ramagopalan SV, Heger A, Berlanga AJ, Maugeri NJ, Lincoln MR, Burrell A, et al. A ChIP-seq defined genome-wide map of vitamin D receptor binding: associations with disease and evolution. Genome Res. 2010 Oct;20(10):1352–60. <a href=""http://www.ncbi.nlm.nih.gov/pubmed/20736230"" target=""_blank"" class=""external"" rel=""nofollow"">PubMed</a> <a href=""https://europepmc.org/abstract/MED/20736230"" target=""_blank"" class=""external"" rel=""nofollow"">Europe PMC</a> <a href=""https://scholia.toolforge.org/pubmed/20736230"" target=""_blank"" class=""external"" rel=""nofollow"">Scholia</a>"
21870057	Pubmed	"Pike JW, Meyer MB, Bishop KA. Regulation of target gene expression by the vitamin D receptor - an update on mechanisms. Rev Endocr Metab Disord. 2012 Mar;13(1):45–55. <a href=""http://www.ncbi.nlm.nih.gov/pubmed/21870057"" target=""_blank"" class=""external"" rel=""nofollow"">PubMed</a> <a href=""https://europepmc.org/abstract/MED/21870057"" target=""_blank"" class=""external"" rel=""nofollow"">Europe PMC</a> <a href=""https://scholia.toolforge.org/pubmed/21870057"" target=""_blank"" class=""external"" rel=""nofollow"">Scholia</a>"
21872797	Pubmed	"Haussler MR, Jurutka PW, Mizwicki M, Norman AW. Vitamin D receptor (VDR)-mediated actions of 1α,25(OH)₂vitamin D₃: genomic and non-genomic mechanisms. Best Pract Res Clin Endocrinol Metab. 2011 Aug;25(4):543–59. <a href=""http://www.ncbi.nlm.nih.gov/pubmed/21872797"" target=""_blank"" class=""external"" rel=""nofollow"">PubMed</a> <a href=""https://europepmc.org/abstract/MED/21872797"" target=""_blank"" class=""external"" rel=""nofollow"">Europe PMC</a> <a href=""https://scholia.toolforge.org/pubmed/21872797"" target=""_blank"" class=""external"" rel=""nofollow"">Scholia</a>"
22213316	Pubmed	"Carlberg C, Seuter S, Heikkinen S. The first genome-wide view of vitamin D receptor locations and their mechanistic implications. Anticancer Res. 2012 Jan;32(1):271–82. <a href=""http://www.ncbi.nlm.nih.gov/pubmed/22213316"" target=""_blank"" class=""external"" rel=""nofollow"">PubMed</a> <a href=""https://europepmc.org/abstract/MED/22213316"" target=""_blank"" class=""external"" rel=""nofollow"">Europe PMC</a> <a href=""https://scholia.toolforge.org/pubmed/22213316"" target=""_blank"" class=""external"" rel=""nofollow"">Scholia</a>"
22782502	Pubmed	"Haussler MR, Whitfield GK, Kaneko I, Haussler CA, Hsieh D, Hsieh J-C, et al. Molecular mechanisms of vitamin D action. Calcif Tissue Int. 2013 Feb;92(2):77–98. <a href=""http://www.ncbi.nlm.nih.gov/pubmed/22782502"" target=""_blank"" class=""external"" rel=""nofollow"">PubMed</a> <a href=""https://europepmc.org/abstract/MED/22782502"" target=""_blank"" class=""external"" rel=""nofollow"">Europe PMC</a> <a href=""https://scholia.toolforge.org/pubmed/22782502"" target=""_blank"" class=""external"" rel=""nofollow"">Scholia</a>"
23923049	Pubmed	"Carlberg C, Seuter S, de Mello VDF, Schwab U, Voutilainen S, Pulkki K, et al. Primary vitamin D target genes allow a categorization of possible benefits of vitamin D₃ supplementation. PLoS One. 2013 Jul 29;8(7):e71042. <a href=""http://www.ncbi.nlm.nih.gov/pubmed/23923049"" target=""_blank"" class=""external"" rel=""nofollow"">PubMed</a> <a href=""https://europepmc.org/abstract/MED/23923049"" target=""_blank"" class=""external"" rel=""nofollow"">Europe PMC</a> <a href=""https://scholia.toolforge.org/pubmed/23923049"" target=""_blank"" class=""external"" rel=""nofollow"">Scholia</a>"
23999061	Pubmed	"Seuter S, Ryynänen J, Carlberg C. The ASAP2 gene is a primary target of 1,25-dihydroxyvitamin D3 in human monocytes and macrophages. J Steroid Biochem Mol Biol. 2014 Oct;144 Pt A:12–8. <a href=""http://www.ncbi.nlm.nih.gov/pubmed/23999061"" target=""_blank"" class=""external"" rel=""nofollow"">PubMed</a> <a href=""https://europepmc.org/abstract/MED/23999061"" target=""_blank"" class=""external"" rel=""nofollow"">Europe PMC</a> <a href=""https://scholia.toolforge.org/pubmed/23999061"" target=""_blank"" class=""external"" rel=""nofollow"">Scholia</a>"
24202443	Pubmed	"Ryynänen J, Seuter S, Campbell MJ, Carlberg C. Gene regulatory scenarios of primary 1,25-dihydroxyvitamin d3 target genes in a human myeloid leukemia cell line. Cancers (Basel). 2013 Oct 16;5(4):1221–41. <a href=""http://www.ncbi.nlm.nih.gov/pubmed/24202443"" target=""_blank"" class=""external"" rel=""nofollow"">PubMed</a> <a href=""https://europepmc.org/abstract/MED/24202443"" target=""_blank"" class=""external"" rel=""nofollow"">Europe PMC</a> <a href=""https://scholia.toolforge.org/pubmed/24202443"" target=""_blank"" class=""external"" rel=""nofollow"">Scholia</a>"
24247221	Pubmed	"Bouillon R, Carmeliet G, Lieben L, Watanabe M, Perino A, Auwerx J, et al. Vitamin D and energy homeostasis: of mice and men. Nat Rev Endocrinol. 2014 Feb;10(2):79–87. <a href=""http://www.ncbi.nlm.nih.gov/pubmed/24247221"" target=""_blank"" class=""external"" rel=""nofollow"">PubMed</a> <a href=""https://europepmc.org/abstract/MED/24247221"" target=""_blank"" class=""external"" rel=""nofollow"">Europe PMC</a> <a href=""https://scholia.toolforge.org/pubmed/24247221"" target=""_blank"" class=""external"" rel=""nofollow"">Scholia</a>"
24261707	Pubmed	"Fijten RRR, Jennen DGJ, van Delft JHM. Pathways for ligand activated nuclear receptors to unravel the genomic responses induced by hepatotoxicants. Curr Drug Metab. 2013 Dec;14(10):1022–8. <a href=""http://www.ncbi.nlm.nih.gov/pubmed/24261707"" target=""_blank"" class=""external"" rel=""nofollow"">PubMed</a> <a href=""https://europepmc.org/abstract/MED/24261707"" target=""_blank"" class=""external"" rel=""nofollow"">Europe PMC</a> <a href=""https://scholia.toolforge.org/pubmed/24261707"" target=""_blank"" class=""external"" rel=""nofollow"">Scholia</a>"
24726990	Pubmed	"Goeman F, De Nicola F, D’Onorio De Meo P, Pallocca M, Elmi B, Castrignanò T, et al. VDR primary targets by genome-wide transcriptional profiling. J Steroid Biochem Mol Biol. 2014 Sep;143:348–56. <a href=""http://www.ncbi.nlm.nih.gov/pubmed/24726990"" target=""_blank"" class=""external"" rel=""nofollow"">PubMed</a> <a href=""https://europepmc.org/abstract/MED/24726990"" target=""_blank"" class=""external"" rel=""nofollow"">Europe PMC</a> <a href=""https://scholia.toolforge.org/pubmed/24726990"" target=""_blank"" class=""external"" rel=""nofollow"">Scholia</a>"
24854954	Pubmed	"Wilfinger J, Seuter S, Tuomainen T-P, Virtanen JK, Voutilainen S, Nurmi T, et al. Primary vitamin D receptor target genes as biomarkers for the vitamin D3 status in the hematopoietic system. J Nutr Biochem. 2014 Aug;25(8):875–84. <a href=""http://www.ncbi.nlm.nih.gov/pubmed/24854954"" target=""_blank"" class=""external"" rel=""nofollow"">PubMed</a> <a href=""https://europepmc.org/abstract/MED/24854954"" target=""_blank"" class=""external"" rel=""nofollow"">Europe PMC</a> <a href=""https://scholia.toolforge.org/pubmed/24854954"" target=""_blank"" class=""external"" rel=""nofollow"">Scholia</a>"
24975273	Pubmed	"Ryynänen J, Neme A, Tuomainen T-P, Virtanen JK, Voutilainen S, Nurmi T, et al. Changes in vitamin D target gene expression in adipose tissue monitor the vitamin D response of human individuals. Mol Nutr Food Res. 2014 Oct;58(10):2036–45. <a href=""http://www.ncbi.nlm.nih.gov/pubmed/24975273"" target=""_blank"" class=""external"" rel=""nofollow"">PubMed</a> <a href=""https://europepmc.org/abstract/MED/24975273"" target=""_blank"" class=""external"" rel=""nofollow"">Europe PMC</a> <a href=""https://scholia.toolforge.org/pubmed/24975273"" target=""_blank"" class=""external"" rel=""nofollow"">Scholia</a>"
