ID	Database	Citation
18927507	Pubmed	"FoxO1 integrates insulin signaling to VLDL production. Kamagate A, Dong HH. Cell Cycle. 2008 Oct;7(20):3162–70.  <a href=""http://www.ncbi.nlm.nih.gov/pubmed/18927507"" target=""_blank"" class=""external"" rel=""nofollow"">PubMed</a> <a href=""https://europepmc.org/abstract/MED/18927507"" target=""_blank"" class=""external"" rel=""nofollow"">Europe PMC</a> <a href=""https://scholia.toolforge.org/pubmed/18927507"" target=""_blank"" class=""external"" rel=""nofollow"">Scholia</a>"
18938145	Pubmed	"The controversial place of vitamin C in cancer treatment. Verrax J, Calderon PB. Biochem Pharmacol. 2008 Dec 15;76(12):1644–52.  <a href=""http://www.ncbi.nlm.nih.gov/pubmed/18938145"" target=""_blank"" class=""external"" rel=""nofollow"">PubMed</a> <a href=""https://europepmc.org/abstract/MED/18938145"" target=""_blank"" class=""external"" rel=""nofollow"">Europe PMC</a> <a href=""https://scholia.toolforge.org/pubmed/18938145"" target=""_blank"" class=""external"" rel=""nofollow"">Scholia</a>"
18987785	Pubmed	"Oxidative modification of LDL: its pathological role in atherosclerosis. Itabe H. Clin Rev Allergy Immunol. 2009 Aug;37(1):4–11.  <a href=""http://www.ncbi.nlm.nih.gov/pubmed/18987785"" target=""_blank"" class=""external"" rel=""nofollow"">PubMed</a> <a href=""https://europepmc.org/abstract/MED/18987785"" target=""_blank"" class=""external"" rel=""nofollow"">Europe PMC</a> <a href=""https://scholia.toolforge.org/pubmed/18987785"" target=""_blank"" class=""external"" rel=""nofollow"">Scholia</a>"
19024248	Pubmed	"Fructosamine--an underutilized tool in diabetes management: case report and literature review. Youssef D, El Abbassi A, Jordan RM, Peiris AN. Tenn Med. 2008 Nov;101(11):31–3.  <a href=""http://www.ncbi.nlm.nih.gov/pubmed/19024248"" target=""_blank"" class=""external"" rel=""nofollow"">PubMed</a> <a href=""https://europepmc.org/abstract/MED/19024248"" target=""_blank"" class=""external"" rel=""nofollow"">Europe PMC</a> <a href=""https://scholia.toolforge.org/pubmed/19024248"" target=""_blank"" class=""external"" rel=""nofollow"">Scholia</a>"
19373259	Pubmed	"TC II deficiency: avoidance of false-negative molecular genetics by RNA-based investigations. Häberle J, Pauli S, Berning C, Koch HG, Linnebank M. J Hum Genet. 2009 Jun;54(6):331–4.  <a href=""http://www.ncbi.nlm.nih.gov/pubmed/19373259"" target=""_blank"" class=""external"" rel=""nofollow"">PubMed</a> <a href=""https://europepmc.org/abstract/MED/19373259"" target=""_blank"" class=""external"" rel=""nofollow"">Europe PMC</a> <a href=""https://scholia.toolforge.org/pubmed/19373259"" target=""_blank"" class=""external"" rel=""nofollow"">Scholia</a>"
19403631	Pubmed	"Studies of biomarker responses to intervention with riboflavin: a systematic review. Hoey L, McNulty H, Strain JJ. Am J Clin Nutr. 2009 Jun;89(6):1960S-1980S.  <a href=""http://www.ncbi.nlm.nih.gov/pubmed/19403631"" target=""_blank"" class=""external"" rel=""nofollow"">PubMed</a> <a href=""https://europepmc.org/abstract/MED/19403631"" target=""_blank"" class=""external"" rel=""nofollow"">Europe PMC</a> <a href=""https://scholia.toolforge.org/pubmed/19403631"" target=""_blank"" class=""external"" rel=""nofollow"">Scholia</a>"
19413181	Pubmed	"Should D-dimer testing be used to predict the risk of recurrence after discontinuation of anticoagulant therapy for a first unprovoked episode of venous thromboembolism? Wu C, Bates SM. Pol Arch Med Wewn. 2009 Apr;119(4):225–30.  <a href=""http://www.ncbi.nlm.nih.gov/pubmed/19413181"" target=""_blank"" class=""external"" rel=""nofollow"">PubMed</a> <a href=""https://europepmc.org/abstract/MED/19413181"" target=""_blank"" class=""external"" rel=""nofollow"">Europe PMC</a> <a href=""https://scholia.toolforge.org/pubmed/19413181"" target=""_blank"" class=""external"" rel=""nofollow"">Scholia</a>"
19415921	Pubmed	"Protein tyrosine nitration: selectivity, physicochemical and biological consequences, denitration, and proteomics methods for the identification of tyrosine-nitrated proteins. Abello N, Kerstjens HAM, Postma DS, Bischoff R. J Proteome Res. 2009 Jul;8(7):3222–38.  <a href=""http://www.ncbi.nlm.nih.gov/pubmed/19415921"" target=""_blank"" class=""external"" rel=""nofollow"">PubMed</a> <a href=""https://europepmc.org/abstract/MED/19415921"" target=""_blank"" class=""external"" rel=""nofollow"">Europe PMC</a> <a href=""https://scholia.toolforge.org/pubmed/19415921"" target=""_blank"" class=""external"" rel=""nofollow"">Scholia</a>"
19450180	Pubmed	"Role of the MTHFR polymorphisms in cancer risk modification and treatment. Kim YI. Future Oncol. 2009 May;5(4):523–42.  <a href=""http://www.ncbi.nlm.nih.gov/pubmed/19450180"" target=""_blank"" class=""external"" rel=""nofollow"">PubMed</a> <a href=""https://europepmc.org/abstract/MED/19450180"" target=""_blank"" class=""external"" rel=""nofollow"">Europe PMC</a> <a href=""https://scholia.toolforge.org/pubmed/19450180"" target=""_blank"" class=""external"" rel=""nofollow"">Scholia</a>"
19625220	Pubmed	"Folate/homocysteine phenotypes and MTHFR 677C>T genotypes are associated with serum levels of monocyte chemoattractant protein-1. Hammons AL, Summers CM, Woodside JV, McNulty H, Strain JJ, Young IS, et al. Clin Immunol. 2009 Oct;133(1):132–7.  <a href=""http://www.ncbi.nlm.nih.gov/pubmed/19625220"" target=""_blank"" class=""external"" rel=""nofollow"">PubMed</a> <a href=""https://europepmc.org/abstract/MED/19625220"" target=""_blank"" class=""external"" rel=""nofollow"">Europe PMC</a> <a href=""https://scholia.toolforge.org/pubmed/19625220"" target=""_blank"" class=""external"" rel=""nofollow"">Scholia</a>"
19674315	Pubmed	"Review article: Coagulation cascade and therapeutics update: relevance to nephrology. Part 1: Overview of coagulation, thrombophilias and history of anticoagulants. Adams RLC, Bird RJ. Nephrology (Carlton). 2009 Aug;14(5):462–70.  <a href=""http://www.ncbi.nlm.nih.gov/pubmed/19674315"" target=""_blank"" class=""external"" rel=""nofollow"">PubMed</a> <a href=""https://europepmc.org/abstract/MED/19674315"" target=""_blank"" class=""external"" rel=""nofollow"">Europe PMC</a> <a href=""https://scholia.toolforge.org/pubmed/19674315"" target=""_blank"" class=""external"" rel=""nofollow"">Scholia</a>"
19707742	Pubmed	"Low plasma vitamin B12 in pregnancy is associated with gestational “diabesity” and later diabetes. Krishnaveni GV, Hill JC, Veena SR, Bhat DS, Wills AK, Karat CLS, et al. Diabetologia. 2009 Nov;52(11):2350–8.  <a href=""http://www.ncbi.nlm.nih.gov/pubmed/19707742"" target=""_blank"" class=""external"" rel=""nofollow"">PubMed</a> <a href=""https://europepmc.org/abstract/MED/19707742"" target=""_blank"" class=""external"" rel=""nofollow"">Europe PMC</a> <a href=""https://scholia.toolforge.org/pubmed/19707742"" target=""_blank"" class=""external"" rel=""nofollow"">Scholia</a>"
19803417	Pubmed	"Proinflammatory cytokines in CRP baseline regulation. Eklund CM. Adv Clin Chem. 2009;48:111–36.  <a href=""http://www.ncbi.nlm.nih.gov/pubmed/19803417"" target=""_blank"" class=""external"" rel=""nofollow"">PubMed</a> <a href=""https://europepmc.org/abstract/MED/19803417"" target=""_blank"" class=""external"" rel=""nofollow"">Europe PMC</a> <a href=""https://scholia.toolforge.org/pubmed/19803417"" target=""_blank"" class=""external"" rel=""nofollow"">Scholia</a>"
19854035	Pubmed	"Associations of plasma homocysteine level with brachial-ankle pulse wave velocity, LDL atherogenicity, and inflammation profile in healthy men. Yun J, Kim JY, Kim OY, Jang Y, Chae JS, Kwak JH, et al. Nutr Metab Cardiovasc Dis. 2011 Feb;21(2):136–43.  <a href=""http://www.ncbi.nlm.nih.gov/pubmed/19854035"" target=""_blank"" class=""external"" rel=""nofollow"">PubMed</a> <a href=""https://europepmc.org/abstract/MED/19854035"" target=""_blank"" class=""external"" rel=""nofollow"">Europe PMC</a> <a href=""https://scholia.toolforge.org/pubmed/19854035"" target=""_blank"" class=""external"" rel=""nofollow"">Scholia</a>"
19940234	Pubmed	"HDL as a biomarker, potential therapeutic target, and therapy. Navab M, Anantharamaiah GM, Reddy ST, Van Lenten BJ, Fogelman AM. Diabetes. 2009 Dec;58(12):2711–7.  <a href=""http://www.ncbi.nlm.nih.gov/pubmed/19940234"" target=""_blank"" class=""external"" rel=""nofollow"">PubMed</a> <a href=""https://europepmc.org/abstract/MED/19940234"" target=""_blank"" class=""external"" rel=""nofollow"">Europe PMC</a> <a href=""https://scholia.toolforge.org/pubmed/19940234"" target=""_blank"" class=""external"" rel=""nofollow"">Scholia</a>"
20110595	Pubmed	"Vitamin B12 levels in Alzheimer’s disease: association with clinical features and cytokine production. Politis A, Olgiati P, Malitas P, Albani D, Signorini A, Polito L, et al. J Alzheimers Dis. 2010;19(2):481–8.  <a href=""http://www.ncbi.nlm.nih.gov/pubmed/20110595"" target=""_blank"" class=""external"" rel=""nofollow"">PubMed</a> <a href=""https://europepmc.org/abstract/MED/20110595"" target=""_blank"" class=""external"" rel=""nofollow"">Europe PMC</a> <a href=""https://scholia.toolforge.org/pubmed/20110595"" target=""_blank"" class=""external"" rel=""nofollow"">Scholia</a>"
