ID	Database	Citation
10949293	Pubmed	"Regulation of chromatin structure by site-specific histone H3 methyltransferases. Rea S, Eisenhaber F, O’Carroll D, Strahl BD, Sun ZW, Schmid M, et al. Nature. 2000 Aug 10;406(6796):593–9.  <a href=""http://www.ncbi.nlm.nih.gov/pubmed/10949293"" target=""_blank"" class=""external"" rel=""nofollow"">PubMed</a> <a href=""https://europepmc.org/abstract/MED/10949293"" target=""_blank"" class=""external"" rel=""nofollow"">Europe PMC</a> <a href=""https://scholia.toolforge.org/pubmed/10949293"" target=""_blank"" class=""external"" rel=""nofollow"">Scholia</a>"
11805083	Pubmed	"COMPASS, a histone H3 (Lysine 4) methyltransferase required for telomeric silencing of gene expression. Krogan NJ, Dover J, Khorrami S, Greenblatt JF, Schneider J, Johnston M, et al. J Biol Chem. 2002 Mar 29;277(13):10753–5.  <a href=""http://www.ncbi.nlm.nih.gov/pubmed/11805083"" target=""_blank"" class=""external"" rel=""nofollow"">PubMed</a> <a href=""https://europepmc.org/abstract/MED/11805083"" target=""_blank"" class=""external"" rel=""nofollow"">Europe PMC</a> <a href=""https://scholia.toolforge.org/pubmed/11805083"" target=""_blank"" class=""external"" rel=""nofollow"">Scholia</a>"
11839797	Pubmed	"Set2 is a nucleosomal histone H3-selective methyltransferase that mediates transcriptional repression. Strahl BD, Grant PA, Briggs SD, Sun ZW, Bone JR, Caldwell JA, et al. Mol Cell Biol. 2002 Mar;22(5):1298–306.  <a href=""http://www.ncbi.nlm.nih.gov/pubmed/11839797"" target=""_blank"" class=""external"" rel=""nofollow"">PubMed</a> <a href=""https://europepmc.org/abstract/MED/11839797"" target=""_blank"" class=""external"" rel=""nofollow"">Europe PMC</a> <a href=""https://scholia.toolforge.org/pubmed/11839797"" target=""_blank"" class=""external"" rel=""nofollow"">Scholia</a>"
12435631	Pubmed	"Histone methyltransferase activity associated with a human multiprotein complex containing the Enhancer of Zeste protein. Kuzmichev A, Nishioka K, Erdjument-Bromage H, Tempst P, Reinberg D. Genes Dev. 2002 Nov 15;16(22):2893–905.  <a href=""http://www.ncbi.nlm.nih.gov/pubmed/12435631"" target=""_blank"" class=""external"" rel=""nofollow"">PubMed</a> <a href=""https://europepmc.org/abstract/MED/12435631"" target=""_blank"" class=""external"" rel=""nofollow"">Europe PMC</a> <a href=""https://scholia.toolforge.org/pubmed/12435631"" target=""_blank"" class=""external"" rel=""nofollow"">Scholia</a>"
15145825	Pubmed	"A silencing pathway to induce H3-K9 and H4-K20 trimethylation at constitutive heterochromatin. Schotta G, Lachner M, Sarma K, Ebert A, Sengupta R, Reuter G, et al. Genes Dev. 2004 Jun 1;18(11):1251–62.  <a href=""http://www.ncbi.nlm.nih.gov/pubmed/15145825"" target=""_blank"" class=""external"" rel=""nofollow"">PubMed</a> <a href=""https://europepmc.org/abstract/MED/15145825"" target=""_blank"" class=""external"" rel=""nofollow"">Europe PMC</a> <a href=""https://scholia.toolforge.org/pubmed/15145825"" target=""_blank"" class=""external"" rel=""nofollow"">Scholia</a>"
http://en.wikipedia.org/wiki/Histone	URL	
http://en.wikipedia.org/wiki/Histone_methyltransferase	URL	
