ID	Database	Citation
15923610	Pubmed	"Banning A, Deubel S, Kluth D, Zhou Z, Brigelius-Flohé R. The GI-GPx gene is a target for Nrf2. Mol Cell Biol. 2005 Jun;25(12):4914–23.  <a href=""http://www.ncbi.nlm.nih.gov/pubmed/15923610"" target=""_blank"" class=""external"" rel=""nofollow"">PubMed</a> <a href=""https://europepmc.org/abstract/MED/15923610"" target=""_blank"" class=""external"" rel=""nofollow"">Europe PMC</a> <a href=""https://scholia.toolforge.org/pubmed/15923610"" target=""_blank"" class=""external"" rel=""nofollow"">Scholia</a>"
19321346	Pubmed	"Hayes JD, McMahon M. NRF2 and KEAP1 mutations: permanent activation of an adaptive response in cancer. Trends Biochem Sci. 2009 Apr;34(4):176–88.  <a href=""http://www.ncbi.nlm.nih.gov/pubmed/19321346"" target=""_blank"" class=""external"" rel=""nofollow"">PubMed</a> <a href=""https://europepmc.org/abstract/MED/19321346"" target=""_blank"" class=""external"" rel=""nofollow"">Europe PMC</a> <a href=""https://scholia.toolforge.org/pubmed/19321346"" target=""_blank"" class=""external"" rel=""nofollow"">Scholia</a>"
21189866	Pubmed	"Müller M, Banning A, Brigelius-Flohé R, Kipp A. Nrf2 target genes are induced under marginal selenium-deficiency. Genes Nutr. 2010 Dec;5(4):297–307.  <a href=""http://www.ncbi.nlm.nih.gov/pubmed/21189866"" target=""_blank"" class=""external"" rel=""nofollow"">PubMed</a> <a href=""https://europepmc.org/abstract/MED/21189866"" target=""_blank"" class=""external"" rel=""nofollow"">Europe PMC</a> <a href=""https://scholia.toolforge.org/pubmed/21189866"" target=""_blank"" class=""external"" rel=""nofollow"">Scholia</a>"
21420387	Pubmed	"Bock KW. From differential induction of UDP-glucuronosyltransferases in rat liver to characterization of responsible ligand-activated transcription factors, and their multilevel crosstalk in humans. Biochem Pharmacol. 2011 Jul 1;82(1):9–16.  <a href=""http://www.ncbi.nlm.nih.gov/pubmed/21420387"" target=""_blank"" class=""external"" rel=""nofollow"">PubMed</a> <a href=""https://europepmc.org/abstract/MED/21420387"" target=""_blank"" class=""external"" rel=""nofollow"">Europe PMC</a> <a href=""https://scholia.toolforge.org/pubmed/21420387"" target=""_blank"" class=""external"" rel=""nofollow"">Scholia</a>"
24261707	Pubmed	"Fijten RRR, Jennen DGJ, van Delft JHM. Pathways for ligand activated nuclear receptors to unravel the genomic responses induced by hepatotoxicants. Curr Drug Metab. 2013 Dec;14(10):1022–8.  <a href=""http://www.ncbi.nlm.nih.gov/pubmed/24261707"" target=""_blank"" class=""external"" rel=""nofollow"">PubMed</a> <a href=""https://europepmc.org/abstract/MED/24261707"" target=""_blank"" class=""external"" rel=""nofollow"">Europe PMC</a> <a href=""https://scholia.toolforge.org/pubmed/24261707"" target=""_blank"" class=""external"" rel=""nofollow"">Scholia</a>"
