ID	Database	Citation
1535095	Pubmed	"Regulation of cell cycle by cdc2 kinase in mammalian cells. Yasuda H. Seikagaku. 1992 Jan;64(1):1–13.  <a href=""http://www.ncbi.nlm.nih.gov/pubmed/1535095"" target=""_blank"" class=""external"" rel=""nofollow"">PubMed</a> <a href=""https://europepmc.org/abstract/MED/1535095"" target=""_blank"" class=""external"" rel=""nofollow"">Europe PMC</a> <a href=""https://scholia.toolforge.org/pubmed/1535095"" target=""_blank"" class=""external"" rel=""nofollow"">Scholia</a>"
1653904	Pubmed	"Isolation of the human cdk2 gene that encodes the cyclin A- and adenovirus E1A-associated p33 kinase. Tsai LH, Harlow E, Meyerson M. Nature. 1991 Sep 12;353(6340):174–7.  <a href=""http://www.ncbi.nlm.nih.gov/pubmed/1653904"" target=""_blank"" class=""external"" rel=""nofollow"">PubMed</a> <a href=""https://europepmc.org/abstract/MED/1653904"" target=""_blank"" class=""external"" rel=""nofollow"">Europe PMC</a> <a href=""https://scholia.toolforge.org/pubmed/1653904"" target=""_blank"" class=""external"" rel=""nofollow"">Scholia</a>"
2142119	Pubmed	"Assignment of the human gene for CREB1 to chromosome 2q32.3-q34. Taylor AK, Klisak I, Mohandas T, Sparkes RS, Li C, Gaynor R, et al. Genomics. 1990 Jul;7(3):416–21.  <a href=""http://www.ncbi.nlm.nih.gov/pubmed/2142119"" target=""_blank"" class=""external"" rel=""nofollow"">PubMed</a> <a href=""https://europepmc.org/abstract/MED/2142119"" target=""_blank"" class=""external"" rel=""nofollow"">Europe PMC</a> <a href=""https://scholia.toolforge.org/pubmed/2142119"" target=""_blank"" class=""external"" rel=""nofollow"">Scholia</a>"
2147521	Pubmed	"Cell cycle control in eukaryotes: molecular mechanisms of cdc2 activation. Draetta G. Trends Biochem Sci. 1990 Oct;15(10):378–83.  <a href=""http://www.ncbi.nlm.nih.gov/pubmed/2147521"" target=""_blank"" class=""external"" rel=""nofollow"">PubMed</a> <a href=""https://europepmc.org/abstract/MED/2147521"" target=""_blank"" class=""external"" rel=""nofollow"">Europe PMC</a> <a href=""https://scholia.toolforge.org/pubmed/2147521"" target=""_blank"" class=""external"" rel=""nofollow"">Scholia</a>"
7488937	Pubmed	"Cell cycle checkpoints and repair of ionizing radiation damage. Liu VF, Boubnov NV, Weaver DT. Stem Cells. 1995 May;13 Suppl 1:117–28.  <a href=""http://www.ncbi.nlm.nih.gov/pubmed/7488937"" target=""_blank"" class=""external"" rel=""nofollow"">PubMed</a> <a href=""https://europepmc.org/abstract/MED/7488937"" target=""_blank"" class=""external"" rel=""nofollow"">Europe PMC</a> <a href=""https://scholia.toolforge.org/pubmed/7488937"" target=""_blank"" class=""external"" rel=""nofollow"">Scholia</a>"
7554031	Pubmed	"Apoptosis, cancer and the p53 tumour suppressor gene. Lee JM, Bernstein A. Cancer Metastasis Rev. 1995 Jun;14(2):149–61.  <a href=""http://www.ncbi.nlm.nih.gov/pubmed/7554031"" target=""_blank"" class=""external"" rel=""nofollow"">PubMed</a> <a href=""https://europepmc.org/abstract/MED/7554031"" target=""_blank"" class=""external"" rel=""nofollow"">Europe PMC</a> <a href=""https://scholia.toolforge.org/pubmed/7554031"" target=""_blank"" class=""external"" rel=""nofollow"">Scholia</a>"
7587079	Pubmed	"DNA damage responses: p53 induction, cell cycle perturbations, and apoptosis. Canman CE, Chen CY, Lee MH, Kastan MB. Cold Spring Harb Symp Quant Biol. 1994;59:277–86.  <a href=""http://www.ncbi.nlm.nih.gov/pubmed/7587079"" target=""_blank"" class=""external"" rel=""nofollow"">PubMed</a> <a href=""https://europepmc.org/abstract/MED/7587079"" target=""_blank"" class=""external"" rel=""nofollow"">Europe PMC</a> <a href=""https://scholia.toolforge.org/pubmed/7587079"" target=""_blank"" class=""external"" rel=""nofollow"">Scholia</a>"
7606818	Pubmed	"P53, cell cycle control and apoptosis: implications for cancer. Kastan MB, Canman CE, Leonard CJ. Cancer Metastasis Rev. 1995 Mar;14(1):3–15.  <a href=""http://www.ncbi.nlm.nih.gov/pubmed/7606818"" target=""_blank"" class=""external"" rel=""nofollow"">PubMed</a> <a href=""https://europepmc.org/abstract/MED/7606818"" target=""_blank"" class=""external"" rel=""nofollow"">Europe PMC</a> <a href=""https://scholia.toolforge.org/pubmed/7606818"" target=""_blank"" class=""external"" rel=""nofollow"">Scholia</a>"
7672812	Pubmed	"The role of p53 in cell-cycle control and apoptosis: implications for cancer. Leonard CJ, Canman CE, Kastan MB. Important Adv Oncol. 1995;33–42.  <a href=""http://www.ncbi.nlm.nih.gov/pubmed/7672812"" target=""_blank"" class=""external"" rel=""nofollow"">PubMed</a> <a href=""https://europepmc.org/abstract/MED/7672812"" target=""_blank"" class=""external"" rel=""nofollow"">Europe PMC</a> <a href=""https://scholia.toolforge.org/pubmed/7672812"" target=""_blank"" class=""external"" rel=""nofollow"">Scholia</a>"
7787878	Pubmed	"Apoptosis and the cell cycle. Chiarugi V, Magnelli L, Cinelli M, Basi G. Cell Mol Biol Res. 1994;40(7–8):603–12.  <a href=""http://www.ncbi.nlm.nih.gov/pubmed/7787878"" target=""_blank"" class=""external"" rel=""nofollow"">PubMed</a> <a href=""https://europepmc.org/abstract/MED/7787878"" target=""_blank"" class=""external"" rel=""nofollow"">Europe PMC</a> <a href=""https://scholia.toolforge.org/pubmed/7787878"" target=""_blank"" class=""external"" rel=""nofollow"">Scholia</a>"
7948950	Pubmed	"Relationship of p53 to the control of apoptotic cell death. Oren M. Semin Cancer Biol. 1994 Jun;5(3):221–7.  <a href=""http://www.ncbi.nlm.nih.gov/pubmed/7948950"" target=""_blank"" class=""external"" rel=""nofollow"">PubMed</a> <a href=""https://europepmc.org/abstract/MED/7948950"" target=""_blank"" class=""external"" rel=""nofollow"">Europe PMC</a> <a href=""https://scholia.toolforge.org/pubmed/7948950"" target=""_blank"" class=""external"" rel=""nofollow"">Scholia</a>"
8301538	Pubmed	"The characterization of human cdc2 kinase and CDK2. Yasuda H, Kamijo M, Ohba Y. Yakugaku Zasshi. 1993 Dec;113(12):829–46.  <a href=""http://www.ncbi.nlm.nih.gov/pubmed/8301538"" target=""_blank"" class=""external"" rel=""nofollow"">PubMed</a> <a href=""https://europepmc.org/abstract/MED/8301538"" target=""_blank"" class=""external"" rel=""nofollow"">Europe PMC</a> <a href=""https://scholia.toolforge.org/pubmed/8301538"" target=""_blank"" class=""external"" rel=""nofollow"">Scholia</a>"
8533012	Pubmed	"p53: DNA damage, DNA repair, and apoptosis. Götz C, Montenarh M. Rev Physiol Biochem Pharmacol. 1996;127:65–95.  <a href=""http://www.ncbi.nlm.nih.gov/pubmed/8533012"" target=""_blank"" class=""external"" rel=""nofollow"">PubMed</a> <a href=""https://europepmc.org/abstract/MED/8533012"" target=""_blank"" class=""external"" rel=""nofollow"">Europe PMC</a> <a href=""https://scholia.toolforge.org/pubmed/8533012"" target=""_blank"" class=""external"" rel=""nofollow"">Scholia</a>"
8533157	Pubmed	"Cellular responses to DNA damage: cell-cycle checkpoints, apoptosis and the roles of p53 and ATM. Enoch T, Norbury C. Trends Biochem Sci. 1995 Oct;20(10):426–30.  <a href=""http://www.ncbi.nlm.nih.gov/pubmed/8533157"" target=""_blank"" class=""external"" rel=""nofollow"">PubMed</a> <a href=""https://europepmc.org/abstract/MED/8533157"" target=""_blank"" class=""external"" rel=""nofollow"">Europe PMC</a> <a href=""https://scholia.toolforge.org/pubmed/8533157"" target=""_blank"" class=""external"" rel=""nofollow"">Scholia</a>"
8617251	Pubmed	"Apoptosis: molecular regulation of cell death. Hale AJ, Smith CA, Sutherland LC, Stoneman VE, Longthorne VL, Culhane AC, et al. Eur J Biochem. 1996 Feb 15;236(1):1–26.  <a href=""http://www.ncbi.nlm.nih.gov/pubmed/8617251"" target=""_blank"" class=""external"" rel=""nofollow"">PubMed</a> <a href=""https://europepmc.org/abstract/MED/8617251"" target=""_blank"" class=""external"" rel=""nofollow"">Europe PMC</a> <a href=""https://scholia.toolforge.org/pubmed/8617251"" target=""_blank"" class=""external"" rel=""nofollow"">Scholia</a>"
8666399	Pubmed	"Structure and evolution of the human IKBA gene. Ito CY, Adey N, Bautch VL, Baldwin AS Jr. Genomics. 1995 Sep 20;29(2):490–5.  <a href=""http://www.ncbi.nlm.nih.gov/pubmed/8666399"" target=""_blank"" class=""external"" rel=""nofollow"">PubMed</a> <a href=""https://europepmc.org/abstract/MED/8666399"" target=""_blank"" class=""external"" rel=""nofollow"">Europe PMC</a> <a href=""https://scholia.toolforge.org/pubmed/8666399"" target=""_blank"" class=""external"" rel=""nofollow"">Scholia</a>"
8782982	Pubmed	"Ataxia telangiectasia: cell signaling, cell death and the cell cycle. Heintz N. Curr Opin Neurol. 1996 Apr;9(2):137–40.  <a href=""http://www.ncbi.nlm.nih.gov/pubmed/8782982"" target=""_blank"" class=""external"" rel=""nofollow"">PubMed</a> <a href=""https://europepmc.org/abstract/MED/8782982"" target=""_blank"" class=""external"" rel=""nofollow"">Europe PMC</a> <a href=""https://scholia.toolforge.org/pubmed/8782982"" target=""_blank"" class=""external"" rel=""nofollow"">Scholia</a>"
8939883	Pubmed	"Novel form of p21(WAF1/CIP1/SDI1) protein in phorbol ester-induced G2/M arrest. Tchou WW, Rom WN, Tchou-Wong KM. J Biol Chem. 1996 Nov 22;271(47):29556–60.  <a href=""http://www.ncbi.nlm.nih.gov/pubmed/8939883"" target=""_blank"" class=""external"" rel=""nofollow"">PubMed</a> <a href=""https://europepmc.org/abstract/MED/8939883"" target=""_blank"" class=""external"" rel=""nofollow"">Europe PMC</a> <a href=""https://scholia.toolforge.org/pubmed/8939883"" target=""_blank"" class=""external"" rel=""nofollow"">Scholia</a>"
8948422	Pubmed	"Cyclins and cyclin-dependent kinases: a biochemical view. Pines J. Biochem J. 1995 Jun 15;308 ( Pt 3)(Pt 3):697–711.  <a href=""http://www.ncbi.nlm.nih.gov/pubmed/8948422"" target=""_blank"" class=""external"" rel=""nofollow"">PubMed</a> <a href=""https://europepmc.org/abstract/MED/8948422"" target=""_blank"" class=""external"" rel=""nofollow"">Europe PMC</a> <a href=""https://scholia.toolforge.org/pubmed/8948422"" target=""_blank"" class=""external"" rel=""nofollow"">Scholia</a>"
8985253	Pubmed	"RAIDD is a new “death” adaptor molecule. Duan H, Dixit VM. Nature. 1997 Jan 2;385(6611):86–9.  <a href=""http://www.ncbi.nlm.nih.gov/pubmed/8985253"" target=""_blank"" class=""external"" rel=""nofollow"">PubMed</a> <a href=""https://europepmc.org/abstract/MED/8985253"" target=""_blank"" class=""external"" rel=""nofollow"">Europe PMC</a> <a href=""https://scholia.toolforge.org/pubmed/8985253"" target=""_blank"" class=""external"" rel=""nofollow"">Scholia</a>"
9108147	Pubmed	"Ataxia-telangiectasia: structural diversity of untranslated sequences suggests complex post-transcriptional regulation of ATM gene expression. Savitsky K, Platzer M, Uziel T, Gilad S, Sartiel A, Rosenthal A, et al. Nucleic Acids Res. 1997 May 1;25(9):1678–84.  <a href=""http://www.ncbi.nlm.nih.gov/pubmed/9108147"" target=""_blank"" class=""external"" rel=""nofollow"">PubMed</a> <a href=""https://europepmc.org/abstract/MED/9108147"" target=""_blank"" class=""external"" rel=""nofollow"">Europe PMC</a> <a href=""https://scholia.toolforge.org/pubmed/9108147"" target=""_blank"" class=""external"" rel=""nofollow"">Scholia</a>"
9261102	Pubmed	"Activation of caspase-2 in apoptosis. Li H, Bergeron L, Cryns V, Pasternack MS, Zhu H, Shi L, et al. J Biol Chem. 1997 Aug 22;272(34):21010–7.  <a href=""http://www.ncbi.nlm.nih.gov/pubmed/9261102"" target=""_blank"" class=""external"" rel=""nofollow"">PubMed</a> <a href=""https://europepmc.org/abstract/MED/9261102"" target=""_blank"" class=""external"" rel=""nofollow"">Europe PMC</a> <a href=""https://scholia.toolforge.org/pubmed/9261102"" target=""_blank"" class=""external"" rel=""nofollow"">Scholia</a>"
9363685	Pubmed	"Ataxia-telangiectasia: is ATM a sensor of oxidative damage and stress? Rotman G, Shiloh Y. Bioessays. 1997 Oct;19(10):911–7.  <a href=""http://www.ncbi.nlm.nih.gov/pubmed/9363685"" target=""_blank"" class=""external"" rel=""nofollow"">PubMed</a> <a href=""https://europepmc.org/abstract/MED/9363685"" target=""_blank"" class=""external"" rel=""nofollow"">Europe PMC</a> <a href=""https://scholia.toolforge.org/pubmed/9363685"" target=""_blank"" class=""external"" rel=""nofollow"">Scholia</a>"
9418909	Pubmed	"Effects of p21(Cip1/Waf1) at both the G1/S and the G2/M cell cycle transitions: pRb is a critical determinant in blocking DNA replication and in preventing endoreduplication. Niculescu AB 3rd, Chen X, Smeets M, Hengst L, Prives C, Reed SI. Mol Cell Biol. 1998 Jan;18(1):629–43.  <a href=""http://www.ncbi.nlm.nih.gov/pubmed/9418909"" target=""_blank"" class=""external"" rel=""nofollow"">PubMed</a> <a href=""https://europepmc.org/abstract/MED/9418909"" target=""_blank"" class=""external"" rel=""nofollow"">Europe PMC</a> <a href=""https://scholia.toolforge.org/pubmed/9418909"" target=""_blank"" class=""external"" rel=""nofollow"">Scholia</a>"
9466696	Pubmed	"Mammalian Rad51 protein: a RecA homologue with pleiotropic functions. Vispé S, Defais M. Biochimie. 1997 Oct;79(9–10):587–92.  <a href=""http://www.ncbi.nlm.nih.gov/pubmed/9466696"" target=""_blank"" class=""external"" rel=""nofollow"">PubMed</a> <a href=""https://europepmc.org/abstract/MED/9466696"" target=""_blank"" class=""external"" rel=""nofollow"">Europe PMC</a> <a href=""https://scholia.toolforge.org/pubmed/9466696"" target=""_blank"" class=""external"" rel=""nofollow"">Scholia</a>"
9681884	Pubmed	"The role of the stress-activated protein kinase (SAPK/JNK) signaling pathway in radiation-induced apoptosis. Verheij M, Ruiter GA, Zerp SF, van Blitterswijk WJ, Fuks Z, Haimovitz-Friedman A, et al. Radiother Oncol. 1998 Jun;47(3):225–32.  <a href=""http://www.ncbi.nlm.nih.gov/pubmed/9681884"" target=""_blank"" class=""external"" rel=""nofollow"">PubMed</a> <a href=""https://europepmc.org/abstract/MED/9681884"" target=""_blank"" class=""external"" rel=""nofollow"">Europe PMC</a> <a href=""https://scholia.toolforge.org/pubmed/9681884"" target=""_blank"" class=""external"" rel=""nofollow"">Scholia</a>"
9735376	Pubmed	"ATM: from gene to function. Rotman G, Shiloh Y. Hum Mol Genet. 1998;7(10):1555–63.  <a href=""http://www.ncbi.nlm.nih.gov/pubmed/9735376"" target=""_blank"" class=""external"" rel=""nofollow"">PubMed</a> <a href=""https://europepmc.org/abstract/MED/9735376"" target=""_blank"" class=""external"" rel=""nofollow"">Europe PMC</a> <a href=""https://scholia.toolforge.org/pubmed/9735376"" target=""_blank"" class=""external"" rel=""nofollow"">Scholia</a>"
10037143	Pubmed	"Involvement of p21 in the PKC-induced regulation of the G2/M cell cycle transition. Barboule N, Lafon C, Chadebech P, Vidal S, Valette A. FEBS Lett. 1999 Feb 5;444(1):32–7.  <a href=""http://www.ncbi.nlm.nih.gov/pubmed/10037143"" target=""_blank"" class=""external"" rel=""nofollow"">PubMed</a> <a href=""https://europepmc.org/abstract/MED/10037143"" target=""_blank"" class=""external"" rel=""nofollow"">Europe PMC</a> <a href=""https://scholia.toolforge.org/pubmed/10037143"" target=""_blank"" class=""external"" rel=""nofollow"">Scholia</a>"
10092119	Pubmed	"Tlk, a novel evolutionarily conserved murine serine threonine kinase, encodes multiple testis transcripts. Shalom S, Don J. Mol Reprod Dev. 1999 Apr;52(4):392–405.  <a href=""http://www.ncbi.nlm.nih.gov/pubmed/10092119"" target=""_blank"" class=""external"" rel=""nofollow"">PubMed</a> <a href=""https://europepmc.org/abstract/MED/10092119"" target=""_blank"" class=""external"" rel=""nofollow"">Europe PMC</a> <a href=""https://scholia.toolforge.org/pubmed/10092119"" target=""_blank"" class=""external"" rel=""nofollow"">Scholia</a>"
10340377	Pubmed	"Mutations in the IkBa gene in Hodgkin’s disease suggest a tumour suppressor role for IkappaBalpha. Cabannes E, Khan G, Aillet F, Jarrett RF, Hay RT. Oncogene. 1999 May 20;18(20):3063–70.  <a href=""http://www.ncbi.nlm.nih.gov/pubmed/10340377"" target=""_blank"" class=""external"" rel=""nofollow"">PubMed</a> <a href=""https://europepmc.org/abstract/MED/10340377"" target=""_blank"" class=""external"" rel=""nofollow"">Europe PMC</a> <a href=""https://scholia.toolforge.org/pubmed/10340377"" target=""_blank"" class=""external"" rel=""nofollow"">Scholia</a>"
10362249	Pubmed	"p21Waf1/Cip1/Sdi1 induces permanent growth arrest with markers of replicative senescence in human tumor cells lacking functional p53. Fang L, Igarashi M, Leung J, Sugrue MM, Lee SW, Aaronson SA. Oncogene. 1999 May 6;18(18):2789–97.  <a href=""http://www.ncbi.nlm.nih.gov/pubmed/10362249"" target=""_blank"" class=""external"" rel=""nofollow"">PubMed</a> <a href=""https://europepmc.org/abstract/MED/10362249"" target=""_blank"" class=""external"" rel=""nofollow"">Europe PMC</a> <a href=""https://scholia.toolforge.org/pubmed/10362249"" target=""_blank"" class=""external"" rel=""nofollow"">Scholia</a>"
10526213	Pubmed	"Rad51/RecA protein families and the associated proteins in eukaryotes. Shinohara A, Ogawa T. Mutat Res. 1999 Sep 13;435(1):13–21.  <a href=""http://www.ncbi.nlm.nih.gov/pubmed/10526213"" target=""_blank"" class=""external"" rel=""nofollow"">PubMed</a> <a href=""https://europepmc.org/abstract/MED/10526213"" target=""_blank"" class=""external"" rel=""nofollow"">Europe PMC</a> <a href=""https://scholia.toolforge.org/pubmed/10526213"" target=""_blank"" class=""external"" rel=""nofollow"">Scholia</a>"
10582242	Pubmed	"Mechanisms and regulation of the degradation of cyclin B. Hershko A. Philos Trans R Soc Lond B Biol Sci. 1999 Sep 29;354(1389):1571–5; discussion 1575-6.  <a href=""http://www.ncbi.nlm.nih.gov/pubmed/10582242"" target=""_blank"" class=""external"" rel=""nofollow"">PubMed</a> <a href=""https://europepmc.org/abstract/MED/10582242"" target=""_blank"" class=""external"" rel=""nofollow"">Europe PMC</a> <a href=""https://scholia.toolforge.org/pubmed/10582242"" target=""_blank"" class=""external"" rel=""nofollow"">Scholia</a>"
10673629	Pubmed	"Role of the ATM gene in genetic predisposition to cancer. Bay JO, Uhrhammer N, Stoppa-Lyonnet D, Hall J. Bull Cancer. 2000 Jan;87(1):29–34.  <a href=""http://www.ncbi.nlm.nih.gov/pubmed/10673629"" target=""_blank"" class=""external"" rel=""nofollow"">PubMed</a> <a href=""https://europepmc.org/abstract/MED/10673629"" target=""_blank"" class=""external"" rel=""nofollow"">Europe PMC</a> <a href=""https://scholia.toolforge.org/pubmed/10673629"" target=""_blank"" class=""external"" rel=""nofollow"">Scholia</a>"
10713716	Pubmed	"c-Abl: activation and nuclear targets. Shaul Y. Cell Death Differ. 2000 Jan;7(1):10–6.  <a href=""http://www.ncbi.nlm.nih.gov/pubmed/10713716"" target=""_blank"" class=""external"" rel=""nofollow"">PubMed</a> <a href=""https://europepmc.org/abstract/MED/10713716"" target=""_blank"" class=""external"" rel=""nofollow"">Europe PMC</a> <a href=""https://scholia.toolforge.org/pubmed/10713716"" target=""_blank"" class=""external"" rel=""nofollow"">Scholia</a>"
10887490	Pubmed	"P53, apoptosis, and breast cancer. Barnes DM, Camplejohn RS. J Mammary Gland Biol Neoplasia. 1996 Apr;1(2):163–75.  <a href=""http://www.ncbi.nlm.nih.gov/pubmed/10887490"" target=""_blank"" class=""external"" rel=""nofollow"">PubMed</a> <a href=""https://europepmc.org/abstract/MED/10887490"" target=""_blank"" class=""external"" rel=""nofollow"">Europe PMC</a> <a href=""https://scholia.toolforge.org/pubmed/10887490"" target=""_blank"" class=""external"" rel=""nofollow"">Scholia</a>"
11089869	Pubmed	"Factors controlling cyclin B expression. Ito M. Plant Mol Biol. 2000 Aug;43(5–6):677–90.  <a href=""http://www.ncbi.nlm.nih.gov/pubmed/11089869"" target=""_blank"" class=""external"" rel=""nofollow"">PubMed</a> <a href=""https://europepmc.org/abstract/MED/11089869"" target=""_blank"" class=""external"" rel=""nofollow"">Europe PMC</a> <a href=""https://scholia.toolforge.org/pubmed/11089869"" target=""_blank"" class=""external"" rel=""nofollow"">Scholia</a>"
11595834	Pubmed	"p73 in apoptosis. Stiewe T, Pützer BM. Apoptosis. 2001 Dec;6(6):447–52.  <a href=""http://www.ncbi.nlm.nih.gov/pubmed/11595834"" target=""_blank"" class=""external"" rel=""nofollow"">PubMed</a> <a href=""https://europepmc.org/abstract/MED/11595834"" target=""_blank"" class=""external"" rel=""nofollow"">Europe PMC</a> <a href=""https://scholia.toolforge.org/pubmed/11595834"" target=""_blank"" class=""external"" rel=""nofollow"">Scholia</a>"
11665719	Pubmed	"ATM: genome stability, neuronal development, and cancer cross paths. Shiloh Y, Kastan MB. Adv Cancer Res. 2001;83:209–54.  <a href=""http://www.ncbi.nlm.nih.gov/pubmed/11665719"" target=""_blank"" class=""external"" rel=""nofollow"">PubMed</a> <a href=""https://europepmc.org/abstract/MED/11665719"" target=""_blank"" class=""external"" rel=""nofollow"">Europe PMC</a> <a href=""https://scholia.toolforge.org/pubmed/11665719"" target=""_blank"" class=""external"" rel=""nofollow"">Scholia</a>"
11832478	Pubmed	"Caspase-2 induces apoptosis by releasing proapoptotic proteins from mitochondria. Guo Y, Srinivasula SM, Druilhe A, Fernandes-Alnemri T, Alnemri ES. J Biol Chem. 2002 Apr 19;277(16):13430–7.  <a href=""http://www.ncbi.nlm.nih.gov/pubmed/11832478"" target=""_blank"" class=""external"" rel=""nofollow"">PubMed</a> <a href=""https://europepmc.org/abstract/MED/11832478"" target=""_blank"" class=""external"" rel=""nofollow"">Europe PMC</a> <a href=""https://scholia.toolforge.org/pubmed/11832478"" target=""_blank"" class=""external"" rel=""nofollow"">Scholia</a>"
11859406	Pubmed	"Role of p73 in malignancy: tumor suppressor or oncogene? Stiewe T, Pützer BM. Cell Death Differ. 2002 Mar;9(3):237–45.  <a href=""http://www.ncbi.nlm.nih.gov/pubmed/11859406"" target=""_blank"" class=""external"" rel=""nofollow"">PubMed</a> <a href=""https://europepmc.org/abstract/MED/11859406"" target=""_blank"" class=""external"" rel=""nofollow"">Europe PMC</a> <a href=""https://scholia.toolforge.org/pubmed/11859406"" target=""_blank"" class=""external"" rel=""nofollow"">Scholia</a>"
12045216	Pubmed	"From Cdc2 to Cdk1: when did the cell cycle kinase join its cyclin partner? Dorée M, Hunt T. J Cell Sci. 2002 Jun 15;115(Pt 12):2461–4.  <a href=""http://www.ncbi.nlm.nih.gov/pubmed/12045216"" target=""_blank"" class=""external"" rel=""nofollow"">PubMed</a> <a href=""https://europepmc.org/abstract/MED/12045216"" target=""_blank"" class=""external"" rel=""nofollow"">Europe PMC</a> <a href=""https://scholia.toolforge.org/pubmed/12045216"" target=""_blank"" class=""external"" rel=""nofollow"">Scholia</a>"
12171872	Pubmed	"Gadd45a: an elusive yet attractive candidate gene in pancreatic cancer. Hildesheim J, Fornace AJ Jr. Clin Cancer Res. 2002 Aug;8(8):2475–9.  <a href=""http://www.ncbi.nlm.nih.gov/pubmed/12171872"" target=""_blank"" class=""external"" rel=""nofollow"">PubMed</a> <a href=""https://europepmc.org/abstract/MED/12171872"" target=""_blank"" class=""external"" rel=""nofollow"">Europe PMC</a> <a href=""https://scholia.toolforge.org/pubmed/12171872"" target=""_blank"" class=""external"" rel=""nofollow"">Scholia</a>"
12207176	Pubmed	"The roles of Bid. Esposti MD. Apoptosis. 2002 Oct;7(5):433–40.  <a href=""http://www.ncbi.nlm.nih.gov/pubmed/12207176"" target=""_blank"" class=""external"" rel=""nofollow"">PubMed</a> <a href=""https://europepmc.org/abstract/MED/12207176"" target=""_blank"" class=""external"" rel=""nofollow"">Europe PMC</a> <a href=""https://scholia.toolforge.org/pubmed/12207176"" target=""_blank"" class=""external"" rel=""nofollow"">Scholia</a>"
12214244	Pubmed	"Two for two: Cdk2 and its role in centrosome doubling. Hinchcliffe EH, Sluder G. Oncogene. 2002 Sep 9;21(40):6154–60.  <a href=""http://www.ncbi.nlm.nih.gov/pubmed/12214244"" target=""_blank"" class=""external"" rel=""nofollow"">PubMed</a> <a href=""https://europepmc.org/abstract/MED/12214244"" target=""_blank"" class=""external"" rel=""nofollow"">Europe PMC</a> <a href=""https://scholia.toolforge.org/pubmed/12214244"" target=""_blank"" class=""external"" rel=""nofollow"">Scholia</a>"
12214253	Pubmed	"Genomic instability, centrosome amplification, cell cycle checkpoints and Gadd45a. Hollander MC, Fornace AJ Jr. Oncogene. 2002 Sep 9;21(40):6228–33.  <a href=""http://www.ncbi.nlm.nih.gov/pubmed/12214253"" target=""_blank"" class=""external"" rel=""nofollow"">PubMed</a> <a href=""https://europepmc.org/abstract/MED/12214253"" target=""_blank"" class=""external"" rel=""nofollow"">Europe PMC</a> <a href=""https://scholia.toolforge.org/pubmed/12214253"" target=""_blank"" class=""external"" rel=""nofollow"">Scholia</a>"
12655298	Pubmed	"Caspase-2 redux. Troy CM, Shelanski ML. Cell Death Differ. 2003 Jan;10(1):101–7.  <a href=""http://www.ncbi.nlm.nih.gov/pubmed/12655298"" target=""_blank"" class=""external"" rel=""nofollow"">PubMed</a> <a href=""https://europepmc.org/abstract/MED/12655298"" target=""_blank"" class=""external"" rel=""nofollow"">Europe PMC</a> <a href=""https://scholia.toolforge.org/pubmed/12655298"" target=""_blank"" class=""external"" rel=""nofollow"">Scholia</a>"
12660173	Pubmed	"Human Tousled like kinases are targeted by an ATM- and Chk1-dependent DNA damage checkpoint. Groth A, Lukas J, Nigg EA, Silljé HHW, Wernstedt C, Bartek J, et al. EMBO J. 2003 Apr 1;22(7):1676–87.  <a href=""http://www.ncbi.nlm.nih.gov/pubmed/12660173"" target=""_blank"" class=""external"" rel=""nofollow"">PubMed</a> <a href=""https://europepmc.org/abstract/MED/12660173"" target=""_blank"" class=""external"" rel=""nofollow"">Europe PMC</a> <a href=""https://scholia.toolforge.org/pubmed/12660173"" target=""_blank"" class=""external"" rel=""nofollow"">Scholia</a>"
12726855	Pubmed	"Cdk2 dethroned as master of S phase entry. Hinds PW. Cancer Cell. 2003 Apr;3(4):305–7.  <a href=""http://www.ncbi.nlm.nih.gov/pubmed/12726855"" target=""_blank"" class=""external"" rel=""nofollow"">PubMed</a> <a href=""https://europepmc.org/abstract/MED/12726855"" target=""_blank"" class=""external"" rel=""nofollow"">Europe PMC</a> <a href=""https://scholia.toolforge.org/pubmed/12726855"" target=""_blank"" class=""external"" rel=""nofollow"">Scholia</a>"
