ID	Database	Citation
9774969	Pubmed	"Yang A, Kaghad M, Wang Y, Gillett E, Fleming MD, Dötsch V, et al. p63, a p53 homolog at 3q27-29, encodes multiple products with transactivating, death-inducing, and dominant-negative activities. Mol Cell. 1998 Sep;2(3):305–16. <a href=""http://www.ncbi.nlm.nih.gov/pubmed/9774969"" target=""_blank"" class=""external"" rel=""nofollow"">PubMed</a> <a href=""https://europepmc.org/abstract/MED/9774969"" target=""_blank"" class=""external"" rel=""nofollow"">Europe PMC</a> <a href=""https://scholia.toolforge.org/pubmed/9774969"" target=""_blank"" class=""external"" rel=""nofollow"">Scholia</a>"
10391251	Pubmed	"Yuan ZM, Shioya H, Ishiko T, Sun X, Gu J, Huang YY, et al. p73 is regulated by tyrosine kinase c-Abl in the apoptotic response to DNA damage. Nature. 1999 Jun 24;399(6738):814–7. <a href=""http://www.ncbi.nlm.nih.gov/pubmed/10391251"" target=""_blank"" class=""external"" rel=""nofollow"">PubMed</a> <a href=""https://europepmc.org/abstract/MED/10391251"" target=""_blank"" class=""external"" rel=""nofollow"">Europe PMC</a> <a href=""https://scholia.toolforge.org/pubmed/10391251"" target=""_blank"" class=""external"" rel=""nofollow"">Scholia</a>"
10713716	Pubmed	"Shaul Y. c-Abl: activation and nuclear targets. Cell Death Differ. 2000 Jan;7(1):10–6. <a href=""http://www.ncbi.nlm.nih.gov/pubmed/10713716"" target=""_blank"" class=""external"" rel=""nofollow"">PubMed</a> <a href=""https://europepmc.org/abstract/MED/10713716"" target=""_blank"" class=""external"" rel=""nofollow"">Europe PMC</a> <a href=""https://scholia.toolforge.org/pubmed/10713716"" target=""_blank"" class=""external"" rel=""nofollow"">Scholia</a>"
11423969	Pubmed	"Dohn M, Zhang S, Chen X. p63alpha and DeltaNp63alpha can induce cell cycle arrest and apoptosis and differentially regulate p53 target genes. Oncogene. 2001 May 31;20(25):3193–205. <a href=""http://www.ncbi.nlm.nih.gov/pubmed/11423969"" target=""_blank"" class=""external"" rel=""nofollow"">PubMed</a> <a href=""https://europepmc.org/abstract/MED/11423969"" target=""_blank"" class=""external"" rel=""nofollow"">Europe PMC</a> <a href=""https://scholia.toolforge.org/pubmed/11423969"" target=""_blank"" class=""external"" rel=""nofollow"">Scholia</a>"
11830511	Pubmed	"Ishimoto O, Kawahara C, Enjo K, Obinata M, Nukiwa T, Ikawa S. Possible oncogenic potential of DeltaNp73: a newly identified isoform of human p73. Cancer Res. 2002 Feb 1;62(3):636–41. <a href=""http://www.ncbi.nlm.nih.gov/pubmed/11830511"" target=""_blank"" class=""external"" rel=""nofollow"">PubMed</a> <a href=""https://europepmc.org/abstract/MED/11830511"" target=""_blank"" class=""external"" rel=""nofollow"">Europe PMC</a> <a href=""https://scholia.toolforge.org/pubmed/11830511"" target=""_blank"" class=""external"" rel=""nofollow"">Scholia</a>"
21047732	Pubmed	"Bunt J, de Haas TG, Hasselt NE, Zwijnenburg DA, Koster J, Versteeg R, et al. Regulation of cell cycle genes and induction of senescence by overexpression of OTX2 in medulloblastoma cell lines. Mol Cancer Res. 2010 Oct;8(10):1344–57. <a href=""http://www.ncbi.nlm.nih.gov/pubmed/21047732"" target=""_blank"" class=""external"" rel=""nofollow"">PubMed</a> <a href=""https://europepmc.org/abstract/MED/21047732"" target=""_blank"" class=""external"" rel=""nofollow"">Europe PMC</a> <a href=""https://scholia.toolforge.org/pubmed/21047732"" target=""_blank"" class=""external"" rel=""nofollow"">Scholia</a>"
