ID	Database	Citation
4395686	Pubmed	"Possible mechanism of liver necrosis caused by aromatic organic compounds. Brodie BB, Reid WD, Cho AK, Sipes G, Krishna G, Gillette JR. Proc Natl Acad Sci U S A. 1971 Jan;68(1):160–4.  <a href=""http://www.ncbi.nlm.nih.gov/pubmed/4395686"" target=""_blank"" class=""external"" rel=""nofollow"">PubMed</a> <a href=""https://europepmc.org/abstract/MED/4395686"" target=""_blank"" class=""external"" rel=""nofollow"">Europe PMC</a> <a href=""https://scholia.toolforge.org/pubmed/4395686"" target=""_blank"" class=""external"" rel=""nofollow"">Scholia</a>"
9107551	Pubmed	"Urinary thiodiacetic acid. A selective biomarker for the cytochrome P450-catalyzed oxidation of 1,2-dibromoethane in the rat. Wormhoudt LW, Commandeur JN, Ploemen JH, Abdoelgafoer RS, Makansi A, Van Bladeren PJ, et al. Drug Metab Dispos. 1997 Apr;25(4):508–15.  <a href=""http://www.ncbi.nlm.nih.gov/pubmed/9107551"" target=""_blank"" class=""external"" rel=""nofollow"">PubMed</a> <a href=""https://europepmc.org/abstract/MED/9107551"" target=""_blank"" class=""external"" rel=""nofollow"">Europe PMC</a> <a href=""https://scholia.toolforge.org/pubmed/9107551"" target=""_blank"" class=""external"" rel=""nofollow"">Scholia</a>"
10490505	Pubmed	"Glutathione conjugation of electrophilic metabolites of 1-nitronaphthalene in rat tracheobronchial airways and liver: identification by mass spectrometry and proton nuclear magnetic resonance spectroscopy. Watt KC, Morin DM, Kurth MJ, Mercer RS, Plopper CG, Buckpitt AR. Chem Res Toxicol. 1999 Sep;12(9):831–9.  <a href=""http://www.ncbi.nlm.nih.gov/pubmed/10490505"" target=""_blank"" class=""external"" rel=""nofollow"">PubMed</a> <a href=""https://europepmc.org/abstract/MED/10490505"" target=""_blank"" class=""external"" rel=""nofollow"">Europe PMC</a> <a href=""https://scholia.toolforge.org/pubmed/10490505"" target=""_blank"" class=""external"" rel=""nofollow"">Scholia</a>"
10570027	Pubmed	"Metabolism and disposition of [(14)C]1-nitronaphthalene in male Sprague-Dawley rats. Halladay JS, Sauer JM, Sipes IG. Drug Metab Dispos. 1999 Dec;27(12):1456–65.  <a href=""http://www.ncbi.nlm.nih.gov/pubmed/10570027"" target=""_blank"" class=""external"" rel=""nofollow"">PubMed</a> <a href=""https://europepmc.org/abstract/MED/10570027"" target=""_blank"" class=""external"" rel=""nofollow"">Europe PMC</a> <a href=""https://scholia.toolforge.org/pubmed/10570027"" target=""_blank"" class=""external"" rel=""nofollow"">Scholia</a>"
10725110	Pubmed	"Role of quinones in toxicology. Bolton JL, Trush MA, Penning TM, Dryhurst G, Monks TJ. Chem Res Toxicol. 2000 Mar;13(3):135–60.  <a href=""http://www.ncbi.nlm.nih.gov/pubmed/10725110"" target=""_blank"" class=""external"" rel=""nofollow"">PubMed</a> <a href=""https://europepmc.org/abstract/MED/10725110"" target=""_blank"" class=""external"" rel=""nofollow"">Europe PMC</a> <a href=""https://scholia.toolforge.org/pubmed/10725110"" target=""_blank"" class=""external"" rel=""nofollow"">Scholia</a>"
12487150	Pubmed	"Naphthalene-induced respiratory tract toxicity: metabolic mechanisms of toxicity. Buckpitt A, Boland B, Isbell M, Morin D, Shultz M, Baldwin R, et al. Drug Metab Rev. 2002 Nov;34(4):791–820.  <a href=""http://www.ncbi.nlm.nih.gov/pubmed/12487150"" target=""_blank"" class=""external"" rel=""nofollow"">PubMed</a> <a href=""https://europepmc.org/abstract/MED/12487150"" target=""_blank"" class=""external"" rel=""nofollow"">Europe PMC</a> <a href=""https://scholia.toolforge.org/pubmed/12487150"" target=""_blank"" class=""external"" rel=""nofollow"">Scholia</a>"
15298956	Pubmed	"Benzo(a)pyrene diolepoxide (BPDE)-DNA adduct levels in leukocytes of smokers in relation to polymorphism of CYP1A1, GSTM1, GSTP1, GSTT1, and mEH. Lodovici M, Luceri C, Guglielmi F, Bacci C, Akpan V, Fonnesu ML, et al. Cancer Epidemiol Biomarkers Prev. 2004 Aug;13(8):1342–8.  <a href=""http://www.ncbi.nlm.nih.gov/pubmed/15298956"" target=""_blank"" class=""external"" rel=""nofollow"">PubMed</a> <a href=""https://europepmc.org/abstract/MED/15298956"" target=""_blank"" class=""external"" rel=""nofollow"">Europe PMC</a> <a href=""https://scholia.toolforge.org/pubmed/15298956"" target=""_blank"" class=""external"" rel=""nofollow"">Scholia</a>"
15319346	Pubmed	"Bioactivation of 1,1-dichloroethylene to its epoxide by CYP2E1 and CYP2F enzymes. Simmonds AC, Reilly CA, Baldwin RM, Ghanayem BI, Lanza DL, Yost GS, et al. Drug Metab Dispos. 2004 Sep;32(9):1032–9.  <a href=""http://www.ncbi.nlm.nih.gov/pubmed/15319346"" target=""_blank"" class=""external"" rel=""nofollow"">PubMed</a> <a href=""https://europepmc.org/abstract/MED/15319346"" target=""_blank"" class=""external"" rel=""nofollow"">Europe PMC</a> <a href=""https://scholia.toolforge.org/pubmed/15319346"" target=""_blank"" class=""external"" rel=""nofollow"">Scholia</a>"
15987776	Pubmed	"Pulmonary bioactivation of trichloroethylene to chloral hydrate: relative contributions of CYP2E1, CYP2F, and CYP2B1. Forkert PG, Baldwin RM, Millen B, Lash LH, Putt DA, Shultz MA, et al. Drug Metab Dispos. 2005 Oct;33(10):1429–37.  <a href=""http://www.ncbi.nlm.nih.gov/pubmed/15987776"" target=""_blank"" class=""external"" rel=""nofollow"">PubMed</a> <a href=""https://europepmc.org/abstract/MED/15987776"" target=""_blank"" class=""external"" rel=""nofollow"">Europe PMC</a> <a href=""https://scholia.toolforge.org/pubmed/15987776"" target=""_blank"" class=""external"" rel=""nofollow"">Scholia</a>"
