ID	Database	Citation
9799222	Pubmed	"Jäättelä M, Wissing D, Kokholm K, Kallunki T, Egeblad M. Hsp70 exerts its anti-apoptotic function downstream of caspase-3-like proteases. EMBO J. 1998 Nov 2;17(21):6124–34. <a href=""http://www.ncbi.nlm.nih.gov/pubmed/9799222"" target=""_blank"" class=""external"" rel=""nofollow"">PubMed</a> <a href=""https://europepmc.org/abstract/MED/9799222"" target=""_blank"" class=""external"" rel=""nofollow"">Europe PMC</a> <a href=""https://scholia.toolforge.org/pubmed/9799222"" target=""_blank"" class=""external"" rel=""nofollow"">Scholia</a>"
9821948	Pubmed	"Gabai VL, Meriin AB, Yaglom JA, Volloch VZ, Sherman MY. Role of Hsp70 in regulation of stress-kinase JNK: implications in apoptosis and aging. FEBS Lett. 1998 Oct 30;438(1–2):1–4. <a href=""http://www.ncbi.nlm.nih.gov/pubmed/9821948"" target=""_blank"" class=""external"" rel=""nofollow"">PubMed</a> <a href=""https://europepmc.org/abstract/MED/9821948"" target=""_blank"" class=""external"" rel=""nofollow"">Europe PMC</a> <a href=""https://scholia.toolforge.org/pubmed/9821948"" target=""_blank"" class=""external"" rel=""nofollow"">Scholia</a>"
10224227	Pubmed	"Schett G, Steiner CW, Gröger M, Winkler S, Graninger W, Smolen J, et al. Activation of Fas inhibits heat-induced activation of HSF1 and up-regulation of hsp70. FASEB J. 1999 May;13(8):833–42. <a href=""http://www.ncbi.nlm.nih.gov/pubmed/10224227"" target=""_blank"" class=""external"" rel=""nofollow"">PubMed</a> <a href=""https://europepmc.org/abstract/MED/10224227"" target=""_blank"" class=""external"" rel=""nofollow"">Europe PMC</a> <a href=""https://scholia.toolforge.org/pubmed/10224227"" target=""_blank"" class=""external"" rel=""nofollow"">Scholia</a>"
10934467	Pubmed	"Saleh A, Srinivasula SM, Balkir L, Robbins PD, Alnemri ES. Negative regulation of the Apaf-1 apoptosome by Hsp70. Nat Cell Biol. 2000 Aug;2(8):476–83. <a href=""http://www.ncbi.nlm.nih.gov/pubmed/10934467"" target=""_blank"" class=""external"" rel=""nofollow"">PubMed</a> <a href=""https://europepmc.org/abstract/MED/10934467"" target=""_blank"" class=""external"" rel=""nofollow"">Europe PMC</a> <a href=""https://scholia.toolforge.org/pubmed/10934467"" target=""_blank"" class=""external"" rel=""nofollow"">Scholia</a>"
10982831	Pubmed	"Mosser DD, Caron AW, Bourget L, Meriin AB, Sherman MY, Morimoto RI, et al. The chaperone function of hsp70 is required for protection against stress-induced apoptosis. Mol Cell Biol. 2000 Oct;20(19):7146–59. <a href=""http://www.ncbi.nlm.nih.gov/pubmed/10982831"" target=""_blank"" class=""external"" rel=""nofollow"">PubMed</a> <a href=""https://europepmc.org/abstract/MED/10982831"" target=""_blank"" class=""external"" rel=""nofollow"">Europe PMC</a> <a href=""https://scholia.toolforge.org/pubmed/10982831"" target=""_blank"" class=""external"" rel=""nofollow"">Scholia</a>"
14512773	Pubmed	"Garrido C, Schmitt E, Candé C, Vahsen N, Parcellier A, Kroemer G. HSP27 and HSP70: potentially oncogenic apoptosis inhibitors. Cell Cycle. 2003;2(6):579–84. <a href=""http://www.ncbi.nlm.nih.gov/pubmed/14512773"" target=""_blank"" class=""external"" rel=""nofollow"">PubMed</a> <a href=""https://europepmc.org/abstract/MED/14512773"" target=""_blank"" class=""external"" rel=""nofollow"">Europe PMC</a> <a href=""https://scholia.toolforge.org/pubmed/14512773"" target=""_blank"" class=""external"" rel=""nofollow"">Scholia</a>"
14555980	Pubmed	"Gurbuxani S, Schmitt E, Cande C, Parcellier A, Hammann A, Daugas E, et al. Heat shock protein 70 binding inhibits the nuclear import of apoptosis-inducing factor. Oncogene. 2003 Oct 2;22(43):6669–78. <a href=""http://www.ncbi.nlm.nih.gov/pubmed/14555980"" target=""_blank"" class=""external"" rel=""nofollow"">PubMed</a> <a href=""https://europepmc.org/abstract/MED/14555980"" target=""_blank"" class=""external"" rel=""nofollow"">Europe PMC</a> <a href=""https://scholia.toolforge.org/pubmed/14555980"" target=""_blank"" class=""external"" rel=""nofollow"">Scholia</a>"
15078873	Pubmed	"Orsini F, Migliaccio E, Moroni M, Contursi C, Raker VA, Piccini D, et al. The life span determinant p66Shc localizes to mitochondria where it associates with mitochondrial heat shock protein 70 and regulates trans-membrane potential. J Biol Chem. 2004 Jun 11;279(24):25689–95. <a href=""http://www.ncbi.nlm.nih.gov/pubmed/15078873"" target=""_blank"" class=""external"" rel=""nofollow"">PubMed</a> <a href=""https://europepmc.org/abstract/MED/15078873"" target=""_blank"" class=""external"" rel=""nofollow"">Europe PMC</a> <a href=""https://scholia.toolforge.org/pubmed/15078873"" target=""_blank"" class=""external"" rel=""nofollow"">Scholia</a>"
