ID	Database	Citation
9783642403361	ISBN	"Blau N, Duran M, Gibson KM, Dionisi-Vici C. Physician’s Guide to the Diagnosis, Treatment, and Follow-Up of Inherited Metabolic Diseases [Internet]. Springer; 2014. 867 p. Available from: https://books.google.com/books/about/Physician_s_Guide_to_the_Diagnosis_Treat.html?hl=&id=wJRBnwEACAAJ <a href=""https://openlibrary.org/search?isbn=9783642403361"" target=""_blank"" class=""external"" rel=""nofollow"">OpenLibrary</a> <a href=""https://www.worldcat.org/search?qt=wikipathways&q=isbn%3A9783642403361"" target=""_blank"" class=""external"" rel=""nofollow"">Worldcat</a>"
10407772	Pubmed	"Neurochemistry and defects of biogenic amine neurotransmitter metabolism. Hyland K. J Inherit Metab Dis. 1999 Jun;22(4):353–63.  <a href=""http://www.ncbi.nlm.nih.gov/pubmed/10407772"" target=""_blank"" class=""external"" rel=""nofollow"">PubMed</a> <a href=""https://europepmc.org/abstract/MED/10407772"" target=""_blank"" class=""external"" rel=""nofollow"">Europe PMC</a> <a href=""https://scholia.toolforge.org/pubmed/10407772"" target=""_blank"" class=""external"" rel=""nofollow"">Scholia</a>"
14984687	Pubmed	"Pediatric neurotransmitter diseases. Pearl PL, Wallis DD, Gibson KM. Curr Neurol Neurosci Rep. 2004 Mar;4(2):147–52.  <a href=""http://www.ncbi.nlm.nih.gov/pubmed/14984687"" target=""_blank"" class=""external"" rel=""nofollow"">PubMed</a> <a href=""https://europepmc.org/abstract/MED/14984687"" target=""_blank"" class=""external"" rel=""nofollow"">Europe PMC</a> <a href=""https://scholia.toolforge.org/pubmed/14984687"" target=""_blank"" class=""external"" rel=""nofollow"">Scholia</a>"
19130291	Pubmed	"Sepiapterin reductase deficiency in a 2-year-old girl with incomplete response to treatment during short-term follow-up. Kusmierska K, Jansen EEW, Jakobs C, Szymanska K, Malunowicz E, Meilei D, et al. J Inherit Metab Dis. 2009 Dec;32 Suppl 1:S5-10.  <a href=""http://www.ncbi.nlm.nih.gov/pubmed/19130291"" target=""_blank"" class=""external"" rel=""nofollow"">PubMed</a> <a href=""https://europepmc.org/abstract/MED/19130291"" target=""_blank"" class=""external"" rel=""nofollow"">Europe PMC</a> <a href=""https://scholia.toolforge.org/pubmed/19130291"" target=""_blank"" class=""external"" rel=""nofollow"">Scholia</a>"
21550412	Pubmed	"Synthesis and recycling of tetrahydrobiopterin in endothelial function and vascular disease. Crabtree MJ, Channon KM. Nitric Oxide. 2011 Aug 1;25(2):81–8.  <a href=""http://www.ncbi.nlm.nih.gov/pubmed/21550412"" target=""_blank"" class=""external"" rel=""nofollow"">PubMed</a> <a href=""https://europepmc.org/abstract/MED/21550412"" target=""_blank"" class=""external"" rel=""nofollow"">Europe PMC</a> <a href=""https://scholia.toolforge.org/pubmed/21550412"" target=""_blank"" class=""external"" rel=""nofollow"">Scholia</a>"
28132689	Pubmed	"Biallelic Mutations in DNAJC12 Cause Hyperphenylalaninemia, Dystonia, and Intellectual Disability. Anikster Y, Haack TB, Vilboux T, Pode-Shakked B, Thöny B, Shen N, et al. Am J Hum Genet. 2017 Feb 2;100(2):257–66.  <a href=""http://www.ncbi.nlm.nih.gov/pubmed/28132689"" target=""_blank"" class=""external"" rel=""nofollow"">PubMed</a> <a href=""https://europepmc.org/abstract/MED/28132689"" target=""_blank"" class=""external"" rel=""nofollow"">Europe PMC</a> <a href=""https://scholia.toolforge.org/pubmed/28132689"" target=""_blank"" class=""external"" rel=""nofollow"">Scholia</a>"
30372766	Pubmed	"Inherited Disorders of Neurotransmitters: Classification and Practical Approaches for Diagnosis and Treatment. Brennenstuhl H, Jung-Klawitter S, Assmann B, Opladen T. Neuropediatrics. 2019 Feb;50(1):2–14.  <a href=""http://www.ncbi.nlm.nih.gov/pubmed/30372766"" target=""_blank"" class=""external"" rel=""nofollow"">PubMed</a> <a href=""https://europepmc.org/abstract/MED/30372766"" target=""_blank"" class=""external"" rel=""nofollow"">Europe PMC</a> <a href=""https://scholia.toolforge.org/pubmed/30372766"" target=""_blank"" class=""external"" rel=""nofollow"">Scholia</a>"
30667134	Pubmed	"Phenylalanine hydroxylase variants interact with the co-chaperone DNAJC12. Jung-Kc K, Himmelreich N, Prestegård KS, Shi TJS, Scherer T, Ying M, et al. Hum Mutat. 2019 Apr;40(4):483–94.  <a href=""http://www.ncbi.nlm.nih.gov/pubmed/30667134"" target=""_blank"" class=""external"" rel=""nofollow"">PubMed</a> <a href=""https://europepmc.org/abstract/MED/30667134"" target=""_blank"" class=""external"" rel=""nofollow"">Europe PMC</a> <a href=""https://scholia.toolforge.org/pubmed/30667134"" target=""_blank"" class=""external"" rel=""nofollow"">Scholia</a>"
34244591	Pubmed	"Redefining differential roles of MAO-A in dopamine degradation and MAO-B in tonic GABA synthesis. Cho HU, Kim S, Sim J, Yang S, An H, Nam MH, et al. Exp Mol Med. 2021 Jul;53(7):1148–58.  <a href=""http://www.ncbi.nlm.nih.gov/pubmed/34244591"" target=""_blank"" class=""external"" rel=""nofollow"">PubMed</a> <a href=""https://europepmc.org/abstract/MED/34244591"" target=""_blank"" class=""external"" rel=""nofollow"">Europe PMC</a> <a href=""https://scholia.toolforge.org/pubmed/34244591"" target=""_blank"" class=""external"" rel=""nofollow"">Scholia</a>"
