ID	Database	Citation
10.1016/j.irbm.2014.02.009	DOI	"Agrofoglio LA, Krstulja A, De Schutter C, Favetta P, Delépée R, Roy V, et al. Detection of urinary modified nucleosides by a bulk acoustic wave MIP sensor – Results and future work. IRBM [Internet]. 2014 Apr;35(2):66–71. Available from: http://dx.doi.org/10.1016/j.irbm.2014.02.009 <a href=""https://doi.org/10.1016/j.irbm.2014.02.009"" target=""_blank"" class=""external"" rel=""nofollow"">DOI</a>"
7508341	Pubmed	"Urinary excretion of modified nucleosides as biological marker of RNA turnover in patients with cancer and AIDS. Nakano K, Nakao T, Schram KH, Hammargren WM, McClure TD, Katz M, et al. Clin Chim Acta. 1993 Sep 30;218(2):169–83.  <a href=""http://www.ncbi.nlm.nih.gov/pubmed/7508341"" target=""_blank"" class=""external"" rel=""nofollow"">PubMed</a> <a href=""https://europepmc.org/abstract/MED/7508341"" target=""_blank"" class=""external"" rel=""nofollow"">Europe PMC</a> <a href=""https://scholia.toolforge.org/pubmed/7508341"" target=""_blank"" class=""external"" rel=""nofollow"">Scholia</a>"
7865238	Pubmed	"Urinary excretion of pseudouridine and prognosis of patients with malignant lymphoma. Rasmuson T, Björk GR. Acta Oncol. 1995;34(1):61–7.  <a href=""http://www.ncbi.nlm.nih.gov/pubmed/7865238"" target=""_blank"" class=""external"" rel=""nofollow"">PubMed</a> <a href=""https://europepmc.org/abstract/MED/7865238"" target=""_blank"" class=""external"" rel=""nofollow"">Europe PMC</a> <a href=""https://scholia.toolforge.org/pubmed/7865238"" target=""_blank"" class=""external"" rel=""nofollow"">Scholia</a>"
15607313	Pubmed	"Clinical significance and prognostic value of urinary nucleosides in breast cancer patients. Zheng YF, Kong HW, Xiong JH, Lv S, Xu GW. Clin Biochem. 2005 Jan;38(1):24–30.  <a href=""http://www.ncbi.nlm.nih.gov/pubmed/15607313"" target=""_blank"" class=""external"" rel=""nofollow"">PubMed</a> <a href=""https://europepmc.org/abstract/MED/15607313"" target=""_blank"" class=""external"" rel=""nofollow"">Europe PMC</a> <a href=""https://scholia.toolforge.org/pubmed/15607313"" target=""_blank"" class=""external"" rel=""nofollow"">Scholia</a>"
18484357	Pubmed	"Metabonomics in cancer diagnosis: mass spectrometry-based profiling of urinary nucleosides from breast cancer patients. Frickenschmidt A, Frohlich H, Bullinger D, Zell A, Laufer S, Gleiter CH, et al. Biomarkers. 2008 Jun;13(4):435–49.  <a href=""http://www.ncbi.nlm.nih.gov/pubmed/18484357"" target=""_blank"" class=""external"" rel=""nofollow"">PubMed</a> <a href=""https://europepmc.org/abstract/MED/18484357"" target=""_blank"" class=""external"" rel=""nofollow"">Europe PMC</a> <a href=""https://scholia.toolforge.org/pubmed/18484357"" target=""_blank"" class=""external"" rel=""nofollow"">Scholia</a>"
19186175	Pubmed	"Evaluation of urinary nucleosides in breast cancer patients before and after tumor removal. Cho SH, Choi MH, Lee WY, Chung BC. Clin Biochem. 2009 Apr;42(6):540–3.  <a href=""http://www.ncbi.nlm.nih.gov/pubmed/19186175"" target=""_blank"" class=""external"" rel=""nofollow"">PubMed</a> <a href=""https://europepmc.org/abstract/MED/19186175"" target=""_blank"" class=""external"" rel=""nofollow"">Europe PMC</a> <a href=""https://scholia.toolforge.org/pubmed/19186175"" target=""_blank"" class=""external"" rel=""nofollow"">Scholia</a>"
19399767	Pubmed	"Analysis of urinary nucleosides as helper tumor markers in hepatocellular carcinoma diagnosis. Jeng LB, Lo WY, Hsu WY, Lin WD, Lin CT, Lai CC, et al. Rapid Commun Mass Spectrom. 2009 Jun;23(11):1543–9.  <a href=""http://www.ncbi.nlm.nih.gov/pubmed/19399767"" target=""_blank"" class=""external"" rel=""nofollow"">PubMed</a> <a href=""https://europepmc.org/abstract/MED/19399767"" target=""_blank"" class=""external"" rel=""nofollow"">Europe PMC</a> <a href=""https://scholia.toolforge.org/pubmed/19399767"" target=""_blank"" class=""external"" rel=""nofollow"">Scholia</a>"
