ID	Database	Citation
15044469	Pubmed	"Prolyl 3-hydroxylase 1, enzyme characterization and identification of a novel family of enzymes. Vranka JA, Sakai LY, Bächinger HP. J Biol Chem. 2004 May 28;279(22):23615–21.  <a href=""http://www.ncbi.nlm.nih.gov/pubmed/15044469"" target=""_blank"" class=""external"" rel=""nofollow"">PubMed</a> <a href=""https://europepmc.org/abstract/MED/15044469"" target=""_blank"" class=""external"" rel=""nofollow"">Europe PMC</a> <a href=""https://scholia.toolforge.org/pubmed/15044469"" target=""_blank"" class=""external"" rel=""nofollow"">Scholia</a>"
17055431	Pubmed	"CRTAP is required for prolyl 3- hydroxylation and mutations cause recessive osteogenesis imperfecta. Morello R, Bertin TK, Chen Y, Hicks J, Tonachini L, Monticone M, et al. Cell. 2006 Oct 20;127(2):291–304.  <a href=""http://www.ncbi.nlm.nih.gov/pubmed/17055431"" target=""_blank"" class=""external"" rel=""nofollow"">PubMed</a> <a href=""https://europepmc.org/abstract/MED/17055431"" target=""_blank"" class=""external"" rel=""nofollow"">Europe PMC</a> <a href=""https://scholia.toolforge.org/pubmed/17055431"" target=""_blank"" class=""external"" rel=""nofollow"">Scholia</a>"
19940144	Pubmed	"Location of 3-hydroxyproline residues in collagen types I, II, III, and V/XI implies a role in fibril supramolecular assembly. Weis MA, Hudson DM, Kim L, Scott M, Wu JJ, Eyre DR. J Biol Chem. 2010 Jan 22;285(4):2580–90.  <a href=""http://www.ncbi.nlm.nih.gov/pubmed/19940144"" target=""_blank"" class=""external"" rel=""nofollow"">PubMed</a> <a href=""https://europepmc.org/abstract/MED/19940144"" target=""_blank"" class=""external"" rel=""nofollow"">Europe PMC</a> <a href=""https://scholia.toolforge.org/pubmed/19940144"" target=""_blank"" class=""external"" rel=""nofollow"">Scholia</a>"
21670757	Pubmed	"New perspectives on osteogenesis imperfecta. Forlino A, Cabral WA, Barnes AM, Marini JC. Nat Rev Endocrinol. 2011 Jun 14;7(9):540–57.  <a href=""http://www.ncbi.nlm.nih.gov/pubmed/21670757"" target=""_blank"" class=""external"" rel=""nofollow"">PubMed</a> <a href=""https://europepmc.org/abstract/MED/21670757"" target=""_blank"" class=""external"" rel=""nofollow"">Europe PMC</a> <a href=""https://scholia.toolforge.org/pubmed/21670757"" target=""_blank"" class=""external"" rel=""nofollow"">Scholia</a>"
28820180	Pubmed	"Osteogenesis imperfecta. Marini JC, Forlino A, Bächinger HP, Bishop NJ, Byers PH, Paepe AD, et al. Nat Rev Dis Primers. 2017 Aug 18;3:17052.  <a href=""http://www.ncbi.nlm.nih.gov/pubmed/28820180"" target=""_blank"" class=""external"" rel=""nofollow"">PubMed</a> <a href=""https://europepmc.org/abstract/MED/28820180"" target=""_blank"" class=""external"" rel=""nofollow"">Europe PMC</a> <a href=""https://scholia.toolforge.org/pubmed/28820180"" target=""_blank"" class=""external"" rel=""nofollow"">Scholia</a>"
