ID	Database	Citation
20923771	Pubmed	"Dennis EA, Deems RA, Harkewicz R, Quehenberger O, Brown HA, Milne SB, et al. A mouse macrophage lipidome. J Biol Chem. 2010 Dec 17;285(51):39976–85. <a href=""http://www.ncbi.nlm.nih.gov/pubmed/20923771"" target=""_blank"" class=""external"" rel=""nofollow"">PubMed</a> <a href=""https://europepmc.org/abstract/MED/20923771"" target=""_blank"" class=""external"" rel=""nofollow"">Europe PMC</a> <a href=""https://scholia.toolforge.org/pubmed/20923771"" target=""_blank"" class=""external"" rel=""nofollow"">Scholia</a>"
30654597	Pubmed	"Yan B, Chu H, Yang D, Sze K-H, Lai P-M, Yuan S, et al. Characterization of the Lipidomic Profile of Human Coronavirus-Infected Cells: Implications for Lipid Metabolism Remodeling upon Coronavirus Replication. Viruses. 2019 Jan 16;11(1):73. <a href=""http://www.ncbi.nlm.nih.gov/pubmed/30654597"" target=""_blank"" class=""external"" rel=""nofollow"">PubMed</a> <a href=""https://europepmc.org/abstract/MED/30654597"" target=""_blank"" class=""external"" rel=""nofollow"">Europe PMC</a> <a href=""https://scholia.toolforge.org/pubmed/30654597"" target=""_blank"" class=""external"" rel=""nofollow"">Scholia</a>"
32130973	Pubmed	"Sigrist CJ, Bridge A, Le Mercier P. A potential role for integrins in host cell entry by SARS-CoV-2. Antiviral Res. 2020 May;177:104759. <a href=""http://www.ncbi.nlm.nih.gov/pubmed/32130973"" target=""_blank"" class=""external"" rel=""nofollow"">PubMed</a> <a href=""https://europepmc.org/abstract/MED/32130973"" target=""_blank"" class=""external"" rel=""nofollow"">Europe PMC</a> <a href=""https://scholia.toolforge.org/pubmed/32130973"" target=""_blank"" class=""external"" rel=""nofollow"">Scholia</a>"
32155444	Pubmed	"Walls AC, Park Y-J, Tortorici MA, Wall A, McGuire AT, Veesler D. Structure, Function, and Antigenicity of the SARS-CoV-2 Spike Glycoprotein. Cell. 2020 Apr 16;181(2):281-292.e6. <a href=""http://www.ncbi.nlm.nih.gov/pubmed/32155444"" target=""_blank"" class=""external"" rel=""nofollow"">PubMed</a> <a href=""https://europepmc.org/abstract/MED/32155444"" target=""_blank"" class=""external"" rel=""nofollow"">Europe PMC</a> <a href=""https://scholia.toolforge.org/pubmed/32155444"" target=""_blank"" class=""external"" rel=""nofollow"">Scholia</a>"
32159237	Pubmed	"Kandeel M, Ibrahim A, Fayez M, Al-Nazawi M. From SARS and MERS CoVs to SARS-CoV-2: Moving toward more biased codon usage in viral structural and nonstructural genes. J Med Virol. 2020 Jun;92(6):660–6. <a href=""http://www.ncbi.nlm.nih.gov/pubmed/32159237"" target=""_blank"" class=""external"" rel=""nofollow"">PubMed</a> <a href=""https://europepmc.org/abstract/MED/32159237"" target=""_blank"" class=""external"" rel=""nofollow"">Europe PMC</a> <a href=""https://scholia.toolforge.org/pubmed/32159237"" target=""_blank"" class=""external"" rel=""nofollow"">Scholia</a>"
