ID	Database	Citation
26930515	Pubmed	"Roles of Aag, Alkbh2, and Alkbh3 in the Repair of Carboxymethylated and Ethylated Thymidine Lesions. You C, Wang P, Nay SL, Wang J, Dai X, O’Connor TR, et al. ACS Chem Biol. 2016 May 20;11(5):1332–8.  <a href=""http://www.ncbi.nlm.nih.gov/pubmed/26930515"" target=""_blank"" class=""external"" rel=""nofollow"">PubMed</a> <a href=""https://europepmc.org/abstract/MED/26930515"" target=""_blank"" class=""external"" rel=""nofollow"">Europe PMC</a> <a href=""https://scholia.toolforge.org/pubmed/26930515"" target=""_blank"" class=""external"" rel=""nofollow"">Scholia</a>"
35582025	Pubmed	"DNA direct reversal repair and alkylating agent drug resistance. Gutierrez R, O’Connor TR. Cancer Drug Resist. 2021 Jun 19;4(2):414–23.  <a href=""http://www.ncbi.nlm.nih.gov/pubmed/35582025"" target=""_blank"" class=""external"" rel=""nofollow"">PubMed</a> <a href=""https://europepmc.org/abstract/MED/35582025"" target=""_blank"" class=""external"" rel=""nofollow"">Europe PMC</a> <a href=""https://scholia.toolforge.org/pubmed/35582025"" target=""_blank"" class=""external"" rel=""nofollow"">Scholia</a>"
35956910	Pubmed	"Conformational Dynamics of Human ALKBH2 Dioxygenase in the Course of DNA Repair as Revealed by Stopped-Flow Fluorescence Spectroscopy. Kanazhevskaya LY, Smyshliaev DA, Timofeyeva NA, Ishchenko AA, Saparbaev M, Kuznetsov NA, et al. Molecules. 2022 Aug 4;27(15):4960.  <a href=""http://www.ncbi.nlm.nih.gov/pubmed/35956910"" target=""_blank"" class=""external"" rel=""nofollow"">PubMed</a> <a href=""https://europepmc.org/abstract/MED/35956910"" target=""_blank"" class=""external"" rel=""nofollow"">Europe PMC</a> <a href=""https://scholia.toolforge.org/pubmed/35956910"" target=""_blank"" class=""external"" rel=""nofollow"">Scholia</a>"
38254819	Pubmed	"The Versatile Attributes of MGMT: Its Repair Mechanism, Crosstalk with Other DNA Repair Pathways, and Its Role in Cancer. Fang Q. Cancers (Basel). 2024 Jan 11;16(2):331.  <a href=""http://www.ncbi.nlm.nih.gov/pubmed/38254819"" target=""_blank"" class=""external"" rel=""nofollow"">PubMed</a> <a href=""https://europepmc.org/abstract/MED/38254819"" target=""_blank"" class=""external"" rel=""nofollow"">Europe PMC</a> <a href=""https://scholia.toolforge.org/pubmed/38254819"" target=""_blank"" class=""external"" rel=""nofollow"">Scholia</a>"
38925328	Pubmed	"Lack of mismatch repair enhances resistance to methylating agents for cells deficient in oxidative demethylation. Gutierrez R, Chan AYS, Lai SWT, Itoh S, Lee DH, Sun K, et al. J Biol Chem. 2024 Aug;300(8):107492.  <a href=""http://www.ncbi.nlm.nih.gov/pubmed/38925328"" target=""_blank"" class=""external"" rel=""nofollow"">PubMed</a> <a href=""https://europepmc.org/abstract/MED/38925328"" target=""_blank"" class=""external"" rel=""nofollow"">Europe PMC</a> <a href=""https://scholia.toolforge.org/pubmed/38925328"" target=""_blank"" class=""external"" rel=""nofollow"">Scholia</a>"
https://repairtoire.genesilico.pl/Pathway/13/	URL	
