ID	Database	Citation
6321612	Pubmed	"Kubonishi I, Miyoshi I. Establishment of a Ph1 chromosome-positive cell line from chronic myelogenous leukemia in blast crisis. Int J Cell Cloning. 1983 Jun;1(2):105–17. <a href=""http://www.ncbi.nlm.nih.gov/pubmed/6321612"" target=""_blank"" class=""external"" rel=""nofollow"">PubMed</a> <a href=""https://europepmc.org/abstract/MED/6321612"" target=""_blank"" class=""external"" rel=""nofollow"">Europe PMC</a> <a href=""https://scholia.toolforge.org/pubmed/6321612"" target=""_blank"" class=""external"" rel=""nofollow"">Scholia</a>"
7753047	Pubmed	"Barel M, Balbo M, Gauffre A, Frade R. Binding sites of the Epstein-Barr virus and C3d receptor (CR2, CD21) for its three intracellular ligands, the p53 anti-oncoprotein, the p68 calcium binding protein and the nuclear p120 ribonucleoprotein. Mol Immunol. 1995 Apr;32(6):389–97. <a href=""http://www.ncbi.nlm.nih.gov/pubmed/7753047"" target=""_blank"" class=""external"" rel=""nofollow"">PubMed</a> <a href=""https://europepmc.org/abstract/MED/7753047"" target=""_blank"" class=""external"" rel=""nofollow"">Europe PMC</a> <a href=""https://scholia.toolforge.org/pubmed/7753047"" target=""_blank"" class=""external"" rel=""nofollow"">Scholia</a>"
16525119	Pubmed	"Suzuki A, Ohno S. The PAR-aPKC system: lessons in polarity. J Cell Sci. 2006 Mar 15;119(Pt 6):979–87. <a href=""http://www.ncbi.nlm.nih.gov/pubmed/16525119"" target=""_blank"" class=""external"" rel=""nofollow"">PubMed</a> <a href=""https://europepmc.org/abstract/MED/16525119"" target=""_blank"" class=""external"" rel=""nofollow"">Europe PMC</a> <a href=""https://scholia.toolforge.org/pubmed/16525119"" target=""_blank"" class=""external"" rel=""nofollow"">Scholia</a>"
17051160	Pubmed	"Janssen BJC, Christodoulidou A, McCarthy A, Lambris JD, Gros P. Structure of C3b reveals conformational changes that underlie complement activity. Nature. 2006 Nov 9;444(7116):213–6. <a href=""http://www.ncbi.nlm.nih.gov/pubmed/17051160"" target=""_blank"" class=""external"" rel=""nofollow"">PubMed</a> <a href=""https://europepmc.org/abstract/MED/17051160"" target=""_blank"" class=""external"" rel=""nofollow"">Europe PMC</a> <a href=""https://scholia.toolforge.org/pubmed/17051160"" target=""_blank"" class=""external"" rel=""nofollow"">Scholia</a>"
18560619	Pubmed	"Mayilyan KR, Weinberger DR, Sim RB. The complement system in schizophrenia. Drug News Perspect. 2008 May;21(4):200–10. <a href=""http://www.ncbi.nlm.nih.gov/pubmed/18560619"" target=""_blank"" class=""external"" rel=""nofollow"">PubMed</a> <a href=""https://europepmc.org/abstract/MED/18560619"" target=""_blank"" class=""external"" rel=""nofollow"">Europe PMC</a> <a href=""https://scholia.toolforge.org/pubmed/18560619"" target=""_blank"" class=""external"" rel=""nofollow"">Scholia</a>"
22403545	Pubmed	"Neher JJ, Neniskyte U, Brown GC. Primary phagocytosis of neurons by inflamed microglia: potential roles in neurodegeneration. Front Pharmacol. 2012 Feb 28;3:27. <a href=""http://www.ncbi.nlm.nih.gov/pubmed/22403545"" target=""_blank"" class=""external"" rel=""nofollow"">PubMed</a> <a href=""https://europepmc.org/abstract/MED/22403545"" target=""_blank"" class=""external"" rel=""nofollow"">Europe PMC</a> <a href=""https://scholia.toolforge.org/pubmed/22403545"" target=""_blank"" class=""external"" rel=""nofollow"">Scholia</a>"
22715882	Pubmed	"Stephan AH, Barres BA, Stevens B. The complement system: an unexpected role in synaptic pruning during development and disease. Annu Rev Neurosci. 2012;35:369–89. <a href=""http://www.ncbi.nlm.nih.gov/pubmed/22715882"" target=""_blank"" class=""external"" rel=""nofollow"">PubMed</a> <a href=""https://europepmc.org/abstract/MED/22715882"" target=""_blank"" class=""external"" rel=""nofollow"">Europe PMC</a> <a href=""https://scholia.toolforge.org/pubmed/22715882"" target=""_blank"" class=""external"" rel=""nofollow"">Scholia</a>"
24077738	Pubmed	"Lopez-Marques RL, Theorin L, Palmgren MG, Pomorski TG. P4-ATPases: lipid flippases in cell membranes. Pflugers Arch. 2014 Jul;466(7):1227–40. <a href=""http://www.ncbi.nlm.nih.gov/pubmed/24077738"" target=""_blank"" class=""external"" rel=""nofollow"">PubMed</a> <a href=""https://europepmc.org/abstract/MED/24077738"" target=""_blank"" class=""external"" rel=""nofollow"">Europe PMC</a> <a href=""https://scholia.toolforge.org/pubmed/24077738"" target=""_blank"" class=""external"" rel=""nofollow"">Scholia</a>"
28258193	Pubmed	"Papanastasiou M, Koutsogiannaki S, Sarigiannis Y, Geisbrecht BV, Ricklin D, Lambris JD. Structural Implications for the Formation and Function of the Complement Effector Protein iC3b. J Immunol. 2017 Apr 15;198(8):3326–35. <a href=""http://www.ncbi.nlm.nih.gov/pubmed/28258193"" target=""_blank"" class=""external"" rel=""nofollow"">PubMed</a> <a href=""https://europepmc.org/abstract/MED/28258193"" target=""_blank"" class=""external"" rel=""nofollow"">Europe PMC</a> <a href=""https://scholia.toolforge.org/pubmed/28258193"" target=""_blank"" class=""external"" rel=""nofollow"">Scholia</a>"
28345259	Pubmed	"Blom AM. The role of complement inhibitors beyond controlling inflammation. J Intern Med. 2017 Aug;282(2):116–28. <a href=""http://www.ncbi.nlm.nih.gov/pubmed/28345259"" target=""_blank"" class=""external"" rel=""nofollow"">PubMed</a> <a href=""https://europepmc.org/abstract/MED/28345259"" target=""_blank"" class=""external"" rel=""nofollow"">Europe PMC</a> <a href=""https://scholia.toolforge.org/pubmed/28345259"" target=""_blank"" class=""external"" rel=""nofollow"">Scholia</a>"
29606485	Pubmed	"Coulthard LG, Hawksworth OA, Woodruff TM. Complement: The Emerging Architect of the Developing Brain. Trends Neurosci. 2018 Jun;41(6):373–84. <a href=""http://www.ncbi.nlm.nih.gov/pubmed/29606485"" target=""_blank"" class=""external"" rel=""nofollow"">PubMed</a> <a href=""https://europepmc.org/abstract/MED/29606485"" target=""_blank"" class=""external"" rel=""nofollow"">Europe PMC</a> <a href=""https://scholia.toolforge.org/pubmed/29606485"" target=""_blank"" class=""external"" rel=""nofollow"">Scholia</a>"
30886620	Pubmed	"Carpanini SM, Torvell M, Morgan BP. Therapeutic Inhibition of the Complement System in Diseases of the Central Nervous System. Front Immunol. 2019 Mar 4;10:362. <a href=""http://www.ncbi.nlm.nih.gov/pubmed/30886620"" target=""_blank"" class=""external"" rel=""nofollow"">PubMed</a> <a href=""https://europepmc.org/abstract/MED/30886620"" target=""_blank"" class=""external"" rel=""nofollow"">Europe PMC</a> <a href=""https://scholia.toolforge.org/pubmed/30886620"" target=""_blank"" class=""external"" rel=""nofollow"">Scholia</a>"
31175934	Pubmed	"Nonaka S, Nakanishi H. Microglial clearance of focal apoptotic synapses. Neurosci Lett. 2019 Aug 10;707:134317. <a href=""http://www.ncbi.nlm.nih.gov/pubmed/31175934"" target=""_blank"" class=""external"" rel=""nofollow"">PubMed</a> <a href=""https://europepmc.org/abstract/MED/31175934"" target=""_blank"" class=""external"" rel=""nofollow"">Europe PMC</a> <a href=""https://scholia.toolforge.org/pubmed/31175934"" target=""_blank"" class=""external"" rel=""nofollow"">Scholia</a>"
31439935	Pubmed	"Woo JJ, Pouget JG, Zai CC, Kennedy JL. The complement system in schizophrenia: where are we now and what’s next? Mol Psychiatry. 2020 Jan;25(1):114–30. <a href=""http://www.ncbi.nlm.nih.gov/pubmed/31439935"" target=""_blank"" class=""external"" rel=""nofollow"">PubMed</a> <a href=""https://europepmc.org/abstract/MED/31439935"" target=""_blank"" class=""external"" rel=""nofollow"">Europe PMC</a> <a href=""https://scholia.toolforge.org/pubmed/31439935"" target=""_blank"" class=""external"" rel=""nofollow"">Scholia</a>"
32116493	Pubmed	"Magdalon J, Mansur F, Teles E Silva AL, de Goes VA, Reiner O, Sertié AL. Complement System in Brain Architecture and Neurodevelopmental Disorders. Front Neurosci. 2020 Feb 5;14:23. <a href=""http://www.ncbi.nlm.nih.gov/pubmed/32116493"" target=""_blank"" class=""external"" rel=""nofollow"">PubMed</a> <a href=""https://europepmc.org/abstract/MED/32116493"" target=""_blank"" class=""external"" rel=""nofollow"">Europe PMC</a> <a href=""https://scholia.toolforge.org/pubmed/32116493"" target=""_blank"" class=""external"" rel=""nofollow"">Scholia</a>"
33599083	Pubmed	"Fatoba O, Itokazu T, Yamashita T. Complement cascade functions during brain development and neurodegeneration. FEBS J. 2021 Feb 18;10.1111/febs.15772. <a href=""http://www.ncbi.nlm.nih.gov/pubmed/33599083"" target=""_blank"" class=""external"" rel=""nofollow"">PubMed</a> <a href=""https://europepmc.org/abstract/MED/33599083"" target=""_blank"" class=""external"" rel=""nofollow"">Europe PMC</a> <a href=""https://scholia.toolforge.org/pubmed/33599083"" target=""_blank"" class=""external"" rel=""nofollow"">Scholia</a>"
33670154	Pubmed	"Hogenaar JTT, van Bokhoven H. Schizophrenia: Complement Cleaning or Killing. Genes (Basel). 2021 Feb 11;12(2):259. <a href=""http://www.ncbi.nlm.nih.gov/pubmed/33670154"" target=""_blank"" class=""external"" rel=""nofollow"">PubMed</a> <a href=""https://europepmc.org/abstract/MED/33670154"" target=""_blank"" class=""external"" rel=""nofollow"">Europe PMC</a> <a href=""https://scholia.toolforge.org/pubmed/33670154"" target=""_blank"" class=""external"" rel=""nofollow"">Scholia</a>"
