ID	Database	Citation
6427116	Pubmed	"Lead poisoning in inherited delta-aminolevulinic acid dehydratase deficiency. Doss M, Laubenthal F, Stoeppler M. Int Arch Occup Environ Health. 1984;54(1):55–63.  <a href=""http://www.ncbi.nlm.nih.gov/pubmed/6427116"" target=""_blank"" class=""external"" rel=""nofollow"">PubMed</a> <a href=""https://europepmc.org/abstract/MED/6427116"" target=""_blank"" class=""external"" rel=""nofollow"">Europe PMC</a> <a href=""https://scholia.toolforge.org/pubmed/6427116"" target=""_blank"" class=""external"" rel=""nofollow"">Scholia</a>"
6826727	Pubmed	"Hereditary tyrosinemia and the heme biosynthetic pathway. Profound inhibition of delta-aminolevulinic acid dehydratase activity by succinylacetone. Sassa S, Kappas A. J Clin Invest. 1983 Mar;71(3):625–34.  <a href=""http://www.ncbi.nlm.nih.gov/pubmed/6826727"" target=""_blank"" class=""external"" rel=""nofollow"">PubMed</a> <a href=""https://europepmc.org/abstract/MED/6826727"" target=""_blank"" class=""external"" rel=""nofollow"">Europe PMC</a> <a href=""https://scholia.toolforge.org/pubmed/6826727"" target=""_blank"" class=""external"" rel=""nofollow"">Scholia</a>"
10692079	Pubmed	"Molecular aspects of the inherited porphyrias. Sassa S, Kappas A. J Intern Med. 2000 Feb;247(2):169–78.  <a href=""http://www.ncbi.nlm.nih.gov/pubmed/10692079"" target=""_blank"" class=""external"" rel=""nofollow"">PubMed</a> <a href=""https://europepmc.org/abstract/MED/10692079"" target=""_blank"" class=""external"" rel=""nofollow"">Europe PMC</a> <a href=""https://scholia.toolforge.org/pubmed/10692079"" target=""_blank"" class=""external"" rel=""nofollow"">Scholia</a>"
12498316	Pubmed	"Lead, chemical porphyria, and heme as a biological mediator. Fujita H, Nishitani C, Ogawa K. Tohoku J Exp Med. 2002 Feb;196(2):53–64.  <a href=""http://www.ncbi.nlm.nih.gov/pubmed/12498316"" target=""_blank"" class=""external"" rel=""nofollow"">PubMed</a> <a href=""https://europepmc.org/abstract/MED/12498316"" target=""_blank"" class=""external"" rel=""nofollow"">Europe PMC</a> <a href=""https://scholia.toolforge.org/pubmed/12498316"" target=""_blank"" class=""external"" rel=""nofollow"">Scholia</a>"
15982550	Pubmed	"The porphyrias. Dombeck TA, Satonik RC. Emerg Med Clin North Am. 2005 Aug;23(3):885–99, x.  <a href=""http://www.ncbi.nlm.nih.gov/pubmed/15982550"" target=""_blank"" class=""external"" rel=""nofollow"">PubMed</a> <a href=""https://europepmc.org/abstract/MED/15982550"" target=""_blank"" class=""external"" rel=""nofollow"">Europe PMC</a> <a href=""https://scholia.toolforge.org/pubmed/15982550"" target=""_blank"" class=""external"" rel=""nofollow"">Scholia</a>"
16330345	Pubmed	"A critical review of biomarkers used for monitoring human exposure to lead: advantages, limitations, and future needs. Barbosa F Jr, Tanus-Santos JE, Gerlach RF, Parsons PJ. Environ Health Perspect. 2005 Dec;113(12):1669–74.  <a href=""http://www.ncbi.nlm.nih.gov/pubmed/16330345"" target=""_blank"" class=""external"" rel=""nofollow"">PubMed</a> <a href=""https://europepmc.org/abstract/MED/16330345"" target=""_blank"" class=""external"" rel=""nofollow"">Europe PMC</a> <a href=""https://scholia.toolforge.org/pubmed/16330345"" target=""_blank"" class=""external"" rel=""nofollow"">Scholia</a>"
17366816	Pubmed	"Lead and delta-aminolevulinic acid dehydratase polymorphism: where does it lead? A meta-analysis. Scinicariello F, Murray HE, Moffett DB, Abadin HG, Sexton MJ, Fowler BA. Environ Health Perspect. 2007 Jan;115(1):35–41.  <a href=""http://www.ncbi.nlm.nih.gov/pubmed/17366816"" target=""_blank"" class=""external"" rel=""nofollow"">PubMed</a> <a href=""https://europepmc.org/abstract/MED/17366816"" target=""_blank"" class=""external"" rel=""nofollow"">Europe PMC</a> <a href=""https://scholia.toolforge.org/pubmed/17366816"" target=""_blank"" class=""external"" rel=""nofollow"">Scholia</a>"
20506125	Pubmed	"Structure and function of enzymes in heme biosynthesis. Layer G, Reichelt J, Jahn D, Heinz DW. Protein Sci. 2010 Jun;19(6):1137–61.  <a href=""http://www.ncbi.nlm.nih.gov/pubmed/20506125"" target=""_blank"" class=""external"" rel=""nofollow"">PubMed</a> <a href=""https://europepmc.org/abstract/MED/20506125"" target=""_blank"" class=""external"" rel=""nofollow"">Europe PMC</a> <a href=""https://scholia.toolforge.org/pubmed/20506125"" target=""_blank"" class=""external"" rel=""nofollow"">Scholia</a>"
21103937	Pubmed	"Harderoporphyria due to homozygosity for coproporphyrinogen oxidase missense mutation H327R. Hasanoglu A, Balwani M, Kasapkara CS, Ezgü FS, Okur I, Tümer L, et al. J Inherit Metab Dis. 2011 Feb;34(1):225–31.  <a href=""http://www.ncbi.nlm.nih.gov/pubmed/21103937"" target=""_blank"" class=""external"" rel=""nofollow"">PubMed</a> <a href=""https://europepmc.org/abstract/MED/21103937"" target=""_blank"" class=""external"" rel=""nofollow"">Europe PMC</a> <a href=""https://scholia.toolforge.org/pubmed/21103937"" target=""_blank"" class=""external"" rel=""nofollow"">Scholia</a>"
23720291	Pubmed	"Porphyrin and heme metabolism and the porphyrias. Bonkovsky HL, Guo JT, Hou W, Li T, Narang T, Thapar M. Compr Physiol. 2013 Jan;3(1):365–401.  <a href=""http://www.ncbi.nlm.nih.gov/pubmed/23720291"" target=""_blank"" class=""external"" rel=""nofollow"">PubMed</a> <a href=""https://europepmc.org/abstract/MED/23720291"" target=""_blank"" class=""external"" rel=""nofollow"">Europe PMC</a> <a href=""https://scholia.toolforge.org/pubmed/23720291"" target=""_blank"" class=""external"" rel=""nofollow"">Scholia</a>"
26132003	Pubmed	"Porphyria Diagnostics-Part 1: A Brief Overview of the Porphyrias. Ramanujam VMS, Anderson KE. Curr Protoc Hum Genet. 2015 Jul 1;86:17.20.1-17.20.26.  <a href=""http://www.ncbi.nlm.nih.gov/pubmed/26132003"" target=""_blank"" class=""external"" rel=""nofollow"">PubMed</a> <a href=""https://europepmc.org/abstract/MED/26132003"" target=""_blank"" class=""external"" rel=""nofollow"">Europe PMC</a> <a href=""https://scholia.toolforge.org/pubmed/26132003"" target=""_blank"" class=""external"" rel=""nofollow"">Scholia</a>"
26637696	Pubmed	"Diagnosis and treatment of sideroblastic anemias: from defective heme synthesis to abnormal RNA splicing. Cazzola M, Malcovati L. Hematology Am Soc Hematol Educ Program. 2015;2015:19–25.  <a href=""http://www.ncbi.nlm.nih.gov/pubmed/26637696"" target=""_blank"" class=""external"" rel=""nofollow"">PubMed</a> <a href=""https://europepmc.org/abstract/MED/26637696"" target=""_blank"" class=""external"" rel=""nofollow"">Europe PMC</a> <a href=""https://scholia.toolforge.org/pubmed/26637696"" target=""_blank"" class=""external"" rel=""nofollow"">Scholia</a>"
27496948	Pubmed	"Novel Mechanisms for Heme-dependent Degradation of ALAS1 Protein as a Component of Negative Feedback Regulation of Heme Biosynthesis. Kubota Y, Nomura K, Katoh Y, Yamashita R, Kaneko K, Furuyama K. J Biol Chem. 2016 Sep 23;291(39):20516–29.  <a href=""http://www.ncbi.nlm.nih.gov/pubmed/27496948"" target=""_blank"" class=""external"" rel=""nofollow"">PubMed</a> <a href=""https://europepmc.org/abstract/MED/27496948"" target=""_blank"" class=""external"" rel=""nofollow"">Europe PMC</a> <a href=""https://scholia.toolforge.org/pubmed/27496948"" target=""_blank"" class=""external"" rel=""nofollow"">Scholia</a>"
27982422	Pubmed	"Update review of the acute porphyrias. Stein PE, Badminton MN, Rees DC. Br J Haematol. 2017 Feb;176(4):527–38.  <a href=""http://www.ncbi.nlm.nih.gov/pubmed/27982422"" target=""_blank"" class=""external"" rel=""nofollow"">PubMed</a> <a href=""https://europepmc.org/abstract/MED/27982422"" target=""_blank"" class=""external"" rel=""nofollow"">Europe PMC</a> <a href=""https://scholia.toolforge.org/pubmed/27982422"" target=""_blank"" class=""external"" rel=""nofollow"">Scholia</a>"
28149023	Pubmed	"Status of Serum Calcium, Vitamin D and Parathyroid Hormone and Hematological Indices Among Lead Exposed Jewelry Workers in Dhaka, Bangladesh. Mazumdar I, Goswami K, Ali MS. Indian J Clin Biochem. 2017 Mar;32(1):110–6.  <a href=""http://www.ncbi.nlm.nih.gov/pubmed/28149023"" target=""_blank"" class=""external"" rel=""nofollow"">PubMed</a> <a href=""https://europepmc.org/abstract/MED/28149023"" target=""_blank"" class=""external"" rel=""nofollow"">Europe PMC</a> <a href=""https://scholia.toolforge.org/pubmed/28149023"" target=""_blank"" class=""external"" rel=""nofollow"">Scholia</a>"
30098397	Pubmed	"Molecular pathophysiology and genetic mutations in congenital sideroblastic anemia. Fujiwara T, Harigae H. Free Radic Biol Med. 2019 Mar;133:179–85.  <a href=""http://www.ncbi.nlm.nih.gov/pubmed/30098397"" target=""_blank"" class=""external"" rel=""nofollow"">PubMed</a> <a href=""https://europepmc.org/abstract/MED/30098397"" target=""_blank"" class=""external"" rel=""nofollow"">Europe PMC</a> <a href=""https://scholia.toolforge.org/pubmed/30098397"" target=""_blank"" class=""external"" rel=""nofollow"">Scholia</a>"
30594473	Pubmed	"Recent advances on porphyria genetics: Inheritance, penetrance & molecular heterogeneity, including new modifying/causative genes. Yasuda M, Chen B, Desnick RJ. Mol Genet Metab. 2019 Nov;128(3):320–31.  <a href=""http://www.ncbi.nlm.nih.gov/pubmed/30594473"" target=""_blank"" class=""external"" rel=""nofollow"">PubMed</a> <a href=""https://europepmc.org/abstract/MED/30594473"" target=""_blank"" class=""external"" rel=""nofollow"">Europe PMC</a> <a href=""https://scholia.toolforge.org/pubmed/30594473"" target=""_blank"" class=""external"" rel=""nofollow"">Scholia</a>"
30704898	Pubmed	"Erythropoietic Protoporphyria and X-Linked Protoporphyria: pathophysiology, genetics, clinical manifestations, and management. Balwani M. Mol Genet Metab. 2019 Nov;128(3):298–303.  <a href=""http://www.ncbi.nlm.nih.gov/pubmed/30704898"" target=""_blank"" class=""external"" rel=""nofollow"">PubMed</a> <a href=""https://europepmc.org/abstract/MED/30704898"" target=""_blank"" class=""external"" rel=""nofollow"">Europe PMC</a> <a href=""https://scholia.toolforge.org/pubmed/30704898"" target=""_blank"" class=""external"" rel=""nofollow"">Scholia</a>"
30828546	Pubmed	"Harderoporphyria: Case of lifelong photosensitivity associated with compound heterozygous coproporphyrinogen oxidase (CPOX) mutations. Moghe A, Ramanujam VMS, Phillips JD, Desnick RJ, Anderson KE. Mol Genet Metab Rep. 2019 Feb 19;19:100457.  <a href=""http://www.ncbi.nlm.nih.gov/pubmed/30828546"" target=""_blank"" class=""external"" rel=""nofollow"">PubMed</a> <a href=""https://europepmc.org/abstract/MED/30828546"" target=""_blank"" class=""external"" rel=""nofollow"">Europe PMC</a> <a href=""https://scholia.toolforge.org/pubmed/30828546"" target=""_blank"" class=""external"" rel=""nofollow"">Scholia</a>"
31085196	Pubmed	"Clinical Guide and Update on Porphyrias. Stölzel U, Doss MO, Schuppan D. Gastroenterology. 2019 Aug;157(2):365-381.e4.  <a href=""http://www.ncbi.nlm.nih.gov/pubmed/31085196"" target=""_blank"" class=""external"" rel=""nofollow"">PubMed</a> <a href=""https://europepmc.org/abstract/MED/31085196"" target=""_blank"" class=""external"" rel=""nofollow"">Europe PMC</a> <a href=""https://scholia.toolforge.org/pubmed/31085196"" target=""_blank"" class=""external"" rel=""nofollow"">Scholia</a>"
31117811	Pubmed	"Ecogenetics of lead toxicity and its influence on risk assessment. Mani MS, Kabekkodu SP, Joshi MB, Dsouza HS. Hum Exp Toxicol. 2019 Sep;38(9):1031–59.  <a href=""http://www.ncbi.nlm.nih.gov/pubmed/31117811"" target=""_blank"" class=""external"" rel=""nofollow"">PubMed</a> <a href=""https://europepmc.org/abstract/MED/31117811"" target=""_blank"" class=""external"" rel=""nofollow"">Europe PMC</a> <a href=""https://scholia.toolforge.org/pubmed/31117811"" target=""_blank"" class=""external"" rel=""nofollow"">Scholia</a>"
31326287	Pubmed	"Heme biosynthesis and the porphyrias. Phillips JD. Mol Genet Metab. 2019 Nov;128(3):164–77.  <a href=""http://www.ncbi.nlm.nih.gov/pubmed/31326287"" target=""_blank"" class=""external"" rel=""nofollow"">PubMed</a> <a href=""https://europepmc.org/abstract/MED/31326287"" target=""_blank"" class=""external"" rel=""nofollow"">Europe PMC</a> <a href=""https://scholia.toolforge.org/pubmed/31326287"" target=""_blank"" class=""external"" rel=""nofollow"">Scholia</a>"
33199206	Pubmed	"5-Aminolevulinate dehydratase porphyria: Update on hepatic 5-aminolevulinic acid synthase induction and long-term response to hemin. Lahiji AP, Anderson KE, Chan A, Simon A, Desnick RJ, Ramanujam VMS. Mol Genet Metab. 2020 Dec;131(4):418–23.  <a href=""http://www.ncbi.nlm.nih.gov/pubmed/33199206"" target=""_blank"" class=""external"" rel=""nofollow"">PubMed</a> <a href=""https://europepmc.org/abstract/MED/33199206"" target=""_blank"" class=""external"" rel=""nofollow"">Europe PMC</a> <a href=""https://scholia.toolforge.org/pubmed/33199206"" target=""_blank"" class=""external"" rel=""nofollow"">Scholia</a>"
