ID	Database	Citation
10.1016/B978-0-12-809633-8.06393-7	DOI	"Neidhardt FC, Kushner SR. Escherichia coli ☆. In: Reference Module in Life Sciences [Internet]. Elsevier; 2017. Available from: http://dx.doi.org/10.1016/B978-0-12-809633-8.06393-7 <a href=""https://doi.org/10.1016/B978-0-12-809633-8.06393-7"" target=""_blank"" class=""external"" rel=""nofollow"">DOI</a>"
2056525	Pubmed	"Activity and specificity of human aldolases. Gamblin SJ, Davies GJ, Grimes JM, Jackson RM, Littlechild JA, Watson HC. J Mol Biol. 1991 Jun 20;219(4):573–6.  <a href=""http://www.ncbi.nlm.nih.gov/pubmed/2056525"" target=""_blank"" class=""external"" rel=""nofollow"">PubMed</a> <a href=""https://europepmc.org/abstract/MED/2056525"" target=""_blank"" class=""external"" rel=""nofollow"">Europe PMC</a> <a href=""https://scholia.toolforge.org/pubmed/2056525"" target=""_blank"" class=""external"" rel=""nofollow"">Scholia</a>"
12941785	Pubmed	"Properties of normal and mutant recombinant human ketohexokinases and implications for the pathogenesis of essential fructosuria. Asipu A, Hayward BE, O’Reilly J, Bonthron DT. Diabetes. 2003 Sep;52(9):2426–32.  <a href=""http://www.ncbi.nlm.nih.gov/pubmed/12941785"" target=""_blank"" class=""external"" rel=""nofollow"">PubMed</a> <a href=""https://europepmc.org/abstract/MED/12941785"" target=""_blank"" class=""external"" rel=""nofollow"">Europe PMC</a> <a href=""https://scholia.toolforge.org/pubmed/12941785"" target=""_blank"" class=""external"" rel=""nofollow"">Scholia</a>"
20949620	Pubmed	"D-glyceric aciduria is caused by genetic deficiency of D-glycerate kinase (GLYCTK). Sass JO, Fischer K, Wang R, Christensen E, Scholl-Bürgi S, Chang R, et al. Hum Mutat. 2010 Dec;31(12):1280–5.  <a href=""http://www.ncbi.nlm.nih.gov/pubmed/20949620"" target=""_blank"" class=""external"" rel=""nofollow"">PubMed</a> <a href=""https://europepmc.org/abstract/MED/20949620"" target=""_blank"" class=""external"" rel=""nofollow"">Europe PMC</a> <a href=""https://scholia.toolforge.org/pubmed/20949620"" target=""_blank"" class=""external"" rel=""nofollow"">Scholia</a>"
23444097	Pubmed	"New insights into the half-of-the-sites reactivity of human aldehyde dehydrogenase 1A1. Yoval-Sánchez B, Pardo JP, Rodríguez-Zavala JS. Proteins. 2013 Aug;81(8):1330–9.  <a href=""http://www.ncbi.nlm.nih.gov/pubmed/23444097"" target=""_blank"" class=""external"" rel=""nofollow"">PubMed</a> <a href=""https://europepmc.org/abstract/MED/23444097"" target=""_blank"" class=""external"" rel=""nofollow"">Europe PMC</a> <a href=""https://scholia.toolforge.org/pubmed/23444097"" target=""_blank"" class=""external"" rel=""nofollow"">Scholia</a>"
24862258	Pubmed	"The metabolic alterations of cancer cells. Sciacovelli M, Gaude E, Hilvo M, Frezza C. Methods Enzymol. 2014;542:1–23.  <a href=""http://www.ncbi.nlm.nih.gov/pubmed/24862258"" target=""_blank"" class=""external"" rel=""nofollow"">PubMed</a> <a href=""https://europepmc.org/abstract/MED/24862258"" target=""_blank"" class=""external"" rel=""nofollow"">Europe PMC</a> <a href=""https://scholia.toolforge.org/pubmed/24862258"" target=""_blank"" class=""external"" rel=""nofollow"">Scholia</a>"
28803808	Pubmed	"Two novel mutations (p.(Ser160Pro) and p.(Arg472Cys)) causing glucose-6-phosphate isomerase deficiency are associated with erythroid dysplasia and inappropriately suppressed hepcidin. Mojzikova R, Koralkova P, Holub D, Saxova Z, Pospisilova D, Prochazkova D, et al. Blood Cells Mol Dis. 2018 Mar;69:23–9.  <a href=""http://www.ncbi.nlm.nih.gov/pubmed/28803808"" target=""_blank"" class=""external"" rel=""nofollow"">PubMed</a> <a href=""https://europepmc.org/abstract/MED/28803808"" target=""_blank"" class=""external"" rel=""nofollow"">Europe PMC</a> <a href=""https://scholia.toolforge.org/pubmed/28803808"" target=""_blank"" class=""external"" rel=""nofollow"">Scholia</a>"
