ID	Database	Citation
1406652	Pubmed	"Characterization of the human lipoprotein lipase (LPL) promoter: evidence of two cis-regulatory regions, LP-alpha and LP-beta, of importance for the differentiation-linked induction of the LPL gene during adipogenesis. Enerbäck S, Ohlsson BG, Samuelsson L, Bjursell G. Mol Cell Biol. 1992 Oct;12(10):4622–33.  <a href=""http://www.ncbi.nlm.nih.gov/pubmed/1406652"" target=""_blank"" class=""external"" rel=""nofollow"">PubMed</a> <a href=""https://europepmc.org/abstract/MED/1406652"" target=""_blank"" class=""external"" rel=""nofollow"">Europe PMC</a> <a href=""https://scholia.toolforge.org/pubmed/1406652"" target=""_blank"" class=""external"" rel=""nofollow"">Scholia</a>"
12921235	Pubmed	"The nuclear lamina and its functions in the nucleus. Gruenbaum Y, Goldman RD, Meyuhas R, Mills E, Margalit A, Fridkin A, et al. Int Rev Cytol. 2003;226:1–62.  <a href=""http://www.ncbi.nlm.nih.gov/pubmed/12921235"" target=""_blank"" class=""external"" rel=""nofollow"">PubMed</a> <a href=""https://europepmc.org/abstract/MED/12921235"" target=""_blank"" class=""external"" rel=""nofollow"">Europe PMC</a> <a href=""https://scholia.toolforge.org/pubmed/12921235"" target=""_blank"" class=""external"" rel=""nofollow"">Scholia</a>"
17660942	Pubmed	"From old organisms to new molecules: integrative biology and therapeutic targets in accelerated human ageing. Cox LS, Faragher RGA. Cell Mol Life Sci. 2007 Oct;64(19–20):2620–41.  <a href=""http://www.ncbi.nlm.nih.gov/pubmed/17660942"" target=""_blank"" class=""external"" rel=""nofollow"">PubMed</a> <a href=""https://europepmc.org/abstract/MED/17660942"" target=""_blank"" class=""external"" rel=""nofollow"">Europe PMC</a> <a href=""https://scholia.toolforge.org/pubmed/17660942"" target=""_blank"" class=""external"" rel=""nofollow"">Scholia</a>"
19841733	Pubmed	"Krüppel-like family of transcription factors: an emerging new frontier in fat biology. Brey CW, Nelder MP, Hailemariam T, Gaugler R, Hashmi S. Int J Biol Sci. 2009 Oct 1;5(6):622–36.  <a href=""http://www.ncbi.nlm.nih.gov/pubmed/19841733"" target=""_blank"" class=""external"" rel=""nofollow"">PubMed</a> <a href=""https://europepmc.org/abstract/MED/19841733"" target=""_blank"" class=""external"" rel=""nofollow"">Europe PMC</a> <a href=""https://scholia.toolforge.org/pubmed/19841733"" target=""_blank"" class=""external"" rel=""nofollow"">Scholia</a>"
19956441	Pubmed	"CAAX-box protein, prenylation process and carcinogenesis. Gao J, Liao J, Yang GY. Am J Transl Res. 2009 May 25;1(3):312–25.  <a href=""http://www.ncbi.nlm.nih.gov/pubmed/19956441"" target=""_blank"" class=""external"" rel=""nofollow"">PubMed</a> <a href=""https://europepmc.org/abstract/MED/19956441"" target=""_blank"" class=""external"" rel=""nofollow"">Europe PMC</a> <a href=""https://scholia.toolforge.org/pubmed/19956441"" target=""_blank"" class=""external"" rel=""nofollow"">Scholia</a>"
21633178	Pubmed	"The role of lipid droplets in metabolic disease in rodents and humans. Greenberg AS, Coleman RA, Kraemer FB, McManaman JL, Obin MS, Puri V, et al. J Clin Invest. 2011 Jun;121(6):2102–10.  <a href=""http://www.ncbi.nlm.nih.gov/pubmed/21633178"" target=""_blank"" class=""external"" rel=""nofollow"">PubMed</a> <a href=""https://europepmc.org/abstract/MED/21633178"" target=""_blank"" class=""external"" rel=""nofollow"">Europe PMC</a> <a href=""https://scholia.toolforge.org/pubmed/21633178"" target=""_blank"" class=""external"" rel=""nofollow"">Scholia</a>"
21636835	Pubmed	"Differential regulation of CIDEA and CIDEC expression by insulin via Akt1/2- and JNK2-dependent pathways in human adipocytes. Ito M, Nagasawa M, Omae N, Ide T, Akasaka Y, Murakami K. J Lipid Res. 2011 Aug;52(8):1450–60.  <a href=""http://www.ncbi.nlm.nih.gov/pubmed/21636835"" target=""_blank"" class=""external"" rel=""nofollow"">PubMed</a> <a href=""https://europepmc.org/abstract/MED/21636835"" target=""_blank"" class=""external"" rel=""nofollow"">Europe PMC</a> <a href=""https://scholia.toolforge.org/pubmed/21636835"" target=""_blank"" class=""external"" rel=""nofollow"">Scholia</a>"
21639948	Pubmed	"The lamin protein family. Dittmer TA, Misteli T. Genome Biol. 2011;12(5):222.  <a href=""http://www.ncbi.nlm.nih.gov/pubmed/21639948"" target=""_blank"" class=""external"" rel=""nofollow"">PubMed</a> <a href=""https://europepmc.org/abstract/MED/21639948"" target=""_blank"" class=""external"" rel=""nofollow"">Europe PMC</a> <a href=""https://scholia.toolforge.org/pubmed/21639948"" target=""_blank"" class=""external"" rel=""nofollow"">Scholia</a>"
24369348	Pubmed	"Cidea controls lipid droplet fusion and lipid storage in brown and white adipose tissue. Wu L, Zhou L, Chen C, Gong J, Xu L, Ye J, et al. Sci China Life Sci. 2014 Jan;57(1):107–16.  <a href=""http://www.ncbi.nlm.nih.gov/pubmed/24369348"" target=""_blank"" class=""external"" rel=""nofollow"">PubMed</a> <a href=""https://europepmc.org/abstract/MED/24369348"" target=""_blank"" class=""external"" rel=""nofollow"">Europe PMC</a> <a href=""https://scholia.toolforge.org/pubmed/24369348"" target=""_blank"" class=""external"" rel=""nofollow"">Scholia</a>"
25418138	Pubmed	"CIDEC/FSP27 is regulated by peroxisome proliferator-activated receptor alpha and plays a critical role in fasting- and diet-induced hepatosteatosis. Langhi C, Baldán Á. Hepatology. 2015 Apr;61(4):1227–38.  <a href=""http://www.ncbi.nlm.nih.gov/pubmed/25418138"" target=""_blank"" class=""external"" rel=""nofollow"">PubMed</a> <a href=""https://europepmc.org/abstract/MED/25418138"" target=""_blank"" class=""external"" rel=""nofollow"">Europe PMC</a> <a href=""https://scholia.toolforge.org/pubmed/25418138"" target=""_blank"" class=""external"" rel=""nofollow"">Scholia</a>"
27995415	Pubmed	"Regulation of PPARγ and CIDEC expression by adenovirus 36 in adipocyte differentiation. Jiao Y, Aisa Y, Liang X, Nuermaimaiti N, Gong X, Zhang Z, et al. Mol Cell Biochem. 2017 Apr;428(1–2):1–8.  <a href=""http://www.ncbi.nlm.nih.gov/pubmed/27995415"" target=""_blank"" class=""external"" rel=""nofollow"">PubMed</a> <a href=""https://europepmc.org/abstract/MED/27995415"" target=""_blank"" class=""external"" rel=""nofollow"">Europe PMC</a> <a href=""https://scholia.toolforge.org/pubmed/27995415"" target=""_blank"" class=""external"" rel=""nofollow"">Scholia</a>"
28404813	Pubmed	"Cycling our way to fit fat. Townsend LK, Knuth CM, Wright DC. Physiol Rep. 2017 Apr;5(7):e13247.  <a href=""http://www.ncbi.nlm.nih.gov/pubmed/28404813"" target=""_blank"" class=""external"" rel=""nofollow"">PubMed</a> <a href=""https://europepmc.org/abstract/MED/28404813"" target=""_blank"" class=""external"" rel=""nofollow"">Europe PMC</a> <a href=""https://scholia.toolforge.org/pubmed/28404813"" target=""_blank"" class=""external"" rel=""nofollow"">Scholia</a>"
29989768	Pubmed	"Lipodystrophy Syndromes: Presentation and Treatment. Akinci B, Sahinoz M, Oral E. In: Feingold KR, Anawalt B, Blackman MR, Boyce A, Chrousos G, Corpas E, et al., editors. Endotext. South Dartmouth (MA): MDText.com, Inc.; 2018.  <a href=""http://www.ncbi.nlm.nih.gov/pubmed/29989768"" target=""_blank"" class=""external"" rel=""nofollow"">PubMed</a> <a href=""https://europepmc.org/abstract/MED/29989768"" target=""_blank"" class=""external"" rel=""nofollow"">Europe PMC</a> <a href=""https://scholia.toolforge.org/pubmed/29989768"" target=""_blank"" class=""external"" rel=""nofollow"">Scholia</a>"
30742913	Pubmed	"Gene-gene and gene-environment interactions in lipodystrophy: Lessons learned from natural PPARγ mutants. Broekema MF, Savage DB, Monajemi H, Kalkhoven E. Biochim Biophys Acta Mol Cell Biol Lipids. 2019 May;1864(5):715–32.  <a href=""http://www.ncbi.nlm.nih.gov/pubmed/30742913"" target=""_blank"" class=""external"" rel=""nofollow"">PubMed</a> <a href=""https://europepmc.org/abstract/MED/30742913"" target=""_blank"" class=""external"" rel=""nofollow"">Europe PMC</a> <a href=""https://scholia.toolforge.org/pubmed/30742913"" target=""_blank"" class=""external"" rel=""nofollow"">Scholia</a>"
30871156	Pubmed	"CIDE Proteins in Human Health and Disease. Slayton M, Gupta A, Balakrishnan B, Puri V. Cells. 2019 Mar 13;8(3):238.  <a href=""http://www.ncbi.nlm.nih.gov/pubmed/30871156"" target=""_blank"" class=""external"" rel=""nofollow"">PubMed</a> <a href=""https://europepmc.org/abstract/MED/30871156"" target=""_blank"" class=""external"" rel=""nofollow"">Europe PMC</a> <a href=""https://scholia.toolforge.org/pubmed/30871156"" target=""_blank"" class=""external"" rel=""nofollow"">Scholia</a>"
31035700	Pubmed	"An Epistatic Interaction between Pnpla2 and Lipe Reveals New Pathways of Adipose Tissue Lipolysis. Zhang X, Zhang CC, Yang H, Soni KG, Wang SP, Mitchell GA, et al. Cells. 2019 Apr 29;8(5):395.  <a href=""http://www.ncbi.nlm.nih.gov/pubmed/31035700"" target=""_blank"" class=""external"" rel=""nofollow"">PubMed</a> <a href=""https://europepmc.org/abstract/MED/31035700"" target=""_blank"" class=""external"" rel=""nofollow"">Europe PMC</a> <a href=""https://scholia.toolforge.org/pubmed/31035700"" target=""_blank"" class=""external"" rel=""nofollow"">Scholia</a>"
33685683	Pubmed	"Inhibition of cell death inducing DNA fragmentation factor-α-like effector c (CIDEC) by tumor necrosis factor-α induces lipolysis and inflammation in calf adipocytes. Fan M, Du X, Chen X, Bai H, Loor JJ, Shen T, et al. J Dairy Sci. 2021 May;104(5):6134–45.  <a href=""http://www.ncbi.nlm.nih.gov/pubmed/33685683"" target=""_blank"" class=""external"" rel=""nofollow"">PubMed</a> <a href=""https://europepmc.org/abstract/MED/33685683"" target=""_blank"" class=""external"" rel=""nofollow"">Europe PMC</a> <a href=""https://scholia.toolforge.org/pubmed/33685683"" target=""_blank"" class=""external"" rel=""nofollow"">Scholia</a>"
