ID	Database	Citation
12921235	Pubmed	"The nuclear lamina and its functions in the nucleus. Gruenbaum Y, Goldman RD, Meyuhas R, Mills E, Margalit A, Fridkin A, et al. Int Rev Cytol. 2003;226:1–62.  <a href=""http://www.ncbi.nlm.nih.gov/pubmed/12921235"" target=""_blank"" class=""external"" rel=""nofollow"">PubMed</a> <a href=""https://europepmc.org/abstract/MED/12921235"" target=""_blank"" class=""external"" rel=""nofollow"">Europe PMC</a> <a href=""https://scholia.toolforge.org/pubmed/12921235"" target=""_blank"" class=""external"" rel=""nofollow"">Scholia</a>"
14747765	Pubmed	"Clinical features and metabolic and autoimmune derangements in acquired partial lipodystrophy: report of 35 cases and review of the literature. Misra A, Peethambaram A, Garg A. Medicine (Baltimore). 2004 Jan;83(1):18–34.  <a href=""http://www.ncbi.nlm.nih.gov/pubmed/14747765"" target=""_blank"" class=""external"" rel=""nofollow"">PubMed</a> <a href=""https://europepmc.org/abstract/MED/14747765"" target=""_blank"" class=""external"" rel=""nofollow"">Europe PMC</a> <a href=""https://scholia.toolforge.org/pubmed/14747765"" target=""_blank"" class=""external"" rel=""nofollow"">Scholia</a>"
16826530	Pubmed	"Sequencing of the reannotated LMNB2 gene reveals novel mutations in patients with acquired partial lipodystrophy. Hegele RA, Cao H, Liu DM, Costain GA, Charlton-Menys V, Rodger NW, et al. Am J Hum Genet. 2006 Aug;79(2):383–9.  <a href=""http://www.ncbi.nlm.nih.gov/pubmed/16826530"" target=""_blank"" class=""external"" rel=""nofollow"">PubMed</a> <a href=""https://europepmc.org/abstract/MED/16826530"" target=""_blank"" class=""external"" rel=""nofollow"">Europe PMC</a> <a href=""https://scholia.toolforge.org/pubmed/16826530"" target=""_blank"" class=""external"" rel=""nofollow"">Scholia</a>"
18419792	Pubmed	"The alternative complement pathway revisited. Harboe M, Mollnes TE. J Cell Mol Med. 2008 Aug;12(4):1074–84.  <a href=""http://www.ncbi.nlm.nih.gov/pubmed/18419792"" target=""_blank"" class=""external"" rel=""nofollow"">PubMed</a> <a href=""https://europepmc.org/abstract/MED/18419792"" target=""_blank"" class=""external"" rel=""nofollow"">Europe PMC</a> <a href=""https://scholia.toolforge.org/pubmed/18419792"" target=""_blank"" class=""external"" rel=""nofollow"">Scholia</a>"
19956441	Pubmed	"CAAX-box protein, prenylation process and carcinogenesis. Gao J, Liao J, Yang GY. Am J Transl Res. 2009 May 25;1(3):312–25.  <a href=""http://www.ncbi.nlm.nih.gov/pubmed/19956441"" target=""_blank"" class=""external"" rel=""nofollow"">PubMed</a> <a href=""https://europepmc.org/abstract/MED/19956441"" target=""_blank"" class=""external"" rel=""nofollow"">Europe PMC</a> <a href=""https://scholia.toolforge.org/pubmed/19956441"" target=""_blank"" class=""external"" rel=""nofollow"">Scholia</a>"
21639948	Pubmed	"The lamin protein family. Dittmer TA, Misteli T. Genome Biol. 2011;12(5):222.  <a href=""http://www.ncbi.nlm.nih.gov/pubmed/21639948"" target=""_blank"" class=""external"" rel=""nofollow"">PubMed</a> <a href=""https://europepmc.org/abstract/MED/21639948"" target=""_blank"" class=""external"" rel=""nofollow"">Europe PMC</a> <a href=""https://scholia.toolforge.org/pubmed/21639948"" target=""_blank"" class=""external"" rel=""nofollow"">Scholia</a>"
21865368	Pubmed	"Clinical review#: Lipodystrophies: genetic and acquired body fat disorders. Garg A. J Clin Endocrinol Metab. 2011 Nov;96(11):3313–25.  <a href=""http://www.ncbi.nlm.nih.gov/pubmed/21865368"" target=""_blank"" class=""external"" rel=""nofollow"">PubMed</a> <a href=""https://europepmc.org/abstract/MED/21865368"" target=""_blank"" class=""external"" rel=""nofollow"">Europe PMC</a> <a href=""https://scholia.toolforge.org/pubmed/21865368"" target=""_blank"" class=""external"" rel=""nofollow"">Scholia</a>"
23475188	Pubmed	"Partners and post-translational modifications of nuclear lamins. Simon DN, Wilson KL. Chromosoma. 2013 Mar;122(1–2):13–31.  <a href=""http://www.ncbi.nlm.nih.gov/pubmed/23475188"" target=""_blank"" class=""external"" rel=""nofollow"">PubMed</a> <a href=""https://europepmc.org/abstract/MED/23475188"" target=""_blank"" class=""external"" rel=""nofollow"">Europe PMC</a> <a href=""https://scholia.toolforge.org/pubmed/23475188"" target=""_blank"" class=""external"" rel=""nofollow"">Scholia</a>"
29279276	Pubmed	"Acquired partial lipodystrophy and C3 glomerulopathy: Dysregulation of the complement system as a common pathogenic mechanism. Corvillo F, López-Trascasa M. Nefrologia (Engl Ed). 2018;38(3):258–66.  <a href=""http://www.ncbi.nlm.nih.gov/pubmed/29279276"" target=""_blank"" class=""external"" rel=""nofollow"">PubMed</a> <a href=""https://europepmc.org/abstract/MED/29279276"" target=""_blank"" class=""external"" rel=""nofollow"">Europe PMC</a> <a href=""https://scholia.toolforge.org/pubmed/29279276"" target=""_blank"" class=""external"" rel=""nofollow"">Scholia</a>"
