ID	Database	Citation
25079019	Pubmed	"Gallieni M, Fusaro M. Vitamin K and cardiovascular calcification in CKD: is patient supplementation on the horizon? Kidney Int. 2014 Aug;86(2):232–4.  <a href=""http://www.ncbi.nlm.nih.gov/pubmed/25079019"" target=""_blank"" class=""external"" rel=""nofollow"">PubMed</a> <a href=""https://europepmc.org/abstract/MED/25079019"" target=""_blank"" class=""external"" rel=""nofollow"">Europe PMC</a> <a href=""https://scholia.toolforge.org/pubmed/25079019"" target=""_blank"" class=""external"" rel=""nofollow"">Scholia</a>"
26904004	Pubmed	"Ravcheev DA, Thiele I. Genomic Analysis of the Human Gut Microbiome Suggests Novel Enzymes Involved in Quinone Biosynthesis. Front Microbiol. 2016 Feb 9;7:128.  <a href=""http://www.ncbi.nlm.nih.gov/pubmed/26904004"" target=""_blank"" class=""external"" rel=""nofollow"">PubMed</a> <a href=""https://europepmc.org/abstract/MED/26904004"" target=""_blank"" class=""external"" rel=""nofollow"">Europe PMC</a> <a href=""https://scholia.toolforge.org/pubmed/26904004"" target=""_blank"" class=""external"" rel=""nofollow"">Scholia</a>"
27437760	Pubmed	"Villa JKD, Diaz MAN, Pizziolo VR, Martino HSD. Effect of vitamin K in bone metabolism and vascular calcification: A review of mechanisms of action and evidences. Crit Rev Food Sci Nutr. 2017 Dec 12;57(18):3959–70.  <a href=""http://www.ncbi.nlm.nih.gov/pubmed/27437760"" target=""_blank"" class=""external"" rel=""nofollow"">PubMed</a> <a href=""https://europepmc.org/abstract/MED/27437760"" target=""_blank"" class=""external"" rel=""nofollow"">Europe PMC</a> <a href=""https://scholia.toolforge.org/pubmed/27437760"" target=""_blank"" class=""external"" rel=""nofollow"">Scholia</a>"
35510250	Pubmed	"Yan H, Chen Y, Zhu H, Huang W-H, Cai X-H, Li D, et al. The Relationship Among Intestinal Bacteria, Vitamin K and Response of Vitamin K Antagonist: A Review of Evidence and Potential Mechanism. Front Med (Lausanne). 2022 Apr 18;9:829304.  <a href=""http://www.ncbi.nlm.nih.gov/pubmed/35510250"" target=""_blank"" class=""external"" rel=""nofollow"">PubMed</a> <a href=""https://europepmc.org/abstract/MED/35510250"" target=""_blank"" class=""external"" rel=""nofollow"">Europe PMC</a> <a href=""https://scholia.toolforge.org/pubmed/35510250"" target=""_blank"" class=""external"" rel=""nofollow"">Scholia</a>"
35922487	Pubmed	"Ward NP, DeNicola GM. Long-sought mediator of vitamin K recycling discovered. Nature. 2022 Aug;608(7924):673–4.  <a href=""http://www.ncbi.nlm.nih.gov/pubmed/35922487"" target=""_blank"" class=""external"" rel=""nofollow"">PubMed</a> <a href=""https://europepmc.org/abstract/MED/35922487"" target=""_blank"" class=""external"" rel=""nofollow"">Europe PMC</a> <a href=""https://scholia.toolforge.org/pubmed/35922487"" target=""_blank"" class=""external"" rel=""nofollow"">Scholia</a>"
35922516	Pubmed	"Mishima E, Ito J, Wu Z, Nakamura T, Wahida A, Doll S, et al. A non-canonical vitamin K cycle is a potent ferroptosis suppressor. Nature. 2022 Aug;608(7924):778–83.  <a href=""http://www.ncbi.nlm.nih.gov/pubmed/35922516"" target=""_blank"" class=""external"" rel=""nofollow"">PubMed</a> <a href=""https://europepmc.org/abstract/MED/35922516"" target=""_blank"" class=""external"" rel=""nofollow"">Europe PMC</a> <a href=""https://scholia.toolforge.org/pubmed/35922516"" target=""_blank"" class=""external"" rel=""nofollow"">Scholia</a>"
