ID	Database	Citation
25559186	Pubmed	"TRP channel-associated factors are a novel protein family that regulates TRPM8 trafficking and activity. Gkika D, Lemonnier L, Shapovalov G, Gordienko D, Poux C, Bernardini M, et al. J Cell Biol. 2015 Jan 5;208(1):89–107.  <a href=""http://www.ncbi.nlm.nih.gov/pubmed/25559186"" target=""_blank"" class=""external"" rel=""nofollow"">PubMed</a> <a href=""https://europepmc.org/abstract/MED/25559186"" target=""_blank"" class=""external"" rel=""nofollow"">Europe PMC</a> <a href=""https://scholia.toolforge.org/pubmed/25559186"" target=""_blank"" class=""external"" rel=""nofollow"">Scholia</a>"
25585697	Pubmed	"Dominant transmission of de novo KIF1A motor domain variant underlying pure spastic paraplegia. Ylikallio E, Kim D, Isohanni P, Auranen M, Kim E, Lönnqvist T, et al. Eur J Hum Genet. 2015 Oct;23(10):1427–30.  <a href=""http://www.ncbi.nlm.nih.gov/pubmed/25585697"" target=""_blank"" class=""external"" rel=""nofollow"">PubMed</a> <a href=""https://europepmc.org/abstract/MED/25585697"" target=""_blank"" class=""external"" rel=""nofollow"">Europe PMC</a> <a href=""https://scholia.toolforge.org/pubmed/25585697"" target=""_blank"" class=""external"" rel=""nofollow"">Scholia</a>"
25588830	Pubmed	"SEPT12 orchestrates the formation of mammalian sperm annulus by organizing core octameric complexes with other SEPT proteins. Kuo YC, Shen YR, Chen HI, Lin YH, Wang YY, Chen YR, et al. J Cell Sci. 2015 Mar 1;128(5):923–34.  <a href=""http://www.ncbi.nlm.nih.gov/pubmed/25588830"" target=""_blank"" class=""external"" rel=""nofollow"">PubMed</a> <a href=""https://europepmc.org/abstract/MED/25588830"" target=""_blank"" class=""external"" rel=""nofollow"">Europe PMC</a> <a href=""https://scholia.toolforge.org/pubmed/25588830"" target=""_blank"" class=""external"" rel=""nofollow"">Scholia</a>"
25608809	Pubmed	"Biological function and molecular mechanism of Twist2. Chengxiao Z, Ze Y. Yi Chuan. 2015 Jan;37(1):17–24.  <a href=""http://www.ncbi.nlm.nih.gov/pubmed/25608809"" target=""_blank"" class=""external"" rel=""nofollow"">PubMed</a> <a href=""https://europepmc.org/abstract/MED/25608809"" target=""_blank"" class=""external"" rel=""nofollow"">Europe PMC</a> <a href=""https://scholia.toolforge.org/pubmed/25608809"" target=""_blank"" class=""external"" rel=""nofollow"">Scholia</a>"
26125038	Pubmed	"De novo mutations in KIF1A cause progressive encephalopathy and brain atrophy. Esmaeeli Nieh S, Madou MRZ, Sirajuddin M, Fregeau B, McKnight D, Lexa K, et al. Ann Clin Transl Neurol. 2015 Jun;2(6):623–35.  <a href=""http://www.ncbi.nlm.nih.gov/pubmed/26125038"" target=""_blank"" class=""external"" rel=""nofollow"">PubMed</a> <a href=""https://europepmc.org/abstract/MED/26125038"" target=""_blank"" class=""external"" rel=""nofollow"">Europe PMC</a> <a href=""https://scholia.toolforge.org/pubmed/26125038"" target=""_blank"" class=""external"" rel=""nofollow"">Scholia</a>"
26378241	Pubmed	"ATG4B (Autophagin-1) phosphorylation modulates autophagy. Yang Z, Wilkie-Grantham RP, Yanagi T, Shu CW, Matsuzawa SI, Reed JC. J Biol Chem. 2015 Oct 30;290(44):26549–61.  <a href=""http://www.ncbi.nlm.nih.gov/pubmed/26378241"" target=""_blank"" class=""external"" rel=""nofollow"">PubMed</a> <a href=""https://europepmc.org/abstract/MED/26378241"" target=""_blank"" class=""external"" rel=""nofollow"">Europe PMC</a> <a href=""https://scholia.toolforge.org/pubmed/26378241"" target=""_blank"" class=""external"" rel=""nofollow"">Scholia</a>"
26456823	Pubmed	"CSNAP Is a Stoichiometric Subunit of the COP9 Signalosome. Rozen S, Füzesi-Levi MG, Ben-Nissan G, Mizrachi L, Gabashvili A, Levin Y, et al. Cell Rep. 2015 Oct 20;13(3):585–98.  <a href=""http://www.ncbi.nlm.nih.gov/pubmed/26456823"" target=""_blank"" class=""external"" rel=""nofollow"">PubMed</a> <a href=""https://europepmc.org/abstract/MED/26456823"" target=""_blank"" class=""external"" rel=""nofollow"">Europe PMC</a> <a href=""https://scholia.toolforge.org/pubmed/26456823"" target=""_blank"" class=""external"" rel=""nofollow"">Scholia</a>"
26487268	Pubmed	"Mutations in TRAF3IP1/IFT54 reveal a new role for IFT proteins in microtubule stabilization. Bizet AA, Becker-Heck A, Ryan R, Weber K, Filhol E, Krug P, et al. Nat Commun. 2015 Oct 21;6:8666.  <a href=""http://www.ncbi.nlm.nih.gov/pubmed/26487268"" target=""_blank"" class=""external"" rel=""nofollow"">PubMed</a> <a href=""https://europepmc.org/abstract/MED/26487268"" target=""_blank"" class=""external"" rel=""nofollow"">Europe PMC</a> <a href=""https://scholia.toolforge.org/pubmed/26487268"" target=""_blank"" class=""external"" rel=""nofollow"">Scholia</a>"
26741492	Pubmed	"A Comprehensive Genomic Analysis Reveals the Genetic Landscape of Mitochondrial Respiratory Chain Complex Deficiencies. Kohda M, Tokuzawa Y, Kishita Y, Nyuzuki H, Moriyama Y, Mizuno Y, et al. PLoS Genet. 2016 Jan 7;12(1):e1005679.  <a href=""http://www.ncbi.nlm.nih.gov/pubmed/26741492"" target=""_blank"" class=""external"" rel=""nofollow"">PubMed</a> <a href=""https://europepmc.org/abstract/MED/26741492"" target=""_blank"" class=""external"" rel=""nofollow"">Europe PMC</a> <a href=""https://scholia.toolforge.org/pubmed/26741492"" target=""_blank"" class=""external"" rel=""nofollow"">Scholia</a>"
26978524	Pubmed	"Associations among Erythroferrone and Biomarkers of Erythropoiesis and Iron Metabolism, and Treatment with Long-Term Erythropoiesis-Stimulating Agents in Patients on Hemodialysis. Honda H, Kobayashi Y, Onuma S, Shibagaki K, Yuza T, Hirao K, et al. PLoS One. 2016 Mar 15;11(3):e0151601.  <a href=""http://www.ncbi.nlm.nih.gov/pubmed/26978524"" target=""_blank"" class=""external"" rel=""nofollow"">PubMed</a> <a href=""https://europepmc.org/abstract/MED/26978524"" target=""_blank"" class=""external"" rel=""nofollow"">Europe PMC</a> <a href=""https://scholia.toolforge.org/pubmed/26978524"" target=""_blank"" class=""external"" rel=""nofollow"">Scholia</a>"
27016801	Pubmed	"A novel Rab27a mutation binds melanophilin, but not Munc13-4, causing immunodeficiency without albinism. Netter P, Chan SK, Banerjee PP, Monaco-Shawver L, Noroski LM, Hanson IC, et al. J Allergy Clin Immunol. 2016 Aug;138(2):599-601.e3.  <a href=""http://www.ncbi.nlm.nih.gov/pubmed/27016801"" target=""_blank"" class=""external"" rel=""nofollow"">PubMed</a> <a href=""https://europepmc.org/abstract/MED/27016801"" target=""_blank"" class=""external"" rel=""nofollow"">Europe PMC</a> <a href=""https://scholia.toolforge.org/pubmed/27016801"" target=""_blank"" class=""external"" rel=""nofollow"">Scholia</a>"
27076518	Pubmed	"Bok is a genuine multi-BH-domain protein that triggers apoptosis in the absence of Bax and Bak. Einsele-Scholz S, Malmsheimer S, Bertram K, Stehle D, Johänning J, Manz M, et al. J Cell Sci. 2016 Jun 1;129(11):2213–23.  <a href=""http://www.ncbi.nlm.nih.gov/pubmed/27076518"" target=""_blank"" class=""external"" rel=""nofollow"">PubMed</a> <a href=""https://europepmc.org/abstract/MED/27076518"" target=""_blank"" class=""external"" rel=""nofollow"">Europe PMC</a> <a href=""https://scholia.toolforge.org/pubmed/27076518"" target=""_blank"" class=""external"" rel=""nofollow"">Scholia</a>"
27146013	Pubmed	"Regulation of Hepcidin by Erythropoiesis: The Story So Far. Pasricha SR, McHugh K, Drakesmith H. Annu Rev Nutr. 2016 Jul 17;36:417–34.  <a href=""http://www.ncbi.nlm.nih.gov/pubmed/27146013"" target=""_blank"" class=""external"" rel=""nofollow"">PubMed</a> <a href=""https://europepmc.org/abstract/MED/27146013"" target=""_blank"" class=""external"" rel=""nofollow"">Europe PMC</a> <a href=""https://scholia.toolforge.org/pubmed/27146013"" target=""_blank"" class=""external"" rel=""nofollow"">Scholia</a>"
27325296	Pubmed	"Structural basis for blocking PD-1-mediated immune suppression by therapeutic antibody pembrolizumab. Na Z, Yeo SP, Bharath SR, Bowler MW, Balıkçı E, Wang CI, et al. Cell Res. 2017 Jan;27(1):147–50.  <a href=""http://www.ncbi.nlm.nih.gov/pubmed/27325296"" target=""_blank"" class=""external"" rel=""nofollow"">PubMed</a> <a href=""https://europepmc.org/abstract/MED/27325296"" target=""_blank"" class=""external"" rel=""nofollow"">Europe PMC</a> <a href=""https://scholia.toolforge.org/pubmed/27325296"" target=""_blank"" class=""external"" rel=""nofollow"">Scholia</a>"
27527864	Pubmed	"O-GlcNAcylation of ATG4B positively regulates autophagy by increasing its hydroxylase activity. Jo YK, Park NY, Park SJ, Kim BG, Shin JH, Jo DS, et al. Oncotarget. 2016 Aug 30;7(35):57186–96.  <a href=""http://www.ncbi.nlm.nih.gov/pubmed/27527864"" target=""_blank"" class=""external"" rel=""nofollow"">PubMed</a> <a href=""https://europepmc.org/abstract/MED/27527864"" target=""_blank"" class=""external"" rel=""nofollow"">Europe PMC</a> <a href=""https://scholia.toolforge.org/pubmed/27527864"" target=""_blank"" class=""external"" rel=""nofollow"">Scholia</a>"
27626371	Pubmed	"Accessory subunits are integral for assembly and function of human mitochondrial complex I. Stroud DA, Surgenor EE, Formosa LE, Reljic B, Frazier AE, Dibley MG, et al. Nature. 2016 Oct 6;538(7623):123–6.  <a href=""http://www.ncbi.nlm.nih.gov/pubmed/27626371"" target=""_blank"" class=""external"" rel=""nofollow"">PubMed</a> <a href=""https://europepmc.org/abstract/MED/27626371"" target=""_blank"" class=""external"" rel=""nofollow"">Europe PMC</a> <a href=""https://scholia.toolforge.org/pubmed/27626371"" target=""_blank"" class=""external"" rel=""nofollow"">Scholia</a>"
27708256	Pubmed	"ARD1-mediated Hsp70 acetylation balances stress-induced protein refolding and degradation. Seo JH, Park JH, Lee EJ, Vo TTL, Choi H, Kim JY, et al. Nat Commun. 2016 Oct 6;7:12882.  <a href=""http://www.ncbi.nlm.nih.gov/pubmed/27708256"" target=""_blank"" class=""external"" rel=""nofollow"">PubMed</a> <a href=""https://europepmc.org/abstract/MED/27708256"" target=""_blank"" class=""external"" rel=""nofollow"">Europe PMC</a> <a href=""https://scholia.toolforge.org/pubmed/27708256"" target=""_blank"" class=""external"" rel=""nofollow"">Scholia</a>"
27734966	Pubmed	"High-resolution crystal structure of the therapeutic antibody pembrolizumab bound to the human PD-1. Horita S, Nomura Y, Sato Y, Shimamura T, Iwata S, Nomura N. Sci Rep. 2016 Oct 13;6:35297.  <a href=""http://www.ncbi.nlm.nih.gov/pubmed/27734966"" target=""_blank"" class=""external"" rel=""nofollow"">PubMed</a> <a href=""https://europepmc.org/abstract/MED/27734966"" target=""_blank"" class=""external"" rel=""nofollow"">Europe PMC</a> <a href=""https://scholia.toolforge.org/pubmed/27734966"" target=""_blank"" class=""external"" rel=""nofollow"">Scholia</a>"
27773354	Pubmed	"Cognitive Performance Among Carriers of Pathogenic Copy Number Variants: Analysis of 152,000 UK Biobank Subjects. Kendall KM, Rees E, Escott-Price V, Einon M, Thomas R, Hewitt J, et al. Biol Psychiatry. 2017 Jul 15;82(2):103–10.  <a href=""http://www.ncbi.nlm.nih.gov/pubmed/27773354"" target=""_blank"" class=""external"" rel=""nofollow"">PubMed</a> <a href=""https://europepmc.org/abstract/MED/27773354"" target=""_blank"" class=""external"" rel=""nofollow"">Europe PMC</a> <a href=""https://scholia.toolforge.org/pubmed/27773354"" target=""_blank"" class=""external"" rel=""nofollow"">Scholia</a>"
27793899	Pubmed	"Secreted Phosphoprotein 24 kD Inhibits Growth of Human Prostate Cancer Cells Stimulated by BMP-2. Lao L, Shen J, Tian H, Yao Q, Li Y, Qian L, et al. Anticancer Res. 2016 Nov;36(11):5773–80.  <a href=""http://www.ncbi.nlm.nih.gov/pubmed/27793899"" target=""_blank"" class=""external"" rel=""nofollow"">PubMed</a> <a href=""https://europepmc.org/abstract/MED/27793899"" target=""_blank"" class=""external"" rel=""nofollow"">Europe PMC</a> <a href=""https://scholia.toolforge.org/pubmed/27793899"" target=""_blank"" class=""external"" rel=""nofollow"">Scholia</a>"
28165004	Pubmed	"An unexpected N-terminal loop in PD-1 dominates binding by nivolumab. Tan S, Zhang H, Chai Y, Song H, Tong Z, Wang Q, et al. Nat Commun. 2017 Feb 6;8:14369.  <a href=""http://www.ncbi.nlm.nih.gov/pubmed/28165004"" target=""_blank"" class=""external"" rel=""nofollow"">PubMed</a> <a href=""https://europepmc.org/abstract/MED/28165004"" target=""_blank"" class=""external"" rel=""nofollow"">Europe PMC</a> <a href=""https://scholia.toolforge.org/pubmed/28165004"" target=""_blank"" class=""external"" rel=""nofollow"">Scholia</a>"
28174521	Pubmed	"Deep Sequencing of the Human Retinae Reveals the Expression of Odorant Receptors. Jovancevic N, Wunderlich KA, Haering C, Flegel C, Maßberg D, Weinrich M, et al. Front Cell Neurosci. 2017 Jan 24;11:03.  <a href=""http://www.ncbi.nlm.nih.gov/pubmed/28174521"" target=""_blank"" class=""external"" rel=""nofollow"">PubMed</a> <a href=""https://europepmc.org/abstract/MED/28174521"" target=""_blank"" class=""external"" rel=""nofollow"">Europe PMC</a> <a href=""https://scholia.toolforge.org/pubmed/28174521"" target=""_blank"" class=""external"" rel=""nofollow"">Scholia</a>"
28287329	Pubmed	"ATG4B contains a C-terminal LIR motif important for binding and efficient cleavage of mammalian orthologs of yeast Atg8. Skytte Rasmussen M, Mouilleron S, Kumar Shrestha B, Wirth M, Lee R, Bowitz Larsen K, et al. Autophagy. 2017 May 4;13(5):834–53.  <a href=""http://www.ncbi.nlm.nih.gov/pubmed/28287329"" target=""_blank"" class=""external"" rel=""nofollow"">PubMed</a> <a href=""https://europepmc.org/abstract/MED/28287329"" target=""_blank"" class=""external"" rel=""nofollow"">Europe PMC</a> <a href=""https://scholia.toolforge.org/pubmed/28287329"" target=""_blank"" class=""external"" rel=""nofollow"">Scholia</a>"
28633005	Pubmed	"Autophagy impairment mediated by S-nitrosation of ATG4B leads to neurotoxicity in response to hyperglycemia. Li Y, Zhang Y, Wang L, Wang P, Xue Y, Li X, et al. Autophagy. 2017 Jul 3;13(7):1145–60.  <a href=""http://www.ncbi.nlm.nih.gov/pubmed/28633005"" target=""_blank"" class=""external"" rel=""nofollow"">PubMed</a> <a href=""https://europepmc.org/abstract/MED/28633005"" target=""_blank"" class=""external"" rel=""nofollow"">Europe PMC</a> <a href=""https://scholia.toolforge.org/pubmed/28633005"" target=""_blank"" class=""external"" rel=""nofollow"">Scholia</a>"
28652408	Pubmed	"The extreme C-terminal region of kindlin-2 is critical to its regulation of integrin activation. Hirbawi J, Bialkowska K, Bledzka KM, Liu J, Fukuda K, Qin J, et al. J Biol Chem. 2017 Aug 25;292(34):14258–69.  <a href=""http://www.ncbi.nlm.nih.gov/pubmed/28652408"" target=""_blank"" class=""external"" rel=""nofollow"">PubMed</a> <a href=""https://europepmc.org/abstract/MED/28652408"" target=""_blank"" class=""external"" rel=""nofollow"">Europe PMC</a> <a href=""https://scholia.toolforge.org/pubmed/28652408"" target=""_blank"" class=""external"" rel=""nofollow"">Scholia</a>"
28821708	Pubmed	"A reversible phospho-switch mediated by ULK1 regulates the activity of autophagy protease ATG4B. Pengo N, Agrotis A, Prak K, Jones J, Ketteler R. Nat Commun. 2017 Aug 18;8(1):294.  <a href=""http://www.ncbi.nlm.nih.gov/pubmed/28821708"" target=""_blank"" class=""external"" rel=""nofollow"">PubMed</a> <a href=""https://europepmc.org/abstract/MED/28821708"" target=""_blank"" class=""external"" rel=""nofollow"">Europe PMC</a> <a href=""https://scholia.toolforge.org/pubmed/28821708"" target=""_blank"" class=""external"" rel=""nofollow"">Scholia</a>"
28951311	Pubmed	"PD-1 pathway and its clinical application: A 20year journey after discovery of the complete human PD-1 gene. Berger KN, Pu JJ. Gene. 2018 Jan 5;638:20–5.  <a href=""http://www.ncbi.nlm.nih.gov/pubmed/28951311"" target=""_blank"" class=""external"" rel=""nofollow"">PubMed</a> <a href=""https://europepmc.org/abstract/MED/28951311"" target=""_blank"" class=""external"" rel=""nofollow"">Europe PMC</a> <a href=""https://scholia.toolforge.org/pubmed/28951311"" target=""_blank"" class=""external"" rel=""nofollow"">Scholia</a>"
29056322	Pubmed	"Intersubunit Crosstalk in the Rag GTPase Heterodimer Enables mTORC1 to Respond Rapidly to Amino Acid Availability. Shen K, Choe A, Sabatini DM. Mol Cell. 2017 Nov 2;68(3):552-565.e8.  <a href=""http://www.ncbi.nlm.nih.gov/pubmed/29056322"" target=""_blank"" class=""external"" rel=""nofollow"">PubMed</a> <a href=""https://europepmc.org/abstract/MED/29056322"" target=""_blank"" class=""external"" rel=""nofollow"">Europe PMC</a> <a href=""https://scholia.toolforge.org/pubmed/29056322"" target=""_blank"" class=""external"" rel=""nofollow"">Scholia</a>"
29121083	Pubmed	"Structural and biochemical analysis of atypically low dephosphorylating activity of human dual-specificity phosphatase 28. Ku B, Hong W, Keum CW, Kim M, Ryu H, Jeon D, et al. PLoS One. 2017 Nov 9;12(11):e0187701.  <a href=""http://www.ncbi.nlm.nih.gov/pubmed/29121083"" target=""_blank"" class=""external"" rel=""nofollow"">PubMed</a> <a href=""https://europepmc.org/abstract/MED/29121083"" target=""_blank"" class=""external"" rel=""nofollow"">Europe PMC</a> <a href=""https://scholia.toolforge.org/pubmed/29121083"" target=""_blank"" class=""external"" rel=""nofollow"">Scholia</a>"
29232556	Pubmed	"MST4 Phosphorylation of ATG4B Regulates Autophagic Activity, Tumorigenicity, and Radioresistance in Glioblastoma. Huang T, Kim CK, Alvarez AA, Pangeni RP, Wan X, Song X, et al. Cancer Cell. 2017 Dec 11;32(6):840-855.e8.  <a href=""http://www.ncbi.nlm.nih.gov/pubmed/29232556"" target=""_blank"" class=""external"" rel=""nofollow"">PubMed</a> <a href=""https://europepmc.org/abstract/MED/29232556"" target=""_blank"" class=""external"" rel=""nofollow"">Europe PMC</a> <a href=""https://scholia.toolforge.org/pubmed/29232556"" target=""_blank"" class=""external"" rel=""nofollow"">Scholia</a>"
29233862	Pubmed	"Prolactin-releasing peptide improved leptin hypothalamic signaling in obese mice. Holubová M, Hrubá L, Neprašová B, Majerčíková Z, Lacinová Z, Kuneš J, et al. J Mol Endocrinol. 2018 Feb;60(2):85–94.  <a href=""http://www.ncbi.nlm.nih.gov/pubmed/29233862"" target=""_blank"" class=""external"" rel=""nofollow"">PubMed</a> <a href=""https://europepmc.org/abstract/MED/29233862"" target=""_blank"" class=""external"" rel=""nofollow"">Europe PMC</a> <a href=""https://scholia.toolforge.org/pubmed/29233862"" target=""_blank"" class=""external"" rel=""nofollow"">Scholia</a>"
29419424	Pubmed	"Levels of the erythropoietin-responsive hormone erythroferrone in mice and humans with chronic kidney disease. Hanudel MR, Rappaport M, Chua K, Gabayan V, Qiao B, Jung G, et al. Haematologica. 2018 Apr;103(4):e141–2.  <a href=""http://www.ncbi.nlm.nih.gov/pubmed/29419424"" target=""_blank"" class=""external"" rel=""nofollow"">PubMed</a> <a href=""https://europepmc.org/abstract/MED/29419424"" target=""_blank"" class=""external"" rel=""nofollow"">Europe PMC</a> <a href=""https://scholia.toolforge.org/pubmed/29419424"" target=""_blank"" class=""external"" rel=""nofollow"">Scholia</a>"
29458288	Pubmed	"Delipidation of mammalian Atg8-family proteins by each of the four ATG4 proteases. Kauffman KJ, Yu S, Jin J, Mugo B, Nguyen N, O’Brien A, et al. Autophagy. 2018;14(6):992–1010.  <a href=""http://www.ncbi.nlm.nih.gov/pubmed/29458288"" target=""_blank"" class=""external"" rel=""nofollow"">PubMed</a> <a href=""https://europepmc.org/abstract/MED/29458288"" target=""_blank"" class=""external"" rel=""nofollow"">Europe PMC</a> <a href=""https://scholia.toolforge.org/pubmed/29458288"" target=""_blank"" class=""external"" rel=""nofollow"">Scholia</a>"
29852131	Pubmed	"The neural border: Induction, specification and maturation of the territory that generates neural crest cells. Pla P, Monsoro-Burq AH. Dev Biol. 2018 Dec 1;444 Suppl 1:S36–46.  <a href=""http://www.ncbi.nlm.nih.gov/pubmed/29852131"" target=""_blank"" class=""external"" rel=""nofollow"">PubMed</a> <a href=""https://europepmc.org/abstract/MED/29852131"" target=""_blank"" class=""external"" rel=""nofollow"">Europe PMC</a> <a href=""https://scholia.toolforge.org/pubmed/29852131"" target=""_blank"" class=""external"" rel=""nofollow"">Scholia</a>"
29883780	Pubmed	"Alanine-glyoxylate aminotransferase 1 (AGXT1) is a novel marker for hepatocellular carcinomas. Zhao CL, Hui Y, Wang LJ, Yang D, Yakirevich E, Mangray S, et al. Hum Pathol. 2018 Oct;80:76–81.  <a href=""http://www.ncbi.nlm.nih.gov/pubmed/29883780"" target=""_blank"" class=""external"" rel=""nofollow"">PubMed</a> <a href=""https://europepmc.org/abstract/MED/29883780"" target=""_blank"" class=""external"" rel=""nofollow"">Europe PMC</a> <a href=""https://scholia.toolforge.org/pubmed/29883780"" target=""_blank"" class=""external"" rel=""nofollow"">Scholia</a>"
30021165	Pubmed	"Regulation of KIF1A-Driven Dense Core Vesicle Transport: Ca2+/CaM Controls DCV Binding and Liprin-α/TANC2 Recruits DCVs to Postsynaptic Sites. Stucchi R, Plucińska G, Hummel JJA, Zahavi EE, Guerra San Juan I, Klykov O, et al. Cell Rep. 2018 Jul 17;24(3):685–700.  <a href=""http://www.ncbi.nlm.nih.gov/pubmed/30021165"" target=""_blank"" class=""external"" rel=""nofollow"">PubMed</a> <a href=""https://europepmc.org/abstract/MED/30021165"" target=""_blank"" class=""external"" rel=""nofollow"">Europe PMC</a> <a href=""https://scholia.toolforge.org/pubmed/30021165"" target=""_blank"" class=""external"" rel=""nofollow"">Scholia</a>"
30076329	Pubmed	"A new quinoline-based chemical probe inhibits the autophagy-related cysteine protease ATG4B. Bosc D, Vezenkov L, Bortnik S, An J, Xu J, Choutka C, et al. Sci Rep. 2018 Aug 3;8(1):11653.  <a href=""http://www.ncbi.nlm.nih.gov/pubmed/30076329"" target=""_blank"" class=""external"" rel=""nofollow"">PubMed</a> <a href=""https://europepmc.org/abstract/MED/30076329"" target=""_blank"" class=""external"" rel=""nofollow"">Europe PMC</a> <a href=""https://scholia.toolforge.org/pubmed/30076329"" target=""_blank"" class=""external"" rel=""nofollow"">Scholia</a>"
30181260	Pubmed	"Ragulator and SLC38A9 activate the Rag GTPases through noncanonical GEF mechanisms. Shen K, Sabatini DM. Proc Natl Acad Sci U S A. 2018 Sep 18;115(38):9545–50.  <a href=""http://www.ncbi.nlm.nih.gov/pubmed/30181260"" target=""_blank"" class=""external"" rel=""nofollow"">PubMed</a> <a href=""https://europepmc.org/abstract/MED/30181260"" target=""_blank"" class=""external"" rel=""nofollow"">Europe PMC</a> <a href=""https://scholia.toolforge.org/pubmed/30181260"" target=""_blank"" class=""external"" rel=""nofollow"">Scholia</a>"
30443548	Pubmed	"Identification of Kinases and Phosphatases That Regulate ATG4B Activity by siRNA and Small Molecule Screening in Cells. Pengo N, Prak K, Costa JR, Luft C, Agrotis A, Freeman J, et al. Front Cell Dev Biol. 2018 Nov 1;6:148.  <a href=""http://www.ncbi.nlm.nih.gov/pubmed/30443548"" target=""_blank"" class=""external"" rel=""nofollow"">PubMed</a> <a href=""https://europepmc.org/abstract/MED/30443548"" target=""_blank"" class=""external"" rel=""nofollow"">Europe PMC</a> <a href=""https://scholia.toolforge.org/pubmed/30443548"" target=""_blank"" class=""external"" rel=""nofollow"">Scholia</a>"
30447376	Pubmed	"Insights into product release dynamics through structural analyses of thymidylate kinase. Chaudhary SK, Iyyappan Y, Elayappan M, Jeyakanthan J, Sekar K. Int J Biol Macromol. 2019 Feb 15;123:637–47.  <a href=""http://www.ncbi.nlm.nih.gov/pubmed/30447376"" target=""_blank"" class=""external"" rel=""nofollow"">PubMed</a> <a href=""https://europepmc.org/abstract/MED/30447376"" target=""_blank"" class=""external"" rel=""nofollow"">Europe PMC</a> <a href=""https://scholia.toolforge.org/pubmed/30447376"" target=""_blank"" class=""external"" rel=""nofollow"">Scholia</a>"
30500680	Pubmed	"Protein Phosphatase 1 Regulatory Subunit SDS22 Inhibits Breast Cancer Cell Tumorigenesis by Functioning as a Negative Regulator of the AKT Signaling Pathway. Paul D, Bargale AB, Rapole S, Shetty PK, Santra MK. Neoplasia. 2019 Jan;21(1):30–40.  <a href=""http://www.ncbi.nlm.nih.gov/pubmed/30500680"" target=""_blank"" class=""external"" rel=""nofollow"">PubMed</a> <a href=""https://europepmc.org/abstract/MED/30500680"" target=""_blank"" class=""external"" rel=""nofollow"">Europe PMC</a> <a href=""https://scholia.toolforge.org/pubmed/30500680"" target=""_blank"" class=""external"" rel=""nofollow"">Scholia</a>"
30524950	Pubmed	"Human nitrobindin: the first example of an all-β-barrel ferric heme-protein that catalyzes peroxynitrite detoxification. De Simone G, di Masi A, Polticelli F, Ascenzi P. FEBS Open Bio. 2018 Nov 9;8(12):2002–10.  <a href=""http://www.ncbi.nlm.nih.gov/pubmed/30524950"" target=""_blank"" class=""external"" rel=""nofollow"">PubMed</a> <a href=""https://europepmc.org/abstract/MED/30524950"" target=""_blank"" class=""external"" rel=""nofollow"">Europe PMC</a> <a href=""https://scholia.toolforge.org/pubmed/30524950"" target=""_blank"" class=""external"" rel=""nofollow"">Scholia</a>"
30661429	Pubmed	"Redundancy of human ATG4 protease isoforms in autophagy and LC3/GABARAP processing revealed in cells. Agrotis A, Pengo N, Burden JJ, Ketteler R. Autophagy. 2019 Jun;15(6):976–97.  <a href=""http://www.ncbi.nlm.nih.gov/pubmed/30661429"" target=""_blank"" class=""external"" rel=""nofollow"">PubMed</a> <a href=""https://europepmc.org/abstract/MED/30661429"" target=""_blank"" class=""external"" rel=""nofollow"">Europe PMC</a> <a href=""https://scholia.toolforge.org/pubmed/30661429"" target=""_blank"" class=""external"" rel=""nofollow"">Scholia</a>"
