ID	Database	Citation
12935900	Pubmed	"MIP-T3 associates with IL-13Ralpha1 and suppresses STAT6 activation in response to IL-13 stimulation. Niu Y, Murata T, Watanabe K, Kawakami K, Yoshimura A, Inoue J ichiro, et al. FEBS Lett. 2003 Aug 28;550(1–3):139–43.  <a href=""http://www.ncbi.nlm.nih.gov/pubmed/12935900"" target=""_blank"" class=""external"" rel=""nofollow"">PubMed</a> <a href=""https://europepmc.org/abstract/MED/12935900"" target=""_blank"" class=""external"" rel=""nofollow"">Europe PMC</a> <a href=""https://scholia.toolforge.org/pubmed/12935900"" target=""_blank"" class=""external"" rel=""nofollow"">Scholia</a>"
12972610	Pubmed	"Hes6 promotes cortical neurogenesis and inhibits Hes1 transcription repression activity by multiple mechanisms. Gratton MO, Torban E, Jasmin SB, Theriault FM, German MS, Stifani S. Mol Cell Biol. 2003 Oct;23(19):6922–35.  <a href=""http://www.ncbi.nlm.nih.gov/pubmed/12972610"" target=""_blank"" class=""external"" rel=""nofollow"">PubMed</a> <a href=""https://europepmc.org/abstract/MED/12972610"" target=""_blank"" class=""external"" rel=""nofollow"">Europe PMC</a> <a href=""https://scholia.toolforge.org/pubmed/12972610"" target=""_blank"" class=""external"" rel=""nofollow"">Scholia</a>"
14500828	Pubmed	"RNAi-mediated depletion of the 15 KH domain protein, vigilin, induces death of dividing and non-dividing human cells but does not initially inhibit protein synthesis. Goolsby KM, Shapiro DJ. Nucleic Acids Res. 2003 Oct 1;31(19):5644–53.  <a href=""http://www.ncbi.nlm.nih.gov/pubmed/14500828"" target=""_blank"" class=""external"" rel=""nofollow"">PubMed</a> <a href=""https://europepmc.org/abstract/MED/14500828"" target=""_blank"" class=""external"" rel=""nofollow"">Europe PMC</a> <a href=""https://scholia.toolforge.org/pubmed/14500828"" target=""_blank"" class=""external"" rel=""nofollow"">Scholia</a>"
14522076	Pubmed	"GCF2: expression and molecular analysis of repression. Rikiyama T, Curtis J, Oikawa M, Zimonjic DB, Popescu N, Murphy BA, et al. Biochim Biophys Acta. 2003 Oct 1;1629(1–3):15–25.  <a href=""http://www.ncbi.nlm.nih.gov/pubmed/14522076"" target=""_blank"" class=""external"" rel=""nofollow"">PubMed</a> <a href=""https://europepmc.org/abstract/MED/14522076"" target=""_blank"" class=""external"" rel=""nofollow"">Europe PMC</a> <a href=""https://scholia.toolforge.org/pubmed/14522076"" target=""_blank"" class=""external"" rel=""nofollow"">Scholia</a>"
14722252	Pubmed	"Characterization of the human calcitonin gene-related peptide receptor subtypes associated with receptor activity-modifying proteins. Kuwasako K, Cao YN, Nagoshi Y, Tsuruda T, Kitamura K, Eto T. Mol Pharmacol. 2004 Jan;65(1):207–13.  <a href=""http://www.ncbi.nlm.nih.gov/pubmed/14722252"" target=""_blank"" class=""external"" rel=""nofollow"">PubMed</a> <a href=""https://europepmc.org/abstract/MED/14722252"" target=""_blank"" class=""external"" rel=""nofollow"">Europe PMC</a> <a href=""https://scholia.toolforge.org/pubmed/14722252"" target=""_blank"" class=""external"" rel=""nofollow"">Scholia</a>"
14990992	Pubmed	"ILKAP regulates ILK signaling and inhibits anchorage-independent growth. Kumar AS, Naruszewicz I, Wang P, Leung-Hagesteijn C, Hannigan GE. Oncogene. 2004 Apr 22;23(19):3454–61.  <a href=""http://www.ncbi.nlm.nih.gov/pubmed/14990992"" target=""_blank"" class=""external"" rel=""nofollow"">PubMed</a> <a href=""https://europepmc.org/abstract/MED/14990992"" target=""_blank"" class=""external"" rel=""nofollow"">Europe PMC</a> <a href=""https://scholia.toolforge.org/pubmed/14990992"" target=""_blank"" class=""external"" rel=""nofollow"">Scholia</a>"
15037601	Pubmed	"YSK1 is activated by the Golgi matrix protein GM130 and plays a role in cell migration through its substrate 14-3-3zeta. Preisinger C, Short B, De Corte V, Bruyneel E, Haas A, Kopajtich R, et al. J Cell Biol. 2004 Mar 29;164(7):1009–20.  <a href=""http://www.ncbi.nlm.nih.gov/pubmed/15037601"" target=""_blank"" class=""external"" rel=""nofollow"">PubMed</a> <a href=""https://europepmc.org/abstract/MED/15037601"" target=""_blank"" class=""external"" rel=""nofollow"">Europe PMC</a> <a href=""https://scholia.toolforge.org/pubmed/15037601"" target=""_blank"" class=""external"" rel=""nofollow"">Scholia</a>"
15037601	Pubmed	"YSK1 is activated by the Golgi matrix protein GM130 and plays a role in cell migration through its substrate 14-3-3zeta. Preisinger C, Short B, De Corte V, Bruyneel E, Haas A, Kopajtich R, et al. J Cell Biol. 2004 Mar 29;164(7):1009–20.  <a href=""http://www.ncbi.nlm.nih.gov/pubmed/15037601"" target=""_blank"" class=""external"" rel=""nofollow"">PubMed</a> <a href=""https://europepmc.org/abstract/MED/15037601"" target=""_blank"" class=""external"" rel=""nofollow"">Europe PMC</a> <a href=""https://scholia.toolforge.org/pubmed/15037601"" target=""_blank"" class=""external"" rel=""nofollow"">Scholia</a>"
15070399	Pubmed	"Identification of a dehydrogenase acting on D-2-hydroxyglutarate. Achouri Y, Noël G, Vertommen D, Rider MH, Veiga-Da-Cunha M, Van Schaftingen E. Biochem J. 2004 Jul 1;381(Pt 1):35–42.  <a href=""http://www.ncbi.nlm.nih.gov/pubmed/15070399"" target=""_blank"" class=""external"" rel=""nofollow"">PubMed</a> <a href=""https://europepmc.org/abstract/MED/15070399"" target=""_blank"" class=""external"" rel=""nofollow"">Europe PMC</a> <a href=""https://scholia.toolforge.org/pubmed/15070399"" target=""_blank"" class=""external"" rel=""nofollow"">Scholia</a>"
15084524	Pubmed	"Glypican-1 as an Abeta binding HSPG in the human brain: its localization in DIG domains and possible roles in the pathogenesis of Alzheimer’s disease. Watanabe N, Araki W, Chui DH, Makifuchi T, Ihara Y, Tabira T. FASEB J. 2004 Jun;18(9):1013–5.  <a href=""http://www.ncbi.nlm.nih.gov/pubmed/15084524"" target=""_blank"" class=""external"" rel=""nofollow"">PubMed</a> <a href=""https://europepmc.org/abstract/MED/15084524"" target=""_blank"" class=""external"" rel=""nofollow"">Europe PMC</a> <a href=""https://scholia.toolforge.org/pubmed/15084524"" target=""_blank"" class=""external"" rel=""nofollow"">Scholia</a>"
15102863	Pubmed	"BOK and NOXA are essential mediators of p53-dependent apoptosis. Yakovlev AG, Di Giovanni S, Wang G, Liu W, Stoica B, Faden AI. J Biol Chem. 2004 Jul 2;279(27):28367–74.  <a href=""http://www.ncbi.nlm.nih.gov/pubmed/15102863"" target=""_blank"" class=""external"" rel=""nofollow"">PubMed</a> <a href=""https://europepmc.org/abstract/MED/15102863"" target=""_blank"" class=""external"" rel=""nofollow"">Europe PMC</a> <a href=""https://scholia.toolforge.org/pubmed/15102863"" target=""_blank"" class=""external"" rel=""nofollow"">Scholia</a>"
15147902	Pubmed	"ADP-ribosylation factor (ARF)-like 7 (ARL7) is induced by cholesterol loading and participates in apolipoprotein AI-dependent cholesterol export. Engel T, Lueken A, Bode G, Hobohm U, Lorkowski S, Schlueter B, et al. FEBS Lett. 2004 May 21;566(1–3):241–6.  <a href=""http://www.ncbi.nlm.nih.gov/pubmed/15147902"" target=""_blank"" class=""external"" rel=""nofollow"">PubMed</a> <a href=""https://europepmc.org/abstract/MED/15147902"" target=""_blank"" class=""external"" rel=""nofollow"">Europe PMC</a> <a href=""https://scholia.toolforge.org/pubmed/15147902"" target=""_blank"" class=""external"" rel=""nofollow"">Scholia</a>"
15169837	Pubmed	"LC3, GABARAP and GATE16 localize to autophagosomal membrane depending on form-II formation. Kabeya Y, Mizushima N, Yamamoto A, Oshitani-Okamoto S, Ohsumi Y, Yoshimori T. J Cell Sci. 2004 Jun 1;117(Pt 13):2805–12.  <a href=""http://www.ncbi.nlm.nih.gov/pubmed/15169837"" target=""_blank"" class=""external"" rel=""nofollow"">PubMed</a> <a href=""https://europepmc.org/abstract/MED/15169837"" target=""_blank"" class=""external"" rel=""nofollow"">Europe PMC</a> <a href=""https://scholia.toolforge.org/pubmed/15169837"" target=""_blank"" class=""external"" rel=""nofollow"">Scholia</a>"
15187094	Pubmed	"HsAtg4B/HsApg4B/autophagin-1 cleaves the carboxyl termini of three human Atg8 homologues and delipidates microtubule-associated protein light chain 3- and GABAA receptor-associated protein-phospholipid conjugates. Tanida I, Sou Y shin, Ezaki J, Minematsu-Ikeguchi N, Ueno T, Kominami E. J Biol Chem. 2004 Aug 27;279(35):36268–76.  <a href=""http://www.ncbi.nlm.nih.gov/pubmed/15187094"" target=""_blank"" class=""external"" rel=""nofollow"">PubMed</a> <a href=""https://europepmc.org/abstract/MED/15187094"" target=""_blank"" class=""external"" rel=""nofollow"">Europe PMC</a> <a href=""https://scholia.toolforge.org/pubmed/15187094"" target=""_blank"" class=""external"" rel=""nofollow"">Scholia</a>"
15213228	Pubmed	"Neu4, a novel human lysosomal lumen sialidase, confers normal phenotype to sialidosis and galactosialidosis cells. Seyrantepe V, Landry K, Trudel S, Hassan JA, Morales CR, Pshezhetsky AV. J Biol Chem. 2004 Aug 27;279(35):37021–9.  <a href=""http://www.ncbi.nlm.nih.gov/pubmed/15213228"" target=""_blank"" class=""external"" rel=""nofollow"">PubMed</a> <a href=""https://europepmc.org/abstract/MED/15213228"" target=""_blank"" class=""external"" rel=""nofollow"">Europe PMC</a> <a href=""https://scholia.toolforge.org/pubmed/15213228"" target=""_blank"" class=""external"" rel=""nofollow"">Scholia</a>"
15306801	Pubmed	"The principle of temperature-dependent gating in cold- and heat-sensitive TRP channels. Voets T, Droogmans G, Wissenbach U, Janssens A, Flockerzi V, Nilius B. Nature. 2004 Aug 12;430(7001):748–54.  <a href=""http://www.ncbi.nlm.nih.gov/pubmed/15306801"" target=""_blank"" class=""external"" rel=""nofollow"">PubMed</a> <a href=""https://europepmc.org/abstract/MED/15306801"" target=""_blank"" class=""external"" rel=""nofollow"">Europe PMC</a> <a href=""https://scholia.toolforge.org/pubmed/15306801"" target=""_blank"" class=""external"" rel=""nofollow"">Scholia</a>"
15470161	Pubmed	"Identification of the UDP-glucuronosyltransferase isoforms involved in mycophenolic acid phase II metabolism. Picard N, Ratanasavanh D, Prémaud A, Le Meur Y, Marquet P. Drug Metab Dispos. 2005 Jan;33(1):139–46.  <a href=""http://www.ncbi.nlm.nih.gov/pubmed/15470161"" target=""_blank"" class=""external"" rel=""nofollow"">PubMed</a> <a href=""https://europepmc.org/abstract/MED/15470161"" target=""_blank"" class=""external"" rel=""nofollow"">Europe PMC</a> <a href=""https://scholia.toolforge.org/pubmed/15470161"" target=""_blank"" class=""external"" rel=""nofollow"">Scholia</a>"
15472229	Pubmed	"Specificity and regioselectivity of the conjugation of estradiol, estrone, and their catecholestrogen and methoxyestrogen metabolites by human uridine diphospho-glucuronosyltransferases expressed in endometrium. Lépine J, Bernard O, Plante M, Têtu B, Pelletier G, Labrie F, et al. J Clin Endocrinol Metab. 2004 Oct;89(10):5222–32.  <a href=""http://www.ncbi.nlm.nih.gov/pubmed/15472229"" target=""_blank"" class=""external"" rel=""nofollow"">PubMed</a> <a href=""https://europepmc.org/abstract/MED/15472229"" target=""_blank"" class=""external"" rel=""nofollow"">Europe PMC</a> <a href=""https://scholia.toolforge.org/pubmed/15472229"" target=""_blank"" class=""external"" rel=""nofollow"">Scholia</a>"
15609246	Pubmed	"Mutations in the D-2-hydroxyglutarate dehydrogenase gene cause D-2-hydroxyglutaric aciduria. Struys EA, Salomons GS, Achouri Y, Van Schaftingen E, Grosso S, Craigen WJ, et al. Am J Hum Genet. 2005 Feb;76(2):358–60.  <a href=""http://www.ncbi.nlm.nih.gov/pubmed/15609246"" target=""_blank"" class=""external"" rel=""nofollow"">PubMed</a> <a href=""https://europepmc.org/abstract/MED/15609246"" target=""_blank"" class=""external"" rel=""nofollow"">Europe PMC</a> <a href=""https://scholia.toolforge.org/pubmed/15609246"" target=""_blank"" class=""external"" rel=""nofollow"">Scholia</a>"
15688063	Pubmed	"Function and regulation of cullin-RING ubiquitin ligases. Petroski MD, Deshaies RJ. Nat Rev Mol Cell Biol. 2005 Jan;6(1):9–20.  <a href=""http://www.ncbi.nlm.nih.gov/pubmed/15688063"" target=""_blank"" class=""external"" rel=""nofollow"">PubMed</a> <a href=""https://europepmc.org/abstract/MED/15688063"" target=""_blank"" class=""external"" rel=""nofollow"">Europe PMC</a> <a href=""https://scholia.toolforge.org/pubmed/15688063"" target=""_blank"" class=""external"" rel=""nofollow"">Scholia</a>"
15767683	Pubmed	"Control of mammalian circadian rhythm by CKIepsilon-regulated proteasome-mediated PER2 degradation. Eide EJ, Woolf MF, Kang H, Woolf P, Hurst W, Camacho F, et al. Mol Cell Biol. 2005 Apr;25(7):2795–807.  <a href=""http://www.ncbi.nlm.nih.gov/pubmed/15767683"" target=""_blank"" class=""external"" rel=""nofollow"">PubMed</a> <a href=""https://europepmc.org/abstract/MED/15767683"" target=""_blank"" class=""external"" rel=""nofollow"">Europe PMC</a> <a href=""https://scholia.toolforge.org/pubmed/15767683"" target=""_blank"" class=""external"" rel=""nofollow"">Scholia</a>"
15774761	Pubmed	"A mitotic septin scaffold required for Mammalian chromosome congression and segregation. Spiliotis ET, Kinoshita M, Nelson WJ. Science. 2005 Mar 18;307(5716):1781–5.  <a href=""http://www.ncbi.nlm.nih.gov/pubmed/15774761"" target=""_blank"" class=""external"" rel=""nofollow"">PubMed</a> <a href=""https://europepmc.org/abstract/MED/15774761"" target=""_blank"" class=""external"" rel=""nofollow"">Europe PMC</a> <a href=""https://scholia.toolforge.org/pubmed/15774761"" target=""_blank"" class=""external"" rel=""nofollow"">Scholia</a>"
15809071	Pubmed	"Identification of a novel aquaporin, AQP12, expressed in pancreatic acinar cells. Itoh T, Rai T, Kuwahara M, Ko SBH, Uchida S, Sasaki S, et al. Biochem Biophys Res Commun. 2005 May 13;330(3):832–8.  <a href=""http://www.ncbi.nlm.nih.gov/pubmed/15809071"" target=""_blank"" class=""external"" rel=""nofollow"">PubMed</a> <a href=""https://europepmc.org/abstract/MED/15809071"" target=""_blank"" class=""external"" rel=""nofollow"">Europe PMC</a> <a href=""https://scholia.toolforge.org/pubmed/15809071"" target=""_blank"" class=""external"" rel=""nofollow"">Scholia</a>"
15847605	Pubmed	"Evidence for mitochondrial localization of a novel human sialidase (NEU4). Yamaguchi K, Hata K, Koseki K, Shiozaki K, Akita H, Wada T, et al. Biochem J. 2005 Aug 15;390(Pt 1):85–93.  <a href=""http://www.ncbi.nlm.nih.gov/pubmed/15847605"" target=""_blank"" class=""external"" rel=""nofollow"">PubMed</a> <a href=""https://europepmc.org/abstract/MED/15847605"" target=""_blank"" class=""external"" rel=""nofollow"">Europe PMC</a> <a href=""https://scholia.toolforge.org/pubmed/15847605"" target=""_blank"" class=""external"" rel=""nofollow"">Scholia</a>"
16037974	Pubmed	"Mutations in phenotypically mild D-2-hydroxyglutaric aciduria. Struys EA, Korman SH, Salomons GS, Darmin PS, Achouri Y, van Schaftingen E, et al. Ann Neurol. 2005 Oct;58(4):626–30.  <a href=""http://www.ncbi.nlm.nih.gov/pubmed/16037974"" target=""_blank"" class=""external"" rel=""nofollow"">PubMed</a> <a href=""https://europepmc.org/abstract/MED/16037974"" target=""_blank"" class=""external"" rel=""nofollow"">Europe PMC</a> <a href=""https://scholia.toolforge.org/pubmed/16037974"" target=""_blank"" class=""external"" rel=""nofollow"">Scholia</a>"
16081310	Pubmed	"Phenotypic heterogeneity in the presentation of D-2-hydroxyglutaric aciduria in monozygotic twins. Misra VK, Struys EA, O’brien W, Salomons GS, Glover T, Jakobs C, et al. Mol Genet Metab. 2005;86(1–2):200–5.  <a href=""http://www.ncbi.nlm.nih.gov/pubmed/16081310"" target=""_blank"" class=""external"" rel=""nofollow"">PubMed</a> <a href=""https://europepmc.org/abstract/MED/16081310"" target=""_blank"" class=""external"" rel=""nofollow"">Europe PMC</a> <a href=""https://scholia.toolforge.org/pubmed/16081310"" target=""_blank"" class=""external"" rel=""nofollow"">Scholia</a>"
16107333	Pubmed	"The chemokine SDF-1/CXCL12 binds to and signals through the orphan receptor RDC1 in T lymphocytes. Balabanian K, Lagane B, Infantino S, Chow KYC, Harriague J, Moepps B, et al. J Biol Chem. 2005 Oct 21;280(42):35760–6.  <a href=""http://www.ncbi.nlm.nih.gov/pubmed/16107333"" target=""_blank"" class=""external"" rel=""nofollow"">PubMed</a> <a href=""https://europepmc.org/abstract/MED/16107333"" target=""_blank"" class=""external"" rel=""nofollow"">Europe PMC</a> <a href=""https://scholia.toolforge.org/pubmed/16107333"" target=""_blank"" class=""external"" rel=""nofollow"">Scholia</a>"
16174775	Pubmed	"Novel role of cold/menthol-sensitive transient receptor potential melastatine family member 8 (TRPM8) in the activation of store-operated channels in LNCaP human prostate cancer epithelial cells. Thebault S, Lemonnier L, Bidaux G, Flourakis M, Bavencoffe A, Gordienko D, et al. J Biol Chem. 2005 Nov 25;280(47):39423–35.  <a href=""http://www.ncbi.nlm.nih.gov/pubmed/16174775"" target=""_blank"" class=""external"" rel=""nofollow"">PubMed</a> <a href=""https://europepmc.org/abstract/MED/16174775"" target=""_blank"" class=""external"" rel=""nofollow"">Europe PMC</a> <a href=""https://scholia.toolforge.org/pubmed/16174775"" target=""_blank"" class=""external"" rel=""nofollow"">Scholia</a>"
16183633	Pubmed	"Structural basis for the specificity and catalysis of human Atg4B responsible for mammalian autophagy. Sugawara K, Suzuki NN, Fujioka Y, Mizushima N, Ohsumi Y, Inagaki F. J Biol Chem. 2005 Dec 2;280(48):40058–65.  <a href=""http://www.ncbi.nlm.nih.gov/pubmed/16183633"" target=""_blank"" class=""external"" rel=""nofollow"">PubMed</a> <a href=""https://europepmc.org/abstract/MED/16183633"" target=""_blank"" class=""external"" rel=""nofollow"">Europe PMC</a> <a href=""https://scholia.toolforge.org/pubmed/16183633"" target=""_blank"" class=""external"" rel=""nofollow"">Scholia</a>"
16199883	Pubmed	"GCF2/LRRFIP1 represses tumor necrosis factor alpha expression. Suriano AR, Sanford AN, Kim N, Oh M, Kennedy S, Henderson MJ, et al. Mol Cell Biol. 2005 Oct;25(20):9073–81.  <a href=""http://www.ncbi.nlm.nih.gov/pubmed/16199883"" target=""_blank"" class=""external"" rel=""nofollow"">PubMed</a> <a href=""https://europepmc.org/abstract/MED/16199883"" target=""_blank"" class=""external"" rel=""nofollow"">Europe PMC</a> <a href=""https://scholia.toolforge.org/pubmed/16199883"" target=""_blank"" class=""external"" rel=""nofollow"">Scholia</a>"
16258079	Pubmed	"Glucuronidation of the aspirin metabolite salicylic acid by expressed UDP-glucuronosyltransferases and human liver microsomes. Kuehl GE, Bigler J, Potter JD, Lampe JW. Drug Metab Dispos. 2006 Feb;34(2):199–202.  <a href=""http://www.ncbi.nlm.nih.gov/pubmed/16258079"" target=""_blank"" class=""external"" rel=""nofollow"">PubMed</a> <a href=""https://europepmc.org/abstract/MED/16258079"" target=""_blank"" class=""external"" rel=""nofollow"">Europe PMC</a> <a href=""https://scholia.toolforge.org/pubmed/16258079"" target=""_blank"" class=""external"" rel=""nofollow"">Scholia</a>"
16275910	Pubmed	"Control of mammalian glycogen synthase by PAS kinase. Wilson WA, Skurat AV, Probst B, de Paoli-Roach A, Roach PJ, Rutter J. Proc Natl Acad Sci U S A. 2005 Nov 15;102(46):16596–601.  <a href=""http://www.ncbi.nlm.nih.gov/pubmed/16275910"" target=""_blank"" class=""external"" rel=""nofollow"">PubMed</a> <a href=""https://europepmc.org/abstract/MED/16275910"" target=""_blank"" class=""external"" rel=""nofollow"">Europe PMC</a> <a href=""https://scholia.toolforge.org/pubmed/16275910"" target=""_blank"" class=""external"" rel=""nofollow"">Scholia</a>"
16286926	Pubmed	"FARP2 triggers signals for Sema3A-mediated axonal repulsion. Toyofuku T, Yoshida J, Sugimoto T, Zhang H, Kumanogoh A, Hori M, et al. Nat Neurosci. 2005 Dec;8(12):1712–9.  <a href=""http://www.ncbi.nlm.nih.gov/pubmed/16286926"" target=""_blank"" class=""external"" rel=""nofollow"">PubMed</a> <a href=""https://europepmc.org/abstract/MED/16286926"" target=""_blank"" class=""external"" rel=""nofollow"">Europe PMC</a> <a href=""https://scholia.toolforge.org/pubmed/16286926"" target=""_blank"" class=""external"" rel=""nofollow"">Scholia</a>"
16325183	Pubmed	"ASB proteins interact with Cullin5 and Rbx2 to form E3 ubiquitin ligase complexes. Kohroki J, Nishiyama T, Nakamura T, Masuho Y. FEBS Lett. 2005 Dec 19;579(30):6796–802.  <a href=""http://www.ncbi.nlm.nih.gov/pubmed/16325183"" target=""_blank"" class=""external"" rel=""nofollow"">PubMed</a> <a href=""https://europepmc.org/abstract/MED/16325183"" target=""_blank"" class=""external"" rel=""nofollow"">Europe PMC</a> <a href=""https://scholia.toolforge.org/pubmed/16325183"" target=""_blank"" class=""external"" rel=""nofollow"">Scholia</a>"
16325581	Pubmed	"TTP specifically regulates the internalization of the transferrin receptor. Tosoni D, Puri C, Confalonieri S, Salcini AE, De Camilli P, Tacchetti C, et al. Cell. 2005 Dec 2;123(5):875–88.  <a href=""http://www.ncbi.nlm.nih.gov/pubmed/16325581"" target=""_blank"" class=""external"" rel=""nofollow"">PubMed</a> <a href=""https://europepmc.org/abstract/MED/16325581"" target=""_blank"" class=""external"" rel=""nofollow"">Europe PMC</a> <a href=""https://scholia.toolforge.org/pubmed/16325581"" target=""_blank"" class=""external"" rel=""nofollow"">Scholia</a>"
16325851	Pubmed	"The crystal structure of human Atg4b, a processing and de-conjugating enzyme for autophagosome-forming modifiers. Kumanomidou T, Mizushima T, Komatsu M, Suzuki A, Tanida I, Sou YS, et al. J Mol Biol. 2006 Jan 27;355(4):612–8.  <a href=""http://www.ncbi.nlm.nih.gov/pubmed/16325851"" target=""_blank"" class=""external"" rel=""nofollow"">PubMed</a> <a href=""https://europepmc.org/abstract/MED/16325851"" target=""_blank"" class=""external"" rel=""nofollow"">Europe PMC</a> <a href=""https://scholia.toolforge.org/pubmed/16325851"" target=""_blank"" class=""external"" rel=""nofollow"">Scholia</a>"
16387653	Pubmed	"ING tumor suppressor proteins are critical regulators of chromatin acetylation required for genome expression and perpetuation. Doyon Y, Cayrou C, Ullah M, Landry AJ, Côté V, Selleck W, et al. Mol Cell. 2006 Jan 6;21(1):51–64.  <a href=""http://www.ncbi.nlm.nih.gov/pubmed/16387653"" target=""_blank"" class=""external"" rel=""nofollow"">PubMed</a> <a href=""https://europepmc.org/abstract/MED/16387653"" target=""_blank"" class=""external"" rel=""nofollow"">Europe PMC</a> <a href=""https://scholia.toolforge.org/pubmed/16387653"" target=""_blank"" class=""external"" rel=""nofollow"">Scholia</a>"
16595710	Pubmed	"Human UDP-glucuronosyltransferase, UGT1A8, glucuronidates dihydrotestosterone to a monoglucuronide and further to a structurally novel diglucuronide. Murai T, Samata N, Iwabuchi H, Ikeda T. Drug Metab Dispos. 2006 Jul;34(7):1102–8.  <a href=""http://www.ncbi.nlm.nih.gov/pubmed/16595710"" target=""_blank"" class=""external"" rel=""nofollow"">PubMed</a> <a href=""https://europepmc.org/abstract/MED/16595710"" target=""_blank"" class=""external"" rel=""nofollow"">Europe PMC</a> <a href=""https://scholia.toolforge.org/pubmed/16595710"" target=""_blank"" class=""external"" rel=""nofollow"">Scholia</a>"
16723715	Pubmed	"Glypican-1 is frequently overexpressed in human gliomas and enhances FGF-2 signaling in glioma cells. Su G, Meyer K, Nandini CD, Qiao D, Salamat S, Friedl A. Am J Pathol. 2006 Jun;168(6):2014–26.  <a href=""http://www.ncbi.nlm.nih.gov/pubmed/16723715"" target=""_blank"" class=""external"" rel=""nofollow"">PubMed</a> <a href=""https://europepmc.org/abstract/MED/16723715"" target=""_blank"" class=""external"" rel=""nofollow"">Europe PMC</a> <a href=""https://scholia.toolforge.org/pubmed/16723715"" target=""_blank"" class=""external"" rel=""nofollow"">Scholia</a>"
16754668	Pubmed	"Kynurenic acid as a ligand for orphan G protein-coupled receptor GPR35. Wang J, Simonavicius N, Wu X, Swaminath G, Reagan J, Tian H, et al. J Biol Chem. 2006 Aug 4;281(31):22021–8.  <a href=""http://www.ncbi.nlm.nih.gov/pubmed/16754668"" target=""_blank"" class=""external"" rel=""nofollow"">PubMed</a> <a href=""https://europepmc.org/abstract/MED/16754668"" target=""_blank"" class=""external"" rel=""nofollow"">Europe PMC</a> <a href=""https://scholia.toolforge.org/pubmed/16754668"" target=""_blank"" class=""external"" rel=""nofollow"">Scholia</a>"
16790502	Pubmed	"Calpain 10: a mitochondrial calpain and its role in calcium-induced mitochondrial dysfunction. Arrington DD, Van Vleet TR, Schnellmann RG. Am J Physiol Cell Physiol. 2006 Dec;291(6):C1159-71.  <a href=""http://www.ncbi.nlm.nih.gov/pubmed/16790502"" target=""_blank"" class=""external"" rel=""nofollow"">PubMed</a> <a href=""https://europepmc.org/abstract/MED/16790502"" target=""_blank"" class=""external"" rel=""nofollow"">Europe PMC</a> <a href=""https://scholia.toolforge.org/pubmed/16790502"" target=""_blank"" class=""external"" rel=""nofollow"">Scholia</a>"
16940167	Pubmed	"A novel chemokine receptor for SDF-1 and I-TAC involved in cell survival, cell adhesion, and tumor development. Burns JM, Summers BC, Wang Y, Melikian A, Berahovich R, Miao Z, et al. J Exp Med. 2006 Sep 4;203(9):2201–13.  <a href=""http://www.ncbi.nlm.nih.gov/pubmed/16940167"" target=""_blank"" class=""external"" rel=""nofollow"">PubMed</a> <a href=""https://europepmc.org/abstract/MED/16940167"" target=""_blank"" class=""external"" rel=""nofollow"">Europe PMC</a> <a href=""https://scholia.toolforge.org/pubmed/16940167"" target=""_blank"" class=""external"" rel=""nofollow"">Scholia</a>"
16954532	Pubmed	"A novel family of membrane-bound E3 ubiquitin ligases. Ohmura-Hoshino M, Goto E, Matsuki Y, Aoki M, Mito M, Uematsu M, et al. J Biochem. 2006 Aug;140(2):147–54.  <a href=""http://www.ncbi.nlm.nih.gov/pubmed/16954532"" target=""_blank"" class=""external"" rel=""nofollow"">PubMed</a> <a href=""https://europepmc.org/abstract/MED/16954532"" target=""_blank"" class=""external"" rel=""nofollow"">Europe PMC</a> <a href=""https://scholia.toolforge.org/pubmed/16954532"" target=""_blank"" class=""external"" rel=""nofollow"">Scholia</a>"
