ID	Database	Citation
11882900	Pubmed	"Reif K, Ekland EH, Ohl L, Nakano H, Lipp M, Förster R, et al. Balanced responsiveness to chemoattractants from adjacent zones determines B-cell position. Nature. 2002 Mar 7;416(6876):94–9.  <a href=""http://www.ncbi.nlm.nih.gov/pubmed/11882900"" target=""_blank"" class=""external"" rel=""nofollow"">PubMed</a> <a href=""https://europepmc.org/abstract/MED/11882900"" target=""_blank"" class=""external"" rel=""nofollow"">Europe PMC</a> <a href=""https://scholia.toolforge.org/pubmed/11882900"" target=""_blank"" class=""external"" rel=""nofollow"">Scholia</a>"
12052884	Pubmed	"Lin K-I, Angelin-Duclos C, Kuo TC, Calame K. Blimp-1-dependent repression of Pax-5 is required for differentiation of B cells to immunoglobulin M-secreting plasma cells. Mol Cell Biol. 2002 Jul;22(13):4771–80.  <a href=""http://www.ncbi.nlm.nih.gov/pubmed/12052884"" target=""_blank"" class=""external"" rel=""nofollow"">PubMed</a> <a href=""https://europepmc.org/abstract/MED/12052884"" target=""_blank"" class=""external"" rel=""nofollow"">Europe PMC</a> <a href=""https://scholia.toolforge.org/pubmed/12052884"" target=""_blank"" class=""external"" rel=""nofollow"">Scholia</a>"
12846803	Pubmed	"MacLennan ICM, Toellner K-M, Cunningham AF, Serre K, Sze DM-Y, Zúñiga E, et al. Extrafollicular antibody responses. Immunol Rev. 2003 Aug;194:8–18.  <a href=""http://www.ncbi.nlm.nih.gov/pubmed/12846803"" target=""_blank"" class=""external"" rel=""nofollow"">PubMed</a> <a href=""https://europepmc.org/abstract/MED/12846803"" target=""_blank"" class=""external"" rel=""nofollow"">Europe PMC</a> <a href=""https://scholia.toolforge.org/pubmed/12846803"" target=""_blank"" class=""external"" rel=""nofollow"">Scholia</a>"
15599405	Pubmed	"Silk JD, Hermans IF, Gileadi U, Chong TW, Shepherd D, Salio M, et al. Utilizing the adjuvant properties of CD1d-dependent NK T cells in T cell-mediated immunotherapy. J Clin Invest. 2004 Dec;114(12):1800–11.  <a href=""http://www.ncbi.nlm.nih.gov/pubmed/15599405"" target=""_blank"" class=""external"" rel=""nofollow"">PubMed</a> <a href=""https://europepmc.org/abstract/MED/15599405"" target=""_blank"" class=""external"" rel=""nofollow"">Europe PMC</a> <a href=""https://scholia.toolforge.org/pubmed/15599405"" target=""_blank"" class=""external"" rel=""nofollow"">Scholia</a>"
20084069	Pubmed	"Crotty S, Johnston RJ, Schoenberger SP. Effectors and memories: Bcl-6 and Blimp-1 in T and B lymphocyte differentiation. Nat Immunol. 2010 Feb;11(2):114–20.  <a href=""http://www.ncbi.nlm.nih.gov/pubmed/20084069"" target=""_blank"" class=""external"" rel=""nofollow"">PubMed</a> <a href=""https://europepmc.org/abstract/MED/20084069"" target=""_blank"" class=""external"" rel=""nofollow"">Europe PMC</a> <a href=""https://scholia.toolforge.org/pubmed/20084069"" target=""_blank"" class=""external"" rel=""nofollow"">Scholia</a>"
20228797	Pubmed	"Barral P, Polzella P, Bruckbauer A, van Rooijen N, Besra GS, Cerundolo V, et al. CD169(+) macrophages present lipid antigens to mediate early activation of iNKT cells in lymph nodes. Nat Immunol. 2010 Apr;11(4):303–12.  <a href=""http://www.ncbi.nlm.nih.gov/pubmed/20228797"" target=""_blank"" class=""external"" rel=""nofollow"">PubMed</a> <a href=""https://europepmc.org/abstract/MED/20228797"" target=""_blank"" class=""external"" rel=""nofollow"">Europe PMC</a> <a href=""https://scholia.toolforge.org/pubmed/20228797"" target=""_blank"" class=""external"" rel=""nofollow"">Scholia</a>"
21636296	Pubmed	"Choi YS, Kageyama R, Eto D, Escobar TC, Johnston RJ, Monticelli L, et al. ICOS receptor instructs T follicular helper cell versus effector cell differentiation via induction of the transcriptional repressor Bcl6. Immunity. 2011 Jun 24;34(6):932–46.  <a href=""http://www.ncbi.nlm.nih.gov/pubmed/21636296"" target=""_blank"" class=""external"" rel=""nofollow"">PubMed</a> <a href=""https://europepmc.org/abstract/MED/21636296"" target=""_blank"" class=""external"" rel=""nofollow"">Europe PMC</a> <a href=""https://scholia.toolforge.org/pubmed/21636296"" target=""_blank"" class=""external"" rel=""nofollow"">Scholia</a>"
21844396	Pubmed	"Kelly LM, Pereira JP, Yi T, Xu Y, Cyster JG. EBI2 guides serial movements of activated B cells and ligand activity is detectable in lymphoid and nonlymphoid tissues. J Immunol. 2011 Sep 15;187(6):3026–32.  <a href=""http://www.ncbi.nlm.nih.gov/pubmed/21844396"" target=""_blank"" class=""external"" rel=""nofollow"">PubMed</a> <a href=""https://europepmc.org/abstract/MED/21844396"" target=""_blank"" class=""external"" rel=""nofollow"">Europe PMC</a> <a href=""https://scholia.toolforge.org/pubmed/21844396"" target=""_blank"" class=""external"" rel=""nofollow"">Scholia</a>"
21948984	Pubmed	"Gatto D, Wood K, Brink R. EBI2 operates independently of but in cooperation with CXCR5 and CCR7 to direct B cell migration and organization in follicles and the germinal center. J Immunol. 2011 Nov 1;187(9):4621–8.  <a href=""http://www.ncbi.nlm.nih.gov/pubmed/21948984"" target=""_blank"" class=""external"" rel=""nofollow"">PubMed</a> <a href=""https://europepmc.org/abstract/MED/21948984"" target=""_blank"" class=""external"" rel=""nofollow"">Europe PMC</a> <a href=""https://scholia.toolforge.org/pubmed/21948984"" target=""_blank"" class=""external"" rel=""nofollow"">Scholia</a>"
22318729	Pubmed	"Nurieva RI, Podd A, Chen Y, Alekseev AM, Yu M, Qi X, et al. STAT5 protein negatively regulates T follicular helper (Tfh) cell generation and function. J Biol Chem. 2012 Mar 30;287(14):11234–9.  <a href=""http://www.ncbi.nlm.nih.gov/pubmed/22318729"" target=""_blank"" class=""external"" rel=""nofollow"">PubMed</a> <a href=""https://europepmc.org/abstract/MED/22318729"" target=""_blank"" class=""external"" rel=""nofollow"">Europe PMC</a> <a href=""https://scholia.toolforge.org/pubmed/22318729"" target=""_blank"" class=""external"" rel=""nofollow"">Scholia</a>"
22425248	Pubmed	"Rao RR, Li Q, Gubbels Bupp MR, Shrikant PA. Transcription factor Foxo1 represses T-bet-mediated effector functions and promotes memory CD8(+) T cell differentiation. Immunity. 2012 Mar 23;36(3):374–87.  <a href=""http://www.ncbi.nlm.nih.gov/pubmed/22425248"" target=""_blank"" class=""external"" rel=""nofollow"">PubMed</a> <a href=""https://europepmc.org/abstract/MED/22425248"" target=""_blank"" class=""external"" rel=""nofollow"">Europe PMC</a> <a href=""https://scholia.toolforge.org/pubmed/22425248"" target=""_blank"" class=""external"" rel=""nofollow"">Scholia</a>"
22865046	Pubmed	"Cerutti A, Puga I, Cols M. New helping friends for B cells. Eur J Immunol. 2012 Aug;42(8):1956–68.  <a href=""http://www.ncbi.nlm.nih.gov/pubmed/22865046"" target=""_blank"" class=""external"" rel=""nofollow"">PubMed</a> <a href=""https://europepmc.org/abstract/MED/22865046"" target=""_blank"" class=""external"" rel=""nofollow"">Europe PMC</a> <a href=""https://scholia.toolforge.org/pubmed/22865046"" target=""_blank"" class=""external"" rel=""nofollow"">Scholia</a>"
22868664	Pubmed	"Cerutti A, Cols M, Puga I. Activation of B cells by non-canonical helper signals. EMBO Rep. 2012 Sep;13(9):798–810.  <a href=""http://www.ncbi.nlm.nih.gov/pubmed/22868664"" target=""_blank"" class=""external"" rel=""nofollow"">PubMed</a> <a href=""https://europepmc.org/abstract/MED/22868664"" target=""_blank"" class=""external"" rel=""nofollow"">Europe PMC</a> <a href=""https://scholia.toolforge.org/pubmed/22868664"" target=""_blank"" class=""external"" rel=""nofollow"">Scholia</a>"
23770227	Pubmed	"Heesters BA, Chatterjee P, Kim Y-A, Gonzalez SF, Kuligowski MP, Kirchhausen T, et al. Endocytosis and recycling of immune complexes by follicular dendritic cells enhances B cell antigen binding and activation. Immunity. 2013 Jun 27;38(6):1164–75.  <a href=""http://www.ncbi.nlm.nih.gov/pubmed/23770227"" target=""_blank"" class=""external"" rel=""nofollow"">PubMed</a> <a href=""https://europepmc.org/abstract/MED/23770227"" target=""_blank"" class=""external"" rel=""nofollow"">Europe PMC</a> <a href=""https://scholia.toolforge.org/pubmed/23770227"" target=""_blank"" class=""external"" rel=""nofollow"">Scholia</a>"
25317561	Pubmed	"Liu D, Xu H, Shih C, Wan Z, Ma X, Ma W, et al. T-B-cell entanglement and ICOSL-driven feed-forward regulation of germinal centre reaction. Nature. 2015 Jan 8;517(7533):214–8.  <a href=""http://www.ncbi.nlm.nih.gov/pubmed/25317561"" target=""_blank"" class=""external"" rel=""nofollow"">PubMed</a> <a href=""https://europepmc.org/abstract/MED/25317561"" target=""_blank"" class=""external"" rel=""nofollow"">Europe PMC</a> <a href=""https://scholia.toolforge.org/pubmed/25317561"" target=""_blank"" class=""external"" rel=""nofollow"">Scholia</a>"
26437243	Pubmed	"Xu H, Chaudhri VK, Wu Z, Biliouris K, Dienger-Stambaugh K, Rochman Y, et al. Regulation of bifurcating B cell trajectories by mutual antagonism between transcription factors IRF4 and IRF8. Nat Immunol. 2015 Dec;16(12):1274–81.  <a href=""http://www.ncbi.nlm.nih.gov/pubmed/26437243"" target=""_blank"" class=""external"" rel=""nofollow"">PubMed</a> <a href=""https://europepmc.org/abstract/MED/26437243"" target=""_blank"" class=""external"" rel=""nofollow"">Europe PMC</a> <a href=""https://scholia.toolforge.org/pubmed/26437243"" target=""_blank"" class=""external"" rel=""nofollow"">Scholia</a>"
30314758	Pubmed	"Jenks SA, Cashman KS, Zumaquero E, Marigorta UM, Patel AV, Wang X, et al. Distinct Effector B Cells Induced by Unregulated Toll-like Receptor 7 Contribute to Pathogenic Responses in Systemic Lupus Erythematosus. Immunity. 2018 Oct 16;49(4):725-739.e6.  <a href=""http://www.ncbi.nlm.nih.gov/pubmed/30314758"" target=""_blank"" class=""external"" rel=""nofollow"">PubMed</a> <a href=""https://europepmc.org/abstract/MED/30314758"" target=""_blank"" class=""external"" rel=""nofollow"">Europe PMC</a> <a href=""https://scholia.toolforge.org/pubmed/30314758"" target=""_blank"" class=""external"" rel=""nofollow"">Scholia</a>"
30874345	Pubmed	"Jenks SA, Cashman KS, Woodruff MC, Lee FE-H, Sanz I. Extrafollicular responses in humans and SLE. Immunol Rev. 2019 Mar;288(1):136–48.  <a href=""http://www.ncbi.nlm.nih.gov/pubmed/30874345"" target=""_blank"" class=""external"" rel=""nofollow"">PubMed</a> <a href=""https://europepmc.org/abstract/MED/30874345"" target=""_blank"" class=""external"" rel=""nofollow"">Europe PMC</a> <a href=""https://scholia.toolforge.org/pubmed/30874345"" target=""_blank"" class=""external"" rel=""nofollow"">Scholia</a>"
32555388	Pubmed	"Robbiani DF, Gaebler C, Muecksch F, Lorenzi JCC, Wang Z, Cho A, et al. Convergent antibody responses to SARS-CoV-2 in convalescent individuals. Nature. 2020 Aug;584(7821):437–42.  <a href=""http://www.ncbi.nlm.nih.gov/pubmed/32555388"" target=""_blank"" class=""external"" rel=""nofollow"">PubMed</a> <a href=""https://europepmc.org/abstract/MED/32555388"" target=""_blank"" class=""external"" rel=""nofollow"">Europe PMC</a> <a href=""https://scholia.toolforge.org/pubmed/32555388"" target=""_blank"" class=""external"" rel=""nofollow"">Scholia</a>"
33028979	Pubmed	"Woodruff MC, Ramonell RP, Nguyen DC, Cashman KS, Saini AS, Haddad NS, et al. Extrafollicular B cell responses correlate with neutralizing antibodies and morbidity in COVID-19. Nat Immunol. 2020 Dec;21(12):1506–16.  <a href=""http://www.ncbi.nlm.nih.gov/pubmed/33028979"" target=""_blank"" class=""external"" rel=""nofollow"">PubMed</a> <a href=""https://europepmc.org/abstract/MED/33028979"" target=""_blank"" class=""external"" rel=""nofollow"">Europe PMC</a> <a href=""https://scholia.toolforge.org/pubmed/33028979"" target=""_blank"" class=""external"" rel=""nofollow"">Scholia</a>"
33326765	Pubmed	"Elsner RA, Shlomchik MJ. Germinal Center and Extrafollicular B Cell Responses in Vaccination, Immunity, and Autoimmunity. Immunity. 2020 Dec 15;53(6):1136–50.  <a href=""http://www.ncbi.nlm.nih.gov/pubmed/33326765"" target=""_blank"" class=""external"" rel=""nofollow"">PubMed</a> <a href=""https://europepmc.org/abstract/MED/33326765"" target=""_blank"" class=""external"" rel=""nofollow"">Europe PMC</a> <a href=""https://scholia.toolforge.org/pubmed/33326765"" target=""_blank"" class=""external"" rel=""nofollow"">Scholia</a>"
33969476	Pubmed	"Li Y, Li Z, Hu F. Double-negative (DN) B cells: an under-recognized effector memory B cell subset in autoimmunity. Clin Exp Immunol. 2021 Aug;205(2):119–27.  <a href=""http://www.ncbi.nlm.nih.gov/pubmed/33969476"" target=""_blank"" class=""external"" rel=""nofollow"">PubMed</a> <a href=""https://europepmc.org/abstract/MED/33969476"" target=""_blank"" class=""external"" rel=""nofollow"">Europe PMC</a> <a href=""https://scholia.toolforge.org/pubmed/33969476"" target=""_blank"" class=""external"" rel=""nofollow"">Scholia</a>"
34001847	Pubmed	"He B, Liu S, Wang Y, Xu M, Cai W, Liu J, et al. Rapid isolation and immune profiling of SARS-CoV-2 specific memory B cell in convalescent COVID-19 patients via LIBRA-seq. Signal Transduct Target Ther. 2021 May 17;6(1):195.  <a href=""http://www.ncbi.nlm.nih.gov/pubmed/34001847"" target=""_blank"" class=""external"" rel=""nofollow"">PubMed</a> <a href=""https://europepmc.org/abstract/MED/34001847"" target=""_blank"" class=""external"" rel=""nofollow"">Europe PMC</a> <a href=""https://scholia.toolforge.org/pubmed/34001847"" target=""_blank"" class=""external"" rel=""nofollow"">Scholia</a>"
34723157	Pubmed	"Schultheiß C, Paschold L, Willscher E, Simnica D, Wöstemeier A, Muscate F, et al. Maturation trajectories and transcriptional landscape of plasmablasts and autoreactive B cells in COVID-19. iScience. 2021 Nov 19;24(11):103325.  <a href=""http://www.ncbi.nlm.nih.gov/pubmed/34723157"" target=""_blank"" class=""external"" rel=""nofollow"">PubMed</a> <a href=""https://europepmc.org/abstract/MED/34723157"" target=""_blank"" class=""external"" rel=""nofollow"">Europe PMC</a> <a href=""https://scholia.toolforge.org/pubmed/34723157"" target=""_blank"" class=""external"" rel=""nofollow"">Scholia</a>"
36110861	Pubmed	"Chen S, Guan F, Candotti F, Benlagha K, Camara NOS, Herrada AA, et al. The role of B cells in COVID-19 infection and vaccination. Front Immunol. 2022 Aug 30;13:988536.  <a href=""http://www.ncbi.nlm.nih.gov/pubmed/36110861"" target=""_blank"" class=""external"" rel=""nofollow"">PubMed</a> <a href=""https://europepmc.org/abstract/MED/36110861"" target=""_blank"" class=""external"" rel=""nofollow"">Europe PMC</a> <a href=""https://scholia.toolforge.org/pubmed/36110861"" target=""_blank"" class=""external"" rel=""nofollow"">Scholia</a>"
