ID	Database	Citation
1352257	Pubmed	"Giuili G, Scholl U, Bulle F, Guellaën G. Molecular cloning of the cDNAs coding for the two subunits of soluble guanylyl cyclase from human brain. FEBS Lett. 1992 Jun 8;304(1):83–8.  <a href=""http://www.ncbi.nlm.nih.gov/pubmed/1352257"" target=""_blank"" class=""external"" rel=""nofollow"">PubMed</a> <a href=""https://europepmc.org/abstract/MED/1352257"" target=""_blank"" class=""external"" rel=""nofollow"">Europe PMC</a> <a href=""https://scholia.toolforge.org/pubmed/1352257"" target=""_blank"" class=""external"" rel=""nofollow"">Scholia</a>"
1378832	Pubmed	"Janssens SP, Shimouchi A, Quertermous T, Bloch DB, Bloch KD. Cloning and expression of a cDNA encoding human endothelium-derived relaxing factor/nitric oxide synthase. J Biol Chem. 1992 Jul 25;267(21):14519–22.  <a href=""http://www.ncbi.nlm.nih.gov/pubmed/1378832"" target=""_blank"" class=""external"" rel=""nofollow"">PubMed</a> <a href=""https://europepmc.org/abstract/MED/1378832"" target=""_blank"" class=""external"" rel=""nofollow"">Europe PMC</a> <a href=""https://scholia.toolforge.org/pubmed/1378832"" target=""_blank"" class=""external"" rel=""nofollow"">Scholia</a>"
1653962	Pubmed	"Scott JD. Cyclic nucleotide-dependent protein kinases. Pharmacol Ther. 1991;50(1):123–45.  <a href=""http://www.ncbi.nlm.nih.gov/pubmed/1653962"" target=""_blank"" class=""external"" rel=""nofollow"">PubMed</a> <a href=""https://europepmc.org/abstract/MED/1653962"" target=""_blank"" class=""external"" rel=""nofollow"">Europe PMC</a> <a href=""https://scholia.toolforge.org/pubmed/1653962"" target=""_blank"" class=""external"" rel=""nofollow"">Scholia</a>"
1662386	Pubmed	"Zembowicz A, Hecker M, Macarthur H, Sessa WC, Vane JR. Nitric oxide and another potent vasodilator are formed from NG-hydroxy-L-arginine by cultured endothelial cells. Proc Natl Acad Sci U S A. 1991 Dec 15;88(24):11172–6.  <a href=""http://www.ncbi.nlm.nih.gov/pubmed/1662386"" target=""_blank"" class=""external"" rel=""nofollow"">PubMed</a> <a href=""https://europepmc.org/abstract/MED/1662386"" target=""_blank"" class=""external"" rel=""nofollow"">Europe PMC</a> <a href=""https://scholia.toolforge.org/pubmed/1662386"" target=""_blank"" class=""external"" rel=""nofollow"">Scholia</a>"
1722402	Pubmed	"Schmidt HH, Murad F. Purification and characterization of a human NO synthase. Biochem Biophys Res Commun. 1991 Dec 31;181(3):1372–7.  <a href=""http://www.ncbi.nlm.nih.gov/pubmed/1722402"" target=""_blank"" class=""external"" rel=""nofollow"">PubMed</a> <a href=""https://europepmc.org/abstract/MED/1722402"" target=""_blank"" class=""external"" rel=""nofollow"">Europe PMC</a> <a href=""https://scholia.toolforge.org/pubmed/1722402"" target=""_blank"" class=""external"" rel=""nofollow"">Scholia</a>"
2160582	Pubmed	"Livi GP, Kmetz P, McHale MM, Cieslinski LB, Sathe GM, Taylor DP, et al. Cloning and expression of cDNA for a human low-Km, rolipram-sensitive cyclic AMP phosphodiesterase. Mol Cell Biol. 1990 Jun;10(6):2678–86.  <a href=""http://www.ncbi.nlm.nih.gov/pubmed/2160582"" target=""_blank"" class=""external"" rel=""nofollow"">PubMed</a> <a href=""https://europepmc.org/abstract/MED/2160582"" target=""_blank"" class=""external"" rel=""nofollow"">Europe PMC</a> <a href=""https://scholia.toolforge.org/pubmed/2160582"" target=""_blank"" class=""external"" rel=""nofollow"">Scholia</a>"
2545495	Pubmed	"Furchgott RF, Vanhoutte PM. Endothelium-derived relaxing and contracting factors. FASEB J. 1989 Jul;3(9):2007–18.  <a href=""http://www.ncbi.nlm.nih.gov/pubmed/2545495"" target=""_blank"" class=""external"" rel=""nofollow"">PubMed</a> <a href=""https://europepmc.org/abstract/MED/2545495"" target=""_blank"" class=""external"" rel=""nofollow"">Europe PMC</a> <a href=""https://scholia.toolforge.org/pubmed/2545495"" target=""_blank"" class=""external"" rel=""nofollow"">Scholia</a>"
7517198	Pubmed	"Hartell NA. cGMP acts within cerebellar Purkinje cells to produce long term depression via mechanisms involving PKC and PKG. Neuroreport. 1994 Mar 21;5(7):833–6.  <a href=""http://www.ncbi.nlm.nih.gov/pubmed/7517198"" target=""_blank"" class=""external"" rel=""nofollow"">PubMed</a> <a href=""https://europepmc.org/abstract/MED/7517198"" target=""_blank"" class=""external"" rel=""nofollow"">Europe PMC</a> <a href=""https://scholia.toolforge.org/pubmed/7517198"" target=""_blank"" class=""external"" rel=""nofollow"">Scholia</a>"
7870041	Pubmed	"Beltman J, Becker DE, Butt E, Jensen GS, Rybalkin SD, Jastorff B, et al. Characterization of cyclic nucleotide phosphodiesterases with cyclic GMP analogs: topology of the catalytic domains. Mol Pharmacol. 1995 Feb;47(2):330–9.  <a href=""http://www.ncbi.nlm.nih.gov/pubmed/7870041"" target=""_blank"" class=""external"" rel=""nofollow"">PubMed</a> <a href=""https://europepmc.org/abstract/MED/7870041"" target=""_blank"" class=""external"" rel=""nofollow"">Europe PMC</a> <a href=""https://scholia.toolforge.org/pubmed/7870041"" target=""_blank"" class=""external"" rel=""nofollow"">Scholia</a>"
8108407	Pubmed	"Virbasius JV, Scarpulla RC. Activation of the human mitochondrial transcription factor A gene by nuclear respiratory factors: a potential regulatory link between nuclear and mitochondrial gene expression in organelle biogenesis. Proc Natl Acad Sci U S A. 1994 Feb 15;91(4):1309–13.  <a href=""http://www.ncbi.nlm.nih.gov/pubmed/8108407"" target=""_blank"" class=""external"" rel=""nofollow"">PubMed</a> <a href=""https://europepmc.org/abstract/MED/8108407"" target=""_blank"" class=""external"" rel=""nofollow"">Europe PMC</a> <a href=""https://scholia.toolforge.org/pubmed/8108407"" target=""_blank"" class=""external"" rel=""nofollow"">Scholia</a>"
8813924	Pubmed	"Boolell M, Gepi-Attee S, Gingell JC, Allen MJ. Sildenafil, a novel effective oral therapy for male erectile dysfunction. Br J Urol. 1996 Aug;78(2):257–61.  <a href=""http://www.ncbi.nlm.nih.gov/pubmed/8813924"" target=""_blank"" class=""external"" rel=""nofollow"">PubMed</a> <a href=""https://europepmc.org/abstract/MED/8813924"" target=""_blank"" class=""external"" rel=""nofollow"">Europe PMC</a> <a href=""https://scholia.toolforge.org/pubmed/8813924"" target=""_blank"" class=""external"" rel=""nofollow"">Scholia</a>"
9356924	Pubmed	"Owada Y, Utsunomiya A, Yoshimoto T, Kondo H. Expression of mRNA for Akt, serine-threonine protein kinase, in the brain during development and its transient enhancement following axotomy of hypoglossal nerve. J Mol Neurosci. 1997 Aug;9(1):27–33.  <a href=""http://www.ncbi.nlm.nih.gov/pubmed/9356924"" target=""_blank"" class=""external"" rel=""nofollow"">PubMed</a> <a href=""https://europepmc.org/abstract/MED/9356924"" target=""_blank"" class=""external"" rel=""nofollow"">Europe PMC</a> <a href=""https://scholia.toolforge.org/pubmed/9356924"" target=""_blank"" class=""external"" rel=""nofollow"">Scholia</a>"
9714779	Pubmed	"Loughney K, Hill TR, Florio VA, Uher L, Rosman GJ, Wolda SL, et al. Isolation and characterization of cDNAs encoding PDE5A, a human cGMP-binding, cGMP-specific 3’,5’-cyclic nucleotide phosphodiesterase. Gene. 1998 Aug 17;216(1):139–47.  <a href=""http://www.ncbi.nlm.nih.gov/pubmed/9714779"" target=""_blank"" class=""external"" rel=""nofollow"">PubMed</a> <a href=""https://europepmc.org/abstract/MED/9714779"" target=""_blank"" class=""external"" rel=""nofollow"">Europe PMC</a> <a href=""https://scholia.toolforge.org/pubmed/9714779"" target=""_blank"" class=""external"" rel=""nofollow"">Scholia</a>"
9742212	Pubmed	"Zabel U, Weeger M, La M, Schmidt HH. Human soluble guanylate cyclase: functional expression and revised isoenzyme family. Biochem J. 1998 Oct 1;335 ( Pt 1)(Pt 1):51–7.  <a href=""http://www.ncbi.nlm.nih.gov/pubmed/9742212"" target=""_blank"" class=""external"" rel=""nofollow"">PubMed</a> <a href=""https://europepmc.org/abstract/MED/9742212"" target=""_blank"" class=""external"" rel=""nofollow"">Europe PMC</a> <a href=""https://scholia.toolforge.org/pubmed/9742212"" target=""_blank"" class=""external"" rel=""nofollow"">Scholia</a>"
10216224	Pubmed	"Sporbert A, Mertsch K, Smolenski A, Haseloff RF, Schönfelder G, Paul M, et al. Phosphorylation of vasodilator-stimulated phosphoprotein: a consequence of nitric oxide- and cGMP-mediated signal transduction in brain capillary endothelial cells and astrocytes. Brain Res Mol Brain Res. 1999 Apr 20;67(2):258–66.  <a href=""http://www.ncbi.nlm.nih.gov/pubmed/10216224"" target=""_blank"" class=""external"" rel=""nofollow"">PubMed</a> <a href=""https://europepmc.org/abstract/MED/10216224"" target=""_blank"" class=""external"" rel=""nofollow"">Europe PMC</a> <a href=""https://scholia.toolforge.org/pubmed/10216224"" target=""_blank"" class=""external"" rel=""nofollow"">Scholia</a>"
10544210	Pubmed	"Zhan X, Li D, Johns RA. Immunohistochemical evidence for the NO cGMP signaling pathway in respiratory ciliated epithelia of rat. J Histochem Cytochem. 1999 Nov;47(11):1369–74.  <a href=""http://www.ncbi.nlm.nih.gov/pubmed/10544210"" target=""_blank"" class=""external"" rel=""nofollow"">PubMed</a> <a href=""https://europepmc.org/abstract/MED/10544210"" target=""_blank"" class=""external"" rel=""nofollow"">Europe PMC</a> <a href=""https://scholia.toolforge.org/pubmed/10544210"" target=""_blank"" class=""external"" rel=""nofollow"">Scholia</a>"
10725240	Pubmed	"Díaz B, Serna J, De Pablo F, de la Rosa EJ. In vivo regulation of cell death by embryonic (pro)insulin and the insulin receptor during early retinal neurogenesis. Development. 2000 Apr;127(8):1641–9.  <a href=""http://www.ncbi.nlm.nih.gov/pubmed/10725240"" target=""_blank"" class=""external"" rel=""nofollow"">PubMed</a> <a href=""https://europepmc.org/abstract/MED/10725240"" target=""_blank"" class=""external"" rel=""nofollow"">Europe PMC</a> <a href=""https://scholia.toolforge.org/pubmed/10725240"" target=""_blank"" class=""external"" rel=""nofollow"">Scholia</a>"
10983986	Pubmed	"Laine J, Künstle G, Obata T, Sha M, Noguchi M. The protooncogene TCL1 is an Akt kinase coactivator. Mol Cell. 2000 Aug;6(2):395–407.  <a href=""http://www.ncbi.nlm.nih.gov/pubmed/10983986"" target=""_blank"" class=""external"" rel=""nofollow"">PubMed</a> <a href=""https://europepmc.org/abstract/MED/10983986"" target=""_blank"" class=""external"" rel=""nofollow"">Europe PMC</a> <a href=""https://scholia.toolforge.org/pubmed/10983986"" target=""_blank"" class=""external"" rel=""nofollow"">Scholia</a>"
11566027	Pubmed	"Lario PI, Bobechko B, Bateman K, Kelly J, Vrielink A, Huang Z. Purification and characterization of the human PDE4A catalytic domain (PDE4A330-723) expressed in Sf9 cells. Arch Biochem Biophys. 2001 Oct 1;394(1):54–60.  <a href=""http://www.ncbi.nlm.nih.gov/pubmed/11566027"" target=""_blank"" class=""external"" rel=""nofollow"">PubMed</a> <a href=""https://europepmc.org/abstract/MED/11566027"" target=""_blank"" class=""external"" rel=""nofollow"">Europe PMC</a> <a href=""https://scholia.toolforge.org/pubmed/11566027"" target=""_blank"" class=""external"" rel=""nofollow"">Scholia</a>"
11839817	Pubmed	"Künstle G, Laine J, Pierron G, Kagami Si S, Nakajima H, Hoh F, et al. Identification of Akt association and oligomerization domains of the Akt kinase coactivator TCL1. Mol Cell Biol. 2002 Mar;22(5):1513–25.  <a href=""http://www.ncbi.nlm.nih.gov/pubmed/11839817"" target=""_blank"" class=""external"" rel=""nofollow"">PubMed</a> <a href=""https://europepmc.org/abstract/MED/11839817"" target=""_blank"" class=""external"" rel=""nofollow"">Europe PMC</a> <a href=""https://scholia.toolforge.org/pubmed/11839817"" target=""_blank"" class=""external"" rel=""nofollow"">Scholia</a>"
12525853	Pubmed	"Goffart S, Wiesner RJ. Regulation and co-ordination of nuclear gene expression during mitochondrial biogenesis. Exp Physiol. 2003 Jan;88(1):33–40.  <a href=""http://www.ncbi.nlm.nih.gov/pubmed/12525853"" target=""_blank"" class=""external"" rel=""nofollow"">PubMed</a> <a href=""https://europepmc.org/abstract/MED/12525853"" target=""_blank"" class=""external"" rel=""nofollow"">Europe PMC</a> <a href=""https://scholia.toolforge.org/pubmed/12525853"" target=""_blank"" class=""external"" rel=""nofollow"">Scholia</a>"
12814915	Pubmed	"Rivero-Vilches FJ, de Frutos S, Saura M, Rodriguez-Puyol D, Rodriguez-Puyol M. Differential relaxing responses to particulate or soluble guanylyl cyclase activation on endothelial cells: a mechanism dependent on PKG-I alpha activation by NO/cGMP. Am J Physiol Cell Physiol. 2003 Oct;285(4):C891-8.  <a href=""http://www.ncbi.nlm.nih.gov/pubmed/12814915"" target=""_blank"" class=""external"" rel=""nofollow"">PubMed</a> <a href=""https://europepmc.org/abstract/MED/12814915"" target=""_blank"" class=""external"" rel=""nofollow"">Europe PMC</a> <a href=""https://scholia.toolforge.org/pubmed/12814915"" target=""_blank"" class=""external"" rel=""nofollow"">Scholia</a>"
15213306	Pubmed	"Blount MA, Beasley A, Zoraghi R, Sekhar KR, Bessay EP, Francis SH, et al. Binding of tritiated sildenafil, tadalafil, or vardenafil to the phosphodiesterase-5 catalytic site displays potency, specificity, heterogeneity, and cGMP stimulation. Mol Pharmacol. 2004 Jul;66(1):144–52.  <a href=""http://www.ncbi.nlm.nih.gov/pubmed/15213306"" target=""_blank"" class=""external"" rel=""nofollow"">PubMed</a> <a href=""https://europepmc.org/abstract/MED/15213306"" target=""_blank"" class=""external"" rel=""nofollow"">Europe PMC</a> <a href=""https://scholia.toolforge.org/pubmed/15213306"" target=""_blank"" class=""external"" rel=""nofollow"">Scholia</a>"
15576651	Pubmed	"Takimoto E, Champion HC, Belardi D, Moslehi J, Mongillo M, Mergia E, et al. cGMP catabolism by phosphodiesterase 5A regulates cardiac adrenergic stimulation by NOS3-dependent mechanism. Circ Res. 2005 Jan 7;96(1):100–9.  <a href=""http://www.ncbi.nlm.nih.gov/pubmed/15576651"" target=""_blank"" class=""external"" rel=""nofollow"">PubMed</a> <a href=""https://europepmc.org/abstract/MED/15576651"" target=""_blank"" class=""external"" rel=""nofollow"">Europe PMC</a> <a href=""https://scholia.toolforge.org/pubmed/15576651"" target=""_blank"" class=""external"" rel=""nofollow"">Scholia</a>"
16891621	Pubmed	"Borniquel S, Valle I, Cadenas S, Lamas S, Monsalve M. Nitric oxide regulates mitochondrial oxidative stress protection via the transcriptional coactivator PGC-1alpha. FASEB J. 2006 Sep;20(11):1889–91.  <a href=""http://www.ncbi.nlm.nih.gov/pubmed/16891621"" target=""_blank"" class=""external"" rel=""nofollow"">PubMed</a> <a href=""https://europepmc.org/abstract/MED/16891621"" target=""_blank"" class=""external"" rel=""nofollow"">Europe PMC</a> <a href=""https://scholia.toolforge.org/pubmed/16891621"" target=""_blank"" class=""external"" rel=""nofollow"">Scholia</a>"
17522320	Pubmed	"Luna-Medina R, Cortes-Canteli M, Sanchez-Galiano S, Morales-Garcia JA, Martinez A, Santos A, et al. NP031112, a thiadiazolidinone compound, prevents inflammation and neurodegeneration under excitotoxic conditions: potential therapeutic role in brain disorders. J Neurosci. 2007 May 23;27(21):5766–76.  <a href=""http://www.ncbi.nlm.nih.gov/pubmed/17522320"" target=""_blank"" class=""external"" rel=""nofollow"">PubMed</a> <a href=""https://europepmc.org/abstract/MED/17522320"" target=""_blank"" class=""external"" rel=""nofollow"">Europe PMC</a> <a href=""https://scholia.toolforge.org/pubmed/17522320"" target=""_blank"" class=""external"" rel=""nofollow"">Scholia</a>"
18198341	Pubmed	"Olson BL, Hock MB, Ekholm-Reed S, Wohlschlegel JA, Dev KK, Kralli A, et al. SCFCdc4 acts antagonistically to the PGC-1alpha transcriptional coactivator by targeting it for ubiquitin-mediated proteolysis. Genes Dev. 2008 Jan 15;22(2):252–64.  <a href=""http://www.ncbi.nlm.nih.gov/pubmed/18198341"" target=""_blank"" class=""external"" rel=""nofollow"">PubMed</a> <a href=""https://europepmc.org/abstract/MED/18198341"" target=""_blank"" class=""external"" rel=""nofollow"">Europe PMC</a> <a href=""https://scholia.toolforge.org/pubmed/18198341"" target=""_blank"" class=""external"" rel=""nofollow"">Scholia</a>"
20590592	Pubmed	"Chung H-H, Dai Z-K, Wu B-N, Yeh J-L, Chai C-Y, Chu K-S, et al. The xanthine derivative KMUP-1 inhibits models of pulmonary artery hypertension via increased NO and cGMP-dependent inhibition of RhoA/Rho kinase. Br J Pharmacol. 2010 Jun;160(4):971–86.  <a href=""http://www.ncbi.nlm.nih.gov/pubmed/20590592"" target=""_blank"" class=""external"" rel=""nofollow"">PubMed</a> <a href=""https://europepmc.org/abstract/MED/20590592"" target=""_blank"" class=""external"" rel=""nofollow"">Europe PMC</a> <a href=""https://scholia.toolforge.org/pubmed/20590592"" target=""_blank"" class=""external"" rel=""nofollow"">Scholia</a>"
21376232	Pubmed	"Shin J-H, Ko HS, Kang H, Lee Y, Lee Y-I, Pletinkova O, et al. PARIS (ZNF746) repression of PGC-1α contributes to neurodegeneration in Parkinson’s disease. Cell. 2011 Mar 4;144(5):689–702.  <a href=""http://www.ncbi.nlm.nih.gov/pubmed/21376232"" target=""_blank"" class=""external"" rel=""nofollow"">PubMed</a> <a href=""https://europepmc.org/abstract/MED/21376232"" target=""_blank"" class=""external"" rel=""nofollow"">Europe PMC</a> <a href=""https://scholia.toolforge.org/pubmed/21376232"" target=""_blank"" class=""external"" rel=""nofollow"">Scholia</a>"
21595933	Pubmed	"Taherzadeh-Fard E, Saft C, Akkad DA, Wieczorek S, Haghikia A, Chan A, et al. PGC-1alpha downstream transcription factors NRF-1 and TFAM are genetic modifiers of Huntington disease. Mol Neurodegener. 2011 May 19;6(1):32.  <a href=""http://www.ncbi.nlm.nih.gov/pubmed/21595933"" target=""_blank"" class=""external"" rel=""nofollow"">PubMed</a> <a href=""https://europepmc.org/abstract/MED/21595933"" target=""_blank"" class=""external"" rel=""nofollow"">Europe PMC</a> <a href=""https://scholia.toolforge.org/pubmed/21595933"" target=""_blank"" class=""external"" rel=""nofollow"">Scholia</a>"
23645209	Pubmed	"Jacquin MA, Chiche J, Zunino B, Bénéteau M, Meynet O, Pradelli LA, et al. GAPDH binds to active Akt, leading to Bcl-xL increase and escape from caspase-independent cell death. Cell Death Differ. 2013 Aug;20(8):1043–54.  <a href=""http://www.ncbi.nlm.nih.gov/pubmed/23645209"" target=""_blank"" class=""external"" rel=""nofollow"">PubMed</a> <a href=""https://europepmc.org/abstract/MED/23645209"" target=""_blank"" class=""external"" rel=""nofollow"">Europe PMC</a> <a href=""https://scholia.toolforge.org/pubmed/23645209"" target=""_blank"" class=""external"" rel=""nofollow"">Scholia</a>"
24039187	Pubmed	"Cohen MM Jr. The AKT genes and their roles in various disorders. Am J Med Genet A. 2013 Dec;161A(12):2931–7.  <a href=""http://www.ncbi.nlm.nih.gov/pubmed/24039187"" target=""_blank"" class=""external"" rel=""nofollow"">PubMed</a> <a href=""https://europepmc.org/abstract/MED/24039187"" target=""_blank"" class=""external"" rel=""nofollow"">Europe PMC</a> <a href=""https://scholia.toolforge.org/pubmed/24039187"" target=""_blank"" class=""external"" rel=""nofollow"">Scholia</a>"
24161927	Pubmed	"Bird MJ, Thorburn DR, Frazier AE. Modelling biochemical features of mitochondrial neuropathology. Biochim Biophys Acta. 2014 Apr;1840(4):1380–92.  <a href=""http://www.ncbi.nlm.nih.gov/pubmed/24161927"" target=""_blank"" class=""external"" rel=""nofollow"">PubMed</a> <a href=""https://europepmc.org/abstract/MED/24161927"" target=""_blank"" class=""external"" rel=""nofollow"">Europe PMC</a> <a href=""https://scholia.toolforge.org/pubmed/24161927"" target=""_blank"" class=""external"" rel=""nofollow"">Scholia</a>"
32366037	Pubmed	"Galera-Monge T, Zurita-Díaz F, Canals I, Hansen MG, Rufián-Vázquez L, Ehinger JK, et al. Mitochondrial Dysfunction and Calcium Dysregulation in Leigh Syndrome Induced Pluripotent Stem Cell Derived Neurons. Int J Mol Sci. 2020 Apr 30;21(9):3191.  <a href=""http://www.ncbi.nlm.nih.gov/pubmed/32366037"" target=""_blank"" class=""external"" rel=""nofollow"">PubMed</a> <a href=""https://europepmc.org/abstract/MED/32366037"" target=""_blank"" class=""external"" rel=""nofollow"">Europe PMC</a> <a href=""https://scholia.toolforge.org/pubmed/32366037"" target=""_blank"" class=""external"" rel=""nofollow"">Scholia</a>"
35326440	Pubmed	"Stevic N, Maalouf J, Argaud L, Gallo-Bona N, Lo Grasso M, Gouriou Y, et al. Cooling Uncouples Differentially ROS Production from Respiration and Ca2+ Homeostasis Dynamic in Brain and Heart Mitochondria. Cells. 2022 Mar 14;11(6):989.  <a href=""http://www.ncbi.nlm.nih.gov/pubmed/35326440"" target=""_blank"" class=""external"" rel=""nofollow"">PubMed</a> <a href=""https://europepmc.org/abstract/MED/35326440"" target=""_blank"" class=""external"" rel=""nofollow"">Europe PMC</a> <a href=""https://scholia.toolforge.org/pubmed/35326440"" target=""_blank"" class=""external"" rel=""nofollow"">Scholia</a>"
