ID	Database	Citation
12670425	Pubmed	"PIP(2) activates KCNQ channels, and its hydrolysis underlies receptor-mediated inhibition of M currents. Zhang H, Craciun LC, Mirshahi T, Rohács T, Lopes CMB, Jin T, et al. Neuron. 2003 Mar 27;37(6):963–75.  <a href=""http://www.ncbi.nlm.nih.gov/pubmed/12670425"" target=""_blank"" class=""external"" rel=""nofollow"">PubMed</a> <a href=""https://europepmc.org/abstract/MED/12670425"" target=""_blank"" class=""external"" rel=""nofollow"">Europe PMC</a> <a href=""https://scholia.toolforge.org/pubmed/12670425"" target=""_blank"" class=""external"" rel=""nofollow"">Scholia</a>"
17699673	Pubmed	"Inositol triphosphate-mediated Ca2+ signals direct purinergic P2Y receptor regulation of neuronal ion channels. Zaika O, Tolstykh GP, Jaffe DB, Shapiro MS. J Neurosci. 2007 Aug 15;27(33):8914–26.  <a href=""http://www.ncbi.nlm.nih.gov/pubmed/17699673"" target=""_blank"" class=""external"" rel=""nofollow"">PubMed</a> <a href=""https://europepmc.org/abstract/MED/17699673"" target=""_blank"" class=""external"" rel=""nofollow"">Europe PMC</a> <a href=""https://scholia.toolforge.org/pubmed/17699673"" target=""_blank"" class=""external"" rel=""nofollow"">Scholia</a>"
23090990	Pubmed	"Modulation of voltage-gated K+ channels by the sodium channel β1 subunit. Nguyen HM, Miyazaki H, Hoshi N, Smith BJ, Nukina N, Goldin AL, et al. Proc Natl Acad Sci U S A. 2012 Nov 6;109(45):18577–82.  <a href=""http://www.ncbi.nlm.nih.gov/pubmed/23090990"" target=""_blank"" class=""external"" rel=""nofollow"">PubMed</a> <a href=""https://europepmc.org/abstract/MED/23090990"" target=""_blank"" class=""external"" rel=""nofollow"">Europe PMC</a> <a href=""https://scholia.toolforge.org/pubmed/23090990"" target=""_blank"" class=""external"" rel=""nofollow"">Scholia</a>"
26687932	Pubmed	"KCNQ potassium channels in sensory system and neural circuits. Wang J jing, Li Y. Acta Pharmacol Sin. 2016 Jan;37(1):25–33.  <a href=""http://www.ncbi.nlm.nih.gov/pubmed/26687932"" target=""_blank"" class=""external"" rel=""nofollow"">PubMed</a> <a href=""https://europepmc.org/abstract/MED/26687932"" target=""_blank"" class=""external"" rel=""nofollow"">Europe PMC</a> <a href=""https://scholia.toolforge.org/pubmed/26687932"" target=""_blank"" class=""external"" rel=""nofollow"">Scholia</a>"
32503841	Pubmed	"Sodium channel β1 subunits are post-translationally modified by tyrosine phosphorylation, S-palmitoylation, and regulated intramembrane proteolysis. Bouza AA, Philippe JM, Edokobi N, Pinsky AM, Offord J, Calhoun JD, et al. J Biol Chem. 2020 Jul 24;295(30):10380–93.  <a href=""http://www.ncbi.nlm.nih.gov/pubmed/32503841"" target=""_blank"" class=""external"" rel=""nofollow"">PubMed</a> <a href=""https://europepmc.org/abstract/MED/32503841"" target=""_blank"" class=""external"" rel=""nofollow"">Europe PMC</a> <a href=""https://scholia.toolforge.org/pubmed/32503841"" target=""_blank"" class=""external"" rel=""nofollow"">Scholia</a>"
35629827	Pubmed	"Behavior of KCNQ Channels in Neural Plasticity and Motor Disorders. Singh SP, William M, Malavia M, Chu XP. Membranes (Basel). 2022 May 6;12(5):499.  <a href=""http://www.ncbi.nlm.nih.gov/pubmed/35629827"" target=""_blank"" class=""external"" rel=""nofollow"">PubMed</a> <a href=""https://europepmc.org/abstract/MED/35629827"" target=""_blank"" class=""external"" rel=""nofollow"">Europe PMC</a> <a href=""https://scholia.toolforge.org/pubmed/35629827"" target=""_blank"" class=""external"" rel=""nofollow"">Scholia</a>"
