ID	Database	Citation
31055719	Pubmed	"Association of Serum Levels of Silent Information Regulator 1 with Persistent Organ Failure in Acute Pancreatitis. Chen J, Wan J, Shu W, Yang X, Xia L. Dig Dis Sci. 2019 Nov;64(11):3173–81.  <a href=""http://www.ncbi.nlm.nih.gov/pubmed/31055719"" target=""_blank"" class=""external"" rel=""nofollow"">PubMed</a> <a href=""https://europepmc.org/abstract/MED/31055719"" target=""_blank"" class=""external"" rel=""nofollow"">Europe PMC</a> <a href=""https://scholia.toolforge.org/pubmed/31055719"" target=""_blank"" class=""external"" rel=""nofollow"">Scholia</a>"
31319247	Pubmed	"GAS5/miR-21 Axis as a Potential Target to Rescue ZCL-082-Induced Autophagy of Female Germline Stem Cells In Vitro. Li B, Hu X, Yang Y, Zhu M, Zhang J, Wang Y, et al. Mol Ther Nucleic Acids. 2019 Sep 6;17:436–47.  <a href=""http://www.ncbi.nlm.nih.gov/pubmed/31319247"" target=""_blank"" class=""external"" rel=""nofollow"">PubMed</a> <a href=""https://europepmc.org/abstract/MED/31319247"" target=""_blank"" class=""external"" rel=""nofollow"">Europe PMC</a> <a href=""https://scholia.toolforge.org/pubmed/31319247"" target=""_blank"" class=""external"" rel=""nofollow"">Scholia</a>"
31359035	Pubmed	"MicroRNA-181a promotes follicular granulosa cell apoptosis via sphingosine-1-phosphate receptor 1 expression downregulation†. Zhang C, Shen J, Kong S, Zhang M, Zhang Q, Zhou J, et al. Biol Reprod. 2019 Nov 21;101(5):975–85.  <a href=""http://www.ncbi.nlm.nih.gov/pubmed/31359035"" target=""_blank"" class=""external"" rel=""nofollow"">PubMed</a> <a href=""https://europepmc.org/abstract/MED/31359035"" target=""_blank"" class=""external"" rel=""nofollow"">Europe PMC</a> <a href=""https://scholia.toolforge.org/pubmed/31359035"" target=""_blank"" class=""external"" rel=""nofollow"">Scholia</a>"
31637660	Pubmed	"Reduced Foxo3a, FoxL2, and p27 mRNA expression in human ovarian tissue in premature ovarian insufficiency. Thanatsis N, Kaponis A, Koika V, Georgopoulos NA, Decavalas GO. Hormones (Athens). 2019 Dec;18(4):409–15.  <a href=""http://www.ncbi.nlm.nih.gov/pubmed/31637660"" target=""_blank"" class=""external"" rel=""nofollow"">PubMed</a> <a href=""https://europepmc.org/abstract/MED/31637660"" target=""_blank"" class=""external"" rel=""nofollow"">Europe PMC</a> <a href=""https://scholia.toolforge.org/pubmed/31637660"" target=""_blank"" class=""external"" rel=""nofollow"">Scholia</a>"
31649622	Pubmed	"Role of mTOR Signaling in Female Reproduction. Guo Z, Yu Q. Front Endocrinol (Lausanne). 2019 Oct 9;10:692.  <a href=""http://www.ncbi.nlm.nih.gov/pubmed/31649622"" target=""_blank"" class=""external"" rel=""nofollow"">PubMed</a> <a href=""https://europepmc.org/abstract/MED/31649622"" target=""_blank"" class=""external"" rel=""nofollow"">Europe PMC</a> <a href=""https://scholia.toolforge.org/pubmed/31649622"" target=""_blank"" class=""external"" rel=""nofollow"">Scholia</a>"
31745224	Pubmed	"The transcriptional regulator CBX2 and ovarian function: A whole genome and whole transcriptome approach. Bouazzi L, Sproll P, Eid W, Biason-Lauber A. Sci Rep. 2019 Nov 19;9(1):17033.  <a href=""http://www.ncbi.nlm.nih.gov/pubmed/31745224"" target=""_blank"" class=""external"" rel=""nofollow"">PubMed</a> <a href=""https://europepmc.org/abstract/MED/31745224"" target=""_blank"" class=""external"" rel=""nofollow"">Europe PMC</a> <a href=""https://scholia.toolforge.org/pubmed/31745224"" target=""_blank"" class=""external"" rel=""nofollow"">Scholia</a>"
31912384	Pubmed	"Correction to: Reduced Foxo3a, FoxL2, and p27 mRNA expression in human ovarian tissue in premature ovarian insufficiency. Thanatsis N, Kaponis A, Koika V, Georgopoulos NA, Decavalas GO. Hormones (Athens). 2019 Dec;18(4):537–8.  <a href=""http://www.ncbi.nlm.nih.gov/pubmed/31912384"" target=""_blank"" class=""external"" rel=""nofollow"">PubMed</a> <a href=""https://europepmc.org/abstract/MED/31912384"" target=""_blank"" class=""external"" rel=""nofollow"">Europe PMC</a> <a href=""https://scholia.toolforge.org/pubmed/31912384"" target=""_blank"" class=""external"" rel=""nofollow"">Scholia</a>"
32772095	Pubmed	"Variants in Homologous Recombination Genes EXO1 and RAD51 Related with Premature Ovarian Insufficiency. Luo W, Guo T, Li G, Liu R, Zhao S, Song M, et al. J Clin Endocrinol Metab. 2020 Oct 1;105(10):dgaa505.  <a href=""http://www.ncbi.nlm.nih.gov/pubmed/32772095"" target=""_blank"" class=""external"" rel=""nofollow"">PubMed</a> <a href=""https://europepmc.org/abstract/MED/32772095"" target=""_blank"" class=""external"" rel=""nofollow"">Europe PMC</a> <a href=""https://scholia.toolforge.org/pubmed/32772095"" target=""_blank"" class=""external"" rel=""nofollow"">Scholia</a>"
32962729	Pubmed	"Whole-exome sequencing in patients with premature ovarian insufficiency: early detection and early intervention. Liu H, Wei X, Sha Y, Liu W, Gao H, Lin J, et al. J Ovarian Res. 2020 Sep 22;13(1):114.  <a href=""http://www.ncbi.nlm.nih.gov/pubmed/32962729"" target=""_blank"" class=""external"" rel=""nofollow"">PubMed</a> <a href=""https://europepmc.org/abstract/MED/32962729"" target=""_blank"" class=""external"" rel=""nofollow"">Europe PMC</a> <a href=""https://scholia.toolforge.org/pubmed/32962729"" target=""_blank"" class=""external"" rel=""nofollow"">Scholia</a>"
34095689	Pubmed	"Next Generation Sequencing Should Be Proposed to Every Woman With “Idiopathic” Primary Ovarian Insufficiency. Eskenazi S, Bachelot A, Hugon-Rodin J, Plu-Bureau G, Gompel A, Catteau-Jonard S, et al. J Endocr Soc. 2021 Mar 1;5(7):bvab032.  <a href=""http://www.ncbi.nlm.nih.gov/pubmed/34095689"" target=""_blank"" class=""external"" rel=""nofollow"">PubMed</a> <a href=""https://europepmc.org/abstract/MED/34095689"" target=""_blank"" class=""external"" rel=""nofollow"">Europe PMC</a> <a href=""https://scholia.toolforge.org/pubmed/34095689"" target=""_blank"" class=""external"" rel=""nofollow"">Scholia</a>"
34794894	Pubmed	"Genetics of ovarian insufficiency and defects of folliculogenesis. França MM, Mendonca BB. Best Pract Res Clin Endocrinol Metab. 2022 Jan;36(1):101594.  <a href=""http://www.ncbi.nlm.nih.gov/pubmed/34794894"" target=""_blank"" class=""external"" rel=""nofollow"">PubMed</a> <a href=""https://europepmc.org/abstract/MED/34794894"" target=""_blank"" class=""external"" rel=""nofollow"">Europe PMC</a> <a href=""https://scholia.toolforge.org/pubmed/34794894"" target=""_blank"" class=""external"" rel=""nofollow"">Scholia</a>"
35248053	Pubmed	"Activation of AKT/mammalian target of rapamycin signaling in the peripheral blood of women with premature ovarian insufficiency and its correlation with FMR1 expression. Rehnitz J, Messmer B, Bender U, Nguyen XP, Germeyer A, Hinderhofer K, et al. Reprod Biol Endocrinol. 2022 Mar 5;20(1):44.  <a href=""http://www.ncbi.nlm.nih.gov/pubmed/35248053"" target=""_blank"" class=""external"" rel=""nofollow"">PubMed</a> <a href=""https://europepmc.org/abstract/MED/35248053"" target=""_blank"" class=""external"" rel=""nofollow"">Europe PMC</a> <a href=""https://scholia.toolforge.org/pubmed/35248053"" target=""_blank"" class=""external"" rel=""nofollow"">Scholia</a>"
36099812	Pubmed	"Genetic landscape of a large cohort of Primary Ovarian Insufficiency: New genes and pathways and implications for personalized medicine. Heddar A, Ogur C, Da Costa S, Braham I, Billaud-Rist L, Findikli N, et al. EBioMedicine. 2022 Oct;84:104246.  <a href=""http://www.ncbi.nlm.nih.gov/pubmed/36099812"" target=""_blank"" class=""external"" rel=""nofollow"">PubMed</a> <a href=""https://europepmc.org/abstract/MED/36099812"" target=""_blank"" class=""external"" rel=""nofollow"">Europe PMC</a> <a href=""https://scholia.toolforge.org/pubmed/36099812"" target=""_blank"" class=""external"" rel=""nofollow"">Scholia</a>"
36381354	Pubmed	"Association study of ESR1 rs9340799, rs2234693, and MMP2 rs243865 variants in Iranian women with premature ovarian insufficiency: A case-control study. Sadat Eshaghi F, Dehghan Tezerjani M, Ghasemi N, Dehghani M. Int J Reprod Biomed. 2022 Nov 2;20(10):841–50.  <a href=""http://www.ncbi.nlm.nih.gov/pubmed/36381354"" target=""_blank"" class=""external"" rel=""nofollow"">PubMed</a> <a href=""https://europepmc.org/abstract/MED/36381354"" target=""_blank"" class=""external"" rel=""nofollow"">Europe PMC</a> <a href=""https://scholia.toolforge.org/pubmed/36381354"" target=""_blank"" class=""external"" rel=""nofollow"">Scholia</a>"
36507521	Pubmed	"Signaling pathway intervention in premature ovarian failure. Bai X, Wang S. Front Med (Lausanne). 2022 Nov 25;9:999440.  <a href=""http://www.ncbi.nlm.nih.gov/pubmed/36507521"" target=""_blank"" class=""external"" rel=""nofollow"">PubMed</a> <a href=""https://europepmc.org/abstract/MED/36507521"" target=""_blank"" class=""external"" rel=""nofollow"">Europe PMC</a> <a href=""https://scholia.toolforge.org/pubmed/36507521"" target=""_blank"" class=""external"" rel=""nofollow"">Scholia</a>"
36732629	Pubmed	"Landscape of pathogenic mutations in premature ovarian insufficiency. Ke H, Tang S, Guo T, Hou D, Jiao X, Li S, et al. Nat Med. 2023 Feb;29(2):483–92.  <a href=""http://www.ncbi.nlm.nih.gov/pubmed/36732629"" target=""_blank"" class=""external"" rel=""nofollow"">PubMed</a> <a href=""https://europepmc.org/abstract/MED/36732629"" target=""_blank"" class=""external"" rel=""nofollow"">Europe PMC</a> <a href=""https://scholia.toolforge.org/pubmed/36732629"" target=""_blank"" class=""external"" rel=""nofollow"">Scholia</a>"
