ID	Database	Citation
7798316	Pubmed	"Direct association of occludin with ZO-1 and its possible involvement in the localization of occludin at tight junctions. Furuse M, Itoh M, Hirase T, Nagafuchi A, Yonemura S, Tsukita S, et al. J Cell Biol. 1994 Dec;127(6 Pt 1):1617–26.  <a href=""http://www.ncbi.nlm.nih.gov/pubmed/7798316"" target=""_blank"" class=""external"" rel=""nofollow"">PubMed</a> <a href=""https://europepmc.org/abstract/MED/7798316"" target=""_blank"" class=""external"" rel=""nofollow"">Europe PMC</a> <a href=""https://scholia.toolforge.org/pubmed/7798316"" target=""_blank"" class=""external"" rel=""nofollow"">Scholia</a>"
9792688	Pubmed	"The tight junction protein ZO-1 establishes a link between the transmembrane protein occludin and the actin cytoskeleton. Fanning AS, Jameson BJ, Jesaitis LA, Anderson JM. J Biol Chem. 1998 Nov 6;273(45):29745–53.  <a href=""http://www.ncbi.nlm.nih.gov/pubmed/9792688"" target=""_blank"" class=""external"" rel=""nofollow"">PubMed</a> <a href=""https://europepmc.org/abstract/MED/9792688"" target=""_blank"" class=""external"" rel=""nofollow"">Europe PMC</a> <a href=""https://scholia.toolforge.org/pubmed/9792688"" target=""_blank"" class=""external"" rel=""nofollow"">Scholia</a>"
10833507	Pubmed	"Regulation of X11L-dependent amyloid precursor protein metabolism by XB51, a novel X11L-binding protein. Lee DS, Tomita S, Kirino Y, Suzuki T. J Biol Chem. 2000 Jul 28;275(30):23134–8.  <a href=""http://www.ncbi.nlm.nih.gov/pubmed/10833507"" target=""_blank"" class=""external"" rel=""nofollow"">PubMed</a> <a href=""https://europepmc.org/abstract/MED/10833507"" target=""_blank"" class=""external"" rel=""nofollow"">Europe PMC</a> <a href=""https://scholia.toolforge.org/pubmed/10833507"" target=""_blank"" class=""external"" rel=""nofollow"">Scholia</a>"
11477107	Pubmed	"The Sp1-like protein BTEB3 inhibits transcription via the basic transcription element box by interacting with mSin3A and HDAC-1 co-repressors and competing with Sp1. Kaczynski J, Zhang JS, Ellenrieder V, Conley A, Duenes T, Kester H, et al. J Biol Chem. 2001 Sep 28;276(39):36749–56.  <a href=""http://www.ncbi.nlm.nih.gov/pubmed/11477107"" target=""_blank"" class=""external"" rel=""nofollow"">PubMed</a> <a href=""https://europepmc.org/abstract/MED/11477107"" target=""_blank"" class=""external"" rel=""nofollow"">Europe PMC</a> <a href=""https://scholia.toolforge.org/pubmed/11477107"" target=""_blank"" class=""external"" rel=""nofollow"">Scholia</a>"
11734628	Pubmed	"The coxsackievirus and adenovirus receptor is a transmembrane component of the tight junction. Cohen CJ, Shieh JT, Pickles RJ, Okegawa T, Hsieh JT, Bergelson JM. Proc Natl Acad Sci U S A. 2001 Dec 18;98(26):15191–6.  <a href=""http://www.ncbi.nlm.nih.gov/pubmed/11734628"" target=""_blank"" class=""external"" rel=""nofollow"">PubMed</a> <a href=""https://europepmc.org/abstract/MED/11734628"" target=""_blank"" class=""external"" rel=""nofollow"">Europe PMC</a> <a href=""https://scholia.toolforge.org/pubmed/11734628"" target=""_blank"" class=""external"" rel=""nofollow"">Scholia</a>"
11748222	Pubmed	"Functional interaction between coactivators CBP/p300, PCAF, and transcription factor FKLF2. Song CZ, Keller K, Murata K, Asano H, Stamatoyannopoulos G. J Biol Chem. 2002 Mar 1;277(9):7029–36.  <a href=""http://www.ncbi.nlm.nih.gov/pubmed/11748222"" target=""_blank"" class=""external"" rel=""nofollow"">PubMed</a> <a href=""https://europepmc.org/abstract/MED/11748222"" target=""_blank"" class=""external"" rel=""nofollow"">Europe PMC</a> <a href=""https://scholia.toolforge.org/pubmed/11748222"" target=""_blank"" class=""external"" rel=""nofollow"">Scholia</a>"
12023291	Pubmed	"Evidence for a functional interaction between cingulin and ZO-1 in cultured cells. D’Atri F, Nadalutti F, Citi S. J Biol Chem. 2002 Aug 2;277(31):27757–64.  <a href=""http://www.ncbi.nlm.nih.gov/pubmed/12023291"" target=""_blank"" class=""external"" rel=""nofollow"">PubMed</a> <a href=""https://europepmc.org/abstract/MED/12023291"" target=""_blank"" class=""external"" rel=""nofollow"">Europe PMC</a> <a href=""https://scholia.toolforge.org/pubmed/12023291"" target=""_blank"" class=""external"" rel=""nofollow"">Scholia</a>"
12154091	Pubmed	"Molecular cloning, functional expression, and tissue distribution of a novel human gap junction-forming protein, connexin-31.9. Interaction with zona occludens protein-1. Nielsen PA, Beahm DL, Giepmans BNG, Baruch A, Hall JE, Kumar NM. J Biol Chem. 2002 Oct 11;277(41):38272–83.  <a href=""http://www.ncbi.nlm.nih.gov/pubmed/12154091"" target=""_blank"" class=""external"" rel=""nofollow"">PubMed</a> <a href=""https://europepmc.org/abstract/MED/12154091"" target=""_blank"" class=""external"" rel=""nofollow"">Europe PMC</a> <a href=""https://scholia.toolforge.org/pubmed/12154091"" target=""_blank"" class=""external"" rel=""nofollow"">Scholia</a>"
14744763	Pubmed	"Transcriptional regulation of the melanoma prognostic marker melastatin (TRPM1) by MITF in melanocytes and melanoma. Miller AJ, Du J, Rowan S, Hershey CL, Widlund HR, Fisher DE. Cancer Res. 2004 Jan 15;64(2):509–16.  <a href=""http://www.ncbi.nlm.nih.gov/pubmed/14744763"" target=""_blank"" class=""external"" rel=""nofollow"">PubMed</a> <a href=""https://europepmc.org/abstract/MED/14744763"" target=""_blank"" class=""external"" rel=""nofollow"">Europe PMC</a> <a href=""https://scholia.toolforge.org/pubmed/14744763"" target=""_blank"" class=""external"" rel=""nofollow"">Scholia</a>"
15183511	Pubmed	"Connexin47, connexin29 and connexin32 co-expression in oligodendrocytes and Cx47 association with zonula occludens-1 (ZO-1) in mouse brain. Li X, Ionescu AV, Lynn BD, Lu S, Kamasawa N, Morita M, et al. Neuroscience. 2004;126(3):611–30.  <a href=""http://www.ncbi.nlm.nih.gov/pubmed/15183511"" target=""_blank"" class=""external"" rel=""nofollow"">PubMed</a> <a href=""https://europepmc.org/abstract/MED/15183511"" target=""_blank"" class=""external"" rel=""nofollow"">Europe PMC</a> <a href=""https://scholia.toolforge.org/pubmed/15183511"" target=""_blank"" class=""external"" rel=""nofollow"">Scholia</a>"
15504725	Pubmed	"Ric-3 promotes functional expression of the nicotinic acetylcholine receptor alpha7 subunit in mammalian cells. Williams ME, Burton B, Urrutia A, Shcherbatko A, Chavez-Noriega LE, Cohen CJ, et al. J Biol Chem. 2005 Jan 14;280(2):1257–63.  <a href=""http://www.ncbi.nlm.nih.gov/pubmed/15504725"" target=""_blank"" class=""external"" rel=""nofollow"">PubMed</a> <a href=""https://europepmc.org/abstract/MED/15504725"" target=""_blank"" class=""external"" rel=""nofollow"">Europe PMC</a> <a href=""https://scholia.toolforge.org/pubmed/15504725"" target=""_blank"" class=""external"" rel=""nofollow"">Scholia</a>"
16120769	Pubmed	"RIC-3 enhances functional expression of multiple nicotinic acetylcholine receptor subtypes in mammalian cells. Lansdell SJ, Gee VJ, Harkness PC, Doward AI, Baker ER, Gibb AJ, et al. Mol Pharmacol. 2005 Nov;68(5):1431–8.  <a href=""http://www.ncbi.nlm.nih.gov/pubmed/16120769"" target=""_blank"" class=""external"" rel=""nofollow"">PubMed</a> <a href=""https://europepmc.org/abstract/MED/16120769"" target=""_blank"" class=""external"" rel=""nofollow"">Europe PMC</a> <a href=""https://scholia.toolforge.org/pubmed/16120769"" target=""_blank"" class=""external"" rel=""nofollow"">Scholia</a>"
17015620	Pubmed	"Cdc42 GEF Tuba regulates the junctional configuration of simple epithelial cells. Otani T, Ichii T, Aono S, Takeichi M. J Cell Biol. 2006 Oct 9;175(1):135–46.  <a href=""http://www.ncbi.nlm.nih.gov/pubmed/17015620"" target=""_blank"" class=""external"" rel=""nofollow"">PubMed</a> <a href=""https://europepmc.org/abstract/MED/17015620"" target=""_blank"" class=""external"" rel=""nofollow"">Europe PMC</a> <a href=""https://scholia.toolforge.org/pubmed/17015620"" target=""_blank"" class=""external"" rel=""nofollow"">Scholia</a>"
17897942	Pubmed	"Domain-swapped dimerization of the second PDZ domain of ZO2 may provide a structural basis for the polymerization of claudins. Wu J, Yang Y, Zhang J, Ji P, Du W, Jiang P, et al. J Biol Chem. 2007 Dec 7;282(49):35988–99.  <a href=""http://www.ncbi.nlm.nih.gov/pubmed/17897942"" target=""_blank"" class=""external"" rel=""nofollow"">PubMed</a> <a href=""https://europepmc.org/abstract/MED/17897942"" target=""_blank"" class=""external"" rel=""nofollow"">Europe PMC</a> <a href=""https://scholia.toolforge.org/pubmed/17897942"" target=""_blank"" class=""external"" rel=""nofollow"">Scholia</a>"
18636092	Pubmed	"Domain-swapped dimerization of ZO-1 PDZ2 generates specific and regulatory connexin43-binding sites. Chen J, Pan L, Wei Z, Zhao Y, Zhang M. EMBO J. 2008 Aug 6;27(15):2113–23.  <a href=""http://www.ncbi.nlm.nih.gov/pubmed/18636092"" target=""_blank"" class=""external"" rel=""nofollow"">PubMed</a> <a href=""https://europepmc.org/abstract/MED/18636092"" target=""_blank"" class=""external"" rel=""nofollow"">Europe PMC</a> <a href=""https://scholia.toolforge.org/pubmed/18636092"" target=""_blank"" class=""external"" rel=""nofollow"">Scholia</a>"
18823282	Pubmed	"Characterization of the ubinuclein protein as a new member of the nuclear and adhesion complex components (NACos). Aho S, Lupo J, Coly PA, Sabine A, Castellazzi M, Morand P, et al. Biol Cell. 2009 Jun;101(6):319–34.  <a href=""http://www.ncbi.nlm.nih.gov/pubmed/18823282"" target=""_blank"" class=""external"" rel=""nofollow"">PubMed</a> <a href=""https://europepmc.org/abstract/MED/18823282"" target=""_blank"" class=""external"" rel=""nofollow"">Europe PMC</a> <a href=""https://scholia.toolforge.org/pubmed/18823282"" target=""_blank"" class=""external"" rel=""nofollow"">Scholia</a>"
19436059	Pubmed	"TRPM1 forms ion channels associated with melanin content in melanocytes. Oancea E, Vriens J, Brauchi S, Jun J, Splawski I, Clapham DE. Sci Signal. 2009 May 12;2(70):ra21.  <a href=""http://www.ncbi.nlm.nih.gov/pubmed/19436059"" target=""_blank"" class=""external"" rel=""nofollow"">PubMed</a> <a href=""https://europepmc.org/abstract/MED/19436059"" target=""_blank"" class=""external"" rel=""nofollow"">Europe PMC</a> <a href=""https://scholia.toolforge.org/pubmed/19436059"" target=""_blank"" class=""external"" rel=""nofollow"">Scholia</a>"
20093627	Pubmed	"Myozap, a novel intercalated disc protein, activates serum response factor-dependent signaling and is required to maintain cardiac function in vivo. Seeger TS, Frank D, Rohr C, Will R, Just S, Grund C, et al. Circ Res. 2010 Mar 19;106(5):880–90.  <a href=""http://www.ncbi.nlm.nih.gov/pubmed/20093627"" target=""_blank"" class=""external"" rel=""nofollow"">PubMed</a> <a href=""https://europepmc.org/abstract/MED/20093627"" target=""_blank"" class=""external"" rel=""nofollow"">Europe PMC</a> <a href=""https://scholia.toolforge.org/pubmed/20093627"" target=""_blank"" class=""external"" rel=""nofollow"">Scholia</a>"
20200156	Pubmed	"Insights into regulated ligand binding sites from the structure of ZO-1 Src homology 3-guanylate kinase module. Lye MF, Fanning AS, Su Y, Anderson JM, Lavie A. J Biol Chem. 2010 Apr 30;285(18):13907–17.  <a href=""http://www.ncbi.nlm.nih.gov/pubmed/20200156"" target=""_blank"" class=""external"" rel=""nofollow"">PubMed</a> <a href=""https://europepmc.org/abstract/MED/20200156"" target=""_blank"" class=""external"" rel=""nofollow"">Europe PMC</a> <a href=""https://scholia.toolforge.org/pubmed/20200156"" target=""_blank"" class=""external"" rel=""nofollow"">Scholia</a>"
20603015	Pubmed	"Identification of KIAA1018/FAN1, a DNA repair nuclease recruited to DNA damage by monoubiquitinated FANCD2. MacKay C, Déclais AC, Lundin C, Agostinho A, Deans AJ, MacArtney TJ, et al. Cell. 2010 Jul 9;142(1):65–76.  <a href=""http://www.ncbi.nlm.nih.gov/pubmed/20603015"" target=""_blank"" class=""external"" rel=""nofollow"">PubMed</a> <a href=""https://europepmc.org/abstract/MED/20603015"" target=""_blank"" class=""external"" rel=""nofollow"">Europe PMC</a> <a href=""https://scholia.toolforge.org/pubmed/20603015"" target=""_blank"" class=""external"" rel=""nofollow"">Scholia</a>"
20622874	Pubmed	"Lys11-linked ubiquitin chains adopt compact conformations and are preferentially hydrolyzed by the deubiquitinase Cezanne. Bremm A, Freund SMV, Komander D. Nat Struct Mol Biol. 2010 Aug;17(8):939–47.  <a href=""http://www.ncbi.nlm.nih.gov/pubmed/20622874"" target=""_blank"" class=""external"" rel=""nofollow"">PubMed</a> <a href=""https://europepmc.org/abstract/MED/20622874"" target=""_blank"" class=""external"" rel=""nofollow"">Europe PMC</a> <a href=""https://scholia.toolforge.org/pubmed/20622874"" target=""_blank"" class=""external"" rel=""nofollow"">Scholia</a>"
20671156	Pubmed	"FAN1 acts with FANCI-FANCD2 to promote DNA interstrand cross-link repair. Liu T, Ghosal G, Yuan J, Chen J, Huang J. Science. 2010 Aug 6;329(5992):693–6.  <a href=""http://www.ncbi.nlm.nih.gov/pubmed/20671156"" target=""_blank"" class=""external"" rel=""nofollow"">PubMed</a> <a href=""https://europepmc.org/abstract/MED/20671156"" target=""_blank"" class=""external"" rel=""nofollow"">Europe PMC</a> <a href=""https://scholia.toolforge.org/pubmed/20671156"" target=""_blank"" class=""external"" rel=""nofollow"">Scholia</a>"
20864041	Pubmed	"MAGE-RING protein complexes comprise a family of E3 ubiquitin ligases. Doyle JM, Gao J, Wang J, Yang M, Potts PR. Mol Cell. 2010 Sep 24;39(6):963–74.  <a href=""http://www.ncbi.nlm.nih.gov/pubmed/20864041"" target=""_blank"" class=""external"" rel=""nofollow"">PubMed</a> <a href=""https://europepmc.org/abstract/MED/20864041"" target=""_blank"" class=""external"" rel=""nofollow"">Europe PMC</a> <a href=""https://scholia.toolforge.org/pubmed/20864041"" target=""_blank"" class=""external"" rel=""nofollow"">Scholia</a>"
21240187	Pubmed	"Cdc42-dependent formation of the ZO-1/MRCKβ complex at the leading edge controls cell migration. Huo L, Wen W, Wang R, Kam C, Xia J, Feng W, et al. EMBO J. 2011 Feb 16;30(4):665–78.  <a href=""http://www.ncbi.nlm.nih.gov/pubmed/21240187"" target=""_blank"" class=""external"" rel=""nofollow"">PubMed</a> <a href=""https://europepmc.org/abstract/MED/21240187"" target=""_blank"" class=""external"" rel=""nofollow"">Europe PMC</a> <a href=""https://scholia.toolforge.org/pubmed/21240187"" target=""_blank"" class=""external"" rel=""nofollow"">Scholia</a>"
21278253	Pubmed	"Transient receptor potential melastatin 1 (TRPM1) is an ion-conducting plasma membrane channel inhibited by zinc ions. Lambert S, Drews A, Rizun O, Wagner TFJ, Lis A, Mannebach S, et al. J Biol Chem. 2011 Apr 8;286(14):12221–33.  <a href=""http://www.ncbi.nlm.nih.gov/pubmed/21278253"" target=""_blank"" class=""external"" rel=""nofollow"">PubMed</a> <a href=""https://europepmc.org/abstract/MED/21278253"" target=""_blank"" class=""external"" rel=""nofollow"">Europe PMC</a> <a href=""https://scholia.toolforge.org/pubmed/21278253"" target=""_blank"" class=""external"" rel=""nofollow"">Scholia</a>"
22016770	Pubmed	"Multi-tasking role of the mechanosensing protein Ankrd2 in the signaling network of striated muscle. Belgrano A, Rakicevic L, Mittempergher L, Campanaro S, Martinelli VC, Mouly V, et al. PLoS One. 2011;6(10):e25519.  <a href=""http://www.ncbi.nlm.nih.gov/pubmed/22016770"" target=""_blank"" class=""external"" rel=""nofollow"">PubMed</a> <a href=""https://europepmc.org/abstract/MED/22016770"" target=""_blank"" class=""external"" rel=""nofollow"">Europe PMC</a> <a href=""https://scholia.toolforge.org/pubmed/22016770"" target=""_blank"" class=""external"" rel=""nofollow"">Scholia</a>"
23827681	Pubmed	"OTU deubiquitinases reveal mechanisms of linkage specificity and enable ubiquitin chain restriction analysis. Mevissen TET, Hospenthal MK, Geurink PP, Elliott PR, Akutsu M, Arnaudo N, et al. Cell. 2013 Jul 3;154(1):169–84.  <a href=""http://www.ncbi.nlm.nih.gov/pubmed/23827681"" target=""_blank"" class=""external"" rel=""nofollow"">PubMed</a> <a href=""https://europepmc.org/abstract/MED/23827681"" target=""_blank"" class=""external"" rel=""nofollow"">Europe PMC</a> <a href=""https://scholia.toolforge.org/pubmed/23827681"" target=""_blank"" class=""external"" rel=""nofollow"">Scholia</a>"
27344019	Pubmed	"Functional interaction between Lypd6 and nicotinic acetylcholine receptors. Arvaniti M, Jensen MM, Soni N, Wang H, Klein AB, Thiriet N, et al. J Neurochem. 2016 Sep;138(6):806–20.  <a href=""http://www.ncbi.nlm.nih.gov/pubmed/27344019"" target=""_blank"" class=""external"" rel=""nofollow"">PubMed</a> <a href=""https://europepmc.org/abstract/MED/27344019"" target=""_blank"" class=""external"" rel=""nofollow"">Europe PMC</a> <a href=""https://scholia.toolforge.org/pubmed/27344019"" target=""_blank"" class=""external"" rel=""nofollow"">Scholia</a>"
27427983	Pubmed	"Destabilized SMC5/6 complex leads to chromosome breakage syndrome with severe lung disease. van der Crabben SN, Hennus MP, McGregor GA, Ritter DI, Nagamani SCS, Wells OS, et al. J Clin Invest. 2016 Aug 1;126(8):2881–92.  <a href=""http://www.ncbi.nlm.nih.gov/pubmed/27427983"" target=""_blank"" class=""external"" rel=""nofollow"">PubMed</a> <a href=""https://europepmc.org/abstract/MED/27427983"" target=""_blank"" class=""external"" rel=""nofollow"">Europe PMC</a> <a href=""https://scholia.toolforge.org/pubmed/27427983"" target=""_blank"" class=""external"" rel=""nofollow"">Scholia</a>"
31473225	Pubmed	"Sperm Flagellar 1 Binds Actin in Intestinal Epithelial Cells and Contributes to Formation of Filopodia and Lamellipodia. Tapia R, Perez-Yepez EA, Carlino MJ, Karandikar UC, Kralicek SE, Estes MK, et al. Gastroenterology. 2019 Dec;157(6):1544-1555.e3.  <a href=""http://www.ncbi.nlm.nih.gov/pubmed/31473225"" target=""_blank"" class=""external"" rel=""nofollow"">PubMed</a> <a href=""https://europepmc.org/abstract/MED/31473225"" target=""_blank"" class=""external"" rel=""nofollow"">Europe PMC</a> <a href=""https://scholia.toolforge.org/pubmed/31473225"" target=""_blank"" class=""external"" rel=""nofollow"">Scholia</a>"
32783947	Pubmed	"NACHO Engages N-Glycosylation ER Chaperone Pathways for α7 Nicotinic Receptor Assembly. Kweon HJ, Gu S, Witham E, Dhara M, Yu H, Mandon ED, et al. Cell Rep. 2020 Aug 11;32(6):108025.  <a href=""http://www.ncbi.nlm.nih.gov/pubmed/32783947"" target=""_blank"" class=""external"" rel=""nofollow"">PubMed</a> <a href=""https://europepmc.org/abstract/MED/32783947"" target=""_blank"" class=""external"" rel=""nofollow"">Europe PMC</a> <a href=""https://scholia.toolforge.org/pubmed/32783947"" target=""_blank"" class=""external"" rel=""nofollow"">Scholia</a>"
