ID	Database	Citation
7947717	Pubmed	"A human opsin-related gene that encodes a retinaldehyde-binding protein. Shen D, Jiang M, Hao W, Tao L, Salazar M, Fong HK. Biochemistry. 1994 Nov 8;33(44):13117–25.  <a href=""http://www.ncbi.nlm.nih.gov/pubmed/7947717"" target=""_blank"" class=""external"" rel=""nofollow"">PubMed</a> <a href=""https://europepmc.org/abstract/MED/7947717"" target=""_blank"" class=""external"" rel=""nofollow"">Europe PMC</a> <a href=""https://scholia.toolforge.org/pubmed/7947717"" target=""_blank"" class=""external"" rel=""nofollow"">Scholia</a>"
9275162	Pubmed	"Neuregulin-3 (NRG3): a novel neural tissue-enriched protein that binds and activates ErbB4. Zhang D, Sliwkowski MX, Mark M, Frantz G, Akita R, Sun Y, et al. Proc Natl Acad Sci U S A. 1997 Sep 2;94(18):9562–7.  <a href=""http://www.ncbi.nlm.nih.gov/pubmed/9275162"" target=""_blank"" class=""external"" rel=""nofollow"">PubMed</a> <a href=""https://europepmc.org/abstract/MED/9275162"" target=""_blank"" class=""external"" rel=""nofollow"">Europe PMC</a> <a href=""https://scholia.toolforge.org/pubmed/9275162"" target=""_blank"" class=""external"" rel=""nofollow"">Scholia</a>"
9663660	Pubmed	"BRAM1, a BMP receptor-associated molecule involved in BMP signalling. Kurozumi K, Nishita M, Yamaguchi K, Fujita T, Ueno N, Shibuya H. Genes Cells. 1998 Apr;3(4):257–64.  <a href=""http://www.ncbi.nlm.nih.gov/pubmed/9663660"" target=""_blank"" class=""external"" rel=""nofollow"">PubMed</a> <a href=""https://europepmc.org/abstract/MED/9663660"" target=""_blank"" class=""external"" rel=""nofollow"">Europe PMC</a> <a href=""https://scholia.toolforge.org/pubmed/9663660"" target=""_blank"" class=""external"" rel=""nofollow"">Scholia</a>"
10037690	Pubmed	"The endogenous chromophore of retinal G protein-coupled receptor opsin from the pigment epithelium. Hao W, Fong HK. J Biol Chem. 1999 Mar 5;274(10):6085–90.  <a href=""http://www.ncbi.nlm.nih.gov/pubmed/10037690"" target=""_blank"" class=""external"" rel=""nofollow"">PubMed</a> <a href=""https://europepmc.org/abstract/MED/10037690"" target=""_blank"" class=""external"" rel=""nofollow"">Europe PMC</a> <a href=""https://scholia.toolforge.org/pubmed/10037690"" target=""_blank"" class=""external"" rel=""nofollow"">Scholia</a>"
10391924	Pubmed	"Cypher, a striated muscle-restricted PDZ and LIM domain-containing protein, binds to alpha-actinin-2 and protein kinase C. Zhou Q, Ruiz-Lozano P, Martone ME, Chen J. J Biol Chem. 1999 Jul 9;274(28):19807–13.  <a href=""http://www.ncbi.nlm.nih.gov/pubmed/10391924"" target=""_blank"" class=""external"" rel=""nofollow"">PubMed</a> <a href=""https://europepmc.org/abstract/MED/10391924"" target=""_blank"" class=""external"" rel=""nofollow"">Europe PMC</a> <a href=""https://scholia.toolforge.org/pubmed/10391924"" target=""_blank"" class=""external"" rel=""nofollow"">Scholia</a>"
10677294	Pubmed	"Methionine adenosyltransferase I/III deficiency: novel mutations and clinical variations. Chamberlin ME, Ubagai T, Mudd SH, Thomas J, Pao VY, Nguyen TK, et al. Am J Hum Genet. 2000 Feb;66(2):347–55.  <a href=""http://www.ncbi.nlm.nih.gov/pubmed/10677294"" target=""_blank"" class=""external"" rel=""nofollow"">PubMed</a> <a href=""https://europepmc.org/abstract/MED/10677294"" target=""_blank"" class=""external"" rel=""nofollow"">Europe PMC</a> <a href=""https://scholia.toolforge.org/pubmed/10677294"" target=""_blank"" class=""external"" rel=""nofollow"">Scholia</a>"
11032875	Pubmed	"Nerve tissue-specific (GLUD2) and housekeeping (GLUD1) human glutamate dehydrogenases are regulated by distinct allosteric mechanisms: implications for biologic function. Plaitakis A, Metaxari M, Shashidharan P. J Neurochem. 2000 Nov;75(5):1862–9.  <a href=""http://www.ncbi.nlm.nih.gov/pubmed/11032875"" target=""_blank"" class=""external"" rel=""nofollow"">PubMed</a> <a href=""https://europepmc.org/abstract/MED/11032875"" target=""_blank"" class=""external"" rel=""nofollow"">Europe PMC</a> <a href=""https://scholia.toolforge.org/pubmed/11032875"" target=""_blank"" class=""external"" rel=""nofollow"">Scholia</a>"
11263668	Pubmed	"The crystal structure of the BMP-2:BMPR-IA complex and the generation of BMP-2 antagonists. Nickel J, Dreyer MK, Kirsch T, Sebald W. J Bone Joint Surg Am. 2001;83-A Suppl 1(Pt 1):S7-14.  <a href=""http://www.ncbi.nlm.nih.gov/pubmed/11263668"" target=""_blank"" class=""external"" rel=""nofollow"">PubMed</a> <a href=""https://europepmc.org/abstract/MED/11263668"" target=""_blank"" class=""external"" rel=""nofollow"">Europe PMC</a> <a href=""https://scholia.toolforge.org/pubmed/11263668"" target=""_blank"" class=""external"" rel=""nofollow"">Scholia</a>"
14576821	Pubmed	"Breast cancer-specific gene 1 interacts with the mitotic checkpoint kinase BubR1. Gupta A, Inaba S, Wong OK, Fang G, Liu J. Oncogene. 2003 Oct 23;22(48):7593–9.  <a href=""http://www.ncbi.nlm.nih.gov/pubmed/14576821"" target=""_blank"" class=""external"" rel=""nofollow"">PubMed</a> <a href=""https://europepmc.org/abstract/MED/14576821"" target=""_blank"" class=""external"" rel=""nofollow"">Europe PMC</a> <a href=""https://scholia.toolforge.org/pubmed/14576821"" target=""_blank"" class=""external"" rel=""nofollow"">Scholia</a>"
15090551	Pubmed	"Bone morphogenetic protein type IA receptor signaling regulates postnatal osteoblast function and bone remodeling. Mishina Y, Starbuck MW, Gentile MA, Fukuda T, Kasparcova V, Seedor JG, et al. J Biol Chem. 2004 Jun 25;279(26):27560–6.  <a href=""http://www.ncbi.nlm.nih.gov/pubmed/15090551"" target=""_blank"" class=""external"" rel=""nofollow"">PubMed</a> <a href=""https://europepmc.org/abstract/MED/15090551"" target=""_blank"" class=""external"" rel=""nofollow"">Europe PMC</a> <a href=""https://scholia.toolforge.org/pubmed/15090551"" target=""_blank"" class=""external"" rel=""nofollow"">Scholia</a>"
15351706	Pubmed	"Interaction of the BMPR-IA tumor suppressor with a developmentally relevant splicing factor. Nishanian TG, Waldman T. Biochem Biophys Res Commun. 2004 Oct 8;323(1):91–7.  <a href=""http://www.ncbi.nlm.nih.gov/pubmed/15351706"" target=""_blank"" class=""external"" rel=""nofollow"">PubMed</a> <a href=""https://europepmc.org/abstract/MED/15351706"" target=""_blank"" class=""external"" rel=""nofollow"">Europe PMC</a> <a href=""https://scholia.toolforge.org/pubmed/15351706"" target=""_blank"" class=""external"" rel=""nofollow"">Scholia</a>"
15674244	Pubmed	"Addition of human melanopsin renders mammalian cells photoresponsive. Melyan Z, Tarttelin EE, Bellingham J, Lucas RJ, Hankins MW. Nature. 2005 Feb 17;433(7027):741–5.  <a href=""http://www.ncbi.nlm.nih.gov/pubmed/15674244"" target=""_blank"" class=""external"" rel=""nofollow"">PubMed</a> <a href=""https://europepmc.org/abstract/MED/15674244"" target=""_blank"" class=""external"" rel=""nofollow"">Europe PMC</a> <a href=""https://scholia.toolforge.org/pubmed/15674244"" target=""_blank"" class=""external"" rel=""nofollow"">Scholia</a>"
16959573	Pubmed	"SIRT4 inhibits glutamate dehydrogenase and opposes the effects of calorie restriction in pancreatic beta cells. Haigis MC, Mostoslavsky R, Haigis KM, Fahie K, Christodoulou DC, Murphy AJ, et al. Cell. 2006 Sep 8;126(5):941–54.  <a href=""http://www.ncbi.nlm.nih.gov/pubmed/16959573"" target=""_blank"" class=""external"" rel=""nofollow"">PubMed</a> <a href=""https://europepmc.org/abstract/MED/16959573"" target=""_blank"" class=""external"" rel=""nofollow"">Europe PMC</a> <a href=""https://scholia.toolforge.org/pubmed/16959573"" target=""_blank"" class=""external"" rel=""nofollow"">Scholia</a>"
19545932	Pubmed	"Interaction of SH3P13 and DYDC1 protein: a germ cell component that regulates acrosome biogenesis during spermiogenesis. Li S, Qiao Y, Di Q, Le X, Zhang L, Zhang X, et al. Eur J Cell Biol. 2009 Sep;88(9):509–20.  <a href=""http://www.ncbi.nlm.nih.gov/pubmed/19545932"" target=""_blank"" class=""external"" rel=""nofollow"">PubMed</a> <a href=""https://europepmc.org/abstract/MED/19545932"" target=""_blank"" class=""external"" rel=""nofollow"">Europe PMC</a> <a href=""https://scholia.toolforge.org/pubmed/19545932"" target=""_blank"" class=""external"" rel=""nofollow"">Scholia</a>"
19909368	Pubmed	"The T-cell-specific adapter protein family: TSAd, ALX, and SH2D4A/SH2D4B. Lapinski PE, Oliver JA, Bodie JN, Marti F, King PD. Immunol Rev. 2009 Nov;232(1):240–54.  <a href=""http://www.ncbi.nlm.nih.gov/pubmed/19909368"" target=""_blank"" class=""external"" rel=""nofollow"">PubMed</a> <a href=""https://europepmc.org/abstract/MED/19909368"" target=""_blank"" class=""external"" rel=""nofollow"">Europe PMC</a> <a href=""https://scholia.toolforge.org/pubmed/19909368"" target=""_blank"" class=""external"" rel=""nofollow"">Scholia</a>"
19951071	Pubmed	"PAMM: a redox regulatory protein that modulates osteoclast differentiation. Xu Y, Morse LR, da Silva RAB, Odgren PR, Sasaki H, Stashenko P, et al. Antioxid Redox Signal. 2010 Jul 1;13(1):27–37.  <a href=""http://www.ncbi.nlm.nih.gov/pubmed/19951071"" target=""_blank"" class=""external"" rel=""nofollow"">PubMed</a> <a href=""https://europepmc.org/abstract/MED/19951071"" target=""_blank"" class=""external"" rel=""nofollow"">Europe PMC</a> <a href=""https://scholia.toolforge.org/pubmed/19951071"" target=""_blank"" class=""external"" rel=""nofollow"">Scholia</a>"
22020326	Pubmed	"MULTIMERIN2 impairs tumor angiogenesis and growth by interfering with VEGF-A/VEGFR2 pathway. Lorenzon E, Colladel R, Andreuzzi E, Marastoni S, Todaro F, Schiappacassi M, et al. Oncogene. 2012 Jun 28;31(26):3136–47.  <a href=""http://www.ncbi.nlm.nih.gov/pubmed/22020326"" target=""_blank"" class=""external"" rel=""nofollow"">PubMed</a> <a href=""https://europepmc.org/abstract/MED/22020326"" target=""_blank"" class=""external"" rel=""nofollow"">Europe PMC</a> <a href=""https://scholia.toolforge.org/pubmed/22020326"" target=""_blank"" class=""external"" rel=""nofollow"">Scholia</a>"
23035126	Pubmed	"The TspanC8 subgroup of tetraspanins interacts with A disintegrin and metalloprotease 10 (ADAM10) and regulates its maturation and cell surface expression. Haining EJ, Yang J, Bailey RL, Khan K, Collier R, Tsai S, et al. J Biol Chem. 2012 Nov 16;287(47):39753–65.  <a href=""http://www.ncbi.nlm.nih.gov/pubmed/23035126"" target=""_blank"" class=""external"" rel=""nofollow"">PubMed</a> <a href=""https://europepmc.org/abstract/MED/23035126"" target=""_blank"" class=""external"" rel=""nofollow"">Europe PMC</a> <a href=""https://scholia.toolforge.org/pubmed/23035126"" target=""_blank"" class=""external"" rel=""nofollow"">Scholia</a>"
23239344	Pubmed	"A Novel pro-adipogenesis factor abundant in adipose tissues and over-expressed in obesity acts upstream of PPARγ and C/EBPα. Ni Y, Ji C, Wang B, Qiu J, Wang J, Guo X. J Bioenerg Biomembr. 2013 Jun;45(3):219–28.  <a href=""http://www.ncbi.nlm.nih.gov/pubmed/23239344"" target=""_blank"" class=""external"" rel=""nofollow"">PubMed</a> <a href=""https://europepmc.org/abstract/MED/23239344"" target=""_blank"" class=""external"" rel=""nofollow"">Europe PMC</a> <a href=""https://scholia.toolforge.org/pubmed/23239344"" target=""_blank"" class=""external"" rel=""nofollow"">Scholia</a>"
23993197	Pubmed	"Loss-of-function mutations in RSPH1 cause primary ciliary dyskinesia with central-complex and radial-spoke defects. Kott E, Legendre M, Copin B, Papon JF, Dastot-Le Moal F, Montantin G, et al. Am J Hum Genet. 2013 Sep 5;93(3):561–70.  <a href=""http://www.ncbi.nlm.nih.gov/pubmed/23993197"" target=""_blank"" class=""external"" rel=""nofollow"">PubMed</a> <a href=""https://europepmc.org/abstract/MED/23993197"" target=""_blank"" class=""external"" rel=""nofollow"">Europe PMC</a> <a href=""https://scholia.toolforge.org/pubmed/23993197"" target=""_blank"" class=""external"" rel=""nofollow"">Scholia</a>"
23996002	Pubmed	"Cypher/ZASP is a novel A-kinase anchoring protein. Lin C, Guo X, Lange S, Liu J, Ouyang K, Yin X, et al. J Biol Chem. 2013 Oct 11;288(41):29403–13.  <a href=""http://www.ncbi.nlm.nih.gov/pubmed/23996002"" target=""_blank"" class=""external"" rel=""nofollow"">PubMed</a> <a href=""https://europepmc.org/abstract/MED/23996002"" target=""_blank"" class=""external"" rel=""nofollow"">Europe PMC</a> <a href=""https://scholia.toolforge.org/pubmed/23996002"" target=""_blank"" class=""external"" rel=""nofollow"">Scholia</a>"
25351403	Pubmed	"CSBF/C10orf99, a novel potential cytokine, inhibits colon cancer cell growth through inducing G1 arrest. Pan W, Cheng Y, Zhang H, Liu B, Mo X, Li T, et al. Sci Rep. 2014 Oct 29;4:6812.  <a href=""http://www.ncbi.nlm.nih.gov/pubmed/25351403"" target=""_blank"" class=""external"" rel=""nofollow"">PubMed</a> <a href=""https://europepmc.org/abstract/MED/25351403"" target=""_blank"" class=""external"" rel=""nofollow"">Europe PMC</a> <a href=""https://scholia.toolforge.org/pubmed/25351403"" target=""_blank"" class=""external"" rel=""nofollow"">Scholia</a>"
26438880	Pubmed	"Adipocyte-derived PAMM suppresses macrophage inflammation by inhibiting MAPK signalling. Guo F, He H, Fu ZC, Huang S, Chen T, Papasian CJ, et al. Biochem J. 2015 Dec 15;472(3):309–18.  <a href=""http://www.ncbi.nlm.nih.gov/pubmed/26438880"" target=""_blank"" class=""external"" rel=""nofollow"">PubMed</a> <a href=""https://europepmc.org/abstract/MED/26438880"" target=""_blank"" class=""external"" rel=""nofollow"">Europe PMC</a> <a href=""https://scholia.toolforge.org/pubmed/26438880"" target=""_blank"" class=""external"" rel=""nofollow"">Scholia</a>"
26668317	Pubmed	"TspanC8 Tetraspanins and A Disintegrin and Metalloprotease 10 (ADAM10) Interact via Their Extracellular Regions: EVIDENCE FOR DISTINCT BINDING MECHANISMS FOR DIFFERENT TspanC8 PROTEINS. Noy PJ, Yang J, Reyat JS, Matthews AL, Charlton AE, Furmston J, et al. J Biol Chem. 2016 Feb 12;291(7):3145–57.  <a href=""http://www.ncbi.nlm.nih.gov/pubmed/26668317"" target=""_blank"" class=""external"" rel=""nofollow"">PubMed</a> <a href=""https://europepmc.org/abstract/MED/26668317"" target=""_blank"" class=""external"" rel=""nofollow"">Europe PMC</a> <a href=""https://scholia.toolforge.org/pubmed/26668317"" target=""_blank"" class=""external"" rel=""nofollow"">Scholia</a>"
26686862	Pubmed	"TspanC8 tetraspanins differentially regulate the cleavage of ADAM10 substrates, Notch activation and ADAM10 membrane compartmentalization. Jouannet S, Saint-Pol J, Fernandez L, Nguyen V, Charrin S, Boucheix C, et al. Cell Mol Life Sci. 2016 May;73(9):1895–915.  <a href=""http://www.ncbi.nlm.nih.gov/pubmed/26686862"" target=""_blank"" class=""external"" rel=""nofollow"">PubMed</a> <a href=""https://europepmc.org/abstract/MED/26686862"" target=""_blank"" class=""external"" rel=""nofollow"">Europe PMC</a> <a href=""https://scholia.toolforge.org/pubmed/26686862"" target=""_blank"" class=""external"" rel=""nofollow"">Scholia</a>"
26895425	Pubmed	"Releasing Activity Disengages Cohesin’s Smc3/Scc1 Interface in a Process Blocked by Acetylation. Beckouët F, Srinivasan M, Roig MB, Chan KL, Scheinost JC, Batty P, et al. Mol Cell. 2016 Feb 18;61(4):563–74.  <a href=""http://www.ncbi.nlm.nih.gov/pubmed/26895425"" target=""_blank"" class=""external"" rel=""nofollow"">PubMed</a> <a href=""https://europepmc.org/abstract/MED/26895425"" target=""_blank"" class=""external"" rel=""nofollow"">Europe PMC</a> <a href=""https://scholia.toolforge.org/pubmed/26895425"" target=""_blank"" class=""external"" rel=""nofollow"">Scholia</a>"
28900043	Pubmed	"A natural ligand for the orphan receptor GPR15 modulates lymphocyte recruitment to epithelia. Suply T, Hannedouche S, Carte N, Li J, Grosshans B, Schaefer M, et al. Sci Signal. 2017 Sep 12;10(496):eaal0180.  <a href=""http://www.ncbi.nlm.nih.gov/pubmed/28900043"" target=""_blank"" class=""external"" rel=""nofollow"">PubMed</a> <a href=""https://europepmc.org/abstract/MED/28900043"" target=""_blank"" class=""external"" rel=""nofollow"">Europe PMC</a> <a href=""https://scholia.toolforge.org/pubmed/28900043"" target=""_blank"" class=""external"" rel=""nofollow"">Scholia</a>"
28936214	Pubmed	"A Mucosal and Cutaneous Chemokine Ligand for the Lymphocyte Chemoattractant Receptor GPR15. Ocón B, Pan J, Dinh TT, Chen W, Ballet R, Bscheider M, et al. Front Immunol. 2017 Sep 7;8:1111.  <a href=""http://www.ncbi.nlm.nih.gov/pubmed/28936214"" target=""_blank"" class=""external"" rel=""nofollow"">PubMed</a> <a href=""https://europepmc.org/abstract/MED/28936214"" target=""_blank"" class=""external"" rel=""nofollow"">Europe PMC</a> <a href=""https://scholia.toolforge.org/pubmed/28936214"" target=""_blank"" class=""external"" rel=""nofollow"">Scholia</a>"
29656893	Pubmed	"DNA Repair Network Analysis Reveals Shieldin as a Key Regulator of NHEJ and PARP Inhibitor Sensitivity. Gupta R, Somyajit K, Narita T, Maskey E, Stanlie A, Kremer M, et al. Cell. 2018 May 3;173(4):972-988.e23.  <a href=""http://www.ncbi.nlm.nih.gov/pubmed/29656893"" target=""_blank"" class=""external"" rel=""nofollow"">PubMed</a> <a href=""https://europepmc.org/abstract/MED/29656893"" target=""_blank"" class=""external"" rel=""nofollow"">Europe PMC</a> <a href=""https://scholia.toolforge.org/pubmed/29656893"" target=""_blank"" class=""external"" rel=""nofollow"">Scholia</a>"
29789392	Pubmed	"FAM35A associates with REV7 and modulates DNA damage responses of normal and BRCA1-defective cells. Tomida J, Takata KI, Bhetawal S, Person MD, Chao HP, Tang DG, et al. EMBO J. 2018 Jun 15;37(12):e99543.  <a href=""http://www.ncbi.nlm.nih.gov/pubmed/29789392"" target=""_blank"" class=""external"" rel=""nofollow"">PubMed</a> <a href=""https://europepmc.org/abstract/MED/29789392"" target=""_blank"" class=""external"" rel=""nofollow"">Europe PMC</a> <a href=""https://scholia.toolforge.org/pubmed/29789392"" target=""_blank"" class=""external"" rel=""nofollow"">Scholia</a>"
31577909	Pubmed	"Organization of Chromosomal DNA by SMC Complexes. Yatskevich S, Rhodes J, Nasmyth K. Annu Rev Genet. 2019 Dec 3;53:445–82.  <a href=""http://www.ncbi.nlm.nih.gov/pubmed/31577909"" target=""_blank"" class=""external"" rel=""nofollow"">PubMed</a> <a href=""https://europepmc.org/abstract/MED/31577909"" target=""_blank"" class=""external"" rel=""nofollow"">Europe PMC</a> <a href=""https://scholia.toolforge.org/pubmed/31577909"" target=""_blank"" class=""external"" rel=""nofollow"">Scholia</a>"
35704588	Pubmed	"GPR15L is an epithelial inflammation-derived pruritogen. Tseng PY, Hoon MA. Sci Adv. 2022 Jun 17;8(24):eabm7342.  <a href=""http://www.ncbi.nlm.nih.gov/pubmed/35704588"" target=""_blank"" class=""external"" rel=""nofollow"">PubMed</a> <a href=""https://europepmc.org/abstract/MED/35704588"" target=""_blank"" class=""external"" rel=""nofollow"">Europe PMC</a> <a href=""https://scholia.toolforge.org/pubmed/35704588"" target=""_blank"" class=""external"" rel=""nofollow"">Scholia</a>"
35912435	Pubmed	"Regulation of mitochondrial proteostasis by the proton gradient. Patron M, Tarasenko D, Nolte H, Kroczek L, Ghosh M, Ohba Y, et al. EMBO J. 2022 Aug 16;41(16):e110476.  <a href=""http://www.ncbi.nlm.nih.gov/pubmed/35912435"" target=""_blank"" class=""external"" rel=""nofollow"">PubMed</a> <a href=""https://europepmc.org/abstract/MED/35912435"" target=""_blank"" class=""external"" rel=""nofollow"">Europe PMC</a> <a href=""https://scholia.toolforge.org/pubmed/35912435"" target=""_blank"" class=""external"" rel=""nofollow"">Scholia</a>"
36321428	Pubmed	"TMBIM5 is the Ca2+ /H+ antiporter of mammalian mitochondria. Austin S, Mekis R, Mohammed SEM, Scalise M, Wang WA, Galluccio M, et al. EMBO Rep. 2022 Dec 6;23(12):e54978.  <a href=""http://www.ncbi.nlm.nih.gov/pubmed/36321428"" target=""_blank"" class=""external"" rel=""nofollow"">PubMed</a> <a href=""https://europepmc.org/abstract/MED/36321428"" target=""_blank"" class=""external"" rel=""nofollow"">Europe PMC</a> <a href=""https://scholia.toolforge.org/pubmed/36321428"" target=""_blank"" class=""external"" rel=""nofollow"">Scholia</a>"
