ID	Database	Citation
1533953	Pubmed	"Mitochondrial genetics: a paradigm for aging and degenerative diseases? Wallace DC. Science. 1992 May 1;256(5057):628–32.  <a href=""http://www.ncbi.nlm.nih.gov/pubmed/1533953"" target=""_blank"" class=""external"" rel=""nofollow"">PubMed</a> <a href=""https://europepmc.org/abstract/MED/1533953"" target=""_blank"" class=""external"" rel=""nofollow"">Europe PMC</a> <a href=""https://scholia.toolforge.org/pubmed/1533953"" target=""_blank"" class=""external"" rel=""nofollow"">Scholia</a>"
7668820	Pubmed	"Aging, energy, and oxidative stress in neurodegenerative diseases. Beal MF. Ann Neurol. 1995 Sep;38(3):357–66.  <a href=""http://www.ncbi.nlm.nih.gov/pubmed/7668820"" target=""_blank"" class=""external"" rel=""nofollow"">PubMed</a> <a href=""https://europepmc.org/abstract/MED/7668820"" target=""_blank"" class=""external"" rel=""nofollow"">Europe PMC</a> <a href=""https://scholia.toolforge.org/pubmed/7668820"" target=""_blank"" class=""external"" rel=""nofollow"">Scholia</a>"
11015200	Pubmed	"Mapping the functional domains of elongation factor-2 kinase. Pavur KS, Petrov AN, Ryazanov AG. Biochemistry. 2000 Oct 10;39(40):12216–24.  <a href=""http://www.ncbi.nlm.nih.gov/pubmed/11015200"" target=""_blank"" class=""external"" rel=""nofollow"">PubMed</a> <a href=""https://europepmc.org/abstract/MED/11015200"" target=""_blank"" class=""external"" rel=""nofollow"">Europe PMC</a> <a href=""https://scholia.toolforge.org/pubmed/11015200"" target=""_blank"" class=""external"" rel=""nofollow"">Scholia</a>"
11278159	Pubmed	"Evidence for a mitochondrial oxidative phosphorylation defect in brains from patients with schizophrenia. Maurer I, Zierz S, Möller H. Schizophr Res. 2001 Mar 1;48(1):125–36.  <a href=""http://www.ncbi.nlm.nih.gov/pubmed/11278159"" target=""_blank"" class=""external"" rel=""nofollow"">PubMed</a> <a href=""https://europepmc.org/abstract/MED/11278159"" target=""_blank"" class=""external"" rel=""nofollow"">Europe PMC</a> <a href=""https://scholia.toolforge.org/pubmed/11278159"" target=""_blank"" class=""external"" rel=""nofollow"">Scholia</a>"
12171600	Pubmed	"Stress-induced regulation of eukaryotic elongation factor 2 kinase by SB 203580-sensitive and -insensitive pathways. Knebel A, Haydon CE, Morrice N, Cohen P. Biochem J. 2002 Oct 15;367(Pt 2):525–32.  <a href=""http://www.ncbi.nlm.nih.gov/pubmed/12171600"" target=""_blank"" class=""external"" rel=""nofollow"">PubMed</a> <a href=""https://europepmc.org/abstract/MED/12171600"" target=""_blank"" class=""external"" rel=""nofollow"">Europe PMC</a> <a href=""https://scholia.toolforge.org/pubmed/12171600"" target=""_blank"" class=""external"" rel=""nofollow"">Scholia</a>"
12194824	Pubmed	"Activation of AMP-activated protein kinase leads to the phosphorylation of elongation factor 2 and an inhibition of protein synthesis. Horman S, Browne G, Krause U, Patel J, Vertommen D, Bertrand L, et al. Curr Biol. 2002 Aug 20;12(16):1419–23.  <a href=""http://www.ncbi.nlm.nih.gov/pubmed/12194824"" target=""_blank"" class=""external"" rel=""nofollow"">PubMed</a> <a href=""https://europepmc.org/abstract/MED/12194824"" target=""_blank"" class=""external"" rel=""nofollow"">Europe PMC</a> <a href=""https://scholia.toolforge.org/pubmed/12194824"" target=""_blank"" class=""external"" rel=""nofollow"">Scholia</a>"
18337751	Pubmed	"cdc2-cyclin B regulates eEF2 kinase activity in a cell cycle- and amino acid-dependent manner. Smith EM, Proud CG. EMBO J. 2008 Apr 9;27(7):1005–16.  <a href=""http://www.ncbi.nlm.nih.gov/pubmed/18337751"" target=""_blank"" class=""external"" rel=""nofollow"">PubMed</a> <a href=""https://europepmc.org/abstract/MED/18337751"" target=""_blank"" class=""external"" rel=""nofollow"">Europe PMC</a> <a href=""https://scholia.toolforge.org/pubmed/18337751"" target=""_blank"" class=""external"" rel=""nofollow"">Scholia</a>"
21112387	Pubmed	"The channel-kinase TRPM7 regulates phosphorylation of the translational factor eEF2 via eEF2-k. Perraud AL, Zhao X, Ryazanov AG, Schmitz C. Cell Signal. 2011 Mar;23(3):586–93.  <a href=""http://www.ncbi.nlm.nih.gov/pubmed/21112387"" target=""_blank"" class=""external"" rel=""nofollow"">PubMed</a> <a href=""https://europepmc.org/abstract/MED/21112387"" target=""_blank"" class=""external"" rel=""nofollow"">Europe PMC</a> <a href=""https://scholia.toolforge.org/pubmed/21112387"" target=""_blank"" class=""external"" rel=""nofollow"">Scholia</a>"
21979464	Pubmed	"TRAP1 and the proteasome regulatory particle TBP7/Rpt3 interact in the endoplasmic reticulum and control cellular ubiquitination of specific mitochondrial proteins. Amoroso MR, Matassa DS, Laudiero G, Egorova AV, Polishchuk RS, Maddalena F, et al. Cell Death Differ. 2012 Apr;19(4):592–604.  <a href=""http://www.ncbi.nlm.nih.gov/pubmed/21979464"" target=""_blank"" class=""external"" rel=""nofollow"">PubMed</a> <a href=""https://europepmc.org/abstract/MED/21979464"" target=""_blank"" class=""external"" rel=""nofollow"">Europe PMC</a> <a href=""https://scholia.toolforge.org/pubmed/21979464"" target=""_blank"" class=""external"" rel=""nofollow"">Scholia</a>"
22329831	Pubmed	"Calcium/calmodulin stimulates the autophosphorylation of elongation factor 2 kinase on Thr-348 and Ser-500 to regulate its activity and calcium dependence. Tavares CDJ, O’Brien JP, Abramczyk O, Devkota AK, Shores KS, Ferguson SB, et al. Biochemistry. 2012 Mar 20;51(11):2232–45.  <a href=""http://www.ncbi.nlm.nih.gov/pubmed/22329831"" target=""_blank"" class=""external"" rel=""nofollow"">PubMed</a> <a href=""https://europepmc.org/abstract/MED/22329831"" target=""_blank"" class=""external"" rel=""nofollow"">Europe PMC</a> <a href=""https://scholia.toolforge.org/pubmed/22329831"" target=""_blank"" class=""external"" rel=""nofollow"">Scholia</a>"
23184662	Pubmed	"Phosphorylation of eukaryotic elongation factor 2 (eEF2) by cyclin A-cyclin-dependent kinase 2 regulates its inhibition by eEF2 kinase. Hizli AA, Chi Y, Swanger J, Carter JH, Liao Y, Welcker M, et al. Mol Cell Biol. 2013 Feb;33(3):596–604.  <a href=""http://www.ncbi.nlm.nih.gov/pubmed/23184662"" target=""_blank"" class=""external"" rel=""nofollow"">PubMed</a> <a href=""https://europepmc.org/abstract/MED/23184662"" target=""_blank"" class=""external"" rel=""nofollow"">Europe PMC</a> <a href=""https://scholia.toolforge.org/pubmed/23184662"" target=""_blank"" class=""external"" rel=""nofollow"">Scholia</a>"
28844695	Pubmed	"Architecture of Human Mitochondrial Respiratory Megacomplex I2III2IV2. Guo R, Zong S, Wu M, Gu J, Yang M. Cell. 2017 Sep 7;170(6):1247-1257.e12.  <a href=""http://www.ncbi.nlm.nih.gov/pubmed/28844695"" target=""_blank"" class=""external"" rel=""nofollow"">PubMed</a> <a href=""https://europepmc.org/abstract/MED/28844695"" target=""_blank"" class=""external"" rel=""nofollow"">Europe PMC</a> <a href=""https://scholia.toolforge.org/pubmed/28844695"" target=""_blank"" class=""external"" rel=""nofollow"">Scholia</a>"
29401421	Pubmed	"CRISPR Screens Uncover Genes that Regulate Target Cell Sensitivity to the Morphogen Sonic Hedgehog. Pusapati GV, Kong JH, Patel BB, Krishnan A, Sagner A, Kinnebrew M, et al. Dev Cell. 2018 Jan 22;44(2):271.  <a href=""http://www.ncbi.nlm.nih.gov/pubmed/29401421"" target=""_blank"" class=""external"" rel=""nofollow"">PubMed</a> <a href=""https://europepmc.org/abstract/MED/29401421"" target=""_blank"" class=""external"" rel=""nofollow"">Europe PMC</a> <a href=""https://scholia.toolforge.org/pubmed/29401421"" target=""_blank"" class=""external"" rel=""nofollow"">Scholia</a>"
30078018	Pubmed	"A Novel Tumor-Suppressor, CDH18, Inhibits Glioma Cell Invasiveness Via UQCRC2 and Correlates with the Prognosis of Glioma Patients. Bai YH, Zhan YB, Yu B, Wang WW, Wang L, Zhou JQ, et al. Cell Physiol Biochem. 2018;48(4):1755–70.  <a href=""http://www.ncbi.nlm.nih.gov/pubmed/30078018"" target=""_blank"" class=""external"" rel=""nofollow"">PubMed</a> <a href=""https://europepmc.org/abstract/MED/30078018"" target=""_blank"" class=""external"" rel=""nofollow"">Europe PMC</a> <a href=""https://scholia.toolforge.org/pubmed/30078018"" target=""_blank"" class=""external"" rel=""nofollow"">Scholia</a>"
31536960	Pubmed	"Rewiring of the Human Mitochondrial Interactome during Neuronal Reprogramming Reveals Regulators of the Respirasome and Neurogenesis. Moutaoufik MT, Malty R, Amin S, Zhang Q, Phanse S, Gagarinova A, et al. iScience. 2019 Sep 27;19:1114–32.  <a href=""http://www.ncbi.nlm.nih.gov/pubmed/31536960"" target=""_blank"" class=""external"" rel=""nofollow"">PubMed</a> <a href=""https://europepmc.org/abstract/MED/31536960"" target=""_blank"" class=""external"" rel=""nofollow"">Europe PMC</a> <a href=""https://scholia.toolforge.org/pubmed/31536960"" target=""_blank"" class=""external"" rel=""nofollow"">Scholia</a>"
34532346	Pubmed	"Insights Into the Pathologic Roles and Regulation of Eukaryotic Elongation Factor-2 Kinase. Ballard DJ, Peng HY, Das JK, Kumar A, Wang L, Ren Y, et al. Front Mol Biosci. 2021 Aug 31;8:727863.  <a href=""http://www.ncbi.nlm.nih.gov/pubmed/34532346"" target=""_blank"" class=""external"" rel=""nofollow"">PubMed</a> <a href=""https://europepmc.org/abstract/MED/34532346"" target=""_blank"" class=""external"" rel=""nofollow"">Europe PMC</a> <a href=""https://scholia.toolforge.org/pubmed/34532346"" target=""_blank"" class=""external"" rel=""nofollow"">Scholia</a>"
