ID	Database	Citation
21070852	Pubmed	"Association of supervillin with KIR2DL1 regulates the inhibitory signaling of natural killer cells. Liu HP, Yu MC, Jiang MH, Chen JX, Yan DP, Liu F, et al. Cell Signal. 2011 Feb;23(2):487–96.  <a href=""http://www.ncbi.nlm.nih.gov/pubmed/21070852"" target=""_blank"" class=""external"" rel=""nofollow"">PubMed</a> <a href=""https://europepmc.org/abstract/MED/21070852"" target=""_blank"" class=""external"" rel=""nofollow"">Europe PMC</a> <a href=""https://scholia.toolforge.org/pubmed/21070852"" target=""_blank"" class=""external"" rel=""nofollow"">Scholia</a>"
22786724	Pubmed	"Complementary phosphorylation sites in the adaptor protein SLP-76 promote synergistic activation of natural killer cells. Kim HS, Long EO. Sci Signal. 2012 Jul 10;5(232):ra49.  <a href=""http://www.ncbi.nlm.nih.gov/pubmed/22786724"" target=""_blank"" class=""external"" rel=""nofollow"">PubMed</a> <a href=""https://europepmc.org/abstract/MED/22786724"" target=""_blank"" class=""external"" rel=""nofollow"">Europe PMC</a> <a href=""https://scholia.toolforge.org/pubmed/22786724"" target=""_blank"" class=""external"" rel=""nofollow"">Scholia</a>"
23418871	Pubmed	"Immunoreceptor tyrosine-based inhibitory motif (ITIM)-mediated inhibitory signaling is regulated by sequential phosphorylation mediated by distinct nonreceptor tyrosine kinases: a case study involving PECAM-1. Tourdot BE, Brenner MK, Keough KC, Holyst T, Newman PJ, Newman DK. Biochemistry. 2013 Apr 16;52(15):2597–608.  <a href=""http://www.ncbi.nlm.nih.gov/pubmed/23418871"" target=""_blank"" class=""external"" rel=""nofollow"">PubMed</a> <a href=""https://europepmc.org/abstract/MED/23418871"" target=""_blank"" class=""external"" rel=""nofollow"">Europe PMC</a> <a href=""https://scholia.toolforge.org/pubmed/23418871"" target=""_blank"" class=""external"" rel=""nofollow"">Scholia</a>"
24091323	Pubmed	"Maternal uterine NK cell-activating receptor KIR2DS1 enhances placentation. Xiong S, Sharkey AM, Kennedy PR, Gardner L, Farrell LE, Chazara O, et al. J Clin Invest. 2013 Oct;123(10):4264–72.  <a href=""http://www.ncbi.nlm.nih.gov/pubmed/24091323"" target=""_blank"" class=""external"" rel=""nofollow"">PubMed</a> <a href=""https://europepmc.org/abstract/MED/24091323"" target=""_blank"" class=""external"" rel=""nofollow"">Europe PMC</a> <a href=""https://scholia.toolforge.org/pubmed/24091323"" target=""_blank"" class=""external"" rel=""nofollow"">Scholia</a>"
24091323	Pubmed	"Maternal uterine NK cell-activating receptor KIR2DS1 enhances placentation. Xiong S, Sharkey AM, Kennedy PR, Gardner L, Farrell LE, Chazara O, et al. J Clin Invest. 2013 Oct;123(10):4264–72.  <a href=""http://www.ncbi.nlm.nih.gov/pubmed/24091323"" target=""_blank"" class=""external"" rel=""nofollow"">PubMed</a> <a href=""https://europepmc.org/abstract/MED/24091323"" target=""_blank"" class=""external"" rel=""nofollow"">Europe PMC</a> <a href=""https://scholia.toolforge.org/pubmed/24091323"" target=""_blank"" class=""external"" rel=""nofollow"">Scholia</a>"
26327470	Pubmed	"Vascular Endothelial Growth Factor-A (VEGF-A) Mediates Activin A-Induced Human Trophoblast Endothelial-Like Tube Formation. Li Y, Zhu H, Klausen C, Peng B, Leung PCK. Endocrinology. 2015 Nov;156(11):4257–68.  <a href=""http://www.ncbi.nlm.nih.gov/pubmed/26327470"" target=""_blank"" class=""external"" rel=""nofollow"">PubMed</a> <a href=""https://europepmc.org/abstract/MED/26327470"" target=""_blank"" class=""external"" rel=""nofollow"">Europe PMC</a> <a href=""https://scholia.toolforge.org/pubmed/26327470"" target=""_blank"" class=""external"" rel=""nofollow"">Scholia</a>"
26467237	Pubmed	"KIR2DL3 and KIR2DL1 show similar impact on licensing of human NK cells. Sim MJW, Stowell J, Sergeant R, Altmann DM, Long EO, Boyton RJ. Eur J Immunol. 2016 Jan;46(1):185–91.  <a href=""http://www.ncbi.nlm.nih.gov/pubmed/26467237"" target=""_blank"" class=""external"" rel=""nofollow"">PubMed</a> <a href=""https://europepmc.org/abstract/MED/26467237"" target=""_blank"" class=""external"" rel=""nofollow"">Europe PMC</a> <a href=""https://scholia.toolforge.org/pubmed/26467237"" target=""_blank"" class=""external"" rel=""nofollow"">Scholia</a>"
27956621	Pubmed	"Expression of KIR2DS1 by decidual natural killer cells increases their ability to control placental HCMV infection. Crespo ÂC, Strominger JL, Tilburgs T. Proc Natl Acad Sci U S A. 2016 Dec 27;113(52):15072–7.  <a href=""http://www.ncbi.nlm.nih.gov/pubmed/27956621"" target=""_blank"" class=""external"" rel=""nofollow"">PubMed</a> <a href=""https://europepmc.org/abstract/MED/27956621"" target=""_blank"" class=""external"" rel=""nofollow"">Europe PMC</a> <a href=""https://scholia.toolforge.org/pubmed/27956621"" target=""_blank"" class=""external"" rel=""nofollow"">Scholia</a>"
29449322	Pubmed	"Actin retrograde flow controls natural killer cell response by regulating the conformation state of SHP-1. Matalon O, Ben-Shmuel A, Kivelevitz J, Sabag B, Fried S, Joseph N, et al. EMBO J. 2018 Mar 1;37(5):e96264.  <a href=""http://www.ncbi.nlm.nih.gov/pubmed/29449322"" target=""_blank"" class=""external"" rel=""nofollow"">PubMed</a> <a href=""https://europepmc.org/abstract/MED/29449322"" target=""_blank"" class=""external"" rel=""nofollow"">Europe PMC</a> <a href=""https://scholia.toolforge.org/pubmed/29449322"" target=""_blank"" class=""external"" rel=""nofollow"">Scholia</a>"
29512837	Pubmed	"Natural killer cell cytotoxicity and its regulation by inhibitory receptors. Kumar S. Immunology. 2018 Jul;154(3):383–93.  <a href=""http://www.ncbi.nlm.nih.gov/pubmed/29512837"" target=""_blank"" class=""external"" rel=""nofollow"">PubMed</a> <a href=""https://europepmc.org/abstract/MED/29512837"" target=""_blank"" class=""external"" rel=""nofollow"">Europe PMC</a> <a href=""https://scholia.toolforge.org/pubmed/29512837"" target=""_blank"" class=""external"" rel=""nofollow"">Scholia</a>"
33335575	Pubmed	"Increased expression of IFN-γ in preeclampsia impairs human trophoblast invasion via a SOCS1/JAK/STAT1 feedback loop. Liu H, Wang W, Liu C. Exp Ther Med. 2021 Feb;21(2):112.  <a href=""http://www.ncbi.nlm.nih.gov/pubmed/33335575"" target=""_blank"" class=""external"" rel=""nofollow"">PubMed</a> <a href=""https://europepmc.org/abstract/MED/33335575"" target=""_blank"" class=""external"" rel=""nofollow"">Europe PMC</a> <a href=""https://scholia.toolforge.org/pubmed/33335575"" target=""_blank"" class=""external"" rel=""nofollow"">Scholia</a>"
34016721	Pubmed	"Peptide: MHC-based DNA vaccination strategy to activate natural killer cells by targeting killer cell immunoglobulin-like receptors. Rettman P, Blunt MD, Fulton RJ, Vallejo AF, Bastidas-Legarda LY, España-Serrano L, et al. J Immunother Cancer. 2021 May;9(5):e001912.  <a href=""http://www.ncbi.nlm.nih.gov/pubmed/34016721"" target=""_blank"" class=""external"" rel=""nofollow"">PubMed</a> <a href=""https://europepmc.org/abstract/MED/34016721"" target=""_blank"" class=""external"" rel=""nofollow"">Europe PMC</a> <a href=""https://scholia.toolforge.org/pubmed/34016721"" target=""_blank"" class=""external"" rel=""nofollow"">Scholia</a>"
34267676	Pubmed	"High Levels of Tumor Necrosis Factor-Alpha Reduce Placental Aquaporin 3 Expression and Impair in vitro Trophoblastic Cell Migration. Dos Passos Junior RR, de Freitas RA, Reppetti J, Medina Y, Dela Justina V, Bach CW, et al. Front Physiol. 2021 Jun 29;12:696495.  <a href=""http://www.ncbi.nlm.nih.gov/pubmed/34267676"" target=""_blank"" class=""external"" rel=""nofollow"">PubMed</a> <a href=""https://europepmc.org/abstract/MED/34267676"" target=""_blank"" class=""external"" rel=""nofollow"">Europe PMC</a> <a href=""https://scholia.toolforge.org/pubmed/34267676"" target=""_blank"" class=""external"" rel=""nofollow"">Scholia</a>"
34392531	Pubmed	"Cereblon regulates NK cell cytotoxicity and migration via Rac1 activation. Fionda C, Stabile H, Molfetta R, Kosta A, Peruzzi G, Ruggeri S, et al. Eur J Immunol. 2021 Nov;51(11):2607–17.  <a href=""http://www.ncbi.nlm.nih.gov/pubmed/34392531"" target=""_blank"" class=""external"" rel=""nofollow"">PubMed</a> <a href=""https://europepmc.org/abstract/MED/34392531"" target=""_blank"" class=""external"" rel=""nofollow"">Europe PMC</a> <a href=""https://scholia.toolforge.org/pubmed/34392531"" target=""_blank"" class=""external"" rel=""nofollow"">Scholia</a>"
34790194	Pubmed	"TNF-α Regulated Endometrial Stroma Secretome Promotes Trophoblast Invasion. You Y, Stelzl P, Joseph DN, Aldo PB, Maxwell AJ, Dekel N, et al. Front Immunol. 2021 Nov 1;12:737401.  <a href=""http://www.ncbi.nlm.nih.gov/pubmed/34790194"" target=""_blank"" class=""external"" rel=""nofollow"">PubMed</a> <a href=""https://europepmc.org/abstract/MED/34790194"" target=""_blank"" class=""external"" rel=""nofollow"">Europe PMC</a> <a href=""https://scholia.toolforge.org/pubmed/34790194"" target=""_blank"" class=""external"" rel=""nofollow"">Scholia</a>"
35561968	Pubmed	"Immunogenomics of Killer Cell Immunoglobulin-Like Receptor (KIR) and HLA Class I: Coevolution and Consequences for Human Health. Pollock NR, Harrison GF, Norman PJ. J Allergy Clin Immunol Pract. 2022 Jul;10(7):1763–75.  <a href=""http://www.ncbi.nlm.nih.gov/pubmed/35561968"" target=""_blank"" class=""external"" rel=""nofollow"">PubMed</a> <a href=""https://europepmc.org/abstract/MED/35561968"" target=""_blank"" class=""external"" rel=""nofollow"">Europe PMC</a> <a href=""https://scholia.toolforge.org/pubmed/35561968"" target=""_blank"" class=""external"" rel=""nofollow"">Scholia</a>"
