ID	Database	Citation
2058745	Pubmed	"Pérgola PE, Alper RH. Vasopressin and autonomic mechanisms mediate cardiovascular actions of central serotonin. Am J Physiol. 1991 Jun;260(6 Pt 2):R1188-93.  <a href=""http://www.ncbi.nlm.nih.gov/pubmed/2058745"" target=""_blank"" class=""external"" rel=""nofollow"">PubMed</a> <a href=""https://europepmc.org/abstract/MED/2058745"" target=""_blank"" class=""external"" rel=""nofollow"">Europe PMC</a> <a href=""https://scholia.toolforge.org/pubmed/2058745"" target=""_blank"" class=""external"" rel=""nofollow"">Scholia</a>"
7592771	Pubmed	"Adams ME, Dwyer TM, Dowler LL, White RA, Froehner SC. Mouse alpha 1- and beta 2-syntrophin gene structure, chromosome localization, and homology with a discs large domain. J Biol Chem. 1995 Oct 27;270(43):25859–65.  <a href=""http://www.ncbi.nlm.nih.gov/pubmed/7592771"" target=""_blank"" class=""external"" rel=""nofollow"">PubMed</a> <a href=""https://europepmc.org/abstract/MED/7592771"" target=""_blank"" class=""external"" rel=""nofollow"">Europe PMC</a> <a href=""https://scholia.toolforge.org/pubmed/7592771"" target=""_blank"" class=""external"" rel=""nofollow"">Scholia</a>"
7745608	Pubmed	"Schmitt M, Bausero P, Simoni P, Queuche D, Geoffroy V, Marschal C, et al. Positive and negative effects of nuclear receptors on transcription activation by AP-1 of the human choline acetyltransferase proximal promoter. J Neurosci Res. 1995 Feb 1;40(2):152–64.  <a href=""http://www.ncbi.nlm.nih.gov/pubmed/7745608"" target=""_blank"" class=""external"" rel=""nofollow"">PubMed</a> <a href=""https://europepmc.org/abstract/MED/7745608"" target=""_blank"" class=""external"" rel=""nofollow"">Europe PMC</a> <a href=""https://scholia.toolforge.org/pubmed/7745608"" target=""_blank"" class=""external"" rel=""nofollow"">Scholia</a>"
7908738	Pubmed	"Dawson SJ, Yoon SO, Chikaraishi DM, Lillycrop KA, Latchman DS. The Oct-2 transcription factor represses tyrosine hydroxylase expression via a heptamer TAATGARAT-like motif in the gene promoter. Nucleic Acids Res. 1994 Mar 25;22(6):1023–8.  <a href=""http://www.ncbi.nlm.nih.gov/pubmed/7908738"" target=""_blank"" class=""external"" rel=""nofollow"">PubMed</a> <a href=""https://europepmc.org/abstract/MED/7908738"" target=""_blank"" class=""external"" rel=""nofollow"">Europe PMC</a> <a href=""https://scholia.toolforge.org/pubmed/7908738"" target=""_blank"" class=""external"" rel=""nofollow"">Scholia</a>"
8841406	Pubmed	"Nishida K, Otsu K, Hori M, Kuzuya T, Tada M. Cloning and characterization of the 5’-upstream regulatory region of the Ca(2+)-release channel gene of cardiac sarcoplasmic reticulum. Eur J Biochem. 1996 Sep 1;240(2):408–15.  <a href=""http://www.ncbi.nlm.nih.gov/pubmed/8841406"" target=""_blank"" class=""external"" rel=""nofollow"">PubMed</a> <a href=""https://europepmc.org/abstract/MED/8841406"" target=""_blank"" class=""external"" rel=""nofollow"">Europe PMC</a> <a href=""https://scholia.toolforge.org/pubmed/8841406"" target=""_blank"" class=""external"" rel=""nofollow"">Scholia</a>"
8957963	Pubmed	"Rahim RA, Boyd PA, Ainslie Patrick WJ, Burdon RH. Human heat shock protein gene polymorphisms and sudden infant death syndrome. Arch Dis Child. 1996 Nov;75(5):451–2.  <a href=""http://www.ncbi.nlm.nih.gov/pubmed/8957963"" target=""_blank"" class=""external"" rel=""nofollow"">PubMed</a> <a href=""https://europepmc.org/abstract/MED/8957963"" target=""_blank"" class=""external"" rel=""nofollow"">Europe PMC</a> <a href=""https://scholia.toolforge.org/pubmed/8957963"" target=""_blank"" class=""external"" rel=""nofollow"">Scholia</a>"
9038229	Pubmed	"Nagamoto-Combs K, Piech KM, Best JA, Sun B, Tank AW. Tyrosine hydroxylase gene promoter activity is regulated by both cyclic AMP-responsive element and AP1 sites following calcium influx. Evidence for cyclic amp-responsive element binding protein-independent regulation. J Biol Chem. 1997 Feb 28;272(9):6051–8.  <a href=""http://www.ncbi.nlm.nih.gov/pubmed/9038229"" target=""_blank"" class=""external"" rel=""nofollow"">PubMed</a> <a href=""https://europepmc.org/abstract/MED/9038229"" target=""_blank"" class=""external"" rel=""nofollow"">Europe PMC</a> <a href=""https://scholia.toolforge.org/pubmed/9038229"" target=""_blank"" class=""external"" rel=""nofollow"">Scholia</a>"
9259266	Pubmed	"Orii KE, Aoyama T, Wakui K, Fukushima Y, Miyajima H, Yamaguchi S, et al. Genomic and mutational analysis of the mitochondrial trifunctional protein beta-subunit (HADHB) gene in patients with trifunctional protein deficiency. Hum Mol Genet. 1997 Aug;6(8):1215–24.  <a href=""http://www.ncbi.nlm.nih.gov/pubmed/9259266"" target=""_blank"" class=""external"" rel=""nofollow"">PubMed</a> <a href=""https://europepmc.org/abstract/MED/9259266"" target=""_blank"" class=""external"" rel=""nofollow"">Europe PMC</a> <a href=""https://scholia.toolforge.org/pubmed/9259266"" target=""_blank"" class=""external"" rel=""nofollow"">Scholia</a>"
9602135	Pubmed	"Raynal JF, Dugast C, Le Van Thaï A, Weber MJ. Winged helix hepatocyte nuclear factor 3 and POU-domain protein brn-2/N-oct-3 bind overlapping sites on the neuronal promoter of human aromatic L-amino acid decarboxylase gene. Brain Res Mol Brain Res. 1998 May;56(1–2):227–37.  <a href=""http://www.ncbi.nlm.nih.gov/pubmed/9602135"" target=""_blank"" class=""external"" rel=""nofollow"">PubMed</a> <a href=""https://europepmc.org/abstract/MED/9602135"" target=""_blank"" class=""external"" rel=""nofollow"">Europe PMC</a> <a href=""https://scholia.toolforge.org/pubmed/9602135"" target=""_blank"" class=""external"" rel=""nofollow"">Scholia</a>"
9645961	Pubmed	"Teerawatanasuk N, Carr LG. CBF/NF-Y activates transcription of the human tryptophan hydroxylase gene through an inverted CCAAT box. Brain Res Mol Brain Res. 1998 Mar 30;55(1):61–70.  <a href=""http://www.ncbi.nlm.nih.gov/pubmed/9645961"" target=""_blank"" class=""external"" rel=""nofollow"">PubMed</a> <a href=""https://europepmc.org/abstract/MED/9645961"" target=""_blank"" class=""external"" rel=""nofollow"">Europe PMC</a> <a href=""https://scholia.toolforge.org/pubmed/9645961"" target=""_blank"" class=""external"" rel=""nofollow"">Scholia</a>"
9676432	Pubmed	"Umenishi F, Verkman AS. Isolation and functional analysis of alternative promoters in the human aquaporin-4 water channel gene. Genomics. 1998 Jun 15;50(3):373–7.  <a href=""http://www.ncbi.nlm.nih.gov/pubmed/9676432"" target=""_blank"" class=""external"" rel=""nofollow"">PubMed</a> <a href=""https://europepmc.org/abstract/MED/9676432"" target=""_blank"" class=""external"" rel=""nofollow"">Europe PMC</a> <a href=""https://scholia.toolforge.org/pubmed/9676432"" target=""_blank"" class=""external"" rel=""nofollow"">Scholia</a>"
9933599	Pubmed	"Goudet G, Delhalle S, Biemar F, Martial JA, Peers B. Functional and cooperative interactions between the homeodomain PDX1, Pbx, and Prep1 factors on the somatostatin promoter. J Biol Chem. 1999 Feb 12;274(7):4067–73.  <a href=""http://www.ncbi.nlm.nih.gov/pubmed/9933599"" target=""_blank"" class=""external"" rel=""nofollow"">PubMed</a> <a href=""https://europepmc.org/abstract/MED/9933599"" target=""_blank"" class=""external"" rel=""nofollow"">Europe PMC</a> <a href=""https://scholia.toolforge.org/pubmed/9933599"" target=""_blank"" class=""external"" rel=""nofollow"">Scholia</a>"
10094440	Pubmed	"Opdal SH, Vege A, Stave AK, Rognum TO. The complement component C4 in sudden infant death. Eur J Pediatr. 1999 Mar;158(3):210–2.  <a href=""http://www.ncbi.nlm.nih.gov/pubmed/10094440"" target=""_blank"" class=""external"" rel=""nofollow"">PubMed</a> <a href=""https://europepmc.org/abstract/MED/10094440"" target=""_blank"" class=""external"" rel=""nofollow"">Europe PMC</a> <a href=""https://scholia.toolforge.org/pubmed/10094440"" target=""_blank"" class=""external"" rel=""nofollow"">Scholia</a>"
10197817	Pubmed	"Mallard C, Tolcos M, Leditschke J, Campbell P, Rees S. Reduction in choline acetyltransferase immunoreactivity but not muscarinic-m2 receptor immunoreactivity in the brainstem of SIDS infants. J Neuropathol Exp Neurol. 1999 Mar;58(3):255–64.  <a href=""http://www.ncbi.nlm.nih.gov/pubmed/10197817"" target=""_blank"" class=""external"" rel=""nofollow"">PubMed</a> <a href=""https://europepmc.org/abstract/MED/10197817"" target=""_blank"" class=""external"" rel=""nofollow"">Europe PMC</a> <a href=""https://scholia.toolforge.org/pubmed/10197817"" target=""_blank"" class=""external"" rel=""nofollow"">Scholia</a>"
10421804	Pubmed	"Echetebu CO, Ali M, Izban MG, MacKay L, Garfield RE. Localization of regulatory protein binding sites in the proximal region of human myometrial connexin 43 gene. Mol Hum Reprod. 1999 Aug;5(8):757–66.  <a href=""http://www.ncbi.nlm.nih.gov/pubmed/10421804"" target=""_blank"" class=""external"" rel=""nofollow"">PubMed</a> <a href=""https://europepmc.org/abstract/MED/10421804"" target=""_blank"" class=""external"" rel=""nofollow"">Europe PMC</a> <a href=""https://scholia.toolforge.org/pubmed/10421804"" target=""_blank"" class=""external"" rel=""nofollow"">Scholia</a>"
10575032	Pubmed	"Hendricks T, Francis N, Fyodorov D, Deneris ES. The ETS domain factor Pet-1 is an early and precise marker of central serotonin neurons and interacts with a conserved element in serotonergic genes. J Neurosci. 1999 Dec 1;19(23):10348–56.  <a href=""http://www.ncbi.nlm.nih.gov/pubmed/10575032"" target=""_blank"" class=""external"" rel=""nofollow"">PubMed</a> <a href=""https://europepmc.org/abstract/MED/10575032"" target=""_blank"" class=""external"" rel=""nofollow"">Europe PMC</a> <a href=""https://scholia.toolforge.org/pubmed/10575032"" target=""_blank"" class=""external"" rel=""nofollow"">Scholia</a>"
10978336	Pubmed	"Pombo PM, Barettino D, Espliguero G, Metsis M, Iglesias T, Rodriguez-Pena A. Transcriptional repression of neurotrophin receptor trkB by thyroid hormone in the developing rat brain. J Biol Chem. 2000 Dec 1;275(48):37510–7.  <a href=""http://www.ncbi.nlm.nih.gov/pubmed/10978336"" target=""_blank"" class=""external"" rel=""nofollow"">PubMed</a> <a href=""https://europepmc.org/abstract/MED/10978336"" target=""_blank"" class=""external"" rel=""nofollow"">Europe PMC</a> <a href=""https://scholia.toolforge.org/pubmed/10978336"" target=""_blank"" class=""external"" rel=""nofollow"">Scholia</a>"
11080175	Pubmed	"Toliver-Kinsky T, Wood T, Perez-Polo JR. Nuclear factor kappaB/p49 is a negative regulatory factor in nerve growth factor-induced choline acetyltransferase promoter activity in PC12 cells. J Neurochem. 2000 Dec;75(6):2241–51.  <a href=""http://www.ncbi.nlm.nih.gov/pubmed/11080175"" target=""_blank"" class=""external"" rel=""nofollow"">PubMed</a> <a href=""https://europepmc.org/abstract/MED/11080175"" target=""_blank"" class=""external"" rel=""nofollow"">Europe PMC</a> <a href=""https://scholia.toolforge.org/pubmed/11080175"" target=""_blank"" class=""external"" rel=""nofollow"">Scholia</a>"
12065627	Pubmed	"Côté F, Schussler N, Boularand S, Peirotes A, Thévenot E, Mallet J, et al. Involvement of NF-Y and Sp1 in basal and cAMP-stimulated transcriptional activation of the tryptophan hydroxylase (TPH ) gene in the pineal gland. J Neurochem. 2002 May;81(4):673–85.  <a href=""http://www.ncbi.nlm.nih.gov/pubmed/12065627"" target=""_blank"" class=""external"" rel=""nofollow"">PubMed</a> <a href=""https://europepmc.org/abstract/MED/12065627"" target=""_blank"" class=""external"" rel=""nofollow"">Europe PMC</a> <a href=""https://scholia.toolforge.org/pubmed/12065627"" target=""_blank"" class=""external"" rel=""nofollow"">Scholia</a>"
12393272	Pubmed	"Robert I, Sutter A, Quirin-Stricker C. Synergistic activation of the human choline acetyltransferase gene by c-Myb and C/EBPbeta. Brain Res Mol Brain Res. 2002 Oct 15;106(1–2):124–35.  <a href=""http://www.ncbi.nlm.nih.gov/pubmed/12393272"" target=""_blank"" class=""external"" rel=""nofollow"">PubMed</a> <a href=""https://europepmc.org/abstract/MED/12393272"" target=""_blank"" class=""external"" rel=""nofollow"">Europe PMC</a> <a href=""https://scholia.toolforge.org/pubmed/12393272"" target=""_blank"" class=""external"" rel=""nofollow"">Scholia</a>"
14575242	Pubmed	"Machaalani R, Waters KA. NMDA receptor 1 expression in the brainstem of human infants and its relevance to the sudden infant death syndrome (SIDS). J Neuropathol Exp Neurol. 2003 Oct;62(10):1076–85.  <a href=""http://www.ncbi.nlm.nih.gov/pubmed/14575242"" target=""_blank"" class=""external"" rel=""nofollow"">PubMed</a> <a href=""https://europepmc.org/abstract/MED/14575242"" target=""_blank"" class=""external"" rel=""nofollow"">Europe PMC</a> <a href=""https://scholia.toolforge.org/pubmed/14575242"" target=""_blank"" class=""external"" rel=""nofollow"">Scholia</a>"
14608012	Pubmed	"Cummings KJ, Pendlebury JD, Sherwood NM, Wilson RJA. Sudden neonatal death in PACAP-deficient mice is associated with reduced respiratory chemoresponse and susceptibility to apnoea. J Physiol. 2004 Feb 15;555(Pt 1):15–26.  <a href=""http://www.ncbi.nlm.nih.gov/pubmed/14608012"" target=""_blank"" class=""external"" rel=""nofollow"">PubMed</a> <a href=""https://europepmc.org/abstract/MED/14608012"" target=""_blank"" class=""external"" rel=""nofollow"">Europe PMC</a> <a href=""https://scholia.toolforge.org/pubmed/14608012"" target=""_blank"" class=""external"" rel=""nofollow"">Scholia</a>"
14693395	Pubmed	"Sawaguchi T, Patricia F, Kadhim H, Groswasser J, Sottiaux M, Nishida H, et al. The correlation between microtubule-associated protein 2 in the brainstem of SIDS victims and physiological data on sleep apnea. Early Hum Dev. 2003 Dec;75 Suppl:S87-97.  <a href=""http://www.ncbi.nlm.nih.gov/pubmed/14693395"" target=""_blank"" class=""external"" rel=""nofollow"">PubMed</a> <a href=""https://europepmc.org/abstract/MED/14693395"" target=""_blank"" class=""external"" rel=""nofollow"">Europe PMC</a> <a href=""https://scholia.toolforge.org/pubmed/14693395"" target=""_blank"" class=""external"" rel=""nofollow"">Scholia</a>"
14741405	Pubmed	"Dugast-Darzacq C, Egloff S, Weber MJ. Cooperative dimerization of the POU domain protein Brn-2 on a new motif activates the neuronal promoter of the human aromatic L-amino acid decarboxylase gene. Brain Res Mol Brain Res. 2004 Jan 5;120(2):151–63.  <a href=""http://www.ncbi.nlm.nih.gov/pubmed/14741405"" target=""_blank"" class=""external"" rel=""nofollow"">PubMed</a> <a href=""https://europepmc.org/abstract/MED/14741405"" target=""_blank"" class=""external"" rel=""nofollow"">Europe PMC</a> <a href=""https://scholia.toolforge.org/pubmed/14741405"" target=""_blank"" class=""external"" rel=""nofollow"">Scholia</a>"
14756806	Pubmed	"Lemonde S, Rogaeva A, Albert PR. Cell type-dependent recruitment of trichostatin A-sensitive repression of the human 5-HT1A receptor gene. J Neurochem. 2004 Feb;88(4):857–68.  <a href=""http://www.ncbi.nlm.nih.gov/pubmed/14756806"" target=""_blank"" class=""external"" rel=""nofollow"">PubMed</a> <a href=""https://europepmc.org/abstract/MED/14756806"" target=""_blank"" class=""external"" rel=""nofollow"">Europe PMC</a> <a href=""https://scholia.toolforge.org/pubmed/14756806"" target=""_blank"" class=""external"" rel=""nofollow"">Scholia</a>"
15056938	Pubmed	"Miyata A, Sugawara H, Iwata S, Shimizu T, Kangawa K. The regulatory mechanism for neuron specific expression of PACAP gene. Nihon Yakurigaku Zasshi. 2004 Apr;123(4):235–42.  <a href=""http://www.ncbi.nlm.nih.gov/pubmed/15056938"" target=""_blank"" class=""external"" rel=""nofollow"">PubMed</a> <a href=""https://europepmc.org/abstract/MED/15056938"" target=""_blank"" class=""external"" rel=""nofollow"">Europe PMC</a> <a href=""https://scholia.toolforge.org/pubmed/15056938"" target=""_blank"" class=""external"" rel=""nofollow"">Scholia</a>"
15199055	Pubmed	"Lau P, Nixon SJ, Parton RG, Muscat GEO. RORalpha regulates the expression of genes involved in lipid homeostasis in skeletal muscle cells: caveolin-3 and CPT-1 are direct targets of ROR. J Biol Chem. 2004 Aug 27;279(35):36828–40.  <a href=""http://www.ncbi.nlm.nih.gov/pubmed/15199055"" target=""_blank"" class=""external"" rel=""nofollow"">PubMed</a> <a href=""https://europepmc.org/abstract/MED/15199055"" target=""_blank"" class=""external"" rel=""nofollow"">Europe PMC</a> <a href=""https://scholia.toolforge.org/pubmed/15199055"" target=""_blank"" class=""external"" rel=""nofollow"">Scholia</a>"
15240857	Pubmed	"Weese-Mayer DE, Berry-Kravis EM, Zhou L, Maher BS, Curran ME, Silvestri JM, et al. Sudden infant death syndrome: case-control frequency differences at genes pertinent to early autonomic nervous system embryologic development. Pediatr Res. 2004 Sep;56(3):391–5.  <a href=""http://www.ncbi.nlm.nih.gov/pubmed/15240857"" target=""_blank"" class=""external"" rel=""nofollow"">PubMed</a> <a href=""https://europepmc.org/abstract/MED/15240857"" target=""_blank"" class=""external"" rel=""nofollow"">Europe PMC</a> <a href=""https://scholia.toolforge.org/pubmed/15240857"" target=""_blank"" class=""external"" rel=""nofollow"">Scholia</a>"
15273283	Pubmed	"Puffenberger EG, Hu-Lince D, Parod JM, Craig DW, Dobrin SE, Conway AR, et al. Mapping of sudden infant death with dysgenesis of the testes syndrome (SIDDT) by a SNP genome scan and identification of TSPYL loss of function. Proc Natl Acad Sci U S A. 2004 Aug 10;101(32):11689–94.  <a href=""http://www.ncbi.nlm.nih.gov/pubmed/15273283"" target=""_blank"" class=""external"" rel=""nofollow"">PubMed</a> <a href=""https://europepmc.org/abstract/MED/15273283"" target=""_blank"" class=""external"" rel=""nofollow"">Europe PMC</a> <a href=""https://scholia.toolforge.org/pubmed/15273283"" target=""_blank"" class=""external"" rel=""nofollow"">Scholia</a>"
15584216	Pubmed	"Lavezzi AM, Ottaviani G, Matturri L. Role of somatostatin and apoptosis in breathing control in sudden perinatal and infant unexplained death. Clin Neuropathol. 2004;23(6):304–10.  <a href=""http://www.ncbi.nlm.nih.gov/pubmed/15584216"" target=""_blank"" class=""external"" rel=""nofollow"">PubMed</a> <a href=""https://europepmc.org/abstract/MED/15584216"" target=""_blank"" class=""external"" rel=""nofollow"">Europe PMC</a> <a href=""https://scholia.toolforge.org/pubmed/15584216"" target=""_blank"" class=""external"" rel=""nofollow"">Scholia</a>"
15758173	Pubmed	"Scott MM, Krueger KC, Deneris ES. A differentially autoregulated Pet-1 enhancer region is a critical target of the transcriptional cascade that governs serotonin neuron development. J Neurosci. 2005 Mar 9;25(10):2628–36.  <a href=""http://www.ncbi.nlm.nih.gov/pubmed/15758173"" target=""_blank"" class=""external"" rel=""nofollow"">PubMed</a> <a href=""https://europepmc.org/abstract/MED/15758173"" target=""_blank"" class=""external"" rel=""nofollow"">Europe PMC</a> <a href=""https://scholia.toolforge.org/pubmed/15758173"" target=""_blank"" class=""external"" rel=""nofollow"">Scholia</a>"
15918042	Pubmed	"Forsyth L, Hume R, Howatson A, Busuttil A, Burchell A. Identification of novel polymorphisms in the glucokinase and glucose-6-phosphatase genes in infants who died suddenly and unexpectedly. J Mol Med (Berl). 2005 Aug;83(8):610–8.  <a href=""http://www.ncbi.nlm.nih.gov/pubmed/15918042"" target=""_blank"" class=""external"" rel=""nofollow"">PubMed</a> <a href=""https://europepmc.org/abstract/MED/15918042"" target=""_blank"" class=""external"" rel=""nofollow"">Europe PMC</a> <a href=""https://scholia.toolforge.org/pubmed/15918042"" target=""_blank"" class=""external"" rel=""nofollow"">Scholia</a>"
16006741	Pubmed	"Fukuchi M, Tabuchi A, Tsuda M. Transcriptional regulation of neuronal genes and its effect on neural functions: cumulative mRNA expression of PACAP and BDNF genes controlled by calcium and cAMP signals in neurons. J Pharmacol Sci. 2005 Jul;98(3):212–8.  <a href=""http://www.ncbi.nlm.nih.gov/pubmed/16006741"" target=""_blank"" class=""external"" rel=""nofollow"">PubMed</a> <a href=""https://europepmc.org/abstract/MED/16006741"" target=""_blank"" class=""external"" rel=""nofollow"">Europe PMC</a> <a href=""https://scholia.toolforge.org/pubmed/16006741"" target=""_blank"" class=""external"" rel=""nofollow"">Scholia</a>"
16275016	Pubmed	"Derry C, Benjamin C, Bladin P, le Bars D, Tochon-Danguy H, Berkovic SF, et al. Increased serotonin receptor availability in human sleep: evidence from an [18F]MPPF PET study in narcolepsy. Neuroimage. 2006 Apr 1;30(2):341–8.  <a href=""http://www.ncbi.nlm.nih.gov/pubmed/16275016"" target=""_blank"" class=""external"" rel=""nofollow"">PubMed</a> <a href=""https://europepmc.org/abstract/MED/16275016"" target=""_blank"" class=""external"" rel=""nofollow"">Europe PMC</a> <a href=""https://scholia.toolforge.org/pubmed/16275016"" target=""_blank"" class=""external"" rel=""nofollow"">Scholia</a>"
16467535	Pubmed	"Czesak M, Lemonde S, Peterson EA, Rogaeva A, Albert PR. Cell-specific repressor or enhancer activities of Deaf-1 at a serotonin 1A receptor gene polymorphism. J Neurosci. 2006 Feb 8;26(6):1864–71.  <a href=""http://www.ncbi.nlm.nih.gov/pubmed/16467535"" target=""_blank"" class=""external"" rel=""nofollow"">PubMed</a> <a href=""https://europepmc.org/abstract/MED/16467535"" target=""_blank"" class=""external"" rel=""nofollow"">Europe PMC</a> <a href=""https://scholia.toolforge.org/pubmed/16467535"" target=""_blank"" class=""external"" rel=""nofollow"">Scholia</a>"
16728402	Pubmed	"Ou X-M, Chen K, Shih JC. Glucocorticoid and androgen activation of monoamine oxidase A is regulated differently by R1 and Sp1. J Biol Chem. 2006 Jul 28;281(30):21512–25.  <a href=""http://www.ncbi.nlm.nih.gov/pubmed/16728402"" target=""_blank"" class=""external"" rel=""nofollow"">PubMed</a> <a href=""https://europepmc.org/abstract/MED/16728402"" target=""_blank"" class=""external"" rel=""nofollow"">Europe PMC</a> <a href=""https://scholia.toolforge.org/pubmed/16728402"" target=""_blank"" class=""external"" rel=""nofollow"">Scholia</a>"
16764822	Pubmed	"Kim SM, Yang JW, Park MJ, Lee J-K, Kim SU, Lee YS, et al. Regulation of human tyrosine hydroxylase gene by neuron-restrictive silencer factor. Biochem Biophys Res Commun. 2006 Jul 28;346(2):426–35.  <a href=""http://www.ncbi.nlm.nih.gov/pubmed/16764822"" target=""_blank"" class=""external"" rel=""nofollow"">PubMed</a> <a href=""https://europepmc.org/abstract/MED/16764822"" target=""_blank"" class=""external"" rel=""nofollow"">Europe PMC</a> <a href=""https://scholia.toolforge.org/pubmed/16764822"" target=""_blank"" class=""external"" rel=""nofollow"">Scholia</a>"
16830328	Pubmed	"Rand CM, Weese-Mayer DE, Zhou L, Maher BS, Cooper ME, Marazita ML, et al. Sudden infant death syndrome: Case-control frequency differences in paired like homeobox (PHOX) 2B gene. Am J Med Genet A. 2006 Aug 1;140(15):1687–91.  <a href=""http://www.ncbi.nlm.nih.gov/pubmed/16830328"" target=""_blank"" class=""external"" rel=""nofollow"">PubMed</a> <a href=""https://europepmc.org/abstract/MED/16830328"" target=""_blank"" class=""external"" rel=""nofollow"">Europe PMC</a> <a href=""https://scholia.toolforge.org/pubmed/16830328"" target=""_blank"" class=""external"" rel=""nofollow"">Scholia</a>"
16846370	Pubmed	"Player A, Wang Y, Bhattacharya B, Rao M, Puri RK, Kawasaki ES. Comparisons between transcriptional regulation and RNA expression in human embryonic stem cell lines. Stem Cells Dev. 2006 Jun;15(3):315–23.  <a href=""http://www.ncbi.nlm.nih.gov/pubmed/16846370"" target=""_blank"" class=""external"" rel=""nofollow"">PubMed</a> <a href=""https://europepmc.org/abstract/MED/16846370"" target=""_blank"" class=""external"" rel=""nofollow"">Europe PMC</a> <a href=""https://scholia.toolforge.org/pubmed/16846370"" target=""_blank"" class=""external"" rel=""nofollow"">Scholia</a>"
16916659	Pubmed	"Dashash M, Pravica V, Hutchinson IV, Barson AJ, Drucker DB. Association of sudden infant death syndrome with VEGF and IL-6 gene polymorphisms. Hum Immunol. 2006 Aug;67(8):627–33.  <a href=""http://www.ncbi.nlm.nih.gov/pubmed/16916659"" target=""_blank"" class=""external"" rel=""nofollow"">PubMed</a> <a href=""https://europepmc.org/abstract/MED/16916659"" target=""_blank"" class=""external"" rel=""nofollow"">Europe PMC</a> <a href=""https://scholia.toolforge.org/pubmed/16916659"" target=""_blank"" class=""external"" rel=""nofollow"">Scholia</a>"
16916793	Pubmed	"Bhat KMR, Maddodi N, Shashikant C, Setaluri V. Transcriptional regulation of human MAP2 gene in melanoma: role of neuronal bHLH factors and Notch1 signaling. Nucleic Acids Res. 2006 Aug 11;34(13):3819–32.  <a href=""http://www.ncbi.nlm.nih.gov/pubmed/16916793"" target=""_blank"" class=""external"" rel=""nofollow"">PubMed</a> <a href=""https://europepmc.org/abstract/MED/16916793"" target=""_blank"" class=""external"" rel=""nofollow"">Europe PMC</a> <a href=""https://scholia.toolforge.org/pubmed/16916793"" target=""_blank"" class=""external"" rel=""nofollow"">Scholia</a>"
16938762	Pubmed	"Hauge Opdal S, Melien Ø, Rootwelt H, Vege A, Arnestad M, Ole Rognum T. The G protein beta3 subunit 825C allele is associated with sudden infant death due to infection. Acta Paediatr. 2006 Sep;95(9):1129–32.  <a href=""http://www.ncbi.nlm.nih.gov/pubmed/16938762"" target=""_blank"" class=""external"" rel=""nofollow"">PubMed</a> <a href=""https://europepmc.org/abstract/MED/16938762"" target=""_blank"" class=""external"" rel=""nofollow"">Europe PMC</a> <a href=""https://scholia.toolforge.org/pubmed/16938762"" target=""_blank"" class=""external"" rel=""nofollow"">Scholia</a>"
