ID	Database	Citation
11971024	Pubmed	"SHIP negatively regulates IgE + antigen-induced IL-6 production in mast cells by inhibiting NF-kappa B activity. Kalesnikoff J, Baur N, Leitges M, Hughes MR, Damen JE, Huber M, et al. J Immunol. 2002 May 1;168(9):4737–46.  <a href=""http://www.ncbi.nlm.nih.gov/pubmed/11971024"" target=""_blank"" class=""external"" rel=""nofollow"">PubMed</a> <a href=""https://europepmc.org/abstract/MED/11971024"" target=""_blank"" class=""external"" rel=""nofollow"">Europe PMC</a> <a href=""https://scholia.toolforge.org/pubmed/11971024"" target=""_blank"" class=""external"" rel=""nofollow"">Scholia</a>"
11983682	Pubmed	"Induction of neuronal differentiation by a peptide corresponding to the homophilic binding site of the second Ig module of the neural cell adhesion molecule. Soroka V, Kiryushko D, Novitskaya V, Ronn LCB, Poulsen FM, Holm A, et al. J Biol Chem. 2002 Jul 5;277(27):24676–83.  <a href=""http://www.ncbi.nlm.nih.gov/pubmed/11983682"" target=""_blank"" class=""external"" rel=""nofollow"">PubMed</a> <a href=""https://europepmc.org/abstract/MED/11983682"" target=""_blank"" class=""external"" rel=""nofollow"">Europe PMC</a> <a href=""https://scholia.toolforge.org/pubmed/11983682"" target=""_blank"" class=""external"" rel=""nofollow"">Scholia</a>"
12032150	Pubmed	"Prolonged nuclear retention of activated extracellular signal-regulated kinase 1/2 is required for hepatocyte growth factor-induced cell motility. Tanimura S, Nomura K, Ozaki K ichi, Tsujimoto M, Kondo T, Kohno M. J Biol Chem. 2002 Aug 2;277(31):28256–64.  <a href=""http://www.ncbi.nlm.nih.gov/pubmed/12032150"" target=""_blank"" class=""external"" rel=""nofollow"">PubMed</a> <a href=""https://europepmc.org/abstract/MED/12032150"" target=""_blank"" class=""external"" rel=""nofollow"">Europe PMC</a> <a href=""https://scholia.toolforge.org/pubmed/12032150"" target=""_blank"" class=""external"" rel=""nofollow"">Scholia</a>"
12048245	Pubmed	"MEKK1 plays a critical role in activating the transcription factor C/EBP-beta-dependent gene expression in response to IFN-gamma. Roy SK, Hu J, Meng Q, Xia Y, Shapiro PS, Reddy SPM, et al. Proc Natl Acad Sci U S A. 2002 Jun 11;99(12):7945–50.  <a href=""http://www.ncbi.nlm.nih.gov/pubmed/12048245"" target=""_blank"" class=""external"" rel=""nofollow"">PubMed</a> <a href=""https://europepmc.org/abstract/MED/12048245"" target=""_blank"" class=""external"" rel=""nofollow"">Europe PMC</a> <a href=""https://scholia.toolforge.org/pubmed/12048245"" target=""_blank"" class=""external"" rel=""nofollow"">Scholia</a>"
12070163	Pubmed	"Regulation of T cell receptor-induced activation of the Ras-ERK pathway by diacylglycerol kinase zeta. Zhong XP, Hainey EA, Olenchock BA, Zhao H, Topham MK, Koretzky GA. J Biol Chem. 2002 Aug 23;277(34):31089–98.  <a href=""http://www.ncbi.nlm.nih.gov/pubmed/12070163"" target=""_blank"" class=""external"" rel=""nofollow"">PubMed</a> <a href=""https://europepmc.org/abstract/MED/12070163"" target=""_blank"" class=""external"" rel=""nofollow"">Europe PMC</a> <a href=""https://scholia.toolforge.org/pubmed/12070163"" target=""_blank"" class=""external"" rel=""nofollow"">Scholia</a>"
12145292	Pubmed	"Ras/MAPK pathway confers basement membrane dependence upon endoderm differentiation of embryonic carcinoma cells. Smedberg JL, Smith ER, Capo-Chichi CD, Frolov A, Yang DH, Godwin AK, et al. J Biol Chem. 2002 Oct 25;277(43):40911–8.  <a href=""http://www.ncbi.nlm.nih.gov/pubmed/12145292"" target=""_blank"" class=""external"" rel=""nofollow"">PubMed</a> <a href=""https://europepmc.org/abstract/MED/12145292"" target=""_blank"" class=""external"" rel=""nofollow"">Europe PMC</a> <a href=""https://scholia.toolforge.org/pubmed/12145292"" target=""_blank"" class=""external"" rel=""nofollow"">Scholia</a>"
12167697	Pubmed	"Rac-PAK signaling stimulates extracellular signal-regulated kinase (ERK) activation by regulating formation of MEK1-ERK complexes. Eblen ST, Slack JK, Weber MJ, Catling AD. Mol Cell Biol. 2002 Sep;22(17):6023–33.  <a href=""http://www.ncbi.nlm.nih.gov/pubmed/12167697"" target=""_blank"" class=""external"" rel=""nofollow"">PubMed</a> <a href=""https://europepmc.org/abstract/MED/12167697"" target=""_blank"" class=""external"" rel=""nofollow"">Europe PMC</a> <a href=""https://scholia.toolforge.org/pubmed/12167697"" target=""_blank"" class=""external"" rel=""nofollow"">Scholia</a>"
12169624	Pubmed	"High resolution crystal structure of the human PDK1 catalytic domain defines the regulatory phosphopeptide docking site. Biondi RM, Komander D, Thomas CC, Lizcano JM, Deak M, Alessi DR, et al. EMBO J. 2002 Aug 15;21(16):4219–28.  <a href=""http://www.ncbi.nlm.nih.gov/pubmed/12169624"" target=""_blank"" class=""external"" rel=""nofollow"">PubMed</a> <a href=""https://europepmc.org/abstract/MED/12169624"" target=""_blank"" class=""external"" rel=""nofollow"">Europe PMC</a> <a href=""https://scholia.toolforge.org/pubmed/12169624"" target=""_blank"" class=""external"" rel=""nofollow"">Scholia</a>"
12181435	Pubmed	"Antibody capture assay reveals bell-shaped concentration-response isotherms for h5-HT(1A) receptor-mediated Galpha(i3) activation: conformational selection by high-efficacy agonists, and relationship to trafficking of receptor signaling. Newman-Tancredi A, Cussac D, Marini L, Millan MJ. Mol Pharmacol. 2002 Sep;62(3):590–601.  <a href=""http://www.ncbi.nlm.nih.gov/pubmed/12181435"" target=""_blank"" class=""external"" rel=""nofollow"">PubMed</a> <a href=""https://europepmc.org/abstract/MED/12181435"" target=""_blank"" class=""external"" rel=""nofollow"">Europe PMC</a> <a href=""https://scholia.toolforge.org/pubmed/12181435"" target=""_blank"" class=""external"" rel=""nofollow"">Scholia</a>"
12181454	Pubmed	"Effects of phosphoinositide 3-kinase on the endothelin-1-induced activation of voltage-independent Ca(2+) channels and mitogenesis in Chinese hamster ovary cells stably expressing endothelin(a) receptor. Kawanabe Y, Hashimoto N, Masaki T. Mol Pharmacol. 2002 Sep;62(3):756–61.  <a href=""http://www.ncbi.nlm.nih.gov/pubmed/12181454"" target=""_blank"" class=""external"" rel=""nofollow"">PubMed</a> <a href=""https://europepmc.org/abstract/MED/12181454"" target=""_blank"" class=""external"" rel=""nofollow"">Europe PMC</a> <a href=""https://scholia.toolforge.org/pubmed/12181454"" target=""_blank"" class=""external"" rel=""nofollow"">Scholia</a>"
12208764	Pubmed	"Constitutive p38HOG mitogen-activated protein kinase activation induces permanent cell cycle arrest and senescence. Haq R, Brenton JD, Takahashi M, Finan D, Finkielsztein A, Damaraju S, et al. Cancer Res. 2002 Sep 1;62(17):5076–82.  <a href=""http://www.ncbi.nlm.nih.gov/pubmed/12208764"" target=""_blank"" class=""external"" rel=""nofollow"">PubMed</a> <a href=""https://europepmc.org/abstract/MED/12208764"" target=""_blank"" class=""external"" rel=""nofollow"">Europe PMC</a> <a href=""https://scholia.toolforge.org/pubmed/12208764"" target=""_blank"" class=""external"" rel=""nofollow"">Scholia</a>"
12218141	Pubmed	"Complement-induced impairment of innate immunity during sepsis. Huber-Lang MS, Younkin EM, Sarma JV, McGuire SR, Lu KT, Guo RF, et al. J Immunol. 2002 Sep 15;169(6):3223–31.  <a href=""http://www.ncbi.nlm.nih.gov/pubmed/12218141"" target=""_blank"" class=""external"" rel=""nofollow"">PubMed</a> <a href=""https://europepmc.org/abstract/MED/12218141"" target=""_blank"" class=""external"" rel=""nofollow"">Europe PMC</a> <a href=""https://scholia.toolforge.org/pubmed/12218141"" target=""_blank"" class=""external"" rel=""nofollow"">Scholia</a>"
12225966	Pubmed	"Duality of G protein-coupled mechanisms for beta-adrenergic activation of NKCC activity in skeletal muscle. Gosmanov AR, Wong JA, Thomason DB. Am J Physiol Cell Physiol. 2002 Oct;283(4):C1025-32.  <a href=""http://www.ncbi.nlm.nih.gov/pubmed/12225966"" target=""_blank"" class=""external"" rel=""nofollow"">PubMed</a> <a href=""https://europepmc.org/abstract/MED/12225966"" target=""_blank"" class=""external"" rel=""nofollow"">Europe PMC</a> <a href=""https://scholia.toolforge.org/pubmed/12225966"" target=""_blank"" class=""external"" rel=""nofollow"">Scholia</a>"
12226077	Pubmed	"Phosphorylation of p85 beta PIX, a Rac/Cdc42-specific guanine nucleotide exchange factor, via the Ras/ERK/PAK2 pathway is required for basic fibroblast growth factor-induced neurite outgrowth. Shin EY, Shin KS, Lee CS, Woo KN, Quan SH, Soung NK, et al. J Biol Chem. 2002 Nov 15;277(46):44417–30.  <a href=""http://www.ncbi.nlm.nih.gov/pubmed/12226077"" target=""_blank"" class=""external"" rel=""nofollow"">PubMed</a> <a href=""https://europepmc.org/abstract/MED/12226077"" target=""_blank"" class=""external"" rel=""nofollow"">Europe PMC</a> <a href=""https://scholia.toolforge.org/pubmed/12226077"" target=""_blank"" class=""external"" rel=""nofollow"">Scholia</a>"
12239223	Pubmed	"Gastrin stimulates cyclooxygenase-2 expression in intestinal epithelial cells through multiple signaling pathways. Evidence for involvement of ERK5 kinase and transactivation of the epidermal growth factor receptor. Guo YS, Cheng JZ, Jin GF, Gutkind JS, Hellmich MR, Townsend CM Jr. J Biol Chem. 2002 Dec 13;277(50):48755–63.  <a href=""http://www.ncbi.nlm.nih.gov/pubmed/12239223"" target=""_blank"" class=""external"" rel=""nofollow"">PubMed</a> <a href=""https://europepmc.org/abstract/MED/12239223"" target=""_blank"" class=""external"" rel=""nofollow"">Europe PMC</a> <a href=""https://scholia.toolforge.org/pubmed/12239223"" target=""_blank"" class=""external"" rel=""nofollow"">Scholia</a>"
12242299	Pubmed	"Distinct cell cycle timing requirements for extracellular signal-regulated kinase and phosphoinositide 3-kinase signaling pathways in somatic cell mitosis. Roberts EC, Shapiro PS, Nahreini TS, Pages G, Pouyssegur J, Ahn NG. Mol Cell Biol. 2002 Oct;22(20):7226–41.  <a href=""http://www.ncbi.nlm.nih.gov/pubmed/12242299"" target=""_blank"" class=""external"" rel=""nofollow"">PubMed</a> <a href=""https://europepmc.org/abstract/MED/12242299"" target=""_blank"" class=""external"" rel=""nofollow"">Europe PMC</a> <a href=""https://scholia.toolforge.org/pubmed/12242299"" target=""_blank"" class=""external"" rel=""nofollow"">Scholia</a>"
12351703	Pubmed	"Dopamine-D2S receptor inhibition of calcium influx, adenylyl cyclase, and mitogen-activated protein kinase in pituitary cells: distinct Galpha and Gbetagamma requirements. Banihashemi B, Albert PR. Mol Endocrinol. 2002 Oct;16(10):2393–404.  <a href=""http://www.ncbi.nlm.nih.gov/pubmed/12351703"" target=""_blank"" class=""external"" rel=""nofollow"">PubMed</a> <a href=""https://europepmc.org/abstract/MED/12351703"" target=""_blank"" class=""external"" rel=""nofollow"">Europe PMC</a> <a href=""https://scholia.toolforge.org/pubmed/12351703"" target=""_blank"" class=""external"" rel=""nofollow"">Scholia</a>"
12361670	Pubmed	"Developing novel treatments for mood disorders: accelerating discovery. Tamminga CA, Nemeroff CB, Blakely RD, Brady L, Carter CS, Davis KL, et al. Biol Psychiatry. 2002 Sep 15;52(6):589–609.  <a href=""http://www.ncbi.nlm.nih.gov/pubmed/12361670"" target=""_blank"" class=""external"" rel=""nofollow"">PubMed</a> <a href=""https://europepmc.org/abstract/MED/12361670"" target=""_blank"" class=""external"" rel=""nofollow"">Europe PMC</a> <a href=""https://scholia.toolforge.org/pubmed/12361670"" target=""_blank"" class=""external"" rel=""nofollow"">Scholia</a>"
12393899	Pubmed	"ERK1/2 antagonizes glycogen synthase kinase-3beta-induced apoptosis in cortical neurons. Hetman M, Hsuan SL, Habas A, Higgins MJ, Xia Z. J Biol Chem. 2002 Dec 20;277(51):49577–84.  <a href=""http://www.ncbi.nlm.nih.gov/pubmed/12393899"" target=""_blank"" class=""external"" rel=""nofollow"">PubMed</a> <a href=""https://europepmc.org/abstract/MED/12393899"" target=""_blank"" class=""external"" rel=""nofollow"">Europe PMC</a> <a href=""https://scholia.toolforge.org/pubmed/12393899"" target=""_blank"" class=""external"" rel=""nofollow"">Scholia</a>"
12414794	Pubmed	"ATF1 phosphorylation by the ERK MAPK pathway is required for epidermal growth factor-induced c-jun expression. Gupta P, Prywes R. J Biol Chem. 2002 Dec 27;277(52):50550–6.  <a href=""http://www.ncbi.nlm.nih.gov/pubmed/12414794"" target=""_blank"" class=""external"" rel=""nofollow"">PubMed</a> <a href=""https://europepmc.org/abstract/MED/12414794"" target=""_blank"" class=""external"" rel=""nofollow"">Europe PMC</a> <a href=""https://scholia.toolforge.org/pubmed/12414794"" target=""_blank"" class=""external"" rel=""nofollow"">Scholia</a>"
12446733	Pubmed	"The requirement of specific membrane domains for Raf-1 phosphorylation and activation. Carey KD, Watson RT, Pessin JE, Stork PJS. J Biol Chem. 2003 Jan 31;278(5):3185–96.  <a href=""http://www.ncbi.nlm.nih.gov/pubmed/12446733"" target=""_blank"" class=""external"" rel=""nofollow"">PubMed</a> <a href=""https://europepmc.org/abstract/MED/12446733"" target=""_blank"" class=""external"" rel=""nofollow"">Europe PMC</a> <a href=""https://scholia.toolforge.org/pubmed/12446733"" target=""_blank"" class=""external"" rel=""nofollow"">Scholia</a>"
12488455	Pubmed	"Na+ promotes the dissociation between Galpha GDP and Gbeta gamma, activating G protein-gated K+ channels. Rishal I, Keren-Raifman T, Yakubovich D, Ivanina T, Dessauer CW, Slepak VZ, et al. J Biol Chem. 2003 Feb 7;278(6):3840–5.  <a href=""http://www.ncbi.nlm.nih.gov/pubmed/12488455"" target=""_blank"" class=""external"" rel=""nofollow"">PubMed</a> <a href=""https://europepmc.org/abstract/MED/12488455"" target=""_blank"" class=""external"" rel=""nofollow"">Europe PMC</a> <a href=""https://scholia.toolforge.org/pubmed/12488455"" target=""_blank"" class=""external"" rel=""nofollow"">Scholia</a>"
12491767	Pubmed	"IP3 receptor, a Ca2+ oscilator--role of IP3 receptor in development and neural plasticity. Mikoshiba K. Nihon Yakurigaku Zasshi. 2002 Nov;120(1):6P-10P.  <a href=""http://www.ncbi.nlm.nih.gov/pubmed/12491767"" target=""_blank"" class=""external"" rel=""nofollow"">PubMed</a> <a href=""https://europepmc.org/abstract/MED/12491767"" target=""_blank"" class=""external"" rel=""nofollow"">Europe PMC</a> <a href=""https://scholia.toolforge.org/pubmed/12491767"" target=""_blank"" class=""external"" rel=""nofollow"">Scholia</a>"
12495932	Pubmed	"Asbestos inhalation induces tyrosine nitration associated with extracellular signal-regulated kinase 1/2 activation in the rat lung. Iwagaki A, Choe N, Li Y, Hemenway DR, Kagan E. Am J Respir Cell Mol Biol. 2003 Jan;28(1):51–60.  <a href=""http://www.ncbi.nlm.nih.gov/pubmed/12495932"" target=""_blank"" class=""external"" rel=""nofollow"">PubMed</a> <a href=""https://europepmc.org/abstract/MED/12495932"" target=""_blank"" class=""external"" rel=""nofollow"">Europe PMC</a> <a href=""https://scholia.toolforge.org/pubmed/12495932"" target=""_blank"" class=""external"" rel=""nofollow"">Scholia</a>"
12496361	Pubmed	"Extracellular signal-regulated protein kinase signaling is uncoupled from initial differentiation of central nervous system stem cells to neurons. Enarsson M, Erlandsson A, Larsson H, Forsberg-Nilsson K. Mol Cancer Res. 2002 Dec;1(2):147–54.  <a href=""http://www.ncbi.nlm.nih.gov/pubmed/12496361"" target=""_blank"" class=""external"" rel=""nofollow"">PubMed</a> <a href=""https://europepmc.org/abstract/MED/12496361"" target=""_blank"" class=""external"" rel=""nofollow"">Europe PMC</a> <a href=""https://scholia.toolforge.org/pubmed/12496361"" target=""_blank"" class=""external"" rel=""nofollow"">Scholia</a>"
12496377	Pubmed	"Cutting edge: induced expression of a RhoA-specific guanine nucleotide exchange factor, p190RhoGEF, following CD40 stimulation and WEHI 231 B cell activation. Lee JR, Ha YJ, Kim HJ. J Immunol. 2003 Jan 1;170(1):19–23.  <a href=""http://www.ncbi.nlm.nih.gov/pubmed/12496377"" target=""_blank"" class=""external"" rel=""nofollow"">PubMed</a> <a href=""https://europepmc.org/abstract/MED/12496377"" target=""_blank"" class=""external"" rel=""nofollow"">Europe PMC</a> <a href=""https://scholia.toolforge.org/pubmed/12496377"" target=""_blank"" class=""external"" rel=""nofollow"">Scholia</a>"
12498787	Pubmed	"Phosphorylation of hippocampal Erk-1/2, Elk-1, and p90-Rsk-1 during contextual fear conditioning: interactions between Erk-1/2 and Elk-1. Sananbenesi F, Fischer A, Schrick C, Spiess J, Radulovic J. Mol Cell Neurosci. 2002 Nov;21(3):463–76.  <a href=""http://www.ncbi.nlm.nih.gov/pubmed/12498787"" target=""_blank"" class=""external"" rel=""nofollow"">PubMed</a> <a href=""https://europepmc.org/abstract/MED/12498787"" target=""_blank"" class=""external"" rel=""nofollow"">Europe PMC</a> <a href=""https://scholia.toolforge.org/pubmed/12498787"" target=""_blank"" class=""external"" rel=""nofollow"">Scholia</a>"
12529253	Pubmed	"Role of phosphoinositide 3-kinase in the nonselective cation channel activation by endothelin-1/endothelinB receptor. Kawanabe Y, Hashimoto N, Masaki T. Am J Physiol Cell Physiol. 2003 Feb;284(2):C506-10.  <a href=""http://www.ncbi.nlm.nih.gov/pubmed/12529253"" target=""_blank"" class=""external"" rel=""nofollow"">PubMed</a> <a href=""https://europepmc.org/abstract/MED/12529253"" target=""_blank"" class=""external"" rel=""nofollow"">Europe PMC</a> <a href=""https://scholia.toolforge.org/pubmed/12529253"" target=""_blank"" class=""external"" rel=""nofollow"">Scholia</a>"
12529254	Pubmed	"Mechanisms of P2X7 receptor-mediated ERK1/2 phosphorylation in human astrocytoma cells. Gendron FP, Neary JT, Theiss PM, Sun GY, Gonzalez FA, Weisman GA. Am J Physiol Cell Physiol. 2003 Feb;284(2):C571-81.  <a href=""http://www.ncbi.nlm.nih.gov/pubmed/12529254"" target=""_blank"" class=""external"" rel=""nofollow"">PubMed</a> <a href=""https://europepmc.org/abstract/MED/12529254"" target=""_blank"" class=""external"" rel=""nofollow"">Europe PMC</a> <a href=""https://scholia.toolforge.org/pubmed/12529254"" target=""_blank"" class=""external"" rel=""nofollow"">Scholia</a>"
12584202	Pubmed	"Oncogenic Ha-Ras transformation modulates the transcription of the CTP:phosphocholine cytidylyltransferase alpha gene via p42/44MAPK and transcription factor Sp3. Bakovic M, Waite K, Vance DE. J Biol Chem. 2003 Apr 25;278(17):14753–61.  <a href=""http://www.ncbi.nlm.nih.gov/pubmed/12584202"" target=""_blank"" class=""external"" rel=""nofollow"">PubMed</a> <a href=""https://europepmc.org/abstract/MED/12584202"" target=""_blank"" class=""external"" rel=""nofollow"">Europe PMC</a> <a href=""https://scholia.toolforge.org/pubmed/12584202"" target=""_blank"" class=""external"" rel=""nofollow"">Scholia</a>"
12588875	Pubmed	"MAPK signaling up-regulates the activity of hypoxia-inducible factors by its effects on p300. Sang N, Stiehl DP, Bohensky J, Leshchinsky I, Srinivas V, Caro J. J Biol Chem. 2003 Apr 18;278(16):14013–9.  <a href=""http://www.ncbi.nlm.nih.gov/pubmed/12588875"" target=""_blank"" class=""external"" rel=""nofollow"">PubMed</a> <a href=""https://europepmc.org/abstract/MED/12588875"" target=""_blank"" class=""external"" rel=""nofollow"">Europe PMC</a> <a href=""https://scholia.toolforge.org/pubmed/12588875"" target=""_blank"" class=""external"" rel=""nofollow"">Scholia</a>"
12589052	Pubmed	"Transforming growth factor-beta1 (TGF-beta)-induced apoptosis of prostate cancer cells involves Smad7-dependent activation of p38 by TGF-beta-activated kinase 1 and mitogen-activated protein kinase kinase 3. Edlund S, Bu S, Schuster N, Aspenström P, Heuchel R, Heldin NE, et al. Mol Biol Cell. 2003 Feb;14(2):529–44.  <a href=""http://www.ncbi.nlm.nih.gov/pubmed/12589052"" target=""_blank"" class=""external"" rel=""nofollow"">PubMed</a> <a href=""https://europepmc.org/abstract/MED/12589052"" target=""_blank"" class=""external"" rel=""nofollow"">Europe PMC</a> <a href=""https://scholia.toolforge.org/pubmed/12589052"" target=""_blank"" class=""external"" rel=""nofollow"">Scholia</a>"
12595573	Pubmed	"Phosphoinositide 3-kinase activity is required for biphasic stimulation of cyclic adenosine 3’,5’-monophosphate by relaxin. Nguyen BT, Yang L, Sanborn BM, Dessauer CW. Mol Endocrinol. 2003 Jun;17(6):1075–84.  <a href=""http://www.ncbi.nlm.nih.gov/pubmed/12595573"" target=""_blank"" class=""external"" rel=""nofollow"">PubMed</a> <a href=""https://europepmc.org/abstract/MED/12595573"" target=""_blank"" class=""external"" rel=""nofollow"">Europe PMC</a> <a href=""https://scholia.toolforge.org/pubmed/12595573"" target=""_blank"" class=""external"" rel=""nofollow"">Scholia</a>"
12600988	Pubmed	"Independent and cooperative activation of chromosomal c-fos promoter by STAT3. Yang E, Lerner L, Besser D, Darnell JE Jr. J Biol Chem. 2003 May 2;278(18):15794–9.  <a href=""http://www.ncbi.nlm.nih.gov/pubmed/12600988"" target=""_blank"" class=""external"" rel=""nofollow"">PubMed</a> <a href=""https://europepmc.org/abstract/MED/12600988"" target=""_blank"" class=""external"" rel=""nofollow"">Europe PMC</a> <a href=""https://scholia.toolforge.org/pubmed/12600988"" target=""_blank"" class=""external"" rel=""nofollow"">Scholia</a>"
12600999	Pubmed	"Hypertonicity-induced aquaporin-1 (AQP1) expression is mediated by the activation of MAPK pathways and hypertonicity-responsive element in the AQP1 gene. Umenishi F, Schrier RW. J Biol Chem. 2003 May 2;278(18):15765–70.  <a href=""http://www.ncbi.nlm.nih.gov/pubmed/12600999"" target=""_blank"" class=""external"" rel=""nofollow"">PubMed</a> <a href=""https://europepmc.org/abstract/MED/12600999"" target=""_blank"" class=""external"" rel=""nofollow"">Europe PMC</a> <a href=""https://scholia.toolforge.org/pubmed/12600999"" target=""_blank"" class=""external"" rel=""nofollow"">Scholia</a>"
12623839	Pubmed	"Map kinase signaling pathways and hematologic malignancies. Platanias LC. Blood. 2003 Jun 15;101(12):4667–79.  <a href=""http://www.ncbi.nlm.nih.gov/pubmed/12623839"" target=""_blank"" class=""external"" rel=""nofollow"">PubMed</a> <a href=""https://europepmc.org/abstract/MED/12623839"" target=""_blank"" class=""external"" rel=""nofollow"">Europe PMC</a> <a href=""https://scholia.toolforge.org/pubmed/12623839"" target=""_blank"" class=""external"" rel=""nofollow"">Scholia</a>"
12628924	Pubmed	"Transcriptional activation of the NF-kappaB p65 subunit by mitogen- and stress-activated protein kinase-1 (MSK1). Vermeulen L, De Wilde G, Van Damme P, Vanden Berghe W, Haegeman G. EMBO J. 2003 Mar 17;22(6):1313–24.  <a href=""http://www.ncbi.nlm.nih.gov/pubmed/12628924"" target=""_blank"" class=""external"" rel=""nofollow"">PubMed</a> <a href=""https://europepmc.org/abstract/MED/12628924"" target=""_blank"" class=""external"" rel=""nofollow"">Europe PMC</a> <a href=""https://scholia.toolforge.org/pubmed/12628924"" target=""_blank"" class=""external"" rel=""nofollow"">Scholia</a>"
12649265	Pubmed	"MAP kinase kinase 6-p38 MAP kinase signaling cascade regulates cyclooxygenase-2 expression in cardiac myocytes in vitro and in vivo. Degousee N, Martindale J, Stefanski E, Cieslak M, Lindsay TF, Fish JE, et al. Circ Res. 2003 Apr 18;92(7):757–64.  <a href=""http://www.ncbi.nlm.nih.gov/pubmed/12649265"" target=""_blank"" class=""external"" rel=""nofollow"">PubMed</a> <a href=""https://europepmc.org/abstract/MED/12649265"" target=""_blank"" class=""external"" rel=""nofollow"">Europe PMC</a> <a href=""https://scholia.toolforge.org/pubmed/12649265"" target=""_blank"" class=""external"" rel=""nofollow"">Scholia</a>"
12649327	Pubmed	"Antisense protein tyrosine phosphatase 1B reverses activation of p38 mitogen-activated protein kinase in liver of ob/ob mice. Gum RJ, Gaede LL, Heindel MA, Waring JF, Trevillyan JM, Zinker BA, et al. Mol Endocrinol. 2003 Jun;17(6):1131–43.  <a href=""http://www.ncbi.nlm.nih.gov/pubmed/12649327"" target=""_blank"" class=""external"" rel=""nofollow"">PubMed</a> <a href=""https://europepmc.org/abstract/MED/12649327"" target=""_blank"" class=""external"" rel=""nofollow"">Europe PMC</a> <a href=""https://scholia.toolforge.org/pubmed/12649327"" target=""_blank"" class=""external"" rel=""nofollow"">Scholia</a>"
12670941	Pubmed	"p38 MAPK is involved in activin A- and hepatocyte growth factor-mediated expression of pro-endocrine gene neurogenin 3 in AR42J-B13 cells. Ogihara T, Watada H, Kanno R, Ikeda F, Nomiyama T, Tanaka Y, et al. J Biol Chem. 2003 Jun 13;278(24):21693–700.  <a href=""http://www.ncbi.nlm.nih.gov/pubmed/12670941"" target=""_blank"" class=""external"" rel=""nofollow"">PubMed</a> <a href=""https://europepmc.org/abstract/MED/12670941"" target=""_blank"" class=""external"" rel=""nofollow"">Europe PMC</a> <a href=""https://scholia.toolforge.org/pubmed/12670941"" target=""_blank"" class=""external"" rel=""nofollow"">Scholia</a>"
12690113	Pubmed	"Interleukin-1 beta and tumor necrosis factor-alpha induce MUC5AC overexpression through a mechanism involving ERK/p38 mitogen-activated protein kinases-MSK1-CREB activation in human airway epithelial cells. Song KS, Lee WJ, Chung KC, Koo JS, Yang EJ, Choi JY, et al. J Biol Chem. 2003 Jun 27;278(26):23243–50.  <a href=""http://www.ncbi.nlm.nih.gov/pubmed/12690113"" target=""_blank"" class=""external"" rel=""nofollow"">PubMed</a> <a href=""https://europepmc.org/abstract/MED/12690113"" target=""_blank"" class=""external"" rel=""nofollow"">Europe PMC</a> <a href=""https://scholia.toolforge.org/pubmed/12690113"" target=""_blank"" class=""external"" rel=""nofollow"">Scholia</a>"
